headline,source,link,datetime
SSD expert shares some worrying truths about Chinese chip makers — and I think this could be more bad news for the RAM crisis,TechRadar,https://www.techradar.com/computing/memory/ssd-expert-shares-some-worrying-truths-about-chinese-chip-makers-and-i-think-this-could-be-more-bad-news-for-the-ram-crisis,2026-06-19 12:02:49
"Apple price hikes predicted to be ‘fairly imminent’ — so don't wait on upgrading your Mac, iPad or iPhone",TechRadar,https://www.techradar.com/phones/apple-price-hikes-predicted-to-be-fairly-imminent-so-dont-wait-on-upgrading-your-mac-ipad-or-iphone,2026-06-19 12:02:49
"From flying chairs to a flood of tempura prawns, the Honor 600 Pro has some absolutely crazy AI video features — but there’s a catch",TechRadar,https://www.techradar.com/phones/honor-phones/from-flying-chairs-to-a-flood-of-tempura-prawns-the-honor-600-pro-has-some-absolutely-crazy-ai-video-features-but-theres-a-catch,2026-06-19 12:02:49
"Canon is tipped to unveil multiple world-first lenses this year — these are the rumored RF lenses to look out for, and your chance to vote for your favorite",TechRadar,https://www.techradar.com/cameras/camera-lenses/canon-is-tipped-to-unveil-multiple-world-first-lenses-this-year-these-are-the-rumored-rf-lenses-to-look-out-for-and-your-chance-to-vote-for-your-favorite,2026-06-19 12:02:49
AI traffic to travel sites is booming as shoppers look for the best holiday deal without doing any research,TechRadar,https://www.techradar.com/pro/ai-traffic-to-travel-sites-is-booming-as-shoppers-look-for-the-best-holiday-deal-without-doing-any-research,2026-06-19 12:02:49
"New Google Health 5.02 update gets praise from Fitbit fans for being ‘solid work’, but some still say that ‘nobody wants' the AI coach",TechRadar,https://www.techradar.com/health-fitness/fitness-apps/new-google-health-5-02-update-gets-praise-from-fitbit-fans-for-being-solid-work-but-some-still-say-that-nobody-wants-the-ai-coach,2026-06-19 12:02:49
"Shadow AI – a step too far, or an opportunity?",TechRadar,https://www.techradar.com/pro/shadow-ai-a-step-too-far-or-an-opportunity,2026-06-19 12:02:49
