headline,source,link,datetime
"Ring just launched a battery-powered version of its premium 4K video doorbell, so you can install it 'virtually anywhere' with no wires",TechRadar,https://www.techradar.com/home/smart-home/ring-just-launched-a-battery-powered-version-of-its-premium-4k-video-doorbell-so-you-can-install-it-virtually-anywhere-with-no-wires,2026-03-25 17:02:51
Meta has a new boss to help 'encourage' its workers to use more AI,TechRadar,https://www.techradar.com/pro/meta-has-a-new-boss-to-help-encourage-its-workers-to-use-more-ai,2026-03-25 17:02:51
Jo Nesbø isn't the next 'Harlan Coben of Netflix' according to the crime writer himself — and he's 'not even thought about' Detective Hole season 2,TechRadar,https://www.techradar.com/streaming/netflix/jo-nesbo-isnt-the-next-harlan-coben-of-netflix-according-to-the-crime-writer-himself-and-hes-not-even-thought-about-detective-hole-season-2,2026-03-25 17:02:51
"I compared the Samsung Galaxy A57 to the Galaxy S26, and it already looks like an excellent budget option",TechRadar,https://www.techradar.com/phones/samsung-galaxy-phones/i-compared-the-samsung-galaxy-a57-to-the-galaxy-s26-and-it-already-looks-like-an-excellent-budget-option,2026-03-25 17:02:51
"How to watch MLB 2026: live streams, cheap Major League Baseball broadcasts, season schedule",TechRadar,https://www.techradar.com/how-to-watch/sport/mlb-2026,2026-03-25 17:02:51
'AI will also present new threats to society' — Sam Altman issues stark warning as $1 billion plan is revealed,TechRadar,https://www.techradar.com/ai-platforms-assistants/openai/ai-will-also-present-new-threats-to-society-sam-altman-issues-stark-warning-as-usd1-billion-plan-is-revealed,2026-03-25 17:02:51
Celebrate Apple's 50th anniversary by boosting your Mac mini's capacity with Acer's secret weapon — M4 Dock SSD Enclosure & Stand is $64 in Amazon's Big Spring Sale,TechRadar,https://www.techradar.com/seasonal-sales/celebrate-apples-50th-anniversary-by-boosting-your-mac-minis-capacity-with-acers-secret-weapon-m4-dock-ssd-enclosure-and-stand-is-usd64-in-amazons-big-spring-sale,2026-03-25 17:02:51
HackerOne says employees hit by data breach - and Navia hack is to blame,TechRadar,https://www.techradar.com/pro/security/hackerone-says-employees-hit-by-data-breach-and-navia-hack-is-to-blame,2026-03-25 17:02:51
Apple TV drops ominous teaser for comedy horror show Widow's Bay — and the Twin Peaks vibes have already got me hooked,TechRadar,https://www.techradar.com/streaming/apple-tv-plus/apple-tv-drops-ominous-teaser-for-comedy-horror-show-widows-bay-and-the-twin-peaks-vibes-have-already-got-me-hooked,2026-03-25 17:02:51
The OnePlus 15T launches with a huge battery and punchy price tag — but its global launch is already in doubt,TechRadar,https://www.techradar.com/phones/oneplus-phones/the-oneplus-15t-launches-with-a-huge-battery-and-punchy-price-tag-but-its-global-launch-is-already-in-doubt,2026-03-25 17:02:51
What is the release date for Monarch: Legacy of Monsters season 2 episode 5 on Apple TV?,TechRadar,https://www.techradar.com/streaming/apple-tv-plus/what-is-the-release-date-for-monarch-legacy-of-monsters-season-2-episode-5-on-apple-tv,2026-03-25 17:02:51
These cheap PS5 games offer hundreds of hours of entertainment and start at less than eight bucks,TechRadar,https://www.techradar.com/seasonal-sales/these-cheap-ps5-games-offer-hundreds-of-hours-of-entertainment-and-start-at-less-than-eight-bucks,2026-03-25 17:02:51
"We’ve unified Apple’s strongest business offerings into one simple, secure platform': Apple Business will now offer MDM, upgraded iCloud storage and more — plus the option to put ads in Maps",TechRadar,https://www.techradar.com/pro/weve-unified-apples-strongest-business-offerings-into-one-simple-secure-platform-apple-business-will-now-offer-mdm-upgraded-icloud-storage-and-more-plus-the-option-to-put-ads-in-maps,2026-03-25 17:02:51
YouTube's biggest camera nerd ranks major brands for color accuracy — and it’s bad news for Fujifilm and Lumix fans,TechRadar,https://www.techradar.com/cameras/youtubes-biggest-camera-nerd-ranks-major-brands-for-actual-color-accuracy-and-its-bad-news-for-fujifilm-and-lumix-fans,2026-03-25 17:02:51
I'm tempted to finally upgrade my aging laptop to the Lenovo LOQ with Ryzen 7 and RTX 5050 power now it's under $1000,TechRadar,https://www.techradar.com/pro/im-tempted-to-finally-upgrade-my-aging-laptop-to-the-lenovo-loq-with-ryzen-7-and-rtx-5050-power-now-its-under-usd1000,2026-03-25 17:02:51
I gave myself a $100 budget — can I build the perfect home vlogging setup?,TechRadar,https://www.techradar.com/tech/i-gave-myself-a-usd100-budget-can-i-build-the-perfect-home-vlogging-setup,2026-03-25 17:02:51
'Please wait a little longer' urges Nintendo as Pokémon XD: Gale of Darkness crashes on Nintendo Switch 2 — a fix is in the works,TechRadar,https://www.techradar.com/gaming/please-wait-a-little-longer-urges-nintendo-as-pokemon-xd-gale-of-darkness-crashes-on-nintendo-switch-2-a-fix-is-in-the-works,2026-03-25 17:02:51
A huge story spoiler for Daredevil: Born Again season 2 has already leaked online — and one of the Marvel TV show's lead actors is to blamefor the faux pas,TechRadar,https://www.techradar.com/streaming/disney-plus/a-huge-story-spoiler-for-daredevil-born-again-season-2-has-already-leaked-online-and-one-of-the-marvel-tv-shows-main-actors-is-to-blame-for-the-faux-pas,2026-03-25 17:02:51
"I spent a morning with the Samsung Galaxy A57, and I'll be amazed if this isn't one of the best cheap phones of 2026",TechRadar,https://www.techradar.com/phones/samsung-galaxy-phones/samsung-galaxy-a57-hands-on,2026-03-25 17:02:51
I felt weird using ChatGPT in public so I tried this extension that disguises it as a Google Doc,TechRadar,https://www.techradar.com/ai-platforms-assistants/chatgpt/i-felt-weird-using-chatgpt-in-public-so-i-tried-this-extension-that-disguises-it-as-a-google-doc,2026-03-25 17:02:51
Europe’s innovation strategy is failing. Here’s how to fix it,TechRadar,https://www.techradar.com/pro/europes-innovation-strategy-is-failing-heres-how-to-fix-it,2026-03-25 17:02:51
Optez pour une technologie à haute efficacité de données pour un coût total de possession (TCO) de stockage réduit.,TechRadar,https://www.techradar.com/computing/storage-backup/optez-pour-une-technologie-a-haute-efficacite-de-donnees-pour-un-cout-total-de-possession-tco-de-stockage-reduit,2026-03-25 17:02:51
Cyber-résilience pour le centre de données moderne,TechRadar,https://www.techradar.com/computing/storage-backup/cyber-resilience-pour-le-centre-de-donnees-moderne,2026-03-25 17:02:51
Senken Sie die Speicherkosten und steigern Sie die Effizienz mit den überlegenen Datenreduktionsfunktionen von Dell PowerStore.,TechRadar,https://www.techradar.com/computing/storage-backup/senken-sie-die-speicherkosten-und-steigern-sie-die-effizienz-mit-den-uberlegenen-datenreduktionsfunktionen-von-dell-powerstore,2026-03-25 17:02:51
Get the sleep you've been dreaming of this Spring with the ultimate mattress upgrade,TechRadar,https://www.techradar.com/home/get-the-sleep-youve-been-dreaming-of-this-spring-with-the-ultimate-mattress-upgrade,2026-03-25 17:02:51
"Shopping in ChatGPT is about to get a lot more interactive – users promised 'improved speed, relevance and product coverage'",TechRadar,https://www.techradar.com/pro/shopping-in-chatgpt-is-about-to-get-a-lot-more-interactive-users-promised-improved-speed-relevance-and-product-coverage,2026-03-25 17:02:51
Big Bang Theory's underrated spinoff is the most watched sitcom on HBO Max this week — and it's not Young Sheldon,TechRadar,https://www.techradar.com/streaming/hbo-max/big-bang-theorys-underrated-spinoff-is-the-most-watched-sitcom-on-hbo-max-this-week-and-its-not-young-sheldon,2026-03-25 17:02:51
"Maximize Performance, Efficiency, and Usability for Enterprise Storage",TechRadar,https://www.techradar.com/computing/storage-backup/maximize-performance-efficiency-and-usability-for-enterprise-storage,2026-03-25 17:02:51
What is the macOS menu bar? Here’s how new MacBook Neo users can get the most out of Apple’s app control bar,TechRadar,https://www.techradar.com/computing/mac-os/what-is-the-macos-menu-bar-heres-how-new-macbook-neo-users-can-get-the-most-out-of-apples-app-control-bar,2026-03-25 17:02:51
"With enticing visual enhancements, creative new bosses, and multiplayer mayhem, is Super Mario Bros. Wonder on Nintendo Switch 2 worth the upgrade? Here’s what I think after collecting every Wonder Seed",TechRadar,https://www.techradar.com/gaming/super-mario-bros-wonder-nintendo-switch-2-edition-plus-meetup-in-bellabel-park-review,2026-03-25 17:02:51
"Need a new laptop? You might want to buy now, as Asus just warned that prices could soon jump by up to 30%",TechRadar,https://www.techradar.com/computing/laptops/need-a-new-laptop-you-might-want-to-buy-now-as-asus-just-warned-that-prices-could-soon-jump-by-up-to-30-percent,2026-03-25 17:02:51
‘Small enough to be tempting’: I need this award-winning turntable company’s new mini automatic vinyl-cleaning machine more than I’ll admit,TechRadar,https://www.techradar.com/audio/turntables/small-enough-to-be-tempting-i-need-this-award-winning-turntable-companys-new-mini-automatic-vinyl-cleaning-machine-more-than-ill-admit,2026-03-25 17:02:51
"Is Amazon's Big Spring Sale better than Prime Day? I've hand-picked the 55 best deals on TVs, appliances, cheap tech gadgets, and more",TechRadar,https://www.techradar.com/live/news/amazon-big-spring-sale-our-experts-hand-picked-the-55-best-deals-on-tvs-appliances-cheap-tech-gadgets-and-more,2026-03-25 17:02:51
"AI agents are flashy, but machine learning still pays the bills",TechRadar,https://www.techradar.com/pro/ai-agents-are-flashy-but-machine-learning-still-pays-the-bills,2026-03-25 17:02:51
I asked ChatGPT to grade my interview answers — it was more useful than real interviews,TechRadar,https://www.techradar.com/ai-platforms-assistants/chatgpt/i-asked-chatgpt-to-grade-my-interview-answers-it-was-more-useful-than-real-interviews,2026-03-25 17:02:51
"Don't wait for EOFY – there's still time to nab exceptional savings on the AirPods Pro 3, AirTags and more Apple gear if you're quick",TechRadar,https://www.techradar.com/audio/headphones/dont-wait-for-eofy-theres-still-time-to-nab-exceptional-savings-on-the-airpods-pro-3-airtags-and-more-apple-gear-if-youre-quick,2026-03-25 17:02:51
"No dropouts, no stress: United’s Starlink Wi-Fi just works — and the rollout to every plane can’t come soon enough",TechRadar,https://www.techradar.com/computing/internet/no-dropouts-no-stress-uniteds-starlink-wi-fi-just-works-and-the-rollout-to-every-plane-cant-come-soon-enough,2026-03-25 17:02:51
I watched all 8 episodes of Daredevil: Born Again season 2 on Disney+ — and the Marvel TV show would be even better than it is if it could fully exorcise its demons,TechRadar,https://www.techradar.com/streaming/disney-plus/daredevil-born-again-season-2-review,2026-03-25 17:02:51
"Need a case for your new 15-inch MacBook Air M5? Here are the best options to keep your kit safe, protected, and organized",TechRadar,https://www.techradar.com/computing/macbooks/need-a-case-for-your-new-15-inch-macbook-air-m5-here-are-the-best-options-to-keep-your-kit-safe-protected-and-organized,2026-03-25 17:02:51
LG's world-first LCD laptop display has a battery-saving superpower — and an OLED version is coming next,TechRadar,https://www.techradar.com/computing/laptops/lgs-world-first-lcd-laptop-display-has-a-battery-saving-superpower-and-an-oled-version-is-coming-next,2026-03-25 17:02:51
"OpenAI unexpectedly kills Sora, and I wonder if this is the start of a mini AI bubble collapse",TechRadar,https://www.techradar.com/ai-platforms-assistants/openai-unexpectedly-kills-sora-and-i-wonder-if-this-is-the-start-of-a-mini-ai-bubble-collapse,2026-03-25 17:02:51
'We are continuing to monitor the situation closely': Crunchyroll investigating breach which reportedly stole data on 6.8 million users,TechRadar,https://www.techradar.com/pro/security/we-are-continuing-to-monitor-the-situation-closely-crunchyroll-investigating-breach-which-reportedly-stole-data-on-6-8-million-users,2026-03-25 17:02:51
'Smartphones were never designed to be vaults': How hackers can steal PINs and private data from over a billion Android devices — even while they’re switched off,TechRadar,https://www.techradar.com/pro/security/smartphones-were-never-designed-to-be-vaults-how-hackers-can-steal-pins-and-private-data-from-over-a-billion-android-devices-even-while-theyre-switched-off,2026-03-25 17:02:51
‘I think we’ve achieved AGI’ — er Jensen… I don't think we have,TechRadar,https://www.techradar.com/ai-platforms-assistants/i-think-weve-achieved-agi-er-jensen-i-dont-think-we-have,2026-03-25 17:02:51
'We are going to push the limits of physics in compute': Elon Musk wants Texas 'Terafab' plant to produce one terawatt of computing power each year and build a global robot population using Tesla and SpaceX tech,TechRadar,https://www.techradar.com/pro/we-are-going-to-push-the-limits-of-physics-in-compute-elon-musk-wants-texas-terafab-plant-to-produce-one-terawatt-of-computing-power-each-year-and-build-a-global-robot-population-using-tesla-and-spacex-tech,2026-03-25 17:02:51
"Good luck, Americans, your Wi-Fi choices are about to get worse — we’ve tested hundreds of routers and every single one of our favorites is made outside of the US",TechRadar,https://www.techradar.com/computing/wi-fi-broadband/good-luck-americans-your-wi-fi-choices-are-about-to-get-worse-weve-tested-hundreds-of-routers-and-every-single-one-of-our-favorites-are-made-outside-of-the-us,2026-03-25 17:02:51
This tax-themed malvertising attack can blind security software before it arrives — and then unleashes ransomware,TechRadar,https://www.techradar.com/pro/security/this-tax-themed-malvertising-attack-can-blind-security-software-before-it-arrives-and-then-unleashes-ransomware,2026-03-25 17:02:51
"Samsung reveals its cheaper mini-LED TVs for 2026 — and it’s dropping QLED on some of them, I kid you not",TechRadar,https://www.techradar.com/televisions/samsung-reveals-its-cheaper-mini-led-tvs-for-2026-and-its-dropping-qled-on-some-of-them-i-kid-you-not,2026-03-25 17:02:51
Acer Swift Edge 14 AI laptop review: Another lightweight wonder from the Acer stable,TechRadar,https://www.techradar.com/pro/acer-swift-edge-14-ai-laptop-review-another-lightweight-wonder-from-the-acer-stable,2026-03-25 17:02:51
"Epic Games is laying off more than 1,000 employees just weeks after raising Fortnite V-Buck prices 'to help pay the bills'",TechRadar,https://www.techradar.com/gaming/gaming-industry/epic-games-is-laying-off-more-than-1-000-employees-just-weeks-after-raising-fortnite-v-buck-prices-to-help-pay-the-bills,2026-03-25 17:02:51
"Surfshark launches HeyPolo, a privacy-first location sharing app to kill ""always-on"" tracking",TechRadar,https://www.techradar.com/vpn/vpn-services/surfshark-launches-heypolo-a-privacy-first-location-sharing-app-to-kill-always-on-tracking,2026-03-25 17:02:51
"Capcom isn't completely abandoning generative AI, but has promised fans it won't use AI assets in games",TechRadar,https://www.techradar.com/gaming/capcom-isnt-completely-abandoning-generative-ai-but-has-promised-fans-it-wont-use-ai-assets-in-games,2026-03-25 17:02:51
