headline,source,link,datetime
Aluminum Foil,Hacker News,https://dernocua.github.io/notes/aluminum-foil.html,2026-07-06 14:03:23
Regression to the Mean: on LLMs and the quiet death of the new,Hacker News,https://rruxandra.github.io/regression-to-the-mean.html,2026-07-06 14:03:23
Real time map of France's rail network,Hacker News,https://carto.tchoo.net/,2026-07-06 14:03:23
Nintendo announces new product revisions in Europe with replaceable batteries,Hacker News,https://www.nintendo.com/en-gb/Support/Nintendo-Switch-2/Information-about-upcoming-battery-related-revisions-to-some-Nintendo-products-3132901.html,2026-07-06 14:03:23
Show HN: Scan your AI agents for dangerous capabilities,Hacker News,https://github.com/makerchecker/MakerChecker,2026-07-06 14:03:23
The Fear of Dying Before You Become Yourself,Hacker News,https://www.dailicle.com/read/the-fear-of-dying-before-you-become-yourself,2026-07-06 14:03:23
Bryan Johnson: I have an autoimmune disease. My stomach is eating itself,Hacker News,https://twitter.com/bryan_johnson/status/2072069730517860385,2026-07-06 14:03:23
Why low-latency Java still requires discipline?,Hacker News,https://chronicle.software/insights/blogs/why-low-latency-java-still-requires-discipline,2026-07-06 14:03:23
Microsoft is selling off four Xbox studios as part of significant gaming cuts,The Verge,https://www.theverge.com/news/961546/xbox-layoffs-studio-sales-2026,2026-07-06 14:03:23
"Microsoft is laying off 4,800 employees",The Verge,https://www.theverge.com/news/961528/microsoft-layoffs-july-2026-sales-xbox,2026-07-06 14:03:23
USB4 cables: When and why it's worth paying more,Engadget,https://www.engadget.com/2207394/usb4-cables-when-why-pay-more/,2026-07-06 14:03:23
Dutton Ranch season 1 is over after 'explosive' episode 9 season finale — but fans have noticed one touching scene didn't even make the final edit,TechRadar,https://www.techradar.com/streaming/paramount-plus/dutton-ranch-season-finale-fan-reaction,2026-07-06 14:03:24
An update to the popular Merlin Bird ID app will turn millions of birdwatchers like me into citizen scientists — doing your bit for bird conservation efforts just got easier,TechRadar,https://www.techradar.com/computing/websites-apps/an-update-to-the-popular-merlin-bird-id-app-will-turn-millions-of-birdwatchers-like-me-into-citizen-scientists-doing-your-bit-for-bird-conservation-efforts-just-got-easier,2026-07-06 14:03:24
A huge surprise Crimson Desert update just landed — and I’m ready to return from my hiatus after 236 hours of playtime,TechRadar,https://www.techradar.com/gaming/a-huge-surprise-crimson-desert-update-just-landed-and-im-ready-to-return-from-my-hiatus-after-236-hours-of-playtime,2026-07-06 14:03:24
OneRep Review,TechRadar,https://www.techradar.com/pro/onerep-review,2026-07-06 14:03:24
MacPaw Moonlock antivirus review,TechRadar,https://www.techradar.com/computing/macs/macpaw-moonlock-antivirus-review,2026-07-06 14:03:24
Aldi’s new range of solar-powered lamps might be just what you need to spruce up your garden this summer — and they’re all under £5,TechRadar,https://www.techradar.com/home/smart-lights/aldis-new-range-of-solar-powered-lamps-might-be-just-what-you-need-to-spruce-up-your-garden-this-summer-and-theyre-all-under-gbp5,2026-07-06 14:03:24
Alibaba is banning its workers from using Claude Code as US v China AI battle heats up,TechRadar,https://www.techradar.com/pro/alibaba-is-banning-its-workers-from-using-claude-code-as-us-v-china-ai-battle-heats-up,2026-07-06 14:03:24
