headline,source,link,datetime
Over 400 Linux CVEs published in the last 24 hours alone,Hacker News,https://lore.kernel.org/linux-cve-announce/,2026-07-21 15:03:49
Stellantis taps Mobileye for hands-free driving assist,The Verge,https://www.theverge.com/transportation/968525/stellantis-taps-mobileye-for-hands-free-driving-assist,2026-07-21 15:03:49
The UK will legalize plug-in solar on August 27,Engadget,https://www.engadget.com/2219664/uk-will-legalize-plug-in-solar-on-august-27/,2026-07-21 15:03:50
Universal has dropped a terrifying trailer for new movie Other Mommy — and I can't wait for Jessica Chastain's return to horror,TechRadar,https://www.techradar.com/streaming/entertainment/universal-has-dropped-a-terrifying-trailer-for-new-movie-other-mommy-and-i-cant-wait-for-jessica-chastains-return-to-horror,2026-07-21 15:03:50
"‘The closest thing to an iPad Air in Android form’ — I was impressed by the Samsung Galaxy Tab S11, but there’s one area where it can't beat Apple",TechRadar,https://www.techradar.com/tablets/samsung-galaxy-tab-s11-review,2026-07-21 15:03:50
Canva wants you to have full control over the design – Code 2.0 just does the heavy lifting for you,TechRadar,https://www.techradar.com/pro/canva-wants-you-to-have-full-control-over-the-design-code-2-0-just-does-the-heavy-lifting-for-you,2026-07-21 15:03:50
I asked AI for financial advice on everyday money decisions — and now I understand why regulators are worried,TechRadar,https://www.techradar.com/ai-platforms-assistants/i-asked-ai-for-financial-advice-on-everyday-money-decisions-and-now-i-understand-why-regulators-are-worried,2026-07-21 15:03:50
Protecting creative storytelling in an AI-first marketing world,TechRadar,https://www.techradar.com/pro/protecting-creative-storytelling-in-an-ai-first-marketing-world,2026-07-21 15:03:50
The best budget OLED TV you can buy just had its price slashed to under $600 at Best Buy,TechRadar,https://www.techradar.com/televisions/the-best-budget-oled-tv-you-can-buy-just-had-its-price-slashed-to-under-usd600-at-best-buy,2026-07-21 15:03:50
Estée Lauder says it was hit by data breach caused by Oracle E-Business issue,TechRadar,https://www.techradar.com/pro/security/estee-lauder-says-it-was-hit-by-data-breach-caused-by-oracle-e-business-issue,2026-07-21 15:03:50
