headline,source,link,datetime
OpenAI is connecting ChatGPT to bank accounts via Plaid,Hacker News,https://firethering.com/chatgpt-bank-account-plaid-openai/,2026-05-15 17:02:34
"I love Linux, but I can't quit Windows",Hacker News,https://jpain.io/i-love-linux-but-i-cant-quit-windows/,2026-05-15 17:02:34
Does Trump Mobile know how many stripes are on the American flag?,The Verge,https://www.theverge.com/gadgets/931347/trump-mobile-t1-phone-logo-flag-stars-stripes,2026-05-15 17:02:34
Google updates its spam rules to include attempts to ‘manipulate’ AI,The Verge,https://www.theverge.com/tech/931416/google-ai-search-spam-policy,2026-05-15 17:02:34
"Amazon has a huge sale on best-selling running shoes ahead of Memorial Day — 57% off Nike, Hoka, Adidas, and Asics",TechRadar,https://www.techradar.com/health-fitness/amazon-has-a-huge-sale-on-best-selling-running-shoes-ahead-of-memorial-day-57-percent-off-nike-hoka-adidas-and-asics,2026-05-15 17:02:35
"Hackers threaten to leak Mistral files online — AI giant confirms breach, but not what data is involved",TechRadar,https://www.techradar.com/pro/security/hackers-threaten-to-leak-mistral-files-online-ai-giant-confirms-breach-but-not-what-data-is-involved,2026-05-15 17:02:35
Bungie outlines plan to save Marathon with Steam player count at less than 15% of launch day peak,TechRadar,https://www.techradar.com/gaming/bungie-outlines-plan-to-save-marathon-with-steam-player-count-at-less-than-15-percent-of-launch-day-peak,2026-05-15 17:02:35
"How to watch Kyunki Saas Bhi Kabhi Bahu Thi 2 online from anywhere – India, US, UK, Australia",TechRadar,https://www.techradar.com/how-to-watch/kyunki-saas-bhi-kabhi-bahu-thi-2-free,2026-05-15 17:02:35
"How to watch Tubi from anywhere – FREE movies, TV shows and live sports",TechRadar,https://www.techradar.com/how-to-watch/tubi-from-anywhere-free,2026-05-15 17:02:35
