headline,source,link,datetime
Show HN: I built a P2P network where AI agents publish formally verified science,Hacker News,https://news.ycombinator.com/item?id=47444212,2026-03-19 19:43:06
A rogue AI led to a serious security incident at Meta,Hacker News,https://www.theverge.com/ai-artificial-intelligence/897528/meta-rogue-ai-agent-security-incident,2026-03-19 19:43:06
NanoGPT Slowrun: 10x Data Efficiency with Infinite Compute,Hacker News,https://qlabs.sh/10x,2026-03-19 19:43:06
"Hermès doesn’t include a power adapter with its $5,150 charging case",The Verge,https://www.theverge.com/tech/897474/hermes-paddock-wireless-charger-apple-watch-airpods-iphone-leather-luxury,2026-03-19 19:43:06
Android will hide app sideloading behind a new one-time security process,Engadget,https://www.engadget.com/apps/android-will-hide-app-sideloading-behind-a-new-one-time-security-process-184651171.html?src=rss,2026-03-19 19:43:06
"Another win for Intel as GMKTec demos Openclaw-capable mini PC that reaches 180 TOPS, supports 10GbE Ethernet, USB4, and OCuLink — oh, and there's a nifty pseudo-memory feature as well that will help you forget RAM nightmares",TechRadar,https://www.techradar.com/pro/another-win-for-intel-as-gmktec-demos-openclaw-capable-mini-pc-that-reaches-180-tops-supports-10gbe-ethernet-usb4-and-oculink-oh-and-theres-a-nifty-pseudo-memory-feature-as-well-that-will-help-you-forget-ram-nightmares,2026-03-19 19:43:07
"Apple TV fans will get a great free upgrade for discovering movies and TV shows soon, but there's a catch",TechRadar,https://www.techradar.com/streaming/apple-tv-plus/apple-tv-fans-will-get-a-great-free-upgrade-for-discovering-movies-and-tv-shows-soon-but-theres-a-catch,2026-03-19 19:43:07
"iPhone Air at 6 months — here’s what I love, what I hate, and why it’s ‘the most conflicted I’ve ever been about a phone’",TechRadar,https://www.techradar.com/phones/iphone/iphone-air-at-6-months-heres-what-i-love-what-i-hate-and-why-its-the-most-conflicted-ive-ever-been-about-a-phone,2026-03-19 19:43:07
