headline,source,link,datetime
AWS Fired the One Employee Who Gave a Damn,Hacker News,https://www.seuros.com/blog/aws-fired-the-human-who-made-the-difference/,2026-05-26 14:02:47
GoPro Mission 1 Pro review: The best action cam video quality comes at a high price,Engadget,https://www.engadget.com/2180965/gopro-mission-1-pro-review/,2026-05-26 14:02:48
Dutton Ranch fans are already hoping one unhinged character 'doesn't survive' first season of Taylor Sheridan's Yellowstone spinoff series — but for the 'dumbest reason',TechRadar,https://www.techradar.com/streaming/paramount-plus/dutton-ranch-episode-3-reaction,2026-05-26 14:02:48
'You can really tell how long a game has been in development' — 007 First Light features a cameo of an internet star who went viral years ago,TechRadar,https://www.techradar.com/gaming/you-can-really-tell-how-long-a-game-has-been-in-development-007-first-light-features-a-cameo-of-an-internet-star-who-went-viral-years-ago,2026-05-26 14:02:48
Could AI-powered dash cams save businesses millions in legal fees?,TechRadar,https://www.techradar.com/pro/could-ai-powered-dash-cams-save-businesses-millions-in-legal-fees,2026-05-26 14:02:48
Observability was built for humans. AI agents need something different,TechRadar,https://www.techradar.com/pro/observability-was-built-for-humans-ai-agents-need-something-different,2026-05-26 14:02:48
The Pope just warned AI could create ‘new forms of dehumanization’ — and his message feels aimed straight at Big Tech,TechRadar,https://www.techradar.com/ai-platforms-assistants/the-pope-just-warned-ai-could-create-new-forms-of-dehumanization-and-his-message-feels-aimed-straight-at-big-tech,2026-05-26 14:02:48
Ghost CMS flaw hijacked to target hundreds of websites with ClickFix attacks — here's how to stay safe,TechRadar,https://www.techradar.com/pro/security/ghost-cms-flaw-hijacked-to-target-hundreds-of-websites-with-clickfix-attacks-heres-how-to-stay-safe,2026-05-26 14:02:48
'It's something we've never done before': Logitech's newest flagship mouse and keyboard comes with something you might never expect - a cushion,TechRadar,https://www.techradar.com/pro/its-something-weve-never-done-before-logitechs-newest-flagship-mouse-and-keyboard-comes-with-something-you-might-never-expect-a-cushion,2026-05-26 14:02:48
