headline,source,link,datetime
Texas man sentenced to 30 years for transporting pamphlets,Hacker News,https://freedom.press/issues/texas-man-sentenced-to-30-years-for-transporting-pamphlets/,2026-06-24 14:03:08
"Slate EV truck starts at $24,950",Hacker News,https://www.slate.auto/en,2026-06-24 14:03:08
Stealing Is a Skill,Hacker News,https://ben-mini.com/2026/stealing-is-a-skill,2026-06-24 14:03:08
Google’s capable TV Streamer 4K is back to its best price for Prime Day,The Verge,https://www.theverge.com/gadgets/953074/google-tv-streamer-4k-amazon-prime-day-2026-deal-sale,2026-06-24 14:03:08
"Wireless charging wastes way more electricity than wired, here's why",Engadget,https://www.engadget.com/2200186/wireless-charging-wastes-electricity-why/,2026-06-24 14:03:08
I've found the sleeper headphones deal of Prime Day and it's Nothing: Pro cans for just $61 and buds just $19!,TechRadar,https://www.techradar.com/audio/wireless-headphones/ive-found-the-sleeper-headphones-deal-of-prime-day-and-its-nothing-pro-cans-for-just-usd61-and-buds-just-usd19,2026-06-24 14:03:08
Getting a Switch 2 for the upcoming Ocarina of Time remake is going to be a worthy investment if you're a super-fan like me — so I’d make sure you get yours before the upcoming price spike,TechRadar,https://www.techradar.com/gaming/nintendo-switch/getting-a-switch-2-for-the-upcoming-ocarina-of-time-remake-is-going-to-be-a-worthy-investment-if-youre-a-super-fan-like-me-so-id-make-sure-you-get-yours-before-the-upcoming-price-spike,2026-06-24 14:03:08
Best Prime Day deals I've found on Reddit,TechRadar,https://www.techradar.com/tech/best-prime-day-deals-ive-found-on-reddit,2026-06-24 14:03:08
Is your Amazon Echo haunted? Viral video captures ‘terrifying’ moment the smart speaker emits ‘guttural sounds’ during a simple family bedtime ritual,TechRadar,https://www.techradar.com/home/smart-speakers/is-your-amazon-echo-haunted-viral-video-captures-terrifying-moment-the-smart-speaker-emits-guttural-sounds-during-a-simple-family-bedtime-ritual,2026-06-24 14:03:08
"With GTA 6 closer than ever, these are all the other Grand Theft Auto games you can play before it arrives",TechRadar,https://www.techradar.com/gaming/with-gta-6-closer-than-ever-these-are-all-the-other-grand-theft-auto-games-you-can-play-before-it-arrives,2026-06-24 14:03:08
'Way out of line': The US government is being sued for executive order restricting foreign access to Project Glasswing,TechRadar,https://www.techradar.com/pro/way-out-of-line-the-us-government-is-being-sued-for-executive-order-restricting-foreign-access-to-project-glasswing,2026-06-24 14:03:08
"As the 2026 World Cup expands, so does the threat surface",TechRadar,https://www.techradar.com/pro/as-the-2026-world-cup-expands-so-does-the-threat-surface,2026-06-24 14:03:08
I test gaming TVs every day and these are the models I'd trust to let GTA 6 look its best,TechRadar,https://www.techradar.com/televisions/i-test-gaming-tvs-every-day-and-these-are-the-models-id-trust-to-let-gta-6-look-its-best,2026-06-24 14:03:08
"Yes, the bad news on the RAM crisis has been relentless lately — but Asus and SK Hynix just gave us glimmers of hope that some relief could be on the horizon",TechRadar,https://www.techradar.com/computing/memory/yes-the-bad-news-on-the-ram-crisis-has-been-relentless-lately-but-asus-and-sk-hynix-just-gave-us-glimmers-of-hope-that-some-relief-could-be-on-the-horizon,2026-06-24 14:03:08
I found every Prime Day 3D printer deal that scored over 4.5 stars in our workshop tests — these are the 14 I fully recommend,TechRadar,https://www.techradar.com/pro/i-found-every-prime-day-3d-printer-deal-that-scored-over-4-5-stars-in-our-workshop-tests-these-are-the-14-i-fully-recommend,2026-06-24 14:03:08
The Blair Witch Project is getting a reboot from Lionsgate — and as a long-time horror fan I'm not convinced it's going to be any good,TechRadar,https://www.techradar.com/streaming/entertainment/the-blair-witch-project-is-getting-a-reboot-from-lionsgate-and-as-a-long-time-horror-fan-im-not-convinced-its-going-to-be-any-good,2026-06-24 14:03:08
Stop using a soccer-related password — ExpressVPN warns football fans that's an own goal for digital privacy,TechRadar,https://www.techradar.com/vpn/vpn-privacy-security/stop-using-a-soccer-related-password-expressvpn-warns-football-fans-thats-an-own-goal-for-digital-privacy,2026-06-24 14:03:08
"How many updates does your phone have left? The longevity of Apple, Samsung, Pixel, and more phones explained",TechRadar,https://www.techradar.com/phones/how-many-updates-does-your-phone-have-left-the-longevity-of-apple-samsung-pixel-and-more-phones-explained,2026-06-24 14:03:08
PlayStation says 'GTA 6 plays best on PS5' and is giving fans a freebie if they pre-order on the PS Store,TechRadar,https://www.techradar.com/gaming/playstation-says-gta-6-plays-best-on-ps5-and-is-giving-fans-a-freebie-if-they-pre-order-on-the-ps-store,2026-06-24 14:03:08
87% of cybersecurity managers say quick compliance programs are actually increasing risk and making businesses less resilient,TechRadar,https://www.techradar.com/pro/security/87-percent-of-cybersecurity-managers-say-quick-compliance-programs-are-actually-increasing-risk-and-making-businesses-less-resilient,2026-06-24 14:03:08
