headline,source,link,datetime
Launch an autonomous AI agent with sandboxed execution in 2 lines of code,Hacker News,https://amaiya.github.io/onprem/examples_agent.html,2026-03-18 02:13:19
The Pleasures of Poor Product Design,Hacker News,https://www.inconspicuous.info/p/the-pleasures-of-poor-product-design,2026-03-18 02:13:19
A tale about fixing eBPF spinlock issues in the Linux kernel,Hacker News,https://rovarma.com/articles/a-tale-about-fixing-ebpf-spinlock-issues-in-the-linux-kernel/,2026-03-18 02:13:19
"You can catch Deoxys, Ho-Oh, and Lugia in Pokémon FireRed and LeafGreen for Switch and Switch 2 — but what about Mew?",TechRadar,https://www.techradar.com/gaming/you-can-catch-deoxys-ho-oh-and-lugia-in-pokemon-firered-and-leafgreen-for-switch-and-switch-2-but-what-about-mew,2026-03-18 02:13:20
This simple ChatGPT trick forces the AI to poke holes in its own logic,TechRadar,https://www.techradar.com/ai-platforms-assistants/chatgpt/this-simple-chatgpt-trick-forces-the-ai-to-poke-holes-in-its-own-logic,2026-03-18 02:13:20
"'Space computing, the final frontier, has arrived': Nvidia wants to power the next generation of data centers in space",TechRadar,https://www.techradar.com/pro/space-computing-the-final-frontier-has-arrived-nvidia-wants-to-power-the-next-generation-of-data-centers-in-space,2026-03-18 02:13:20
"'This year is the most challenging year since the company was founded': MSI exec makes it clear how bad the RAM crisis has got, despite some prices plateauing",TechRadar,https://www.techradar.com/computing/memory/this-year-is-the-most-challenging-year-since-the-company-was-founded-msi-exec-makes-it-clear-how-bad-the-ram-crisis-has-got-despite-some-prices-plateauing,2026-03-18 02:13:20
