headline,source,link,datetime
I went to America's worst national parks so you don't have to,Hacker News,https://substack.com/home/post/p-193626949,2026-04-13 13:02:58
Michigan 'digital age' bills pulled after privacy concerns raised,Hacker News,https://www.thecentersquare.com/michigan/article_7ca4e268-4a68-42fb-9042-f9d8604ebd7f.html,2026-04-13 13:02:58
The Strait of Hormuz blockade is causing a slow-moving food crisis,The Verge,https://www.theverge.com/science/910326/iran-strait-hormuz-fertilizer-feedstock-food-crisis,2026-04-13 13:02:58
Roblox will need age verification to make sure you’re at least 9 years old,The Verge,https://www.theverge.com/games/910218/roblox-age-verification-check-games-kids-select-accounts,2026-04-13 13:02:58
Roblox has games again,The Verge,https://www.theverge.com/games/910699/roblox-games-experiences-switch-friends-connections,2026-04-13 13:02:58
Roblox introduces mandatory age-gated account tiers,Engadget,https://www.engadget.com/gaming/roblox-introduces-mandatory-age-gated-account-tiers-121535702.html?src=rss,2026-04-13 13:02:58
Google Pixel voicemail finally lets you record custom greetings in a new beta,TechRadar,https://www.techradar.com/phones/google-pixel-phones/google-pixel-voicemail-finally-lets-you-record-custom-greetings-in-a-new-beta,2026-04-13 13:02:58
"Tap to Share will soon bring some AirDrop-like features to Android, and it’s just been shown off",TechRadar,https://www.techradar.com/phones/android/tap-to-share-will-soon-bring-some-airdrop-like-features-to-android-and-its-just-been-shown-off,2026-04-13 13:02:58
