headline,source,link,datetime
Manufact (YC S25) Is Hiring a Senior infra engineer to build the MCP cloud,Hacker News,https://www.ycombinator.com/companies/manufact/jobs/Dh6PYP5-senior-infrastructure-engineer,2026-07-17 14:03:48
The manosphere’s testosterone fever is coming for the troops,The Verge,https://www.theverge.com/column/966770/optimizer-manosphere-testosterone-troops,2026-07-17 14:03:48
Even Microsoft couldn’t make Windows 11 work well on 8GB of RAM,The Verge,https://www.theverge.com/tech/966937/microsoft-surface-laptop-13-inch-8gb-ram-2026-review,2026-07-17 14:03:48
God of War show recasts Kratos after Ryan Hurst sustains an injury on set,Engadget,https://www.engadget.com/2217362/god-of-war-prime-video-show-recasts-kratos-ryan-hurst-injury-on-set/,2026-07-17 14:03:49
Most smart appliances collect data: Here's how to find out what yours tracks,Engadget,https://www.engadget.com/2210745/smart-appliances-data-transmission-weekly/,2026-07-17 14:03:49
Is sovereignty threatening your resilience?,TechRadar,https://www.techradar.com/pro/is-sovereignty-threatening-your-resilience,2026-07-17 14:03:49
Two 32GB DDR5-6000 RAM kits just dropped in price —  choose V-Color's low-latency Manta XSky or Corsair's Vengeance,TechRadar,https://www.techradar.com/pro/two-32gb-ddr5-6000-ram-kits-just-dropped-in-price-choose-v-colors-low-latency-manta-xsky-or-corsairs-vengeance,2026-07-17 14:03:49
The Chat Control gambit: The EU's 'undemocratic' revival of chat scanning may have long term consequences for digital privacy,TechRadar,https://www.techradar.com/vpn/vpn-privacy-security/the-chat-control-gambit-the-eus-undemocratic-revival-of-chat-scanning-may-have-long-term-consequences-for-digital-privacy,2026-07-17 14:03:49
Coca-Cola shuts down Fairlife dairy production lines following ransomware attack,TechRadar,https://www.techradar.com/pro/security/coca-cola-shuts-down-fairlife-dairy-production-lines-following-ransomware-attack,2026-07-17 14:03:49
