headline,source,link,datetime
Solar in California surpassed natural gas in the first five months of 2026,Hacker News,https://www.eia.gov/todayinenergy/detail.php?id=67784#,2026-06-17 21:03:00
"Krugman: Musk, a Human Ponzi Scheme",Hacker News,https://paulkrugman.substack.com/p/elon-musk-human-ponzi-scheme,2026-06-17 21:03:00
VSCO launches Studio Pro mobile photo editing app and plans $500 per year subscription,The Verge,https://www.theverge.com/tech/951863/vsco-studio-pro-vsco-one-subscription,2026-06-17 21:03:00
ChatGPT now has a hub for scheduled tasks,Engadget,https://www.engadget.com/2196844/chatgpt-now-has-a-hub-for-scheduled-tasks/,2026-06-17 21:03:01
Epic Games details how it's embracing generative AI in Unreal Engine,Engadget,https://www.engadget.com/2196807/epic-games-details-how-its-embracing-gen-ai-in-unreal-engine/,2026-06-17 21:03:01
"I rounded up the best Toy Story 5 toys and merch — these are the high-tech figures, Lego sets, and apparel worth buying",TechRadar,https://www.techradar.com/streaming/entertainment/i-rounded-up-the-best-toy-story-5-toys-and-merch-these-are-the-high-tech-figures-lego-sets-and-apparel-worth-buying,2026-06-17 21:03:01
How to watch Ghana vs Panama: Free Streams & TV Channels for FIFA World Cup 2026,TechRadar,https://www.techradar.com/how-to-watch/football/ghana-vs-panama-world-cup-2026-free,2026-06-17 21:03:01
