headline,source,link,datetime
Four stable kernels with partial fixes for Dirty Frag,Hacker News,https://lwn.net/Articles/1071775/,2026-05-08 15:02:56
PC Engine CPU,Hacker News,https://jsgroth.dev/blog/posts/pc-engine-cpu/,2026-05-08 15:02:56
Govee’s solar-powered string lights are already on sale for 20 percent off,The Verge,https://www.theverge.com/gadgets/926434/govee-outdoor-solar-string-lights-star-fox-switch-2-deal-sale,2026-05-08 15:02:56
The future of game consoles is looking bleak,The Verge,https://www.theverge.com/games/926772/nintendo-switch-2-price-hike-console-gaming-future,2026-05-08 15:02:56
How to watch VRT outside Belgium – from anywhere with a VPN,TechRadar,https://www.techradar.com/how-to-watch/vrt-outside-belgium-free,2026-05-08 15:02:56
Why AI auditability is what every security leader should be talking about,TechRadar,https://www.techradar.com/pro/why-ai-auditability-is-what-every-security-leader-should-be-talking-about,2026-05-08 15:02:56
OpenAI rolls out new model for cybersecurity teams a month after Anthropic's Mythos debut,TechRadar,https://www.techradar.com/pro/security/openai-rolls-out-new-model-for-cybersecurity-teams-a-month-after-anthropics-mythos-debut,2026-05-08 15:02:56
"Ever wish for earbuds with the disc-style fit of Apple's original iPod buds, but with hi-fi-quality sound and a USB-C cable? Then I've got great news for you — but don't expect them to come in all-white",TechRadar,https://www.techradar.com/audio/earbuds-airpods/disc-style-fit-of-apples-original-ipod-buds-but-with-hi-fi-quality-sound-and-a-usb-c-cable,2026-05-08 15:02:56
