headline,source,link,datetime
"Quote of the day by Sam Altman: ""I cannot imagine having gone through figuring out how to raise a newborn without ChatGPT"" — opening up on how reliant we are on chatbots",TechRadar,https://www.techradar.com/pro/quote-of-the-day-by-sam-altman-i-cannot-imagine-having-gone-through-figuring-out-how-to-raise-a-newborn-without-chatgpt-opening-up-on-how-reliant-we-are-on-chatbots,2026-06-04 22:03:03
"Cape Fear review: Apple TV's new adaptation is stylish, scary, and features Javier Bardem's best performance yet",TechRadar,https://www.techradar.com/streaming/apple-tv-plus/cape-fear-review-apple-tvs-new-adaptation-is-stylish-scary-and-features-javier-bardems-best-performance-yet,2026-06-04 22:03:03
I used Gemini in Google Forms to auto-build a survey and analyze responses for me,TechRadar,https://www.techradar.com/ai-platforms-assistants/i-used-gemini-in-google-forms-to-auto-build-a-survey-and-analyze-responses-for-me,2026-06-04 22:03:03
AIs like ChatGPT fall apart in classic 'Stroop' psychological test — and that could stand in the way of achieving artificial general intelligence,TechRadar,https://www.techradar.com/ai-platforms-assistants/ais-like-chatgpt-fall-apart-in-classic-stroop-psychological-test-and-that-could-stand-in-the-way-of-achieving-artificial-general-intelligence,2026-06-04 22:03:03
"Best Buy slashes up to $400 off Apple tech in a limited-time sale — get AirPods, MacBooks, iPads and Apple Watches from $99.99",TechRadar,https://www.techradar.com/seasonal-sales/best-buy-slashes-up-to-usd400-off-apple-tech-in-its-limited-time-sale-get-airpods-macbooks-ipads-and-apple-watches-from-usd99-99,2026-06-04 22:03:03
