headline,source,link,datetime
Linux security mailing list 'almost unmanageable',Hacker News,https://www.theregister.com/security/2026/05/18/linus-torvalds-says-ai-powered-bug-hunters-have-made-linux-security-mailing-list-almost-entirely-unmanageable/5241633,2026-05-18 13:02:38
Leaked images reveal Sony’s 10th anniversary ‘ColleXion’ headphones,The Verge,https://www.theverge.com/tech/932262/sony-1000x-headphone-collexion-image-spec-leaks,2026-05-18 13:02:38
What is the release date for The Boys season 5 episode 8 on Prime Video?,TechRadar,https://www.techradar.com/streaming/amazon-prime-video/what-is-the-release-date-for-the-boys-season-5-episode-8-on-prime-video,2026-05-18 13:02:38
Dutton Ranch fans are convinced Yellowstone spinoff's premiere has glaring 'plot hole' that completely ruins season 5 part 2 ending of hit Taylor Sheridan Western series,TechRadar,https://www.techradar.com/streaming/paramount-plus/dutton-ranch-premiere-fan-reaction,2026-05-18 13:02:38
"'It’s all shaping up to be a wonderfully daring adventure, with plenty of surprises in store' — The 2026 Future Games Show Summer Showcase has found its hosts in The Last of Us actor Troy Baker and Tomb Raider: Legacy of Atlantis' Alix Wilton Regan",TechRadar,https://www.techradar.com/gaming/gaming-industry/its-all-shaping-up-to-be-a-wonderfully-daring-adventure-with-plenty-of-surprises-in-store-the-2026-future-games-show-summer-showcase-has-found-its-hosts-in-the-last-of-us-actor-troy-baker-and-tomb-raider-legacy-of-atlantis-alix-wilton-regan,2026-05-18 13:02:38
"'I'm confused and I need an adult' — that unsettling Steam game you're seeing on Instagram is real, it's coming soon, and frankly, I'm terrified",TechRadar,https://www.techradar.com/gaming/pc-gaming/im-confused-and-i-need-an-adult-that-unsettling-steam-game-youre-seeing-on-instagram-is-real-its-coming-soon-and-frankly-im-terrified,2026-05-18 13:02:38
5 things to expect at Google I/O 2026 — from Android XR smart glasses to Gemini Remy,TechRadar,https://www.techradar.com/phones/android/5-things-to-expect-at-google-i-o-2026,2026-05-18 13:02:38
