headline,source,link,datetime
The Rise of the Em-Dash in Hacker News Comments,Hacker News,https://boazsobrado.com/blog/2026/04/15/the-rise-of-the-em-dash-in-hacker-news-comments/,2026-04-15 23:02:27
I Made a Terminal Pager,Hacker News,https://theleo.zone/posts/pager/,2026-04-15 23:02:27
YouTube now lets you turn off Shorts,The Verge,https://www.theverge.com/streaming/912898/youtube-shorts-feed-limit-zero-minutes,2026-04-15 23:02:27
Is this the tipping point for AI at work? New Gallup survey finds half of all US employees now use it in some way,TechRadar,https://www.techradar.com/pro/is-this-the-tipping-point-for-ai-at-work-new-gallup-survey-finds-half-of-all-us-employees-now-use-it-in-some-way,2026-04-15 23:02:28
"I have an Allbirds collection that I love, and its AI pivot feels worse than poorly-fitting shoes",TechRadar,https://www.techradar.com/ai-platforms-assistants/i-have-an-allbirds-collection-that-i-love-and-its-ai-pivot-feels-worse-than-poorly-fitting-shoes,2026-04-15 23:02:28
