headline,source,link,datetime
Amazon’s Panos Panay addresses new Fire phone rumors,The Verge,https://www.theverge.com/tech/929412/amazon-panos-panay-interview-phone-transformer,2026-05-13 09:02:53
I thought Google NotebookLM was just an AI research tool — now it organizes my entire life,TechRadar,https://www.techradar.com/ai-platforms-assistants/i-thought-google-notebooklm-was-just-an-ai-research-tool-now-it-organizes-my-entire-life,2026-05-13 09:02:53
AI agents are the new unmanaged endpoints,TechRadar,https://www.techradar.com/pro/ai-agents-are-the-new-unmanaged-endpoints,2026-05-13 09:02:53
"Claude AI has started telling some users to sleep, drink water, and stop working — and people can’t stop talking about it",TechRadar,https://www.techradar.com/ai-platforms-assistants/claude-ai-has-started-telling-some-users-to-sleep-drink-water-and-stop-working-and-people-cant-stop-talking-about-it,2026-05-13 09:02:53
Sony Xperia 1 VIII launches with a Google Pixel-style camera assist feature and a new design,TechRadar,https://www.techradar.com/phones/sony-xperia-phones/sony-xperia-1-viii-launches-with-a-google-pixel-style-camera-assist-feature-and-a-new-design,2026-05-13 09:02:53
Is your internet provider quietly slowing down your Netflix streams? Here’s how to check (and stop it),TechRadar,https://www.techradar.com/vpn/is-your-internet-provider-quietly-slowing-down-your-netflix-streams-heres-how-to-check-and-stop-it,2026-05-13 09:02:53
How to bypass AI bots and land the interview with these simple CV tweaks,TechRadar,https://www.techradar.com/pro/how-to-bypass-ai-bots-and-land-the-interview-with-these-simple-cv-tweaks,2026-05-13 09:02:53
