headline,source,link,datetime
U.S. Senators Vote to Ban Themselves from Trading on Prediction Markets,Hacker News,https://www.wsj.com/politics/policy/senators-vote-to-ban-themselves-from-trading-on-prediction-markets-ae4535dd,2026-04-30 20:02:37
Follow-up to Carrot disclosure: Forgejo,Hacker News,https://dustri.org/b/follow-up-to-carrot-disclosure-forgejo.html,2026-04-30 20:02:37
The logic of the racist Supreme Court isn’t adding up,The Verge,https://www.theverge.com/policy/921597/callais-louisiana-voting-rights-act,2026-04-30 20:02:37
Microsoft’s Xbox mode is now available for all Windows 11 PCs,The Verge,https://www.theverge.com/news/921582/microsoft-xbox-mode-windows-11,2026-04-30 20:02:37
Meta threatens to pull its apps from New Mexico if forced to make ‘technologically impractical’ changes,The Verge,https://www.theverge.com/policy/921557/meta-threatens-leaving-new-mexico,2026-04-30 20:02:37
You can now choose which games use Quick Resume on Xbox,Engadget,https://www.engadget.com/2161516/you-can-now-choose-which-games-use-quick-resume-on-xbox/,2026-04-30 20:02:38
The minimalist Light Phone III will soon support a curated set of third-party apps,Engadget,https://www.engadget.com/2161468/the-minimalist-light-phone-iii-will-soon-support-a-curated-set-of-third-party-apps/,2026-04-30 20:02:38
Has smart home tech gone too far? This robot vacuum is also a closet — and four washer-dryers,TechRadar,https://www.techradar.com/home/robot-vacuums/has-smart-home-tech-gone-too-far-this-robot-vacuum-is-also-a-closet-and-four-washer-dryers,2026-04-30 20:02:38
