headline,source,link,datetime
Un-0: Generating Images with Coupled Oscillators,Hacker News,https://unconv.ai/blog/introducing-un-0-generating-images-with-coupled-oscillators/,2026-06-25 21:02:49
"The Customer Who Almost Killed Slack, Stripe, and Airbnb",Hacker News,https://siliconopera.com/the-customer-who-almost-killed-slack-stripe-and-airbnb/,2026-06-25 21:02:49
An oral history of Bank Python (2021),Hacker News,https://calpaterson.com/bank-python.html,2026-06-25 21:02:49
Parallel Parentheses Matching,Hacker News,https://williamdue.github.io/blog/parallel-parentheses-matching,2026-06-25 21:02:49
Score a discounted Xbox console before the prices jump,The Verge,https://www.theverge.com/gadgets/957170/xbox-series-s-x-prime-day-deal-sale,2026-06-25 21:02:49
Instagram wants to monopolize your attention,The Verge,https://www.theverge.com/tech/956456/instagram-for-tv-youtube-microdramas-longform-video,2026-06-25 21:02:49
"I’ve covered tech sales for 8 years — these 25 Prime Day smart home deals are at record-low prices, and worth your cash",TechRadar,https://www.techradar.com/seasonal-sales/ive-covered-tech-sales-for-8-years-these-25-prime-day-smart-home-deals-are-at-record-low-prices-and-worth-your-cash,2026-06-25 21:02:49
"How to watch Tunisia vs Netherlands: Free Streams, TV Channels & Kick-Off time for FIFA World Cup 2026 as Oranje aim to clinch top spot",TechRadar,https://www.techradar.com/how-to-watch/football/tunisia-vs-netherlands-world-cup-2026-free,2026-06-25 21:02:49
The HomePod mini was my favorite cheap wireless speaker — but Apple’s price hike has now handed that honor to the Sonos Era 100 SL,TechRadar,https://www.techradar.com/audio/multi-room/the-homepod-mini-was-my-favorite-cheap-wireless-speaker-but-apples-price-hike-has-now-handed-that-honor-to-the-sonos-era-100-sl,2026-06-25 21:02:49
"The best upgrade you can give your home is new, better Wi-Fi – and Amazon has knocked $100 off its eero mesh system",TechRadar,https://www.techradar.com/tech/the-best-upgrade-you-can-give-your-home-is-new-better-wi-fi-and-amazon-has-knocked-usd100-off-its-eero-mesh-system,2026-06-25 21:02:49
"As a fitness tracker reviewer, sometimes I'm sick of wearing smartwatches — here are 3 discreet, screenless fitness trackers I've personally tested, and where to buy them on Prime Day",TechRadar,https://www.techradar.com/health-fitness/fitness-trackers/as-a-fitness-tracker-reviewer-sometimes-im-sick-of-wearing-smartwatches-here-are-3-discreet-screenless-fitness-trackers-ive-personally-tested-and-where-to-buy-them-on-prime-day,2026-06-25 21:02:49
"How to watch Japan vs Sweden: Free Streams, TV Channels & Kick-Off time for crucial Group F clash at FIFA World Cup 2026",TechRadar,https://www.techradar.com/how-to-watch/football/japan-vs-sweden-world-cup-2026-free,2026-06-25 21:02:49
