headline,source,link,datetime
Google hallucinated that I am sponsored by Ground News,Hacker News,https://www.youtube.com/post/UgkxsAIUDMQTYc15yQqURsGy0Kg7O1x2TtnB,2026-06-26 13:03:23
Captcha proves you're human. HATCHA proves you're not,Hacker News,https://github.com/mondaycom/HATCHA,2026-06-26 13:03:23
Prime Day is offering rare discounts on Philips Hue smart lights,The Verge,https://www.theverge.com/tech/957269/philips-hue-amazon-prime-day-2026-deal-sale,2026-06-26 13:03:23
"'Humanity now stands on the eve of AGI': DeepSeek wants to ""at least double the size of every department"" as company pursues hiring spree in pursuit of AGI",TechRadar,https://www.techradar.com/pro/humanity-now-stands-on-the-eve-of-agi-deepseek-wants-to-at-least-double-the-size-of-every-department-as-company-pursues-hiring-spree-in-pursuit-of-agi,2026-06-26 13:03:24
New report suggests retailers may run out of PS5 and Xbox stock 'around the launch of GTA 6' — 'Demand will likely outstrip supply during the year end period',TechRadar,https://www.techradar.com/gaming/new-report-suggests-retailers-may-run-out-of-ps5-and-xbox-stock-around-the-launch-of-gta-6-demand-will-likely-outstrip-supply-during-the-year-end-period,2026-06-26 13:03:24
"'Actually, no I cannot hear you Clem Fandango’: these excellent ANC headphones are hugely discounted and yes, you get the voice of Matt Berry",TechRadar,https://www.techradar.com/tech/actually-no-i-cannot-hear-you-clem-fandango-these-excellent-anc-headphones-are-hugely-discounted-and-yes-you-get-the-voice-of-matt-berry,2026-06-26 13:03:24
