headline,source,link,datetime
RAM crisis prompts further RTX 3060 GPU resurrections as Palit launches new 12GB model — I just hope pricing makes more sense than it has done so far,TechRadar,https://www.techradar.com/computing/gpu/ram-crisis-prompts-further-rtx-3060-gpu-resurrections-as-palit-launches-new-12gb-model-i-just-hope-pricing-makes-more-sense-than-it-has-done-so-far,2026-07-16 11:03:25
The agentic commerce gold rush risks repeating ecommerce's biggest mistakes,TechRadar,https://www.techradar.com/pro/the-agentic-commerce-gold-rush-risks-repeating-ecommerces-biggest-mistakes,2026-07-16 11:03:25
"I'm rediscovering Assassin's Creed Black Flag in Resynced — here's what I love, and what I'd change",TechRadar,https://www.techradar.com/gaming/im-rediscovering-assassins-creed-black-flag-in-resynced-heres-what-i-love-and-what-id-change,2026-07-16 11:03:25
What is Pixel Glow? Google teases new Pixel 11 feature — and it looks like a useful alternative to Nothing’s Glyph interface,TechRadar,https://www.techradar.com/phones/google-pixel-phones/what-is-pixel-glow-google-teases-new-pixel-11-feature-and-it-looks-like-a-useful-alternative-to-nothings-glyph-interface,2026-07-16 11:03:25
"Best business laptop deals 2026 — Top picks from HP, Asus, Dell, starting at $548",TechRadar,https://www.techradar.com/pro/best-business-laptop-deals-2026-top-picks-from-hp-asus-dell-starting-at-usd548,2026-07-16 11:03:25
"As AI scales, is meaningful governance possible?",TechRadar,https://www.techradar.com/pro/as-ai-scales-is-meaningful-governance-possible,2026-07-16 11:03:25
The rise of “comprehension debt” in the age of AI coding,TechRadar,https://www.techradar.com/pro/the-rise-of-comprehension-debt-in-the-age-of-ai-coding,2026-07-16 11:03:25
KFC may be forced to shut some stores following cyberattack at key supplier,TechRadar,https://www.techradar.com/pro/security/kfc-may-be-forced-to-shut-some-stores-following-cyberattack-at-key-supplier,2026-07-16 11:03:25
