headline,source,link,datetime
"If Apple makes an iPad Neo, it's all over",Hacker News,https://www.techadvisor.com/article/3128472/if-apple-makes-an-ipad-neo-its-all-over.html,2026-04-30 19:02:59
Elon Musk confirms xAI used OpenAI’s models to train Grok,The Verge,https://www.theverge.com/ai-artificial-intelligence/921546/elon-musk-xai-openai-trial-model-distillation,2026-04-30 19:02:59
City of None is the next game from the co-creator of Celeste,Engadget,https://www.engadget.com/2161453/city-of-none-is-the-next-game-from-the-co-creator-of-celeste/,2026-04-30 19:02:59
Anbernic's swiveling retro handheld will be available May 11,Engadget,https://www.engadget.com/2161434/anbernics-swiveling-retro-handheld-will-be-available-may-11/,2026-04-30 19:02:59
LG's UltraGear evo 5K gaming monitor is available to pre-order,Engadget,https://www.engadget.com/2161419/lgs-ultragear-evo-5k-gaming-monitor-is-available-to-pre-order/,2026-04-30 19:02:59
'PIN and data remain encrypted at rest': This unhackable offline device is quietly solving a problem most companies don’t realize is about to cost them everything,TechRadar,https://www.techradar.com/pro/pin-and-data-remain-encrypted-at-rest-this-unhackable-offline-device-is-quietly-solving-a-problem-most-companies-dont-realize-is-about-to-cost-them-everything,2026-04-30 19:02:59
