headline,source,link,datetime
Did Claude Increase Bugs in Rsync?,Hacker News,https://alexispurslane.github.io/rsync-analysis/,2026-06-05 13:02:44
OpenAI will let the US government review its AI models before release,Engadget,https://www.engadget.com/2188124/openai-will-let-us-government-review-its-models/,2026-06-05 13:02:45
Vertigo Games announces closure of its Amsterdam VR studio,Engadget,https://www.engadget.com/2188110/vertigo-games-closes-amsterdam-studio/,2026-06-05 13:02:45
Amazon drops early deals ahead of Prime Day later this month — here are the top 18 offers I've found,TechRadar,https://www.techradar.com/tech/amazon-drops-early-deals-ahead-of-prime-day-later-this-month-here-are-the-top-18-offers-ive-found,2026-06-05 13:02:45
'They want to build a moat': Anthropic's scary warnings about rapid AI 'self-improvement' and 'temporarily' pausing development aren’t convincing the cynics,TechRadar,https://www.techradar.com/ai-platforms-assistants/they-want-to-build-a-moat-anthropics-scary-warnings-about-rapid-ai-self-improvement-and-temporarily-pausing-development-arent-convincing-the-cynics,2026-06-05 13:02:45
Seagate FireCuda X Vault review: Large capacity and decent transfer rates make this external hard drive a great solution for video and photography,TechRadar,https://www.techradar.com/pro/seagate-firecuda-x-vault-external-hard-drive-review,2026-06-05 13:02:45
