headline,source,link,datetime
Welcome to Gas City,Hacker News,https://steve-yegge.medium.com/welcome-to-gas-city-57f564bb3607,2026-05-04 22:03:05
Claude Is Dead,Hacker News,https://www.javiertordable.com/claude-is-dead/,2026-05-04 22:03:05
Elon Musk settles with the SEC for $1.5 million after years-long dispute over his Twitter investment,Engadget,https://www.engadget.com/2164424/elon-musk-settles-with-the-sec-for-15-million-after-years-long-dispute-over-his-twitter-investment/,2026-05-04 22:03:05
The White House is considering tighter regulation of new AI models,Engadget,https://www.engadget.com/2164390/the-white-house-is-considering-tighter-regulation-of-new-ai-models/,2026-05-04 22:03:05
'Help cattle producers hold onto their land and livelihoods': This first-of-its-kind solar ranch in Tennessee uses ingenious sensors to shelter cattle and cut carbon emissions — and it could help to offset $1 billion of US agriculture declines,TechRadar,https://www.techradar.com/pro/help-cattle-producers-hold-onto-their-land-and-livelihoods-this-first-of-its-kind-solar-ranch-in-tennessee-uses-ingenious-sensors-to-shelter-cattle-and-cut-carbon-emissions-and-it-could-help-to-offset-usd1-billion-of-us-agriculture-declines,2026-05-04 22:03:05
