headline,source,link,datetime
Fox to Buy Roku Streaming Service in $22B Deal,Hacker News,https://www.wsj.com/business/deals/fox-roku-deal-f6e564f9,2026-06-15 13:03:40
Salesforce to Acquire Fin (formerly Intercom) for $3.6BN,Hacker News,https://www.salesforce.com/news/press-releases/2026/06/15/salesforce-signs-definitive-agreement-to-acquire-fin/?bc=HL,2026-06-15 13:03:40
Fox is buying Roku for $22 billion,Engadget,https://www.engadget.com/2194058/fox-is-buying-roku-for-22-billion/,2026-06-15 13:03:41
"Early Prime Day deals just dropped at Amazon UK — get up to 65% off Ring, Blink, Ninja, Apple, Sonos, and more",TechRadar,https://www.techradar.com/seasonal-sales/early-prime-day-deals-just-dropped-at-amazon-uk-get-up-to-65-percent-off-ring-blink-ninja-apple-sonos-and-more,2026-06-15 13:03:41
FBI takes out huge AI-powered phishing service: Outsider Enterprise was using over a million phishing URLs to steal credit card data and passwords,TechRadar,https://www.techradar.com/pro/security/fbi-takes-out-huge-ai-powered-phishing-service-outsider-enterprise-was-using-over-a-million-phishing-urls-to-steal-credit-card-data-and-passwords,2026-06-15 13:03:41
"'Set picture mode to Sport': Gemini on Google TVs is getting its most useful upgrade yet — you can now tell it to change picture settings instantly, or even just tell it what's wrong with the picture and it'll (try to) fix it for you",TechRadar,https://www.techradar.com/televisions/set-picture-mode-to-sport-gemini-on-google-tvs-is-getting-its-most-useful-upgrade-yet-you-can-now-tell-it-to-change-picture-settings-instantly-or-even-just-tell-it-whats-wrong-with-the-picture-and-itll-try-to-fix-it-for-you,2026-06-15 13:03:41
