headline,source,link,datetime
How are we going to get out of Meta? (Or social media in general),Hacker News,https://hugoib.beehiiv.com/p/how-are-we-going-to-get-out-of-meta-or-social-media-in-general,2026-05-11 16:02:45
Show HN: Free tool to see how much AI bots are costing your site,Hacker News,https://botcost.dev,2026-05-11 16:02:45
7 of our favorite deals from Amazon’s Pet Days sale,The Verge,https://www.theverge.com/gadgets/927788/amazon-pet-days-tech-gadgets-cat-dog-deal-sale,2026-05-11 16:02:45
GM settles California lawsuit claiming it sold driving habit data to insurance companies,The Verge,https://www.theverge.com/transportation/927863/gm-settles-california-lawsuit-claiming-it-sold-driving-habit-data-to-insurance-companies,2026-05-11 16:02:45
OpenAI sued by spouse of FSU shooting victim,Engadget,https://www.engadget.com/2169656/openai-sued-by-spouse-of-fsu-shooting-victim/,2026-05-11 16:02:45
The DJI Mini 3 is 'an entry-level DJI drone with a strong set of video features' — it's now back to a record-low price on Amazon,TechRadar,https://www.techradar.com/cameras/drones/the-dji-mini-3-is-an-entry-level-dji-drone-with-a-strong-set-of-video-features-its-now-back-to-a-record-low-price-on-amazon,2026-05-11 16:02:46
Dua Lipa brands Samsung ‘dismissive and callous’ as she sues the tech giant for $15m for using her photo on TV packaging without her permission,TechRadar,https://www.techradar.com/televisions/dua-lipa-brands-samsung-dismissive-and-callous-as-she-sues-the-tech-giant-for-usd15m-for-using-her-photo-on-tv-packaging-without-her-permission,2026-05-11 16:02:46
"I love my Ninja Slushi drinks machine, but this new version is twice as ice — how can you resist cool twisted multi-colored slushies at home?",TechRadar,https://www.techradar.com/home/small-appliances/i-love-my-ninja-slushi-drinks-machine-but-this-new-version-is-twice-as-ice-how-can-you-resist-cool-twisted-multi-colored-slushies-at-home,2026-05-11 16:02:46
A fake OpenAI repository has taken top spot on Hugging Face — but all it does is push infostealer malware,TechRadar,https://www.techradar.com/pro/security/a-fake-openai-repository-has-taken-top-spot-on-hugging-face-but-all-it-does-is-push-infostealer-malware,2026-05-11 16:02:46
