headline,source,link,datetime
Do We Need Billionaires?,Hacker News,https://bjhess.com/posts/do-we-need-billionaires,2026-06-05 12:02:46
The Morning After: NVIDIA thinks its new chip will revolutionize PCs,Engadget,https://www.engadget.com/2188063/engadget-newsletter-nvidia-rtx-spark/,2026-06-05 12:02:47
"Forget Prime Day: these are the best AI-enabled all-in-one inkjet deals I've found in HP's big printer sale, with massive savings and free Instant Ink",TechRadar,https://www.techradar.com/pro/forget-prime-day-these-are-the-best-ai-enabled-all-in-one-inkjet-deals-ive-found-in-hps-big-printer-sale-with-massive-savings-and-free-instant-ink,2026-06-05 12:02:47
Exclusive: Fairphone CEO teases ‘two new products’ that will ‘really push the envelope’ for sustainable tech — could we be about to see the first Fairtablet?,TechRadar,https://www.techradar.com/computing/instagram/exclusive-fairphone-ceo-teases-two-new-products-that-will-really-push-the-envelope-for-sustainable-tech-could-we-be-about-to-see-the-first-fairtablet,2026-06-05 12:02:47
"The Steam Machine could be weeks away from launch, as Valve confirms it will ship 'this summer' — but there's still no price tag, and experts think it could start at USD 1,200",TechRadar,https://www.techradar.com/gaming/consoles-pc/the-steam-machine-could-be-weeks-away-from-launch-as-valve-confirms-it-will-ship-this-summer-but-theres-still-no-price-tag-and-experts-think-it-could-start-at-usd-1-200,2026-06-05 12:02:47
"A year on, my Switch 2 has more than proved its worth — but Nintendo needs to act fast if it wants to break its generational curse",TechRadar,https://www.techradar.com/gaming/a-year-on-my-switch-2-has-more-than-proved-its-worth-but-nintendo-needs-to-act-fast-if-it-wants-to-break-its-generational-curse,2026-06-05 12:02:47
This 'simply adorable' Obsbot webcam just hit its lowest price ahead of Prime Day — the Meet SE is a perfect budget upgrade,TechRadar,https://www.techradar.com/pro/this-simply-adorable-obsbot-webcam-just-hit-its-lowest-price-ahead-of-prime-day-the-meet-se-is-a-perfect-budget-upgrade,2026-06-05 12:02:47
