headline,source,link,datetime
Apple’s education discount now requires proof that you’re a student,The Verge,https://www.theverge.com/tech/926675/apple-education-discount-unidays-verification-us,2026-05-08 12:02:32
Sony wants TSMC's help to make image sensors,Engadget,https://www.engadget.com/2167681/sony-tsmc-image-sensor-joint-venture/,2026-05-08 12:02:32
‘They fixed everything’ — Honor quietly launched the best mid-range Android tablet I’ve ever tested,TechRadar,https://www.techradar.com/tablets/honor-magic-pad-4-review,2026-05-08 12:02:32
"Xbox plans to share more on its next console, Project Helix, 'later this year'",TechRadar,https://www.techradar.com/gaming/xbox/xbox-plans-to-share-more-on-its-next-console-project-helix-later-this-year,2026-05-08 12:02:32
"'The stakes are high: a misconfigured payment flow doesn’t just produce a bad answer, it moves real money': Amazon Bedrock teams up with Coinbase and Stripe to let AI agents carry out transactions using stablecoins",TechRadar,https://www.techradar.com/pro/the-stakes-are-high-a-misconfigured-payment-flow-doesnt-just-produce-a-bad-answer-it-moves-real-money-amazon-bedrock-teams-up-with-coinbase-and-stripe-to-let-ai-agents-carry-out-transactions-using-stablecoins,2026-05-08 12:02:32
"‘Google is not collaborative and not in the spirit of complying with this regulation’ – can the EU Commission strong-arm Google into levelling the playing field of the search engine market, and is this really in the interest of your privacy?",TechRadar,https://www.techradar.com/vpn/vpn-privacy-security/google-is-not-collaborative-and-not-in-the-spirit-of-complying-with-this-regulation-can-the-eu-commission-strong-arm-google-into-levelling-the-playing-field-of-the-search-engine-market-and-is-this-really-in-the-interest-of-your-privacy,2026-05-08 12:02:32
