headline,source,link,datetime
Show HN: Updated my landing page with Fable (retro pixel style),Hacker News,https://www.tryguildly.com/,2026-07-03 22:03:30
AI First: How the Federal Government Is Prioritizing AI over People and Planet,Hacker News,https://stopgreedbuildgreen.climateandcommunity.org/posts/ai-first,2026-07-03 22:03:30
Africans Are Turning to Starlink,Hacker News,https://www.economist.com/middle-east-and-africa/2026/07/02/africans-are-turning-to-starlink,2026-07-03 22:03:30
"Quote of the day by Studio Ghibli co-founder Hayao Miyazaki on AI: ""I strongly feel that this is an insult to life itself"" — decrying the rise of machine-made art",TechRadar,https://www.techradar.com/pro/quote-of-the-day-by-studio-ghibli-co-founder-hayao-miyazaki-on-ai-i-strongly-feel-that-this-is-an-insult-to-life-itself-decrying-the-rise-of-machine-made-art,2026-07-03 22:03:30
NASA and Red Hat are building an open source medical system to diagnose sick astronauts on the ISS — could a Star Trek Tricorder be next?,TechRadar,https://www.techradar.com/pro/nasa-and-red-hat-are-building-an-open-source-medical-system-to-diagnose-sick-astronauts-on-the-iss-could-a-star-trek-tricorder-be-next,2026-07-03 22:03:30
