headline,source,link,datetime
"A type-safe, realtime collaborative Graph Database in a CRDT",Hacker News,https://codemix.com/graph,2026-04-21 11:02:43
"""75% of web designers now fear AI more than shrinking budgets"": How AI is reshaping web design and how web pros can adapt",TechRadar,https://www.techradar.com/pro/website-hosting/75-percent-of-web-designers-now-fear-ai-more-than-shrinking-budgets-how-ai-is-reshaping-web-design-and-how-web-pros-can-adapt,2026-04-21 11:02:44
Why enterprises need governance frameworks for agentic AI,TechRadar,https://www.techradar.com/pro/why-enterprises-need-governance-frameworks-for-agentic-ai,2026-04-21 11:02:44
Microsoft issues warning over Teams helpdesk impersonation attacks – hackers are 'blending into routine IT support activity' by abusing remote assistance access,TechRadar,https://www.techradar.com/pro/security/microsoft-issues-warning-over-teams-helpdesk-impersonation-attacks-hackers-are-blending-into-routine-it-support-activity-by-abusing-remote-assistance-access,2026-04-21 11:02:44
"'We know you know' — Ubisoft officially announces Assassin's Creed Black Flag Resynced, which will receive a 'dedicated' worldwide reveal showcase this week",TechRadar,https://www.techradar.com/gaming/we-know-you-know-ubisoft-officially-announces-assassins-creed-black-flag-resynced-which-will-receive-a-dedicated-worldwide-reveal-showcase-this-week,2026-04-21 11:02:44
"'NHS users report that it is awful to use': Palantir could be forced to exit NHS after pushback from staff, MPs, unions, and pressure groups over Federated Data Platform",TechRadar,https://www.techradar.com/pro/security/nhs-users-report-that-it-is-awful-to-use-palantir-could-be-forced-to-exit-nhs-after-pushback-from-staff-mps-unions-and-pressure-groups-over-federated-data-platform,2026-04-21 11:02:44
Software 3.0 is speeding up coding - but delivery is a different story,TechRadar,https://www.techradar.com/pro/software-3-0-is-speeding-up-coding-but-delivery-is-a-different-story,2026-04-21 11:02:44
I've found the best Samsung Galaxy A57 covers to keep your new mid-range handset protected from bumps and scratches,TechRadar,https://www.techradar.com/phones/samsung-galaxy-phones/ive-found-the-best-samsung-galaxy-a57-covers-to-keep-your-new-mid-range-handset-protected-from-bumps-and-scratches,2026-04-21 11:02:44
'They ruined my favorite movie': fans slam Practical Magic 2 trailer for 'Netflix lighting' as Sandra Bullock and Nicole Kidman legacy sequel swaps haunting darkness for pastel color,TechRadar,https://www.techradar.com/streaming/entertainment/practical-magic-2-trailer,2026-04-21 11:02:44
"Goodbye, Cosmic Orange — the iPhone 18 Pro's possible colors have leaked, and everyone's talking about one specific shade",TechRadar,https://www.techradar.com/phones/iphone/goodbye-cosmic-orange-the-iphone-18-pros-possible-colors-have-leaked-and-everyones-talking-about-one-specific-shade,2026-04-21 11:02:44
"HireRight background check review: Efficient, compliant, but not flawless",TechRadar,https://www.techradar.com/pro/hireright-review,2026-04-21 11:02:44
The 'unbeatable' and five-star-rated JBL Charge 6 just got a big discount at Best Buy,TechRadar,https://www.techradar.com/audio/wireless-bluetooth-speakers/the-unbeatable-and-five-star-rated-jbl-charge-6-just-got-a-big-discount-at-best-buy,2026-04-21 11:02:44
