headline,source,link,datetime
Uber tells London to get ready for robotaxis,The Verge,https://www.theverge.com/transportation/945614/uber-wayve-robotaxi-interest-list-launch-london,2026-06-08 12:02:50
"Forget the Kodak Charmera — this miniature digital camera is even smaller, even cheaper, and features a mini torch!",TechRadar,https://www.techradar.com/cameras/compact-cameras/forget-the-kodak-charmera-this-miniature-digital-camera-is-even-smaller-even-cheaper-and-features-a-mini-torch,2026-06-08 12:02:51
This SanDisk Extreme Pro portable SSD deal is a fantastic Father’s Day gift for business and creative professionals,TechRadar,https://www.techradar.com/pro/this-sandisk-extreme-pro-portable-ssd-deal-is-a-fantastic-fathers-day-gift-for-business-and-creative-professionals,2026-06-08 12:02:51
"Spotify wants to have more video content, and it could start streaming live concert footage soon — but my scepticism is telling me that YouTube still has the upper hand",TechRadar,https://www.techradar.com/audio/spotify/spotify-wants-to-have-more-video-content-and-it-could-start-streaming-live-concert-footage-soon-but-my-scepticism-is-telling-me-that-youtube-still-has-the-upper-hand,2026-06-08 12:02:51
"The Lenovo Legion Pro 7i features a 'gorgeous' OLED display, RTX 5080, and 32GB of RAM — and it's $950 cheaper after a surprise pre-Prime Day deal",TechRadar,https://www.techradar.com/computing/gaming-laptops/the-lenovo-legion-pro-7i-features-a-gorgeous-oled-display-rtx-5080-and-32gb-of-ram-and-its-usd950-cheaper-after-a-surprise-pre-prime-day-deal,2026-06-08 12:02:51
Someone made a smart Sonos touchscreen music controller for just $20 / £16 — and it makes me miss the days when Sonos made its own iPod-like dedicated controller,TechRadar,https://www.techradar.com/audio/someone-made-a-smart-sonos-touchscreen-music-controller-for-just-usd20-gbp16-and-it-makes-me-miss-the-days-when-sonos-made-its-own-ipod-like-dedicated-controller,2026-06-08 12:02:51
