headline,source,link,datetime
NPM Website Is Down,Hacker News,https://status.npmjs.org,2026-04-27 22:02:46
"I used the same camera to photograph the moon as the Artemis II astronauts, and it's probably the closest I'll ever get to going into space — but it also showed me I've got a lot to learn about astrophotography",TechRadar,https://www.techradar.com/cameras/mirrorless-cameras/i-used-the-same-camera-to-photograph-the-moon-as-the-artemis-ii-astronauts-and-its-probably-the-closest-ill-ever-get-to-going-into-space-but-it-also-showed-me-ive-got-a-lot-to-learn-about-astrophotography,2026-04-27 22:02:46
"Acer ProCreator PE320QXT review: This 6K touchscreen monitor is aggressively priced, but I'd still swap the touch capabilities for an even cheaper display",TechRadar,https://www.techradar.com/pro/acer-procreator-pe320qxt-6k-touchscreen-monitor-review,2026-04-27 22:02:46
'The future of the CH-47 Chinook': See the legendary twin rotor morph into a massive drone-swarming mothership,TechRadar,https://www.techradar.com/pro/the-future-of-the-ch-47-chinook-see-the-legendary-twin-rotor-morph-into-a-massive-drone-swarming-mothership,2026-04-27 22:02:46
"'The death of Top Gun' — Ukraine becomes the first to scale remotely operated interceptors that can score aerial kills from ""thousands of kilometers"" away while staying in bunkers as era of pilotless dogfighting and zero crew casualties takes to the sky",TechRadar,https://www.techradar.com/pro/the-death-of-top-gun-ukraine-becomes-the-first-to-scale-remotely-operated-interceptors-that-can-score-aerial-kills-from-thousands-of-kilometers-away-while-staying-in-bunkers-as-era-of-pilotless-dogfighting-and-zero-crew-casualties-takes-to-the-sky,2026-04-27 22:02:46
