headline,source,link,datetime
ICE denies having a protester database. A letter to Congress sheds more light,Hacker News,https://www.npr.org/2026/06/10/nx-s1-5843159/ice-protester-database-dhs,2026-06-10 14:03:33
I Hate (Most) Keyboard 'Fn' Keys,Hacker News,https://danq.me/2026/06/09/fn-keys/,2026-06-10 14:03:33
Ask HN: Are most corporate SWE jobs performative?,Hacker News,https://news.ycombinator.com/item?id=48475871,2026-06-10 14:03:33
What that tiny green dot on your Samsung phone is telling you,Engadget,https://www.engadget.com/2190478/what-that-tiny-green-dot-on-your-samsung-phone-is-telling-you/,2026-06-10 14:03:34
AirPods Pro 3 have hit a record-low price of $179 ahead of Prime Day — I doubt these 'near-perfect set of noise-cancelling earbuds' will get any cheaper,TechRadar,https://www.techradar.com/audio/earbuds-airpods/airpods-pro-3-have-hit-a-record-low-price-of-usd179-ahead-of-prime-day-i-doubt-these-near-perfect-set-of-noise-cancelling-earbuds-will-get-any-cheaper,2026-06-10 14:03:34
Major Russian mobile provider Beeline launches 'whitelist VPN' for Netflix and Spotify,TechRadar,https://www.techradar.com/vpn/vpn-privacy-security/major-russian-mobile-provider-beeline-launches-whitelist-vpn-for-netflix-and-spotify,2026-06-10 14:03:34
"ServiceNow reveals security issue affecting customer data, but won't reveal much on what actually happened",TechRadar,https://www.techradar.com/pro/security/servicenow-reveals-security-issue-affecting-customer-data-but-wont-reveal-much-on-what-actually-happened,2026-06-10 14:03:34
