headline,source,link,datetime
A Girl Who Couldn't Draw Home,Hacker News,https://www.gailweiner.com/post/the-girl-who-couldn-t-draw-home,2026-05-21 12:04:05
Python 3.15: features that didn't make the headlines,Hacker News,https://blog.changs.co.uk/python-315-features-that-didnt-make-the-headlines.html,2026-05-21 12:04:05
"Meta has reportedly laid off 8,000 employees",Engadget,https://www.engadget.com/2178378/meta-reportedly-lays-off-8000-employees/,2026-05-21 12:04:05
"I loved a lot of things about the Dell XPS 14 (2026), but it won't make me ditch my MacBook Pro... yet",TechRadar,https://www.techradar.com/computing/windows-laptops/dell-xps-14-2026,2026-05-21 12:04:05
"'AI is a great tool, but it's a tool': Linus Torvalds lays out his complex 'love-hate relationship with AI'",TechRadar,https://www.techradar.com/pro/ai-is-a-great-tool-but-its-a-tool-linus-torvalds-lays-out-his-complex-love-hate-relationship-with-ai,2026-05-21 12:04:05
"‘Nothing short of nightmarish’: Xiaomi's Redmi Note 15 Pro 5G has some of the worst software I’ve ever used — but its display, cameras, and battery life are undeniably impressive",TechRadar,https://www.techradar.com/phones/xiaomi-redmi-note-15-pro-5g-review,2026-05-21 12:04:05
"It's not too late to get a portable air conditioner before the UK heatwave hits, and they don't cost a fortune — I bought one three years ago, and I'm so grateful to past me",TechRadar,https://www.techradar.com/home/small-appliances/its-not-too-late-to-get-a-portable-air-conditioner-before-the-uk-heatwave-hits-and-they-dont-cost-a-fortune-i-bought-one-three-years-ago-and-im-so-grateful-to-past-me,2026-05-21 12:04:05
"Is there a better way to watch the World Cup in style than this enormous 98-inch QLED TV? Better still, it's now a massive £1,100 off",TechRadar,https://www.techradar.com/televisions/is-there-a-better-way-to-watch-the-world-cup-in-style-than-this-enormous-98-inch-qled-tv-better-still-its-now-a-massive-gbp1-100-off,2026-05-21 12:04:05
