headline,source,link,datetime
Forget The Super Mario Galaxy Movie — Chris Pratt’s unhinged AI sci-fi movie on Prime Video is what you need to stream this week,TechRadar,https://www.techradar.com/streaming/amazon-prime-video/forget-the-super-mario-galaxy-movie-chris-pratts-unhinged-ai-sci-fi-movie-on-prime-video-is-what-you-need-to-stream-this-week,2026-03-30 20:02:53
"'When intelligence and trust move together, AI stops being an experiment and starts becoming how work gets done': Microsoft and OpenAI are making AI research tools smarter to help answer even your trickiest questions",TechRadar,https://www.techradar.com/pro/when-intelligence-and-trust-move-together-ai-stops-being-an-experiment-and-starts-becoming-how-work-gets-done-microsoft-and-openai-are-making-ai-research-tools-smarter-to-help-answer-even-your-trickiest-questions,2026-03-30 20:02:53
What is the release date for Daredevil: Born Again season 2 episodes 2 and 3 on Disney+?,TechRadar,https://www.techradar.com/streaming/disney-plus/what-is-the-release-date-for-daredevil-born-again-season-2-episodes-2-and-3-on-disney,2026-03-30 20:02:53
Everything you need to know about Moltbook,TechRadar,https://www.techradar.com/pro/everything-you-need-to-know-about-moltbook,2026-03-30 20:02:53
Don't get fooled by fake discounts in the Amazon Big Spring Sale! Join our live Q&A for the best tech deals advice,TechRadar,https://www.techradar.com/seasonal-sales/dont-get-fooled-by-fake-discounts-in-the-amazon-big-spring-sale-join-our-live-q-and-a-for-the-best-tech-deal-advice,2026-03-30 20:02:53
"Samsung Galaxy Watch9 development may already have been completed — and after last year's 'triumph', I'm convinced it'll be a Garmin-beater",TechRadar,https://www.techradar.com/health-fitness/smartwatches/samsung-galaxy-watch9-development-may-already-have-been-completed-and-after-last-years-triumph-im-convinced-itll-be-a-garmin-beater,2026-03-30 20:02:53
TCL finally brings its flagship mini-LED TVs to the UK this year — that means 'Super Quantum Dots' and exceptional brightness,TechRadar,https://www.techradar.com/televisions/tcl-finally-brings-its-flagship-mini-led-tvs-to-the-uk-this-year-that-means-super-quantum-dots-and-exceptional-brightness,2026-03-30 20:02:53
Quick! Our supposedly dead exclusive NordVPN deal is still alive — here's how to claim it while you can,TechRadar,https://www.techradar.com/vpn/vpn-services/quick-our-supposedly-dead-exclusive-nordvpn-deal-is-still-alive-heres-how-to-claim-it-while-you-can,2026-03-30 20:02:53
Samsung adds AirDrop to more Galaxy devices — but users say there’s a big catch,TechRadar,https://www.techradar.com/phones/samsung-adds-airdrop-to-more-galaxy-devices-but-users-say-theres-a-big-catch,2026-03-30 20:02:53
World Backup Day 2026: Everything — and I mean EVERYTHING — you need to keep your data safe from loss and disaster,TechRadar,https://www.techradar.com/pro/world-backup-day-storage-deals,2026-03-30 20:02:53
'None of your decisions from the first game matter' — Life is Strange: Reunion wants you to have your cake and eat it,TechRadar,https://www.techradar.com/gaming/life-is-strange-reunion-review,2026-03-30 20:02:53
Cloud spending soars as hyperscalers up AI investment - and could reach a landmark high in 2026,TechRadar,https://www.techradar.com/pro/cloud-spending-soars-as-hyperscalers-up-ai-investment-and-could-reach-a-landmark-high-in-2026,2026-03-30 20:02:53
You can now buy an iPhone 17 Pro containing a piece of Steve Jobs' turtleneck — if you’re prepared to commit a crime against taste,TechRadar,https://www.techradar.com/phones/iphone/you-can-now-buy-an-iphone-17-pro-containing-a-piece-of-steve-jobs-turtleneck-if-youre-prepared-to-commit-a-crime-against-taste,2026-03-30 20:02:53
7 settings to change on your new MacBook Neo that will get it up and running in record time,TechRadar,https://www.techradar.com/computing/macs/7-settings-to-change-on-your-new-macbook-neo-that-will-get-it-up-and-running-in-record-time,2026-03-30 20:02:53
"YouTube is rolling out support for Android Auto, but there are quite a few catches with it — and it could be another way to get you to sign up to Premium",TechRadar,https://www.techradar.com/computing/websites-apps/youtube-is-rolling-out-support-for-android-auto-but-there-are-quite-a-few-catches-with-it-and-it-could-be-another-way-to-get-you-to-sign-up-to-premium,2026-03-30 20:02:53
WhatsApp is getting a native CarPlay app — and you can grab the beta version now,TechRadar,https://www.techradar.com/phones/iphone/whatsapp-is-getting-a-native-carplay-app-and-you-can-grab-the-beta-version-now,2026-03-30 20:02:53
How to safely experiment with OpenClaw,TechRadar,https://www.techradar.com/pro/how-to-safely-experiment-with-openclaw,2026-03-30 20:02:53
How to watch Celebrity Ex on the Beach season 4 online – stream UK's celeb dating show from anywhere,TechRadar,https://www.techradar.com/how-to-watch/tv-shows/celebrity-ex-on-the-beach-season-4,2026-03-30 20:02:53
What is the release date for Last One Laughing UK season 2 episode 6 on Prime Video?,TechRadar,https://www.techradar.com/streaming/amazon-prime-video/last-one-laughing-uk-season-2-episode-6-release-date-time,2026-03-30 20:02:53
European Commission confirms platform data breach — admits 'data have been taken' from official websites,TechRadar,https://www.techradar.com/pro/security/european-commission-confirms-platform-data-breach-admits-data-have-been-taken-from-official-websites,2026-03-30 20:02:53
The human cost of cybersecurity and what we should do about it,TechRadar,https://www.techradar.com/pro/the-human-cost-of-cybersecurity-and-what-we-should-do-about-it,2026-03-30 20:02:53
"JBL just upgraded two of our favorite Bluetooth speakers — one's big and powerful, and one's cheap and portable",TechRadar,https://www.techradar.com/audio/wireless-bluetooth-speakers/jbl-just-upgraded-two-of-our-favorite-bluetooth-speakers-ones-big-and-powerful-and-ones-cheap-and-portable,2026-03-30 20:02:53
What is OpenClaw?,TechRadar,https://www.techradar.com/pro/what-is-openclaw,2026-03-30 20:02:53
"World Backup Day 2026: All the news, updates and advice from our experts",TechRadar,https://www.techradar.com/pro/live/world-backup-day-2026-all-the-news-updates-and-advice-from-our-experts,2026-03-30 20:02:53
Gboard could soon get a useful feature you probably assumed it already had,TechRadar,https://www.techradar.com/phones/gboard-could-soon-get-a-useful-feature-you-probably-assumed-it-already-had,2026-03-30 20:02:53
"Tour Championship 2026 Free Streams: How To Watch Snooker, TV Channels, Preview, Schedule",TechRadar,https://www.techradar.com/how-to-watch/sport/tour-championship-2026-free-streams-snooker,2026-03-30 20:02:53
"Why October 1, 2026, could be the day SSL/TLS certificates 'break the Internet'",TechRadar,https://www.techradar.com/pro/why-october-1-2026-could-be-the-day-ssl-tls-certificates-break-the-internet,2026-03-30 20:02:53
'Belief alone is not enough': New study reveals businesses are widely different when it comes to AI adoption — so what's the best course?,TechRadar,https://www.techradar.com/pro/belief-alone-is-not-enough-new-study-reveals-businesses-are-widely-different-when-it-comes-to-ai-adoption-so-whats-the-best-course,2026-03-30 20:02:53
How to watch Sky Go from anywhere,TechRadar,https://www.techradar.com/how-to-watch/sky-go-from-anywhere,2026-03-30 20:02:53
"I just saw United Airlines big plans for the future and, yes, it wants to fly like Apple",TechRadar,https://www.techradar.com/tech/i-just-saw-united-airlines-big-plans-for-the-future-and-yes-it-wants-to-fly-like-apple,2026-03-30 20:02:53
"Some of the best Lego deals I've seen are at Amazon right now — Star Wars, Technic, and Botanicals sets from $13.49",TechRadar,https://www.techradar.com/streaming/entertainment/some-of-the-best-lego-deals-ive-seen-are-at-amazon-right-now-star-wars-technic-and-botanicals-sets-from-usd13-49,2026-03-30 20:02:53
I like some of Samsung's innovations on the Galaxy S26 Ultra — but here's why I'm sticking with my iPhone,TechRadar,https://www.techradar.com/phones/samsung-galaxy-phones/i-like-some-of-samsungs-innovations-on-the-galaxy-s26-ultra-but-heres-why-im-sticking-with-my-iphone,2026-03-30 20:02:53
Gigabyte Radeon RX 9070 XT Gaming OC Ice 16GB review: excellent performance from a standout graphics card,TechRadar,https://www.techradar.com/computing/gpu/gigabyte-radeon-rx-9070-xt-gaming-oc-ice-16gb-review-excellent-performance-from-a-standout-graphics-card,2026-03-30 20:02:53
'Weekend work increased more than 40%': How AI is quietly expanding the work week as Saturday starts shift to 7:11 am,TechRadar,https://www.techradar.com/pro/weekend-work-increased-more-than-40-how-ai-is-quietly-expanding-the-work-week-as-saturday-starts-shift-to-7-11-a-m,2026-03-30 20:02:53
Samsung has a massive TV sale to celebrate the Final Four — here are 9 TVs that I'd spend my own money on,TechRadar,https://www.techradar.com/tech/samsung-has-a-massive-tv-sale-to-celebrate-the-final-four-here-are-9-tvs-that-id-spend-my-own-money-on,2026-03-30 20:02:53
