headline,source,link,datetime
New York becomes the first state to impose a data center moratorium,Hacker News,https://www.reuters.com/world/new-york-becomes-first-state-impose-data-center-moratorium-2026-07-14/,2026-07-14 15:04:03
A Philosopher's One-Word Theory to Explain Why the World Feels So Weird,Hacker News,https://www.derekthompson.org/p/a-philosophers-one-word-theory-to,2026-07-14 15:04:03
OpenAI mandates hardware-backed passkeys for Trusted Access Cyber members,Hacker News,https://www.yubico.com/blog/openai-mandates-hardware-backed-passkeys-for-trusted-access-cyber-members-to-log-into-chatgpt-accounts/,2026-07-14 15:04:03
Which Ninja air fryer should I buy? Here are our personal favorites — plus top tips on how to choose,TechRadar,https://www.techradar.com/home/air-fryers/which-ninja-air-fryer-should-i-buy-here-are-our-personal-favorites-plus-top-tips-on-how-to-choose,2026-07-14 15:04:03
AI does not solve poor finance infrastructure: it weakens it,TechRadar,https://www.techradar.com/pro/ai-does-not-solve-poor-finance-infrastructure-it-weakens-it,2026-07-14 15:04:03
Autonomous AI worms mark a new era of adaptive cyberattacks,TechRadar,https://www.techradar.com/pro/autonomous-ai-worms-mark-a-new-era-of-adaptive-cyberattacks,2026-07-14 15:04:03
Real Housewives of London season 2 release date confirmed as Hayu promises 'most personal season yet' — I just hope it doesn't repeat the same annoying mistake,TechRadar,https://www.techradar.com/streaming/entertainment/real-housewives-of-london-season-2-release-date-hayu,2026-07-14 15:04:03
"Why is a Kodak point-and-shoot with worse picture quality than your phone the best-selling camera year after year? The answer is surprising, but also kind of obvious",TechRadar,https://www.techradar.com/cameras/compact-cameras/why-is-a-kodak-point-and-shoot-with-worse-picture-quality-than-your-phone-the-best-selling-camera-year-after-year-the-answer-is-surprising-but-also-kind-of-obvious,2026-07-14 15:04:03
"Mini PC deals for video editing and gaming: I found the best space-saving desktop gear from GMKtec, Geekom, Minisforum, and Corsair",TechRadar,https://www.techradar.com/pro/mini-pc-deals-for-4k-editing-and-gaming-i-found-the-best-space-saving-desktop-gear-from-gmktec-geekom-minisforum-and-corsair,2026-07-14 15:04:03
