headline,source,link,datetime
"California AB 2047 makes 3d printers off-limits to students, educators, business",Hacker News,https://www.the3dprintingnerd.com/ab2047,2026-06-23 23:03:06
Google Home will soon get better at recognizing you,The Verge,https://www.theverge.com/tech/955385/google-home-familiar-faces-clothing,2026-06-23 23:03:06
Hollywood is bending the knee to OpenAI,The Verge,https://www.theverge.com/entertainment/954899/luca-guadagnino-artificial-sam-altman-amazon-a24-neon-mubi-chatgpt,2026-06-23 23:03:06
"NYT Connections hints and answers for Wednesday, June 24 (game #1109)",TechRadar,https://www.techradar.com/gaming/nyt-connections-today-answers-hints-24-june-2026,2026-06-23 23:03:07
"Quordle hints and answers for Wednesday, June 24 (game #1612)",TechRadar,https://www.techradar.com/computing/websites-apps/quordle-today-answers-clues-24-june-2026,2026-06-23 23:03:07
"NYT Strands hints and answers for Wednesday, June 24 (game #843)",TechRadar,https://www.techradar.com/computing/websites-apps/nyt-strands-today-answers-hints-24-june-2026,2026-06-23 23:03:07
"Prime Day mini PC deal: My daughter wanted a mini PC for school, and this is the most powerful one I could find under $500",TechRadar,https://www.techradar.com/pro/prime-day-mini-pc-deal-my-daughter-wanted-a-mini-pc-for-school-and-this-is-the-most-powerful-one-i-could-find-under-usd500,2026-06-23 23:03:07
Not sure if a Kindle Colorsoft is worth the cash? Here are 4 alternative color ereaders to consider — including a 5-star standout,TechRadar,https://www.techradar.com/tablets/ereaders/not-sure-if-a-kindle-colorsoft-is-worth-the-cash-here-are-4-alternative-color-ereaders-to-consider-including-a-5-star-standout,2026-06-23 23:03:07
The LG UltraGear 5K2K is my dream ultrawide gaming monitor — but there’s one big reason why I’m holding off from upgrading,TechRadar,https://www.techradar.com/computing/monitors/the-lg-ultragear-5k2k-is-my-dream-ultrawide-gaming-monitor-but-theres-one-big-reason-why-im-holding-off-from-upgrading,2026-06-23 23:03:07
"I review tech for a living, and these are the 7 essential tech buys I'd recommend for your summer travels",TechRadar,https://www.techradar.com/tech/i-review-tech-for-a-living-and-these-are-the-7-essential-tech-buys-id-recommend-for-your-summer-travels,2026-06-23 23:03:07
