headline,source,link,datetime
Meta and Google found liable in social media addiction trial,Hacker News,https://www.bbc.co.uk/news/articles/c747x7gz249o,2026-03-25 19:02:34
Meta and YouTube Found Negligent in Landmark Social Media Addiction Case,Hacker News,https://www.nytimes.com/2026/03/25/technology/social-media-trial-verdict.html,2026-03-25 19:02:34
"Tracy Kidder, Author of 'The Soul of a New Machine,' Dies at 80",Hacker News,https://www.nytimes.com/2026/03/25/books/tracy-kidder-dead.html,2026-03-25 19:02:34
"Jury says Meta knowingly harmed children for profit, awarding landmark verdict",Hacker News,https://www.latimes.com/business/story/2026-03-25/jury-says-meta-knowingly-harmed-children-for-profit-awarding-landmark-verdict,2026-03-25 19:02:34
Slovenian officials catch Israeli firm Black Cube trying to manipulate vote,Hacker News,https://www.wsj.com/world/europe/spies-lies-and-fake-investors-in-disguise-how-plotters-tried-to-flip-a-european-election-1f42b39a,2026-03-25 19:02:34
A Eulogy for Vim,Hacker News,https://drewdevault.com/2026/03/25/2026-03-25-Forking-vim.html,2026-03-25 19:02:34
Quantization from the Ground Up,Hacker News,https://ngrok.com/blog/quantization,2026-03-25 19:02:34
Musketeer d'Artagnan's remains believed found under Dutch church,Hacker News,https://www.bbc.co.uk/news/articles/cm2rew2dgzzo,2026-03-25 19:02:34
'Tiny Shortcuts' Are Poisoning Science,Hacker News,https://nautil.us/how-tiny-shortcuts-are-poisoning-science-1279176,2026-03-25 19:02:34
Sony V. Cox Decision Reversed,Hacker News,https://supreme.justia.com/cases/federal/us/607/24-171/,2026-03-25 19:02:34
Hubble Snaps a New Dazzling Photo of the Crab Nebula,Hacker News,https://nautil.us/hubble-snaps-a-new-dazzling-photo-of-the-crab-nebula-1279203,2026-03-25 19:02:34
Supreme Court Sides with Cox in Copyright Fight over Pirated Music,Hacker News,https://www.nytimes.com/2026/03/25/us/politics/supreme-court-cox-music-copyright.html,2026-03-25 19:02:34
Antimatter has been transported for the first time,Hacker News,https://www.nature.com/articles/d41586-026-00950-w,2026-03-25 19:02:34
How to Keep ICE Agents Out of Your Devices at Airports,Hacker News,https://theintercept.com/2026/03/25/ice-airports-phone-security-privacy-safety/,2026-03-25 19:02:34
OpenAI's latest repo has Claude as the third top contributor,Hacker News,https://twitter.com/CodeByNZ/status/2036723050197012771,2026-03-25 19:02:34
Ubuntu wants to strip some of GRUB features in 26.10 for security purposes,Hacker News,https://discourse.ubuntu.com/t/streamlining-secure-boot-for-26-10/79069,2026-03-25 19:02:34
Apple Just Lost Me,Hacker News,https://andregarzia.com/2026/03/apple-just-lost-me.html,2026-03-25 19:02:34
Thoughts on Slowing the Fuck Down,Hacker News,https://mariozechner.at/posts/2026-03-25-thoughts-on-slowing-the-fuck-down/,2026-03-25 19:02:34
Palestinians warn of expanding West Bank settler violence,Hacker News,https://www.bbc.com/news/articles/c747x00m83vo,2026-03-25 19:02:34
Local LLM by Ente,Hacker News,https://ente.com/blog/ensu/,2026-03-25 19:02:34
Open source isn't a tip jar – it's time to charge for access,Hacker News,https://www.theregister.com/2026/03/25/open_source_bill_opinion/,2026-03-25 19:02:34
Building a coding agent in Swift from scratch,Hacker News,https://github.com/ivan-magda/swift-claude-code,2026-03-25 19:02:34
I tried to prove I'm not AI. My aunt wasn't convinced,Hacker News,https://www.bbc.com/future/article/20260324-i-tried-to-prove-im-not-an-ai-deepfake,2026-03-25 19:02:34
Meta told to pay $375M for misleading users over child safety,Hacker News,https://www.bbc.com/news/articles/cql75dn07n2o,2026-03-25 19:02:34
I Forked Httpx,Hacker News,https://tildeweb.nl/~michiel/httpxyz.html,2026-03-25 19:02:34
Implementing automatic eSIM installation on Android,Hacker News,https://medium.com/proandroiddev/integration-of-automatic-esim-installation-on-android-6c5f6d7124cb,2026-03-25 19:02:34
TurboQuant: Redefining AI efficiency with extreme compression,Hacker News,https://research.google/blog/turboquant-redefining-ai-efficiency-with-extreme-compression/,2026-03-25 19:02:34
Social media bans and digital curfews to be trialled on UK teenagers,Hacker News,https://www.bbc.com/news/articles/cn89g3ngkyzo,2026-03-25 19:02:34
Miscellanea: The War in Iran,Hacker News,https://acoup.blog/2026/03/25/miscellanea-the-war-in-iran/,2026-03-25 19:02:34
Meta ordered to pay $375M in New Mexico trial over child exploitation,Hacker News,https://www.reuters.com/sustainability/boards-policy-regulation/jury-orders-meta-pay-375-mln-new-mexico-lawsuit-over-child-sexual-exploitation-2026-03-24/,2026-03-25 19:02:34
US Army raises enlistment age to 42 and removes marijuana waiver requirement,Hacker News,https://armypubs.army.mil/epubs/DR_pubs/DR_a/ARN42922-AR_601-210-000-WEB-1.pdf,2026-03-25 19:02:34
Show HN: DuckDB community extension for prefiltered HNSW using ACORN-1,Hacker News,https://github.com/cigrainger/duckdb-hnsw-acorn,2026-03-25 19:02:34
VitruvianOS – Desktop Linux Inspired by the BeOS,Hacker News,https://v-os.dev,2026-03-25 19:02:34
"Oil at $150 will trigger global recession, says boss of financial BlackRock",Hacker News,https://www.bbc.com/news/articles/c9wqrdkx8ppo,2026-03-25 19:02:34
"In Edison’s Revenge, Data Centers Are Transitioning From AC to DC",Hacker News,https://spectrum.ieee.org/data-center-dc,2026-03-25 19:02:34
Zero-Cost POSIX Compliance: Encoding the Socket State Machine in Lean's Types,Hacker News,https://ngrislain.github.io/blog/2026-3-25-zerocost-posix-compliance-encoding-the-socket-state-machine-in-lean-4s-type-system/,2026-03-25 19:02:34
Flighty Airports,Hacker News,https://flighty.com/airports,2026-03-25 19:02:34
A Compiler Writing Journey,Hacker News,https://github.com/DoctorWkt/acwj,2026-03-25 19:02:34
Thoughts on LLMs – Psychological Complications,Hacker News,https://parsingphase.dev/tech/LLMs/psychologicalFactors.html,2026-03-25 19:02:34
Jury finds Meta liable in case over child sexual exploitation on its platforms,Hacker News,https://www.cnn.com/2026/03/24/tech/meta-new-mexico-trial-jury-deliberation,2026-03-25 19:02:34
"I wanted to build vertical SaaS for pest control, so I took a technician job",Hacker News,https://www.onhand.pro/p/i-wanted-to-build-vertical-saas-for-pest-control-i-took-a-technician-job-instead,2026-03-25 19:02:34
Disney Exits OpenAI Deal After AI Giant Shutters Sora,Hacker News,https://www.hollywoodreporter.com/business/digital/openai-shutting-down-sora-ai-video-app-1236546187/,2026-03-25 19:02:34
Is anybody else bored of talking about AI?,Hacker News,https://blog.jakesaunders.dev/is-anybody-else-bored-of-talking-about-ai/,2026-03-25 19:02:34
GitHub is once again down,Hacker News,https://www.githubstatus.com/incidents/kp06czybl7dw,2026-03-25 19:02:34
We’re saying goodbye to Sora,Hacker News,https://twitter.com/soraofficialapp/status/2036532795984715896,2026-03-25 19:02:34
Welcome to FastMCP,Hacker News,https://gofastmcp.com/getting-started/welcome,2026-03-25 19:02:34
Show HN: Antimatter – Match the opposites (Mahjong solitaire mechanic),Hacker News,https://www.linguabase.org/antimatter/,2026-03-25 19:02:34
Show HN: AI Roundtable – Let 200 models debate your question,Hacker News,https://opper.ai/ai-roundtable/,2026-03-25 19:02:34
Can you monitor a situation without monitors? The Polymarket sports bar tried,The Verge,https://www.theverge.com/column/900536/alliance-for-a-better-future-polymarket,2026-03-25 19:02:34
"The United States router ban, explained",The Verge,https://www.theverge.com/tech/899906/fcc-router-ban-march-2026-explainer,2026-03-25 19:02:34
Meta and YouTube found negligent in landmark social media addiction case,The Verge,https://www.theverge.com/policy/900654/meta-google-instagram-youtube-social-media-addiction-trial-kgm-jury-decision,2026-03-25 19:02:34
Nintendo is going to charge less for digital Switch 2 games,The Verge,https://www.theverge.com/games/900590/nintendo-switch-2-digital-games-pricing,2026-03-25 19:02:34
X tries to limit creator revenue for foreign influencers but Musk intervenes,The Verge,https://www.theverge.com/tech/900535/x-creator-payouts-american-politics-elon-musk,2026-03-25 19:02:34
The TSA is broken — is privatization next?,The Verge,https://www.theverge.com/transportation/900510/airport-tsa-seurity-wait-privatization-trump-mullin,2026-03-25 19:02:34
"Cox Communications not liable for pirated music, Supreme Court rules",The Verge,https://www.theverge.com/policy/900502/cox-communications-music-labels-piracy-supreme-court,2026-03-25 19:02:34
Seiko resurrected a 44-year-old digital watch NASA astronauts wore to space,The Verge,https://www.theverge.com/tech/900428/seiko-rotocall-digital-watch-retro-nasa-astronauts,2026-03-25 19:02:34
Reddit accounts with ‘fishy’ bot-like behavior will soon need to prove they’re human,The Verge,https://www.theverge.com/tech/900363/reddit-human-verification-bots-crackdown,2026-03-25 19:02:34
Google Lyria 3 Pro makes longer AI songs,The Verge,https://www.theverge.com/ai-artificial-intelligence/900425/google-lyria-3-pro-ai-music,2026-03-25 19:02:34
Live-service games are such a mess even Fortnite is struggling,The Verge,https://www.theverge.com/games/900389/live-service-games-mess-fortnite-layoffs,2026-03-25 19:02:34
Senate Democrats are trying to ‘codify’ Anthropic’s red lines on autonomous weapons and mass surveillance,The Verge,https://www.theverge.com/policy/900341/senator-schiff-anthropic-autonomous-weapons-mass-surveillance,2026-03-25 19:02:34
You can install these wireless security cameras over half a mile away,The Verge,https://www.theverge.com/tech/898980/xthings-ulticam-security-camera-wi-fi-halow-wireless,2026-03-25 19:02:34
Mark Zuckerberg and Jensen Huang are part of Trump’s new ‘tech panel’,The Verge,https://www.theverge.com/policy/900340/trump-tech-panel-mark-zuckerberg-jensen-huang,2026-03-25 19:02:34
Ring finally brings 4K video to its battery-powered doorbell camera,The Verge,https://www.theverge.com/tech/900270/ring-4k-battery-powered-video-doorbell-ai-price-release-date-specs,2026-03-25 19:02:34
Keychron’s mechanical keyboards are up to 60 percent off,The Verge,https://www.theverge.com/gadgets/899433/keychron-mechanical-keyboards-amazon-big-spring-sale-2026-deal,2026-03-25 19:02:34
Apple’s iOS 26.4 update adds age verification in the UK,The Verge,https://www.theverge.com/tech/900284/apple-ios-26-4-uk-age-verification,2026-03-25 19:02:34
The best deals we’ve found from Amazon’s Big Spring Sale (so far),The Verge,https://www.theverge.com/gadgets/899580/best-amazon-big-spring-sale-2026-deals,2026-03-25 19:02:34
"Dell made its new Pro laptops thinner and tweaked their naming scheme, again",The Verge,https://www.theverge.com/tech/900090/dell-made-its-new-pro-laptops-thinner-and-tweaked-their-naming-scheme-again,2026-03-25 19:02:34
Reolink’s first solar-powered floodlight camera offers wire-free home security,The Verge,https://www.theverge.com/tech/900204/reolink-solar-floodlight-camera-price-release-date-specs,2026-03-25 19:02:34
Sony and Honda ain’t feelin’ the Afeela anymore,The Verge,https://www.theverge.com/tech/900219/sony-honda-afeela-discontinue-cancel-refund,2026-03-25 19:02:34
"Samsung’s Galaxy A57 gets thinner, faster, and more expensive",The Verge,https://www.theverge.com/gadgets/899399/samsung-galaxy-a57-a37-launch-price-specs,2026-03-25 19:02:34
Anthropic’s Claude Code gets ‘safer’ auto mode,The Verge,https://www.theverge.com/ai-artificial-intelligence/900201/anthropic-claude-code-auto-mode,2026-03-25 19:02:34
It’s always a good time to revisit Super Mario Bros. Wonder,The Verge,https://www.theverge.com/games/899839/super-mario-bros-wonder-nintendo-switch-2-review,2026-03-25 19:02:34
The BB-777 is the ultimate in boombox nostalgia,The Verge,https://www.theverge.com/tech/897876/the-bb-777-is-the-ultimate-in-boombox-nostalgia,2026-03-25 19:02:34
Instagram and Facebook are about to be filled with affiliate content,The Verge,https://www.theverge.com/news/899717/meta-instagram-facebook-affiliate-shopping-links-reels,2026-03-25 19:02:34
"Meta misled users about its products’ safety, jury decides",The Verge,https://www.theverge.com/policy/899910/meta-new-mexico-jury-verdict,2026-03-25 19:02:34
NASA wants to put a $20 billion base on the Moon,The Verge,https://www.theverge.com/science/899891/nasa-moon-base-mars-nuclear-power-jared-isaacman,2026-03-25 19:02:34
What is ICE actually doing at the airport?,The Verge,https://www.theverge.com/policy/899855/ice-airports-tsa-shutdown-dhs-jfk,2026-03-25 19:02:34
OpenAI just gave up on its Sora AI video generator,The Verge,https://www.theverge.com/ai-artificial-intelligence/899850/openai-sora-ai-chatgpt,2026-03-25 19:02:34
Arm’s first CPU ever will plug into Meta’s AI datacenters later this year,The Verge,https://www.theverge.com/ai-artificial-intelligence/899823/arm-agi-cpu-meta,2026-03-25 19:02:34
Apple is testing a standalone app for its overhauled Siri,The Verge,https://www.theverge.com/tech/899801/apple-wwdc-2026-new-siri-apple-intelligence-standalone-app,2026-03-25 19:02:34
The man who coined Metaverse now says Meta’s glasses are creepy,The Verge,https://www.theverge.com/tech/899797/metaverse-neal-stephenson-headsets-goggles-glasses-creepy-no-business-case,2026-03-25 19:02:34
"Apple launches iOS 26.4 with AI playlists, purchase sharing, and more",The Verge,https://www.theverge.com/tech/899799/apple-ios-26-4-ai-playlist-purchase-sharing-update,2026-03-25 19:02:34
Nintendo to start charging different prices for first-party digital and physical games,Engadget,https://www.engadget.com/gaming/nintendo/nintendo-to-start-charging-different-prices-for-first-party-digital-and-physical-games-184249374.html?src=rss,2026-03-25 19:02:35
YouTube is bringing affiliate shopping features to more creators,Engadget,https://www.engadget.com/social-media/youtube-is-bringing-affiliate-shopping-features-to-more-creators-183927027.html?src=rss,2026-03-25 19:02:35
Jury rules against Meta and YouTube in social media addiction case,Engadget,https://www.engadget.com/social-media/jury-rules-against-meta-and-youtube-in-social-media-addiction-case-181344860.html?src=rss,2026-03-25 19:02:35
Here's your first look at For All Mankind spinoff Star City,Engadget,https://www.engadget.com/entertainment/streaming/heres-your-first-look-at-for-all-mankind-spinoff-star-city-174359587.html?src=rss,2026-03-25 19:02:35
Google's Lyria 3 Pro can now generate AI music (slop) up to 3 minutes in length,Engadget,https://www.engadget.com/ai/googles-lyria-3-pro-can-now-generate-ai-music-slop-up-to-3-minutes-in-length-172738752.html?src=rss,2026-03-25 19:02:35
"Meta lays off hundreds of workers, including more from Reality Labs",Engadget,https://www.engadget.com/big-tech/meta-lays-off-hundreds-of-workers-including-more-from-reality-labs-171536879.html?src=rss,2026-03-25 19:02:35
The Afeela 1 came too late and now is gone too soon,Engadget,https://www.engadget.com/transportation/evs/the-afeela-1-came-too-late-and-now-is-gone-too-soon-164845008.html?src=rss,2026-03-25 19:02:35
Supreme Court rules ISPs aren't liable for subscribers' music piracy,Engadget,https://www.engadget.com/entertainment/streaming/supreme-court-rules-isps-arent-liable-for-subscribers-music-piracy-163412791.html?src=rss,2026-03-25 19:02:35
Spotify is testing a tool to help real artists deal with AI slop on their profiles,Engadget,https://www.engadget.com/ai/spotify-is-testing-a-tool-to-help-real-artists-deal-with-ai-slop-on-their-profiles-161013653.html?src=rss,2026-03-25 19:02:35
Reddit will prompt some accounts to 'verify humanness' in latest bot crackdown,Engadget,https://www.engadget.com/social-media/reddit-will-prompt-some-accounts-to-verify-humanness-in-latest-bot-crackdown-161000181.html?src=rss,2026-03-25 19:02:35
Sony's upcoming Bravia 3 II is a mid-range LED TV available in sizes up to 100 inches,Engadget,https://www.engadget.com/home/home-theater/sonys-upcoming-bravia-3-ii-is-a-mid-range-led-tv-available-in-sizes-up-to-100-inches-160002697.html?src=rss,2026-03-25 19:02:35
Sony adds the Bravia Theater Bar 5 and Bar 7 to its soundbar lineup,Engadget,https://www.engadget.com/audio/speakers/sony-adds-the-bravia-theater-bar-5-and-bar-7-to-its-soundbar-lineup-160000680.html?src=rss,2026-03-25 19:02:35
"Mark Zuckerberg, Jensen Huang and Sergey Brin join Trump's tech advisory panel",Engadget,https://www.engadget.com/big-tech/mark-zuckerberg-jensen-huang-and-sergey-brin-join-trumps-tech-advisory-panel-144722797.html?src=rss,2026-03-25 19:02:35
Stephen Colbert is writing a new Lord of the Rings movie,Engadget,https://www.engadget.com/entertainment/tv-movies/stephen-colbert-is-writing-a-new-lord-of-the-rings-movie-143004743.html?src=rss,2026-03-25 19:02:35
Anthropic releases safer Claude Code 'auto mode' to avoid mass file deletions and other AI snafus,Engadget,https://www.engadget.com/ai/anthropic-releases-safer-claude-code-auto-mode-to-avoid-mass-file-deletions-and-other-ai-snafus-142500615.html?src=rss,2026-03-25 19:02:35
Ring adds 4K to its battery-powered video doorbells,Engadget,https://www.engadget.com/home/ring-adds-4k-to-its-battery-powered-video-doorbells-130021181.html?src=rss,2026-03-25 19:02:35
Sennheiser's owners want to sell its consumer headphone business,Engadget,https://www.engadget.com/audio/sennheisers-owners-want-to-sell-its-consumer-headphone-business-121830441.html?src=rss,2026-03-25 19:02:35
Samsung Galaxy A37 and A57 hands-on: The cheaper phone might be a winner,Engadget,https://www.engadget.com/mobile/smartphones/samsung-galaxy-a37-and-a57-hands-on-the-cheaper-phone-might-be-a-winner-120000965.html?src=rss,2026-03-25 19:02:35
Apple introduces age verification for iCloud accounts in the UK,Engadget,https://www.engadget.com/big-tech/apple-introduces-age-verification-for-icloud-accounts-in-the-uk-115340237.html?src=rss,2026-03-25 19:02:35
Sony and Honda kill its Afeela EVs,Engadget,https://www.engadget.com/transportation/evs/sony-and-honda-kill-its-afeela-evs-100426852.html?src=rss,2026-03-25 19:02:35
X is changing its revenue-sharing policy to deter users pretending to be Americans,Engadget,https://www.engadget.com/social-media/x-is-changing-its-revenue-sharing-policy-to-deter-users-pretending-to-be-americans-090701729.html?src=rss,2026-03-25 19:02:35
Meta is letting creators fill their Reels with shopping links,Engadget,https://www.engadget.com/social-media/meta-is-letting-creators-fill-their-reels-with-shopping-links-232406681.html?src=rss,2026-03-25 19:02:35
"Jury rules against Meta, orders $375 million fine in major child safety trial",Engadget,https://www.engadget.com/social-media/jury-rules-against-meta-orders-375-million-fine-in-major-child-safety-trial-224215209.html?src=rss,2026-03-25 19:02:35
"Sony is reportedly shutting down Dark Outlaw Games, run by former Call of Duty director",Engadget,https://www.engadget.com/gaming/playstation/sony-is-reportedly-shutting-down-dark-outlaw-games-run-by-former-call-of-duty-director-215634410.html?src=rss,2026-03-25 19:02:35
Baltimore sues xAI over Grok deepfakes,Engadget,https://www.engadget.com/ai/baltimore-sues-xai-over-grok-deepfakes-214135922.html?src=rss,2026-03-25 19:02:35
OpenAI is shutting down its Sora video generation app,Engadget,https://www.engadget.com/ai/openai-is-shutting-down-its-sora-video-generation-app-211023358.html?src=rss,2026-03-25 19:02:35
Apple could give Siri a standalone app and an 'Ask Siri' button in iOS 27,Engadget,https://www.engadget.com/ai/apple-could-give-siri-a-standalone-app-and-an-ask-siri-button-in-ios-27-202802492.html?src=rss,2026-03-25 19:02:35
Zoox is bringing its robotaxi to new cities and expanding coverage in Las Vegas and San Francisco,Engadget,https://www.engadget.com/transportation/zoox-is-bringing-its-robotaxi-to-new-cities-and-expanding-coverage-in-las-vegas-and-san-francisco-195410391.html?src=rss,2026-03-25 19:02:35
AccuWeather is now available inside ChatGPT,Engadget,https://www.engadget.com/ai/accuweather-is-now-available-inside-chatgpt-192637363.html?src=rss,2026-03-25 19:02:35
Splitgate's 1047 Games is starting work on a Titanfall-style movement shooter,Engadget,https://www.engadget.com/gaming/splitgates-1047-games-is-starting-work-on-a-titanfall-style-movement-shooter-192551191.html?src=rss,2026-03-25 19:02:35
