headline,source,link,datetime
The Need for an Independent AI Grid,Hacker News,https://amppublic.com/,2026-03-19 21:29:13
EsoLang-Bench: Evaluating Genuine Reasoning in LLMs via Esoteric Languages,Hacker News,https://esolang-bench.vercel.app/,2026-03-19 21:29:13
Cockpit is a web-based graphical interface for servers,Hacker News,https://github.com/cockpit-project/cockpit,2026-03-19 21:29:13
Sony’s WF-1000XM6 wireless earbuds are on sale for the first time,The Verge,https://www.theverge.com/gadgets/897668/sony-wf-1000xm6-wireless-earbuds-deal-sale,2026-03-19 21:29:13
DoorDash will start paying gig workers for creating content to train AI models,Engadget,https://www.engadget.com/ai/doordash-will-start-paying-gig-workers-for-creating-content-to-train-ai-models-204048743.html?src=rss,2026-03-19 21:29:13
Google is reportedly testing a Gemini app for Mac,Engadget,https://www.engadget.com/ai/google-is-reportedly-testing-a-gemini-app-for-mac-203703372.html?src=rss,2026-03-19 21:29:13
"No Nvidia, No AMD, No Intel, No ARM: Meta plans inference-led RISC-y future without friends as 1700w superchip emerges with 30 PFLOPs performance and half Terabyte (yes 512GB) HBM",TechRadar,https://www.techradar.com/pro/no-nvidia-no-amd-no-intel-no-arm-meta-plans-inference-led-risc-y-future-without-friends-as-1700w-superchip-emerges-with-30-pflops-performance-and-half-terabyte-yes-512gb-hbm,2026-03-19 21:29:13
Amazon's preview Spring Sale is slashing up to 45% off some of my favorite robot vacuums — these are the 7 best deals,TechRadar,https://www.techradar.com/home/robot-vacuums/amazons-preview-spring-sale-is-slashing-up-to-45-percent-off-some-of-my-favorite-robot-vacuums-these-are-the-7-best-deals,2026-03-19 21:29:13
