headline,source,link,datetime
"Oh look, the BBC and Channel 4 are in talks to merge streaming services... yet again",Engadget,https://www.engadget.com/2211235/bbc-channel-4-uk-streaming-service/,2026-07-09 11:09:10
"'As good as it gets': You won't want to miss this Geekom A8 mini PC deal for office work, content creation, and 4K video editing",TechRadar,https://www.techradar.com/pro/as-good-as-it-gets-you-wont-want-to-miss-this-geekom-a8-mini-pc-deal-for-office-work-content-creation-and-4k-video-editing,2026-07-09 11:09:11
The AI security paradox: Why are organizations  trusting what they can’t fully see?,TechRadar,https://www.techradar.com/pro/the-ai-security-paradox-why-are-organizations-trusting-what-they-cant-fully-see,2026-07-09 11:09:11
AI work slop: What is it & how can UK businesses protect themselves?,TechRadar,https://www.techradar.com/pro/ai-work-slop-what-is-it-and-how-can-uk-businesses-protect-themselves,2026-07-09 11:09:11
"Razer wants the Seiren V3 Pro to be the ultimate gaming mic, but you probably don’t need it",TechRadar,https://www.techradar.com/computing/peripherals-accessories/razer-seiren-v3-pro,2026-07-09 11:09:11
The makers of New Vegas are working on a new Fallout game,TechRadar,https://www.techradar.com/gaming/the-makers-of-new-vegas-are-working-on-a-new-fallout-game,2026-07-09 11:09:11
Shadow AI is creeping in to healthcare - leaders need to recognize the risk before it’s too late,TechRadar,https://www.techradar.com/pro/shadow-ai-is-creeping-in-to-healthcare-leaders-need-to-recognize-the-risk-before-its-too-late,2026-07-09 11:09:11
Don't buy a new work PC right now — memory crunch and price rises lead to global shipments falling for the first time in two years,TechRadar,https://www.techradar.com/pro/dont-buy-a-new-work-pc-right-now-memory-crunch-and-price-rises-lead-to-global-shipments-falling-for-the-first-time-in-two-years,2026-07-09 11:09:11
"'Not for everyone': Sony announces its most premium wired earbuds yet, but their ideal use case is nothing if not niche",TechRadar,https://www.techradar.com/audio/not-for-everyone-sony-announces-its-most-premium-wired-earbuds-yet-but-their-ideal-use-case-is-nothing-if-not-niche,2026-07-09 11:09:11
