headline,source,link,datetime
RGG's Stranger Than Heaven game arrives this winter,Engadget,https://www.engadget.com/2166765/rgg-stranger-than-heaven-winter-release/,2026-05-07 09:02:42
Samsung says its Galaxy Watch can predict fainting with 'high accuracy',Engadget,https://www.engadget.com/2166756/samsung-says-galaxy-watch-can-predict-fainting-with-high-accuracy/,2026-05-07 09:02:42
Can we tax the robots?,TechRadar,https://www.techradar.com/pro/can-we-tax-the-robots,2026-05-07 09:02:43
"Apple is about to let you replace its AI with ChatGPT, Gemini, and Claude — and it could change the iPhone forever",TechRadar,https://www.techradar.com/ai-platforms-assistants/apple-intelligence/apple-is-about-to-let-you-replace-its-ai-with-chatgpt-gemini-and-claude-and-it-could-change-the-iphone-forever,2026-05-07 09:02:43
You can’t firewall a conversation: how AI red-teaming became mission-critical,TechRadar,https://www.techradar.com/pro/you-cant-firewall-a-conversation-how-ai-red-teaming-became-mission-critical,2026-05-07 09:02:43
Get £80 off the isinwheel GT4 Dual Motor Electric Scooter but only with our exclusive code,TechRadar,https://www.techradar.com/tech/get-gbp80-off-the-isinwheel-gt4-dual-motor-electric-scooter-but-only-with-our-exclusive-code,2026-05-07 09:02:43
