headline,source,link,datetime
New study compares growing corn for energy to solar production. It's no contest,Hacker News,https://www.anthropocenemagazine.org/2025/04/new-study-compares-growing-corn-for-energy-to-solar-production-its-no-contest/,2026-04-22 20:02:36
"You deserve to watch the World Cup on the best TV on the market — save $1,400 on LG's award-winning C5 OLED TV",TechRadar,https://www.techradar.com/seasonal-sales/you-deserve-to-watch-the-world-cup-on-the-best-tv-on-the-market-save-usd1-400-on-lgs-award-winning-c5-oled-tv,2026-04-22 20:02:36
"'We will reveal their identity photos, names, location, and other': Experts reveal extraordinary battle between rival ransomware gangs — and how victims can get their data back",TechRadar,https://www.techradar.com/pro/security/we-will-reveal-their-identity-photos-names-location-and-other-experts-reveal-extraordinary-battle-between-rival-ransomware-gangs-and-how-victims-can-get-their-data-back,2026-04-22 20:02:36
"Ransomware negotiator recruited by BlackCat ransomware gang pleads guilty to 2023 attacks, faces 20 years in prison",TechRadar,https://www.techradar.com/pro/security/ransomware-negotiator-recruited-by-blackcat-ransomware-gang-pleads-guilty-to-2023-attacks-faces-20-years-in-prison,2026-04-22 20:02:36
"I've picked the top 14 deals from Amazon's surprise Tech Week sale — get up to 30% off Asus, Shark, Shokz, Garmin, and more",TechRadar,https://www.techradar.com/tech/ive-picked-the-top-14-deals-from-amazons-surprise-tech-week-sale-get-up-to-30-percent-off-asus-shark-shokz-garmin-and-more,2026-04-22 20:02:36
