headline,source,link,datetime
"Apple Sues OpenAI, Accusing It of Stealing Company Secrets",Hacker News,https://www.nytimes.com/2026/07/10/technology/apple-openai-lawsuit.html,2026-07-10 22:03:26
Moss (YC F25) Is Hiring,Hacker News,https://www.ycombinator.com/companies/moss/jobs/52LnqLQ-software-engineer-sdk,2026-07-10 22:03:26
Prismata: Confining cross-site prompt injection in web agents,Hacker News,https://arxiv.org/abs/2607.08147,2026-07-10 22:03:26
Apple sues OpenAI for allegedly stealing hardware secrets,The Verge,https://www.theverge.com/tech/964350/apple-openai-lawsuit-trade-secrets,2026-07-10 22:03:26
Apple calls OpenAI's hardware business 'rotten to its core' in trade secret theft lawsuit,Engadget,https://www.engadget.com/2212759/apple-calls-openais-hardware-business-rotten-to-its-core-in-trade-secret-theft-lawsuit/,2026-07-10 22:03:26
Mamdani announces new Click-to-Cancel rule for New York City,Engadget,https://www.engadget.com/2212741/mamdani-announces-new-click-to-cancel-rule-for-new-york-city/,2026-07-10 22:03:26
Quote of the day by Netscape founder Marc Andreessen: 'We believe any deceleration of AI will cost lives' — a full-throated defense of the AI buildout,TechRadar,https://www.techradar.com/pro/quote-of-the-day-by-netscape-founder-marc-andreessen-we-believe-any-deceleration-of-ai-will-cost-lives-a-full-throated-defense-of-the-ai-buildout,2026-07-10 22:03:27
AMD abandons HBM for inferior LPDDR5x as AI monster devours precious high-bandwidth memory,TechRadar,https://www.techradar.com/pro/amd-abandons-hbm-for-inferior-lpddr5x-as-ai-monster-devours-precious-high-bandwidth-memory,2026-07-10 22:03:27
