headline,source,link,datetime
The Whistleblower Who Uncovered the NSA's 'Big Brother Machine',Hacker News,https://thereader.mitpress.mit.edu/the-whistleblower-who-uncovered-the-nsas-big-brother-machine/,2026-04-30 17:02:52
Largest Digital Human Rights Conference Suddenly Canceled,Hacker News,https://www.404media.co/rightscon-human-rights-conference-suddenly-postponed/,2026-04-30 17:02:52
SatoshiGuesser – Roll for Bitcoin,Hacker News,https://github.com/Pathos0925/SatoshiGuesser,2026-04-30 17:02:52
Shai-Hulud Themed Malware Found in the PyTorch Lightning AI Training Library,Hacker News,https://semgrep.dev/blog/2026/malicious-dependency-in-pytorch-lightning-used-for-ai-training/,2026-04-30 17:02:52
Meta is running get-rich-quick ads for its AI tools,The Verge,https://www.theverge.com/ai-artificial-intelligence/915970/meta-manus-ai-ads-website-slop,2026-04-30 17:02:52
"Cricut’s Joy 2 makes creating stickers easier for beginners, and it’s on sale",The Verge,https://www.theverge.com/gadgets/921355/cricut-joy-2-mothers-day-deal-sale,2026-04-30 17:02:52
Atomfall is the latest indie game being turned into a TV show,Engadget,https://www.engadget.com/2161301/atomfall-is-the-latest-indie-game-being-turned-into-a-tv-show/,2026-04-30 17:02:53
"I tested the Honor 600 Pro, and it's one of the most accomplished mimics around",TechRadar,https://www.techradar.com/phones/honor-phones/honor-600-pro-review,2026-04-30 17:02:53
"'He'll kill when he needs to, but he's not someone who loves killing' — 007 First Light dev explains the game's unique license to kill mechanic",TechRadar,https://www.techradar.com/gaming/hell-kill-when-he-needs-to-but-hes-not-someone-who-loves-killing-007-first-light-dev-explains-the-games-unique-license-to-kill-mechanic,2026-04-30 17:02:53
‘Poultry in motion’: South Korea tests fried chicken delivery to remote island using a drone and four-wheel robot in the world’s most elaborate takeaway operation,TechRadar,https://www.techradar.com/cameras/drones/poultry-in-motion-south-korea-tests-fried-chicken-delivery-to-remote-island-using-a-drone-and-four-wheel-robot-in-the-worlds-most-elaborate-takeaway-operation,2026-04-30 17:02:53
"Take-Two CEO wants GTA 6 to be 'the most spectacular piece of entertainment on Earth, in history'",TechRadar,https://www.techradar.com/gaming/take-two-ceo-wants-gta-6-to-be-the-most-spectacular-piece-of-entertainment-on-earth-in-history,2026-04-30 17:02:53
'The Internet is falling down': Critical cPanel CRLF injection vulnerability puts tens of millions of websites at risk of total compromise – hosting providers urged to apply CVE-2026-41940 patch immediately,TechRadar,https://www.techradar.com/pro/security/the-internet-is-falling-down-critical-cpanel-crlf-injection-vulnerability-puts-tens-of-millions-of-websites-at-risk-of-total-compromise-hosting-providers-urged-to-apply-cve-2026-41940-patch-immediately,2026-04-30 17:02:53
IKEA bedroom trends for summer: create a coastal haven with calming blues and bright coral,TechRadar,https://www.techradar.com/home/ikea-bedroom-trends-for-summer-create-a-coastal-haven-with-calming-blues-and-bright-coral,2026-04-30 17:02:53
AdGuard rolls out an accessibility-first update for its Mac VPN app,TechRadar,https://www.techradar.com/vpn/vpn-services/adguard-rolls-out-an-accessibility-first-update-for-its-mac-vpn-app,2026-04-30 17:02:53
