headline,source,link,datetime
The Rich and Powerful Want to Live Forever. What If They Could?,Hacker News,https://www.nytimes.com/2026/04/24/magazine/eternal-life-longevity-world-leaders.html,2026-04-24 13:02:51
The operating cost of adult and gambling startups,Hacker News,https://orchidfiles.com/stigma-is-a-tax-on-every-operational-decision/,2026-04-24 13:02:51
A new Republican privacy bill could be ‘worse than no standard at all’,The Verge,https://www.theverge.com/policy/917828/data-privacy-bill-secure-act-house-state-laws,2026-04-24 13:02:51
Engadget Podcast: Tim Cook’s Apple era and what lies ahead for John Ternus,Engadget,https://www.engadget.com/computing/engadget-podcast-tim-cooks-apple-era-and-what-lies-ahead-for-john-ternus-121853488.html?src=rss,2026-04-24 13:02:51
"I watched the first 6 episodes of Widow's Bay on Apple TV — and the dark comedy horror show had me coming back for the humor, but not the frights",TechRadar,https://www.techradar.com/streaming/apple-tv-plus/widows-bay-review,2026-04-24 13:02:52
"'No stability fixes? Is this even an update?' — New PS5 software update is a big one, adding... more emoji message reactions?",TechRadar,https://www.techradar.com/gaming/no-stability-fixes-is-this-even-an-update-new-ps5-software-update-is-a-big-one-adding-more-emoji-message-reactions,2026-04-24 13:02:52
This Firefox vulnerability may have been tracking all your private Tor identities – even in Private Mode,TechRadar,https://www.techradar.com/pro/security/this-firefox-vulnerability-may-have-been-tracking-all-your-private-tor-identities-even-in-private-mode,2026-04-24 13:02:52
The Xiaomi 17 Ultra is the best Xiaomi phone yet and one of the best camera phones I've ever tested,TechRadar,https://www.techradar.com/phones/xiaomi-phones/xiaomi-17-ultra-review,2026-04-24 13:02:52
