headline,source,link,datetime
SPCX is now Wall Street's most shorted new stock,Hacker News,https://invezz.com/news/2026/07/16/the-worlds-most-valuable-ipo-spcx-is-now-wall-streets-most-shorted-new-stock/,2026-07-16 19:03:30
Kalshi says it caught Trump’s teleprompter operator insider trading,The Verge,https://www.theverge.com/news/966676/trump-teleprompter-operator-kalshi-bets-mention-markets-investigation,2026-07-16 19:03:31
The AMD Ryzen 7 7700X3D chip is now available for $329,Engadget,https://www.engadget.com/2216899/amd-ryzen-7-7700x3d-chip-now-available-for-329/,2026-07-16 19:03:31
Don't lose sleep over reports of 260 Starlink satellites deorbiting,Engadget,https://www.engadget.com/2212810/spacex-starlink-satellites-deorbit-reports/,2026-07-16 19:03:31
"No sleep score, no steps: this Signal smart ring from an ex-Google head is focused on cracking cuffless, calibration-less blood pressure readings",TechRadar,https://www.techradar.com/health-fitness/no-sleep-score-no-steps-this-signal-smart-ring-from-an-ex-google-head-is-focused-on-cracking-cuffless-calibration-less-blood-pressure-readings,2026-07-16 19:03:31
China beats Elon Musk’s Neuralink to the world’s first commercial brain-computer interface implant — car crash victim given coin-sized chip that turns neural signals into hand movements,TechRadar,https://www.techradar.com/ai-platforms-assistants/china-beats-elon-musks-neuralink-to-the-worlds-first-commercial-brain-computer-interface-implant-car-crash-victim-given-coin-sized-chip-that-turns-neural-signals-into-hand-movements,2026-07-16 19:03:31
Russia to launch Rassvet Starlink rival within days with 318-strong satellite constellation expected by 2028,TechRadar,https://www.techradar.com/pro/russia-to-launch-rassvet-starlink-rival-within-days-with-318-strong-satellite-constellation-expected-by-2028,2026-07-16 19:03:31
