headline,source,link,datetime
Stop Using Conventional Commits,Hacker News,https://sumnerevans.com/posts/software-engineering/stop-using-conventional-commits/,2026-06-05 16:02:55
Ask HN: What is your (AI) dev tech stack / workflow? (June 2026),Hacker News,https://news.ycombinator.com/item?id=48413629,2026-06-05 16:02:55
Good Careers at Bad Companies,Hacker News,https://sharedphysics.com/good-careers-at-bad-companies/,2026-06-05 16:02:55
New York lawmakers pass one-year ban on new data centers,The Verge,https://www.theverge.com/policy/944041/new-york-data-center-moratorium,2026-06-05 16:02:56
ISS astronauts had to shelter in place in the SpaceX Dragon capsule because of an air leak,Engadget,https://www.engadget.com/2188304/iss-astronauts-had-to-shelter-in-place-due-to-air-leak/,2026-06-05 16:02:56
This $1.33 per month VPN is the most customizable option out there — perfect if you're after a secure connection tailored to your exact needs,TechRadar,https://www.techradar.com/vpn/vpn-services/this-usd1-33-per-month-vpn-is-the-most-customizable-option-out-there-perfect-if-youre-after-a-secure-connection-tailored-to-your-exact-needs,2026-06-05 16:02:56
"The Future Game Show Summer Showcase airs tomorrow and will offer an extended look at Exodus, as well reveal new trailers and game announcements — here's when you can tune in",TechRadar,https://www.techradar.com/gaming/gaming-industry/the-future-game-show-summer-showcase-airs-tomorrow-and-will-offer-an-extended-look-at-exodus-as-well-reveal-new-trailers-and-game-announcements-heres-when-you-can-tune-in,2026-06-05 16:02:56
"'Not your usual business PC': Dell Pro Max Tower T2 workstation with a Core Ultra 9 CPU, RTX 2000 Ada graphics, 32GB RAM, and 1TB SSD delivers insanely powerful performance and professional reliability — and it's $900 off right now",TechRadar,https://www.techradar.com/pro/not-your-usual-business-pc-dell-pro-max-tower-t2-workstation-with-a-core-ultra-9-cpu-rtx-2000-ada-graphics-32gb-ram-and-1tb-ssd-delivers-insanely-powerful-performance-and-professional-reliability-and-its-usd900-off-right-now,2026-06-05 16:02:56
"Panasonic Lumix L10 vs Fujifilm X100VI: two of my favorite premium compact cameras, but which one is best for everyday photography?",TechRadar,https://www.techradar.com/cameras/compact-cameras/panasonic-lumix-l10-vs-fujifilm-x100vi-two-of-my-favorite-premium-compact-cameras-but-which-one-is-best-for-everyday-photography,2026-06-05 16:02:56
'Nintendo products are fully compliant with these requirements' — A new Nintendo Switch 2 model featuring a removable battery will be released in the EU soon to meet regulations,TechRadar,https://www.techradar.com/gaming/nintendo-products-are-fully-compliant-with-these-requirements-a-new-nintendo-switch-2-model-featuring-a-removable-battery-will-be-released-in-the-eu-soon-to-meet-regulations,2026-06-05 16:02:56
Anthropic's bizarre call for everyone to slow down on AI is a pipe dream — here's why that will never happen,TechRadar,https://www.techradar.com/ai-platforms-assistants/anthropics-bizarre-call-for-everyone-to-slow-down-on-ai-is-a-pipe-dream-heres-why-that-will-never-happen,2026-06-05 16:02:56
Proxmox VE virtualization platform review,TechRadar,https://www.techradar.com/pro/proxmox-ve-review-virtualization-platform-review,2026-06-05 16:02:56
"Google Fitbit Air review: The affordable Whoop alternative hits all the right notes, but its messy AI-powered app holds it back from greatness",TechRadar,https://www.techradar.com/health-fitness/fitness-trackers/google-fitbit-air-review,2026-06-05 16:02:56
