headline,source,link,datetime
Opus 4.7 to 4.6 Inflation is ~45%,Hacker News,https://tokens.billchambers.me/leaderboard,2026-04-18 17:02:43
Amazon won't release Fire Sticks that support sideloading anymore,Hacker News,https://arstechnica.com/gadgets/2026/04/amazon-wont-release-fire-sticks-that-support-sideloading-anymore/,2026-04-18 17:02:43
Judge rules Trump administration violated the First Amendment in fight against ICE-tracking,The Verge,https://www.theverge.com/policy/914619/trump-administration-violated-first-amendment-ice-tracking,2026-04-18 17:02:43
DOJ refuses to help French authorities in criminal probe of X,Engadget,https://www.engadget.com/social-media/doj-refuses-to-help-french-authorities-in-criminal-probe-of-x-162654518.html?src=rss,2026-04-18 17:02:43
I tried a new ChatGPT tool to help me find a better wedding venue — and I’m very glad it isn’t planning my big day,TechRadar,https://www.techradar.com/ai-platforms-assistants/chatgpt/i-tried-a-new-chatgpt-tool-to-help-me-find-a-better-wedding-venue-and-im-very-glad-it-isnt-planning-my-big-day,2026-04-18 17:02:44
"'Update immediately': 60,000 WordPress websites at risk after experts discover flaw that allows hackers to create hidden admin accounts",TechRadar,https://www.techradar.com/pro/security/update-immediately-60-000-wordpress-websites-at-risk-after-experts-discover-flaw-that-allows-hackers-to-create-hidden-admin-accounts,2026-04-18 17:02:44
