headline,source,link,datetime
Show HN: AnalystAIPack – 118 runnable agent skills for malware analysis and RE,Hacker News,https://meltedinhex.com/posts/analyst-ai-pack/,2026-07-01 18:03:10
Are readers generating fiction with AI models?,Hacker News,https://arxiv.org/abs/2606.22748,2026-07-01 18:03:10
Krafton settles with Subnautica 2 developer after drawn-out dispute over $250 million,The Verge,https://www.theverge.com/games/960354/krafton-subnautica-2-settlement-bonuses-unknown-worlds,2026-07-01 18:03:10
Xbox testing disc-to-digital feature that digitizes a physical game collection,The Verge,https://www.theverge.com/report/960173/microsoft-xbox-disc-to-digital-feature-physical-game-collection,2026-07-01 18:03:10
7 discs new 4K Blu-rays to add to your collection from June 2026,TechRadar,https://www.techradar.com/televisions/blu-ray/7-discs-new-4k-blu-rays-to-add-to-your-collection-from-june-2026,2026-07-01 18:03:11
"How to watch Belgium vs Senegal: Free Streams, TV Channels & Kick-Off time for FIFA World Cup 2026 as Kevin De Bruyne & Co. eye progress",TechRadar,https://www.techradar.com/how-to-watch/football/belgium-vs-senegal-world-cup-2026-free,2026-07-01 18:03:11
