headline,source,link,datetime
Ask HN: How to solve the cold start problem for two-sided marketplace?,Hacker News,https://news.ycombinator.com/item?id=47834213,2026-04-20 14:02:43
All phones sold in the EU to have replaceable batteries from 2027,Hacker News,https://www.theolivepress.es/spain-news/2026/04/20/eu-to-force-replaceable-batteries-in-phones-and-tablets-from-2027/,2026-04-20 14:02:43
"Show HN: Saunas lower nighttime heart rate more than exercise (n=59,000)",Hacker News,https://tryterra.co/research/sauna-effect-on-heart-rate,2026-04-20 14:02:43
The Elden Ring movie hits theaters in March 2028,The Verge,https://www.theverge.com/entertainment/914818/elden-ring-movie-date-cast,2026-04-20 14:02:43
Adobe Summit 2026: we're live at Adobe's annual keynotes to hear what's new this year,TechRadar,https://www.techradar.com/pro/live/adobe-summit-2026,2026-04-20 14:02:43
Apple says it’s survived a ‘relentless legal campaign’ against the Apple Watch — and it could mean a key health feature is returning to your wrist,TechRadar,https://www.techradar.com/health-fitness/smartwatches/apple-says-its-survived-a-relentless-legal-campaign-against-the-apple-watch-and-it-could-mean-a-key-health-feature-is-returning-to-your-wrist,2026-04-20 14:02:43
The AI trust advantage: How smarter security wins customer confidence,TechRadar,https://www.techradar.com/pro/the-ai-trust-advantage-how-smarter-security-wins-customer-confidence,2026-04-20 14:02:43
I went inside Mattel and saw how Toy Story 5 toys are built — and made interactive,TechRadar,https://www.techradar.com/streaming/entertainment/i-went-inside-mattel-and-saw-how-toy-story-5-toys-are-built-and-made-interactive,2026-04-20 14:02:43
