headline,source,link,datetime
Switzerland Built an Alternative to BGP,Hacker News,https://www.theregister.com/2026/03/17/switzerland_bgp_alternative/,2026-03-18 07:04:36
SSH has no Host header,Hacker News,https://blog.exe.dev/ssh-host-header,2026-03-18 07:04:36
Forget Flags and Scripts: Just Rename the File,Hacker News,https://robertsdotpm.github.io/software_engineering/program_names_as_input.html,2026-03-18 07:04:36
Afterpay Day hasn't officially started yet — but these 20+ offers are already my favourites,TechRadar,https://www.techradar.com/live/news/afterpay-day-march-2026,2026-03-18 07:04:36
MSI Prestige 14 AI+ review: a sleek business laptop with all-day battery life,TechRadar,https://www.techradar.com/computing/laptops/msi-prestige-14-ai-plus-laptop-review,2026-03-18 07:04:36
