headline,source,link,datetime
"Microsoft terms say Copilot is for entertainment purposes only, not serious use",Hacker News,https://www.tomshardware.com/tech-industry/artificial-intelligence/microsoft-says-copilot-is-for-entertainment-purposes-only-not-serious-use-firm-pushing-ai-hard-to-consumers-tells-users-not-to-rely-on-it-for-important-advice,2026-04-05 16:02:38
StackOverflow: Retiring the Beta Site,Hacker News,https://meta.stackoverflow.com/questions/438628/retiring-the-beta-site,2026-04-05 16:02:38
Phone-free bars and restaurants on the rise across the U.S.,Hacker News,https://www.axios.com/2026/04/05/phone-free-restaurants-bars-bans-restrictions-offline,2026-04-05 16:02:38
The first iPhone 17 Pro Max photos sent back from the Artemis II mission really are out of this world,TechRadar,https://www.techradar.com/phones/iphone/the-first-iphone-17-pro-max-photos-sent-back-from-the-artemis-ii-mission-really-are-out-of-this-world,2026-04-05 16:02:38
(Don't) Mind the gap — Japanese firm tests whether data centers can survive the strains and stresses of the Tokyo metro,TechRadar,https://www.techradar.com/pro/dont-mind-the-gap-japanese-firm-tests-whether-data-centers-can-survive-the-strains-and-stresses-of-the-tokyo-metro,2026-04-05 16:02:38
