headline,source,link,datetime
Claude Code removed from Anthropic's Pro plan,Hacker News,https://claude.com/pricing,2026-04-21 22:02:55
We translated the Palantir manifesto for actual human beings,The Verge,https://www.theverge.com/policy/915237/palantir-manifesto,2026-04-21 22:02:55
Cash App now supports accounts for kids 6-12,Engadget,https://www.engadget.com/apps/cash-app-now-supports-accounts-for-kids-6-12-210651025.html?src=rss,2026-04-21 22:02:55
Home theater fans will be happy the LG G6 OLED TV fixes this overlooked picture issue its predecessors had — but there's a catch,TechRadar,https://www.techradar.com/televisions/home-theater-fans-will-be-happy-the-lg-g6-oled-tv-fixes-this-overlooked-picture-issue-its-predecessors-had-but-theres-a-catch,2026-04-21 22:02:55
'Not just generating images. It’s thinking' — ChatGPT Images 2.0 could fundamentally change how you make AI images,TechRadar,https://www.techradar.com/ai-platforms-assistants/chatgpt/not-just-generating-images-its-thinking-chatgpt-images-2-0-could-fundamentally-change-how-you-make-ai-images,2026-04-21 22:02:55
"'Pushpaganda is, at the highest level, a case of social engineering': Experts warn scammers are flooding Google Discover with AI-generated content spreading malicious notifications",TechRadar,https://www.techradar.com/pro/pushpaganda-is-at-the-highest-level-a-case-of-social-engineering-experts-warn-scammers-are-flooding-google-discover-with-ai-generated-content-spreading-malicious-notifications,2026-04-21 22:02:55
