headline,source,link,datetime
"MaralGPT ""Mythos"" 9B just released, and this is why I'm proud of my project",Hacker News,https://haghiri75.com/en/maralgpt-mythos-9b-just-released-and-this-is-why-im-proud-of-my-project/,2026-06-29 12:03:04
Comcast is splitting in two,The Verge,https://www.theverge.com/tech/958849/comcast-nbcuniversal-company-spinoff-announcement,2026-06-29 12:03:04
Google reportedly capped Meta's use of Gemini AI for coding and chatbots,Engadget,https://www.engadget.com/2203579/google-reportedly-capped-meta-use-of-gemini-ai-for-coding-chatbots/,2026-06-29 12:03:04
What is the release date for Cape Fear episode 6 on Apple TV?,TechRadar,https://www.techradar.com/streaming/apple-tv-plus/what-is-the-release-date-for-cape-fear-episode-6-on-apple-tv,2026-06-29 12:03:04
The Razer Pro Type Ergo proves the company can do non-gaming keyboards well – but it’s not perfect,TechRadar,https://www.techradar.com/computing/keyboards/the-razer-pro-type-ergo-proves-the-company-can-do-non-gaming-keyboards-well-but-its-not-perfect,2026-06-29 12:03:04
'Plenty of AI tools claim to be built for finance; Microsoft 365 Copilot in Excel is proving it in practice': Microsoft is fuelling up Excel with lots more AI tools for finance workers,TechRadar,https://www.techradar.com/pro/plenty-of-ai-tools-claim-to-be-built-for-finance-microsoft-365-copilot-in-excel-is-proving-it-in-practice-microsoft-is-fuelling-up-excel-with-lots-more-ai-tools-for-finance-workers,2026-06-29 12:03:04
