headline,source,link,datetime
YouTube will let you ask AI to make a custom video feed,The Verge,https://www.theverge.com/streaming/938759/youtube-custom-ai-feed-prompt-availability,2026-05-28 09:02:55
Four key questions insurers must answer to embrace AI effectively,TechRadar,https://www.techradar.com/pro/four-key-questions-insurers-must-answer-to-embrace-ai-effectively,2026-05-28 09:02:56
VPNs are not a 'threat' — industry hopes for an evidence-based outcome to UK online safety consultation,TechRadar,https://www.techradar.com/vpn/vpn-privacy-security/vpns-are-not-a-threat-industry-hopes-for-an-evidence-based-outcome-to-uk-online-safety-consultation,2026-05-28 09:02:56
"Cybercriminals are using GTA 6 hype to spread malware ahead of launch, NordVPN warns",TechRadar,https://www.techradar.com/vpn/vpn-privacy-security/cybercriminals-are-using-gta-6-hype-to-spread-malware-ahead-of-launch-nordvpn-warns,2026-05-28 09:02:56
Deli Boys season 3 plans 'in the works' as executive producer confirms Hulu and Disney+ show's long-term framework after 'big cliffhanger' in new season 2 finale,TechRadar,https://www.techradar.com/streaming/hulu/deli-boys-season-3-update-disney-plus,2026-05-28 09:02:56
