headline,source,link,datetime
"Google, Microsoft, Meta All Tracking You Even When You Opt Out",Hacker News,https://www.404media.co/google-microsoft-meta-all-tracking-you-even-when-you-opt-out-according-to-an-independent-audit/,2026-04-14 16:03:21
"For the First Time in the U.S., Renewables Generate More Power Than Natural Gas",Hacker News,https://e360.yale.edu/digest/us-renewables-natural-gas-coal,2026-04-14 16:03:21
AI Will Never Be Ethical or Safe,Hacker News,https://meiert.com/blog/ai-ethics-and-safety/,2026-04-14 16:03:21
The AI School Bus Camera Company Blanketing America in Tickets,Hacker News,https://www.bloomberg.com/news/features/2026-04-14/buspatrol-school-bus-traffic-tickets-have-limited-safety-benefits-critics-say,2026-04-14 16:03:21
DaVinci Resolve adds new photo editing tools to take on Lightroom and Photoshop,The Verge,https://www.theverge.com/tech/911635/blackmagic-design-davinci-resolve-21-photo-page-raw-support,2026-04-14 16:03:21
Bose’s noise-crushing QC Ultra Earbuds are nearly 20 percent off right now,The Verge,https://www.theverge.com/gadgets/911188/bose-quietcomfort-ultra-earbuds-2nd-gen-turtle-beach-stealth-pivot-deal-sale,2026-04-14 16:03:21
'It's more common than you think': Experts reveal how hackers are trying to hijack your inbox with these clever tactics,TechRadar,https://www.techradar.com/pro/security/its-more-common-than-you-think-experts-reveal-how-hackers-are-trying-to-hijack-your-inbox-with-these-clever-tactics,2026-04-14 16:03:21
'The AirPods Pro 3 deliver the quietest ANC I’ve ever experienced' — and you can save $50 on the earbuds at Amazon,TechRadar,https://www.techradar.com/audio/earbuds-airpods/the-airpods-pro-3-deliver-the-quietest-anc-ive-ever-experienced-and-you-can-save-usd50-on-the-earbuds-at-amazon,2026-04-14 16:03:21
"I launched a successful fitness side hustle on Wix: Here is what worked and what didn't, a two-year reflection",TechRadar,https://www.techradar.com/pro/website-building/i-launched-a-successful-fitness-side-hustle-on-wix-here-is-what-worked-and-what-didnt-a-two-year-reflection,2026-04-14 16:03:21
Forget Lego Smart Bricks — this ‘ridiculously wild’ home-built Lego PC is the coolest thing you’ll see today,TechRadar,https://www.techradar.com/computing/forget-lego-smart-bricks-this-ridiculously-wild-home-built-lego-pc-is-the-coolest-thing-youll-see-today,2026-04-14 16:03:21
"Jeff Bezos still gets paid an $80,000 salary from Amazon — but also gets $1.6 million for travel and security, and 'requested not to receive additional compensation'",TechRadar,https://www.techradar.com/pro/jeff-bezos-still-gets-paid-an-usd80-000-salary-from-amazon-but-also-gets-usd1-6-million-for-travel-and-security-and-requested-not-to-receive-additional-compensation,2026-04-14 16:03:21
GTA 5 voice actor shuts down rumors that he's playing GTA 6's Carl Hampton but says he would love to play a 'proper villain' in the game,TechRadar,https://www.techradar.com/gaming/gta-5-voice-actor-shuts-down-rumors-that-hes-playing-gta-6s-carl-hampton-but-says-he-would-love-to-play-a-proper-villain-in-the-game,2026-04-14 16:03:21
