headline,source,link,datetime
We stopped AI bot spam in our GitHub repo using Git's –author flag,Hacker News,https://archestra.ai/blog/only-responsible-ai,2026-05-18 16:04:01
"What ""Amazon Supply Chain Services"" Tells Us About What Amazon Is",Hacker News,https://gadallon.substack.com/p/the-third-time-amazon-did-this-what,2026-05-18 16:04:01
Amazon Alexa Plus can now create AI-generated podcasts,The Verge,https://www.theverge.com/tech/932375/amazon-alexa-plus-ai-podcasts,2026-05-18 16:04:02
Google's much-improved app icons are rolling out now,Engadget,https://www.engadget.com/2175514/googles-much-improved-app-icons-are-rolling-out-now/,2026-05-18 16:04:02
"This smart spotting scope can identify up to 10,000 bird species for you, sports a 30x zoom, and 4K video with subject tracking autofocus — bird watching might never be the same again",TechRadar,https://www.techradar.com/cameras/this-smart-spotting-scope-can-identify-up-to-10-000-bird-species-for-you-sports-a-30x-zoom-and-4k-video-with-subject-tracking-autofocus-bird-watching-might-never-be-the-same-again,2026-05-18 16:04:02
"Another top WordPress plugin exploited — hackers target credit card details, here's what you need to know",TechRadar,https://www.techradar.com/pro/security/another-top-wordpress-plugin-exploited-hackers-target-credit-card-details-heres-what-you-need-to-know,2026-05-18 16:04:02
"Discord's latest 'year of the Linux desktop' update is a game-changer for Steam Deck, but fans are concerned about its age verification plans",TechRadar,https://www.techradar.com/computing/social-media/discords-latest-year-of-the-linux-desktop-update-is-a-game-changer-for-steam-deck-but-fans-are-concerned-about-its-age-verification-plans,2026-05-18 16:04:02
