headline,source,link,datetime
How to Write to SSDs [pdf],Hacker News,https://www.vldb.org/pvldb/vol19/p1469-lee.pdf,2026-05-15 23:02:40
YouTube is expanding its AI deepfake detection tool to all adult users,The Verge,https://www.theverge.com/news/931884/youtube-likeness-detection-ai-deepfake-expansion-all-adults,2026-05-15 23:02:40
"Quordle hints and answers for Saturday, May 16 (game #1573)",TechRadar,https://www.techradar.com/computing/websites-apps/quordle-today-answers-clues-16-may-2026,2026-05-15 23:02:40
"NYT Strands hints and answers for Saturday, May 16 (game #804)",TechRadar,https://www.techradar.com/computing/websites-apps/nyt-strands-today-answers-hints-16-may-2026,2026-05-15 23:02:40
"NYT Connections hints and answers for Saturday, May 16 (game #1070)",TechRadar,https://www.techradar.com/gaming/nyt-connections-today-answers-hints-16-may-2026,2026-05-15 23:02:40
Attack of the AI lawnmowers? Yarbo forced to patch products after experts reveal method to remotely hijack thousands of devices,TechRadar,https://www.techradar.com/pro/security/attack-of-the-ai-lawnmowers-yarbo-forced-to-patch-products-after-experts-reveal-method-to-remotely-hijack-thousands-of-devices,2026-05-15 23:02:40
