headline,source,link,datetime
New Netflix crime drama dominating the charts is 'relentlessly grim' — but there's a bigger issue underneath the surface,TechRadar,https://www.techradar.com/streaming/netflix/jo-nesbo-detective-hole-comment,2026-04-01 16:02:57
Your Android phone just got better at saving your life — here’s how,TechRadar,https://www.techradar.com/phones/android/your-android-phone-just-got-better-at-saving-your-life-heres-how,2026-04-01 16:02:57
Tech sovereignty: Why one size doesn’t fit all,TechRadar,https://www.techradar.com/pro/tech-sovereignty-why-one-size-doesnt-fit-all,2026-04-01 16:02:57
Here are the OpenClaw security risks you should know about,TechRadar,https://www.techradar.com/pro/here-are-the-openclaw-security-risks-you-should-know-about,2026-04-01 16:02:57
Why volumetric video works for the Olympics – but not yet for cinema,TechRadar,https://www.techradar.com/pro/why-volumetric-video-works-for-the-olympics-but-not-yet-for-cinema,2026-04-01 16:02:57
Why you shouldn’t ask ChatGPT for relationship advice — it’ll just tell you you’re right and 'may worsen rather than resolve conflict',TechRadar,https://www.techradar.com/ai-platforms-assistants/why-you-shouldnt-ask-chatgpt-for-relationship-advice-itll-just-tell-you-youre-right-and-may-worsen-rather-than-resolve-conflict,2026-04-01 16:02:57
12 irresistibly boxy and beige Apple accessories that'll transform your shiny new gadgets into retro tech in seconds,TechRadar,https://www.techradar.com/computing/macs/12-irresistibly-boxy-and-beige-apple-accessories-thatll-transform-your-shiny-new-gadgets-into-retro-tech-in-seconds,2026-04-01 16:02:57
"Microsoft set to face another major UK probe - this time over cloud and software licensing, and if it should get ‘strategic market status’",TechRadar,https://www.techradar.com/pro/microsoft-set-to-face-another-major-uk-probe-this-time-over-cloud-and-software-licensing-and-if-it-should-get-strategic-market-status,2026-04-01 16:02:57
The Oppo Find X9 Ultra could be the world’s best camera phone — and it’s launching globally this month,TechRadar,https://www.techradar.com/phones/oppo-phones/the-oppo-find-x9-ultra-could-be-the-worlds-best-camera-phone-and-its-launching-globally-this-month,2026-04-01 16:02:57
Daredevil: Born Again season 2 episodes 2 and 3 just sparked two big fan theories about the Marvel TV show — and they relate to characters in Wilson Fisk's inner circle,TechRadar,https://www.techradar.com/streaming/disney-plus/daredevil-born-again-season-2-episodes-2-and-3-just-sparked-two-big-fan-theories-about-the-marvel-tv-show-and-they-relate-to-characters-in-wilson-fisks-inner-circle,2026-04-01 16:02:57
"Salesforce reveals major AI overhaul for 'ultimate teammate' Slackbot, with over 30 new features",TechRadar,https://www.techradar.com/pro/salesforce-reveals-major-ai-overhaul-for-ultimate-teammate-slackbot-with-over-30-new-features,2026-04-01 16:02:57
10 wild things people are building with OpenClaw,TechRadar,https://www.techradar.com/pro/wild-things-people-are-building-with-openclaw,2026-04-01 16:02:57
I use these 5 simple ‘ChatGPT codes’ every day — and they instantly improve my results,TechRadar,https://www.techradar.com/ai-platforms-assistants/chatgpt/i-use-these-5-simple-chatgpt-codes-every-day-and-they-instantly-improve-my-results,2026-04-01 16:02:57
No F1 in April — Here are 5 sporting events I can’t wait to watch,TechRadar,https://www.techradar.com/how-to-watch/no-f1-in-april-here-are-5-other-sporting-events-for-you-to-watch,2026-04-01 16:02:57
AI hasn’t killed the website but it has exposed weak content foundations,TechRadar,https://www.techradar.com/pro/ai-hasnt-killed-the-website-but-it-has-exposed-weak-content-foundations,2026-04-01 16:02:57
Invincible season 4 episode 5 just made a big change to one of the Prime Video show's new heroes — and I can't see everyone being okay with it,TechRadar,https://www.techradar.com/streaming/amazon-prime-video/invincible-season-4-episode-5-just-made-a-big-change-to-one-of-the-prime-video-shows-new-heroes-and-i-cant-see-everyone-being-okay-with-it,2026-04-01 16:02:57
'The Apple graveyard': 7 mythical Apple products from the past 50 years that never saw the light of day,TechRadar,https://www.techradar.com/tech/the-apple-graveyard-7-mythical-apple-products-from-the-past-50-years-that-never-saw-the-light-of-day,2026-04-01 16:02:57
How to watch Dwars door Vlaanderen 2026: Free Streams and TV Channels for the UCI WorldTour Race,TechRadar,https://www.techradar.com/how-to-watch/cycling/dwars-door-vlaanderen-2026-live-stream,2026-04-01 16:02:57
How Apple accidentally destroyed the record business — and why I wish we'd stuck with iPods,TechRadar,https://www.techradar.com/audio/apple-music/how-apple-accidentally-destroyed-the-record-business-and-why-i-wish-wed-stuck-with-ipods,2026-04-01 16:02:57
"'You’re holding it wrong': 11 iconic phrases that define Apple's last 50 years, from genius highs to embarrassing lows",TechRadar,https://www.techradar.com/tech/youre-holding-it-wrong-11-iconic-phrases-that-define-apples-last-50-years-from-genius-highs-to-embarrassing-lows,2026-04-01 16:02:57
Iran’s internet shutdown proves we need to go beyond Starlink and VPNs — this could this be the solution,TechRadar,https://www.techradar.com/vpn/vpn-privacy-security/irans-internet-shutdown-proves-we-need-to-go-beyond-starlink-and-vpns-this-could-this-be-the-solution,2026-04-01 16:02:57
Our most recommended robovacs are perfect for post-Easter cleanups — and they're discounted by up to 68% off,TechRadar,https://www.techradar.com/home/vacuums/our-most-recommended-robovacs-are-perfect-for-post-easter-cleanups-and-theyre-discounted-by-up-to-68-percent-off,2026-04-01 16:02:57
'You've tarnished Apple's reputation': 11 things Apple got horribly wrong over the past 50 years,TechRadar,https://www.techradar.com/tech/youve-tarnished-apples-reputation-11-things-apple-got-horribly-wrong-over-the-past-50-years,2026-04-01 16:02:57
'Never in my wildest dreams did I expect this to happen' — pro sealife photographer captures 'first-ever' photos of rare seal in Antarctica,TechRadar,https://www.techradar.com/cameras/photography/never-in-my-wildest-dreams-did-i-expect-this-to-happen-pro-sealife-photographer-captures-first-ever-photos-of-rare-seal-in-antarctica,2026-04-01 16:02:57
I used a simple ChatGPT ‘gig finder’ prompt — and it found bands playing near me I’d never heard of,TechRadar,https://www.techradar.com/ai-platforms-assistants/chatgpt/i-used-a-simple-chatgpt-gig-finder-prompt-and-it-found-bands-playing-near-me-id-never-heard-of,2026-04-01 16:02:57
"Quordle hints and answers for Wednesday, April 1 (game #1528)",TechRadar,https://www.techradar.com/computing/websites-apps/quordle-today-answers-clues-1-april-2026,2026-04-01 16:02:57
"NYT Strands hints and answers for Wednesday, April 1 (game #759)",TechRadar,https://www.techradar.com/computing/websites-apps/nyt-strands-today-answers-hints-1-april-2026,2026-04-01 16:02:57
"NYT Connections hints and answers for Wednesday, April 1 (game #1025)",TechRadar,https://www.techradar.com/gaming/nyt-connections-today-answers-hints-1-april-2026,2026-04-01 16:02:57
'Performance without compromise': AMD debuts first dual 3D V-Cache Ryzen CPU in potential showdown against Threadripper and EPYC siblings,TechRadar,https://www.techradar.com/pro/performance-without-compromise-amd-debuts-first-dual-3d-v-cache-ryzen-cpu-in-potential-lowdown-against-threadripper-and-epyc-siblings,2026-04-01 16:02:57
"Delta is finally joining the faster satellite Wi-Fi craze with Amazon — but if you want in-flight satellite now, you’ll still want to book United",TechRadar,https://www.techradar.com/computing/internet/delta-is-finally-joining-the-faster-satellite-wi-fi-craze-with-amazon-but-if-you-want-in-flight-satellite-now-youll-still-want-to-book-united,2026-04-01 16:02:57
"Apple turns 50 — we’re live tracking the celebration, surprises, and more",TechRadar,https://www.techradar.com/news/live/apple-50th-anniversary-celebration,2026-04-01 16:02:57
The Division Resurgence seems like the perfect way to get your MMO shooter fix on the go — 'We believe it's a good way to catch up with the universe in a more flexible way' developer says,TechRadar,https://www.techradar.com/gaming/mobile-gaming/the-division-resurgence-seems-like-the-perfect-way-to-get-your-mmo-shooter-fix-on-the-go-we-believe-its-a-good-way-to-catch-up-with-the-universe-in-a-more-flexible-way-developer-says,2026-04-01 16:02:57
Say goodbye to printed signs at work — Samsung says its new color e-paper will bring in a new era of workplace comms,TechRadar,https://www.techradar.com/pro/say-goodbye-to-printed-signs-at-work-samsung-says-its-new-color-e-paper-will-bring-in-a-new-era-of-workplace-comms,2026-04-01 16:02:57
"I was in love with Meta’s ‘most comfortable glasses’ ever, and then I saw the price tag",TechRadar,https://www.techradar.com/computing/virtual-reality-augmented-reality/i-was-in-love-with-metas-most-comfortable-glasses-ever-and-then-i-saw-the-price-tag,2026-04-01 16:02:57
'AI-driven traffic is the fastest-growing category of internet traffic': New report claims it's official — AI and bots have taken over the internet,TechRadar,https://www.techradar.com/pro/ai-driven-traffic-is-the-fastest-growing-category-of-internet-traffic-new-report-claims-its-official-ai-and-bots-have-taken-over-the-internet,2026-04-01 16:02:57
"Here are 13 TV deals I'd buy before Amazon's Spring Sale ends — shop award-winning 4K, QLED, and OLED TVs from $145",TechRadar,https://www.techradar.com/seasonal-sales/here-are-13-tv-deals-id-buy-before-amazons-spring-sale-ends-shop-award-winning-4k-qled-and-oled-tvs-from-usd145,2026-04-01 16:02:57
The Elder Scrolls Online Season Zero adds an all-new event zone in upcoming seasonal content that's 'free for anyone who owns the game’,TechRadar,https://www.techradar.com/gaming/the-elder-scrolls-online-season-zero-adds-an-all-new-event-zone-in-upcoming-seasonal-content-thats-free-for-anyone-who-owns-the-game,2026-04-01 16:02:57
"The Elder Scrolls Online is coming to PC Game Pass in June, and it's free right now with PlayStation Plus",TechRadar,https://www.techradar.com/gaming/the-elder-scrolls-online-is-coming-to-pc-game-pass-in-june-and-its-free-right-now-with-playstation-plus,2026-04-01 16:02:57
12 essential MagSafe accessories for travel,TechRadar,https://www.techradar.com/home/12-essential-magsafe-accessories-for-travel,2026-04-01 16:02:57
I wouldn't let Amazon's Spring Sale come to a close without scoring these epic Lego deals — shop my top picks from $15.99,TechRadar,https://www.techradar.com/streaming/entertainment/i-wouldnt-let-amazons-spring-sale-come-to-a-close-without-scoring-these-epic-lego-deals-shop-my-top-picks-from-usd15-99,2026-04-01 16:02:57
"DR Congo vs Jamaica free streams: How to watch 2026 World Cup intercontinental playoff, TV schedule, preview",TechRadar,https://www.techradar.com/how-to-watch/dr-congo-vs-jamaica-free-streams-2026-world-cup-intercontinental-playoff,2026-04-01 16:02:57
I saw Steve Jobs give his last WWDC presentation — and that was when I knew Apple could last for 50 years and beyond,TechRadar,https://www.techradar.com/phones/iphone/i-saw-steve-jobs-give-his-last-wwdc-presentation-and-that-was-when-i-knew-apple-could-last-for-50-years-and-beyond,2026-04-01 16:02:57
'A hard truth for the AI era: don’t assume AI tools are secure by default': OpenAI patches flaw allowing silent data leakage from ChatGPT conversations without users ever knowing,TechRadar,https://www.techradar.com/pro/security/a-hard-truth-for-the-ai-era-dont-assume-ai-tools-are-secure-by-default-openai-patches-flaw-allowing-silent-data-leakage-from-chatgpt-conversations-without-users-ever-knowing,2026-04-01 16:02:57
A24's Backrooms has a full trailer — and its found footage clips have left me absolutely terrified,TechRadar,https://www.techradar.com/streaming/entertainment/a24s-backrooms-has-a-full-trailer-and-its-found-footage-clips-have-left-me-absolutely-terrified,2026-04-01 16:02:57
Apple TV's Cape Fear trailer gives a chilling first look at villain Max Cady and fans are impressed: 'Javier Bardem can do anything',TechRadar,https://www.techradar.com/streaming/apple-tv-plus/apple-tvs-cape-fear-trailer-gives-a-chilling-first-look-at-villain-max-cady-and-fans-are-impressed-javier-bardem-can-do-anything,2026-04-01 16:02:57
Is Apple’s rumored AI strategy a risk to your iPhone? Here’s why the new Siri could be the last thing Apple fans need,TechRadar,https://www.techradar.com/phones/iphone/is-apples-rumored-ai-strategy-a-risk-to-your-iphone-heres-why-the-new-siri-could-be-the-last-thing-apple-fans-need,2026-04-01 16:02:57
Keep your files protected: 1TB Samsung T9 Portable SSD gets a welcome price cut for World Backup Day,TechRadar,https://www.techradar.com/pro/keep-your-files-protected-1tb-samsung-t9-portable-ssd-gets-a-welcome-price-cut-for-world-backup-day,2026-04-01 16:02:57
How to watch Sweden vs Poland for FREE: live streams for World Cup Qualifier 2026,TechRadar,https://www.techradar.com/how-to-watch/football/sweden-vs-poland-fifa-world-cup-2026-qualifier-final,2026-04-01 16:02:57
This roguelike coin pusher game has all the addictive fun of the arcade without wasting your pocket money,TechRadar,https://www.techradar.com/gaming/pc-gaming/this-roguelike-coin-pusher-game-has-all-the-addictive-fun-of-the-arcade-without-wasting-your-pocket-money,2026-04-01 16:02:57
Crimson Desert Kliff actor reveals his character changed a lot during development and he had to push Pearl Abyss for clarity — 'I just kept pushing and pushing and pushing about story and character as much as I could',TechRadar,https://www.techradar.com/gaming/crimson-desert-kliff-actor-reveals-his-character-changed-a-lot-during-development-and-he-had-to-push-pearl-abyss-for-clarity-i-just-kept-pushing-and-pushing-and-pushing-about-story-and-character-as-much-as-i-could,2026-04-01 16:02:57
These Sony headphones are 'still the best in the business' — and they're down to a new record-low price for a very limited time,TechRadar,https://www.techradar.com/audio/wireless-headphones/these-sony-headphones-are-still-the-best-in-the-business-and-theyre-down-to-a-new-record-low-price-for-a-very-limited-time,2026-04-01 16:02:57
More and more workers say they'd be happy with an AI boss — but don't expect it to give them a raise any time soon,TechRadar,https://www.techradar.com/pro/more-and-more-workers-say-theyd-be-happy-with-an-ai-boss-but-dont-expect-it-to-give-them-a-raise-any-time-soon,2026-04-01 16:02:57
