headline,source,link,datetime
"H.264 Streaming Fees: What Changed, Who's Affected, and What It Means",Hacker News,https://www.streamingmedia.com/Articles/ReadArticle.aspx?ArticleID=173935,2026-04-03 12:02:34
Chatbots are now prescribing psychiatric drugs,The Verge,https://www.theverge.com/ai-artificial-intelligence/906525/ai-chatbot-prescribe-refill-psychiatric-drugs,2026-04-03 12:02:34
The Morning After: NASA’s Artemis II is on a voyage around the Moon,Engadget,https://www.engadget.com/general/the-morning-after-engadget-newsletter-111544222.html?src=rss,2026-04-03 12:02:34
'I think EmDash was created to sell more Cloudflare services': WordPress co-founder Matt Mullenweg gives his verdict on Cloudflare's EmDash,TechRadar,https://www.techradar.com/pro/i-think-emdash-was-created-to-sell-more-cloudflare-services-wordpress-co-founder-matt-mullenweg-gives-his-verdict-on-cloudflares-emdash,2026-04-03 12:02:34
The leadership dilemma: Governing the “Agentic AI” workforce,TechRadar,https://www.techradar.com/pro/the-leadership-dilemma-governing-the-agentic-ai-workforce,2026-04-03 12:02:34
