headline,source,link,datetime
Launch HN: Drafted (YC P26) – Models for residential architecture,Hacker News,https://news.ycombinator.com/item?id=48543908,2026-06-15 17:02:54
TinyWind: A pixel pirate sailing game with real wind physics (380k+ kms sailed),Hacker News,https://tinywind.io,2026-06-15 17:02:54
How Brexit has made Britain poorer – in charts,Hacker News,https://www.theguardian.com/politics/2026/jun/14/how-uk-economy-changed-since-brexit-vote-charts,2026-06-15 17:02:54
How to watch OnlyFans: Inside the Machine online – it's free,TechRadar,https://www.techradar.com/how-to-watch/how-to-watch-onlyfans-inside-the-machine-online-its-free,2026-06-15 17:02:54
"‘Time for a new streaming stick’: Fox is acquiring Roku for $22 billion, and users of the streaming devices are far from happy",TechRadar,https://www.techradar.com/televisions/streaming-devices/time-for-a-new-streaming-stick-fox-is-acquiring-roku-for-usd22-billion-and-users-of-the-streaming-devices-are-far-from-happy,2026-06-15 17:02:54
This Dell laptop deal is a steal for work and study — and I'm impressed with the specs for this price,TechRadar,https://www.techradar.com/pro/this-dell-laptop-deal-is-a-steal-for-work-and-study-and-im-impressed-with-the-specs-for-this-price,2026-06-15 17:02:54
Move over Samsung and Google — you can currently get the 'intentionally outlandish' Nothing Phone (3) for its lowest ever price at Amazon,TechRadar,https://www.techradar.com/phones/move-over-samsung-and-google-you-can-currently-get-the-intentionally-outlandish-nothing-phone-3-for-its-lowest-ever-price-at-amazon,2026-06-15 17:02:54
"Collapsing floorboards, vaulting over tables, and dodging arrows — Blood Message is a cinematic adventure that looks like it could have been developed by Naughty Dog",TechRadar,https://www.techradar.com/gaming/collapsing-floorboards-vaulting-over-tables-and-dodging-arrows-blood-message-is-a-cinematic-adventure-that-looks-like-it-could-have-been-developed-by-naughty-dog,2026-06-15 17:02:54
