headline,source,link,datetime
When su replaced login for becoming another Unix login,Hacker News,https://utcc.utoronto.ca/~cks/space/blog/unix/SuAsLoginReplacement,2026-06-04 12:03:21
NASA's Mars MAVEN probe is dead,Engadget,https://www.engadget.com/2187315/nasa-ends-maven-mars-mission/,2026-06-04 12:03:21
"I went behind the construction walls at Disney World's future Monsters, Inc. land, and Monstropolis is already taking shape",TechRadar,https://www.techradar.com/streaming/entertainment/i-went-behind-the-construction-walls-at-disney-worlds-future-monsters-inc-land-and-monstropolis-is-already-taking-shape,2026-06-04 12:03:21
Roku just got 4 free sports channels including two from FIFA — but World Cup fans should still use these VPNs and apps instead,TechRadar,https://www.techradar.com/streaming/roku-just-got-4-free-sports-channels-including-two-from-fifa-but-world-cup-fans-should-still-use-these-vpns-and-apps-instead,2026-06-04 12:03:21
"Wolverine director says violent gameplay is a 'key part' of bringing the character to life, but knows it's not for everyone — 'We also implemented an accessibility feature to turn off gore'",TechRadar,https://www.techradar.com/gaming/wolverine-director-says-violent-gameplay-is-a-key-part-of-bringing-the-character-to-life-but-knows-its-not-for-everyone-we-also-implemented-an-accessibility-feature-to-turn-off-gore,2026-06-04 12:03:21
"Yamaha's high-end wireless hi-fi speakers could give KEF conniptions, boasting luxury listening (and they look stunning too)",TechRadar,https://www.techradar.com/audio/speakers/yamahas-high-end-wireless-hi-fi-speakers-could-give-kef-conniptions-boasting-luxury-listening-and-they-look-stunning-too,2026-06-04 12:03:21
'A much more polished 4K camera': This DJI Pocket 4 Creator Combo Deal is a steal for professional vloggers,TechRadar,https://www.techradar.com/pro/a-much-more-polished-4k-camera-this-dji-pocket-4-creator-combo-deal-is-a-steal-for-professional-vloggers,2026-06-04 12:03:21
I used ChatGPT to find jobs and rewrite my resume — and it felt like having a personal recruiter,TechRadar,https://www.techradar.com/ai-platforms-assistants/chatgpt/i-used-chatgpt-to-find-jobs-and-rewrite-my-resume-and-it-felt-like-having-a-personal-recruiter,2026-06-04 12:03:21
Tired of your ugly robot vacuum? Shark has a solution — designer robovacs in chic colors that blend with your decor rather than standing out,TechRadar,https://www.techradar.com/home/vacuums/shark-launches-designer-robot-vacuums,2026-06-04 12:03:21
"Meta, Starlink and Microsoft team up with the FBI to delete over 1.4 million accounts and seize millions in cryptocurrency related to huge scam networks targeting Americans",TechRadar,https://www.techradar.com/pro/security/meta-starlink-and-microsoft-team-up-with-the-fbi-to-delete-over-1-4-million-accounts-and-seize-millions-in-cryptocurrency-related-to-huge-scam-networks-targeting-americans,2026-06-04 12:03:21
I'm an outdoors expert — here are 9 easy-pitch tents I'd recommend for a fuss-free camping trip,TechRadar,https://www.techradar.com/health-fitness/im-an-outdoors-expert-here-are-9-easy-pitch-tents-id-recommend-for-a-fuss-free-camping-trip,2026-06-04 12:03:21
