headline,source,link,datetime
Ask HN: What surprised you about Estonia e-Residency and running an Estonian OÜ?,Hacker News,https://news.ycombinator.com/item?id=48673801,2026-06-25 15:03:05
"Federal agents track down woman, demand she remove Instagram post about ICE",Hacker News,https://www.syracuse.com/news/2026/06/federal-agents-track-down-syracuse-woman-demand-she-remove-instagram-post-about-ice.html,2026-06-25 15:03:05
Show HN: I made Google Trends for Hacker News by indexing 18 years of comments,Hacker News,https://hackernewstrends.com,2026-06-25 15:03:05
Bungie hit with ‘significant’ layoffs after ending Destiny 2,The Verge,https://www.theverge.com/entertainment/956880/bungie-layoffs-destiny-2,2026-06-25 15:03:05
Apple hikes prices for most of its hardware,Engadget,https://www.engadget.com/2201524/apple-hikes-prices-for-most-of-its-hardware/,2026-06-25 15:03:05
Sense and Sensibility trailer slammed by frustrated fans as 'unnecessary' — but I think there's a secret weapon hiding in its spectacular cast,TechRadar,https://www.techradar.com/streaming/entertainment/sense-and-sensibility-trailer,2026-06-25 15:03:05
I tested 5 tools for growing a plumbing business in 2026,TechRadar,https://www.techradar.com/pro/i-tested-5-tools-for-growing-a-plumbing-business,2026-06-25 15:03:05
"Look, Bose still makes the best noise-cancelling earbuds for Android and that's final —I don't recommend AirPods without an iPhone",TechRadar,https://www.techradar.com/tech/look-bose-still-makes-the-best-noise-cancelling-earbuds-for-android-and-thats-final-i-dont-recommend-airpods-without-an-iphone,2026-06-25 15:03:05
"Sure, you have an AeroPress, but is it pink? The whole rainbow is on offer for Amazon Prime Day, and you might just need another one",TechRadar,https://www.techradar.com/seasonal-sales/sure-you-have-an-aeropress-but-is-it-pink-the-whole-rainbow-is-on-offer-for-amazon-prime-day-and-you-might-just-need-another-one,2026-06-25 15:03:05
How autonomous systems are reshaping warehouse operations,TechRadar,https://www.techradar.com/pro/how-autonomous-systems-are-reshaping-warehouse-operations,2026-06-25 15:03:05
"Apple price hikes live — all the latest on Mac, iPad and HomePod price rises and which deals to grab now",TechRadar,https://www.techradar.com/news/live/apple-price-rises-mac-ipad-homepod-apple-tv-june-2026,2026-06-25 15:03:05
"I use this small but mighty mini Bluetooth speaker to soundtrack my summer socializing, and it's on sale right now — and you don't need Amazon Prime",TechRadar,https://www.techradar.com/audio/wireless-bluetooth-speakers/i-use-this-small-but-mighty-mini-bluetooth-speaker-to-soundtrack-my-summer-socializing-and-its-on-sale-right-now-and-you-dont-need-amazon-prime,2026-06-25 15:03:05
Edge users beware — this malicious extension can break out of the sandbox and install ransomware,TechRadar,https://www.techradar.com/pro/security/edge-users-beware-this-malicious-extension-can-break-out-of-the-sandbox-and-install-ransomware,2026-06-25 15:03:05
Apple just made Macs and iPads more expensive — Prime Day might be your last chance to buy before prices catch up,TechRadar,https://www.techradar.com/tech/apple-just-made-macs-and-ipads-more-expensive-prime-day-might-be-your-last-chance-to-buy-before-prices-catch-up,2026-06-25 15:03:05
How banks can build a risk-intelligent approach to core modernization,TechRadar,https://www.techradar.com/pro/how-banks-can-build-a-risk-intelligent-approach-to-core-modernization,2026-06-25 15:03:05
9 ways contractors can streamline processes in 2026,TechRadar,https://www.techradar.com/pro/9-ways-contractors-can-streamline-processes,2026-06-25 15:03:05
