headline,source,link,datetime
Is It Safe to Host HTML That Runs Its Own JavaScript?,Hacker News,https://sharemypage.app/blog/is-it-safe-to-host-html-that-runs-javascript,2026-07-09 14:03:57
US seeks cheaper hunter-killer drones after Iran destroys $1B worth of Reapers,Hacker News,https://arstechnica.com/gadgets/2026/07/us-seeks-cheaper-hunter-killer-drones-after-iran-destroys-1b-worth-of-reapers/,2026-07-09 14:03:57
Syria's solar boom is redefining Middle East's energy model,Hacker News,https://www.thenationalnews.com/business/energy/2026/07/06/syrias-solar-boom-is-redefining-middle-easts-energy-model/,2026-07-09 14:03:57
The Glass Backbone: Why the Army's Logistics Will Break in the Next War,Hacker News,https://mwi.westpoint.edu/the-glass-backbone-why-the-armys-logistics-will-break-in-the-next-war/,2026-07-09 14:03:57
Show HN: FableCut – A browser video editor AI agents can drive (zero deps),Hacker News,https://github.com/ronak-create/FableCut,2026-07-09 14:03:57
AI builders outnumber AI governance hires 7:1 in Europe,Hacker News,https://axipro.co/eu-ai-act-hiring-gap-study/,2026-07-09 14:03:57
ICE agents are making house calls for online critics,The Verge,https://www.theverge.com/report/963106/ice-doxxing-office-of-professional-responsibility-free-speech,2026-07-09 14:03:57
Say hello to Claude Wrapped,The Verge,https://www.theverge.com/ai-artificial-intelligence/963105/anthropic-claude-wrapped-reflection-ai-usage,2026-07-09 14:03:57
Character.AI wants a piece of the microdrama pie,The Verge,https://www.theverge.com/entertainment/962897/character-ai-series-microdrama-vertical-video,2026-07-09 14:03:57
New York is the first US state to ban smart glasses in all its courthouses,Engadget,https://www.engadget.com/2211151/new-york-first-us-state-ban-smart-glasses-all-courthouses/,2026-07-09 14:03:57
Claude's new Reflect dashboard wants to help you log off of Claude,Engadget,https://www.engadget.com/2211304/claude-reflect-dashboard-wants-to-help-you-log-off/,2026-07-09 14:03:57
Here's how to block Meta from using your Instagram pictures for its AI,Engadget,https://www.engadget.com/2211315/heres-how-to-block-meta-from-using-your-instagram-pictures-for-its-ai/,2026-07-09 14:03:57
"I took over 1,000 shots with the Sony RX10 V across my kid’s sports day, a bird photography trip and more – here’s how Sony’s surprise new superzoom performed",TechRadar,https://www.techradar.com/cameras/bridge-cameras/sony-rx10-v-review,2026-07-09 14:03:58
"Sony RX10 V vs Sony Cyber-shot RX10 IV: I love this classic wildlife camera’s upgrades after a nine-year wait, but there’s one big drawback",TechRadar,https://www.techradar.com/cameras/bridge-cameras/sony-rx10-v-vs-sony-cyber-shot-rx10-iv,2026-07-09 14:03:58
Insurance company AssuranceAmerica exposes 6.9 million drivers following major data breach — here's what we know,TechRadar,https://www.techradar.com/pro/security/insurance-company-assuranceamerica-exposes-6-9-million-drivers-following-major-data-breach-heres-what-we-know,2026-07-09 14:03:58
