headline,source,link,datetime
Trump demands ABC to fire Jimmy Kimmel,The Verge,https://www.theverge.com/policy/919337/president-trump-jimmy-kimmel-fire-abc,2026-04-27 19:02:43
Google employees ask Sundar Pichai to say no to classified military AI use,The Verge,https://www.theverge.com/ai-artificial-intelligence/919326/google-ai-pentagon-classified-letter,2026-04-27 19:02:43
Images of Samsung's rumored smart glasses have leaked,Engadget,https://www.engadget.com/ar-vr/images-of-samsungs-rumored-smart-glasses-have-leaked-184129483.html?src=rss,2026-04-27 19:02:43
Joby Aviation is demoing 10-minute air taxi flights from JFK to Manhattan for a week,Engadget,https://www.engadget.com/transportation/joby-aviation-is-demoing-10-minute-air-taxi-flights-from-jfk-to-manhattan-for-a-week-180247411.html?src=rss,2026-04-27 19:02:43
"Neurodivergent teacher uses dyscalculia ""superpower"" to recreate full-scale, whale-sized replica of world's first programmable digital computer — 21st-century ENIAC used almost 3,000 sq ft of cardboard and NASA's Artemis II may be his next big challenge",TechRadar,https://www.techradar.com/pro/neurodivergent-teacher-uses-dyscalculia-superpower-to-recreate-full-scale-whale-sized-replica-of-worlds-first-programmable-digital-computer-21st-century-eniac-used-almost-3-000-sq-ft-of-cardboard-and-nasas-artemis-ii-may-be-his-next-big-challenge,2026-04-27 19:02:44
