headline,source,link,datetime
PSA: The first F1 race on Netflix is this weekend,Engadget,https://www.engadget.com/2176061/psa-the-first-f1-race-on-netflix-is-this-weekend/,2026-05-18 23:03:00
Here are the 3 Google I/O 2026 Android XR smart glasses announcements I'm hoping to see,TechRadar,https://www.techradar.com/phones/android/here-are-the-3-google-i-o-2026-android-xr-smart-glasses-announcements-im-hoping-to-see,2026-05-18 23:03:00
"NYT Strands hints and answers for Tuesday, May 19 (game #807)",TechRadar,https://www.techradar.com/computing/websites-apps/nyt-strands-today-answers-hints-19-may-2026,2026-05-18 23:03:00
"NYT Connections hints and answers for Tuesday, May 19 (game #1073)",TechRadar,https://www.techradar.com/gaming/nyt-connections-today-answers-hints-19-may-2026,2026-05-18 23:03:00
"Quordle hints and answers for Tuesday, May 19 (game #1576)",TechRadar,https://www.techradar.com/computing/websites-apps/quordle-today-answers-clues-19-may-2026,2026-05-18 23:03:00
"You can't buy them for your home or office, but AWS just snapped up a host of Apple's most highly desired M3 Ultra Macs",TechRadar,https://www.techradar.com/pro/you-cant-buy-them-for-your-home-or-office-but-aws-just-snapped-up-a-host-of-apples-most-highly-desired-m3-ultra-macs,2026-05-18 23:03:00
