headline,source,link,datetime
Be intentional about how AI changes your codebase,Hacker News,https://aicode.swerdlow.dev,2026-03-19 22:21:15
Sony’s WF-1000XM6 wireless earbuds are on sale for the first time,The Verge,https://www.theverge.com/gadgets/897668/sony-wf-1000xm6-wireless-earbuds-deal-sale,2026-03-19 22:21:16
States are suing the EPA for relinquishing its role as a greenhouse gas emissions regulator,Engadget,https://www.engadget.com/science/states-are-suing-the-epa-for-relinquishing-its-role-as-a-greenhouse-gas-emissions-regulator-221425064.html?src=rss,2026-03-19 22:21:16
Amazon acquires autonomous robotics startup Rivr,Engadget,https://www.engadget.com/big-tech/amazon-acquires-autonomous-robotics-startup-rivr-212839750.html?src=rss,2026-03-19 22:21:16
"Everyone hates this Pokémon, but it's one of the best you can use in Pokémon FireRed and LeafGreen — here’s how you can obtain it on Nintendo Switch and Switch 2",TechRadar,https://www.techradar.com/gaming/everyone-hates-this-pokemon-but-its-one-of-the-best-you-can-use-in-pokemon-firered-and-leafgreen-heres-how-you-can-obtain-it-on-nintendo-switch-and-switch-2,2026-03-19 22:21:16
Crimson Desert's puzzles can be quite challenging — but there's one simple mechanic that means you might not even need to complete them,TechRadar,https://www.techradar.com/gaming/crimson-deserts-puzzles-can-be-quite-challenging-but-theres-one-simple-mechanic-that-means-you-might-not-even-need-to-complete-them,2026-03-19 22:21:16
