headline,source,link,datetime
Virginia Bans Sale of Geolocation Data,Hacker News,https://www.hunton.com/privacy-and-cybersecurity-law-blog/virginia-bans-sale-of-geolocation-data,2026-07-02 22:03:00
Meta has a new app to let you make little AI experiences,The Verge,https://www.theverge.com/tech/961086/meta-pocket-app-gizmo-ai,2026-07-02 22:03:00
Cloudflare will filter out web crawlers that serve AI companies,Engadget,https://www.engadget.com/2207360/cloudflare-will-filter-out-web-crawlers-that-serve-ai-companies/,2026-07-02 22:03:00
"The 11 best hi-fi upgrades of 2026 so far — we gave these speakers, turntables and DACs our highest marks after tough testing",TechRadar,https://www.techradar.com/audio/multi-room/the-11-best-hi-fi-upgrades-of-2026-so-far-we-gave-these-speakers-turntables-and-dacs-our-highest-marks-after-tough-testing,2026-07-02 22:03:00
"Quote of the day by SpaceX CEO Elon Musk: 'Are you prepared to die? Then okay, you're a candidate' — a reminder that the manned mission to Mars might be a deadly one",TechRadar,https://www.techradar.com/pro/quote-of-the-day-by-spacex-ceo-elon-musk-are-you-prepared-to-die-then-okay-youre-a-candidate-a-reminder-that-the-manned-mission-to-mars-might-be-a-deadly-one,2026-07-02 22:03:00
Samsung is plotting to replace your M.2 SSD with a storage chip smaller than a fingernail to improve battery life and supercharge ondevice AI inference,TechRadar,https://www.techradar.com/pro/samsung-is-plotting-to-replace-your-m-2-ssd-with-a-storage-chip-smaller-than-a-fingernail-to-improve-battery-life-and-supercharge-ondevice-ai-inference,2026-07-02 22:03:00
