headline,source,link,datetime
War crimes are no longer shameful. That should terrify you,Hacker News,https://www.aljazeera.com/opinions/2026/4/3/war-crimes-are-no-longer-shameful-that-should-terrify-you,2026-04-03 20:02:43
Age Verification on Systemd and Flatpak,Hacker News,https://cybrkyd.com/post/age-verification-on-systemd-and-flatpak/,2026-04-03 20:02:43
Lenovo Legion Go 2 suddenly costs $650 more as RAMageddon lays waste to gaming hardware,The Verge,https://www.theverge.com/games/906752/lenovo-legion-go-2-suddenly-costs-650-more-as-ramageddon-lays-waste-to-gaming-hardware,2026-04-03 20:02:43
I turned the Artemis II mission's most stunning Earth photo into an iPhone wallpaper — but I needed a little help from AI,TechRadar,https://www.techradar.com/phones/iphone/i-turned-the-artemis-ii-missions-most-stunning-earth-photo-into-an-iphone-wallpaper-but-i-needed-a-little-help-from-ai,2026-04-03 20:02:44
Save over $500 on this powerful Alienware 16X Aurora gaming laptop with an RTX 5060,TechRadar,https://www.techradar.com/tech/save-over-usd500-on-this-powerful-alienware-16x-aurora-gaming-laptop-with-an-rtx-5060,2026-04-03 20:02:44
