headline,source,link,datetime
Show HN: Performative-UI – a react component library of design tropes,Hacker News,https://vorpus.github.io/performativeUI/,2026-06-08 15:03:41
"Hackers likely hijacked over 20,000 Instagram accounts with Meta’s AI chatbot",The Verge,https://www.theverge.com/tech/945658/meta-ai-support-chatbot-exploit-instagram-accounts,2026-06-08 15:03:41
Nintendo will pay a $40 million fine for faulty Joy-Cons,Engadget,https://www.engadget.com/2189455/nintendo-will-pay-a-dollar40-million-fine-for-faulty-joy-cons/,2026-06-08 15:03:41
Here are the IMAX theaters that can play 'The Odyssey' in true 70mm,Engadget,https://www.engadget.com/2189436/here-are-the-imax-theaters-that-can-play-the-odyssey-in-true-70mm/,2026-06-08 15:03:41
The next Nintendo Direct is scheduled for June 9,Engadget,https://www.engadget.com/2189415/the-next-nintendo-direct-is-scheduled-for-june-9/,2026-06-08 15:03:41
"Lepow 16in Quad Monitor for Laptop review: This truly portable, backpack-friendly display system is ready to transform any workspace",TechRadar,https://www.techradar.com/computing/lepow-16in-quad-monitor-for-laptop-review,2026-06-08 15:03:42
"Mainframe modernization is about trust, not migration",TechRadar,https://www.techradar.com/pro/mainframe-modernization-is-about-trust-not-migration,2026-06-08 15:03:42
"This clever peephole camera is perfect for renters, adding smart home video without wires, drilling, or an expensive subscription",TechRadar,https://www.techradar.com/home/home-security/this-clever-peephole-camera-is-perfect-for-renters-adding-smart-home-video-without-wires-drilling-or-an-expensive-subscription,2026-06-08 15:03:42
