headline,source,link,datetime
Werner Herzog in conversation with Paul Cronin (2014),Hacker News,https://fsgworkinprogress.com/2014/09/26/insignificant-bullets-evil-poachers-and-l-a-culture/,2026-05-30 17:02:35
"To have a moral stance on AI is to be an outcast, and it sucks",Hacker News,https://musings.martyn.berlin/to-have-a-moral-stance-on-ai-is-to-be-an-outcast-and-it-sucks,2026-05-30 17:02:35
Backrooms is a certified blockbuster with a $38 million opening day,The Verge,https://www.theverge.com/entertainment/940421/backrooms-blockbuster-38-million-opening,2026-05-30 17:02:35
Oscar-winning 'Star Wars' editor Marcia Lucas has died,Engadget,https://www.engadget.com/2184274/oscar-winning-star-wars-editor-marcia-lucas-has-died/,2026-05-30 17:02:36
"NASA readies the X-59 for its first supersonic flight, SpaceX's Starship grounded and more science stories",Engadget,https://www.engadget.com/2184257/nasa-x-59-first-supersonic-flight-spacex-starship-grounded-and-more-science-stories/,2026-05-30 17:02:36
SpaceX lands a $4 billion contract to help build Trump's Golden Dome,Engadget,https://www.engadget.com/2184272/spacex-lands-a-4-billion-contract-to-help-build-trump-golden-dome/,2026-05-30 17:02:36
