headline,source,link,datetime
Turning a MacBook into a touchscreen with $1 of hardware (2018),Hacker News,https://anishathalye.com/macbook-touchscreen/,2026-03-30 20:02:51
"William Blake, Remote by the Sea",Hacker News,https://www.laphamsquarterly.org/roundtable/william-blake-remote-sea,2026-03-30 20:02:51
How Does Offline Bitcoin Signing Work Step by Step,Hacker News,https://frozensecurity.com/blog/how-offline-bitcoin-signing-works/,2026-03-30 20:02:51
Kyber (YC W23) Is Hiring a Staff Engineer/Tech Lead,Hacker News,https://www.ycombinator.com/companies/kyber/jobs/jJSh3JN-enterprise-account-executive-ae,2026-03-30 20:02:51
Vulnerability Research Is Cooked,Hacker News,https://sockpuppet.org/blog/2026/03/30/vulnerability-research-is-cooked/,2026-03-30 20:02:51
A sea of sparks: Seeing radioactivity,Hacker News,https://maurycyz.com/projects/spinthariscope/,2026-03-30 20:02:51
The Hateful Eight is 85% of S&P 500 Decline,Hacker News,https://paulkedrosky.com/chart-of-the-day-the-hateful-eight-is-85-of-s-p-500-decline/,2026-03-30 20:02:51
Fedware: Government Apps That Spy Harder Than the Apps They Ban,Hacker News,https://www.sambent.com/the-white-house-app-has-huawei-spyware-and-an-ice-tip-line/,2026-03-30 20:02:51
"""CEO Said a Thing "" Journalism",Hacker News,https://karlbode.com/ceo-said-a-thing-journalism/,2026-03-30 20:02:51
Spain shuts airspace for us planes involved in Iran war,Hacker News,https://english.aawsat.com/world/5256772-spain-shuts-airspace-us-planes-involved-iran-war,2026-03-30 20:02:51
Recover Apple Keychain,Hacker News,https://arkoinad.com/posts/apple_keychain_recovery.html,2026-03-30 20:02:51
DigitalOcean Seeks $800M in Funding,Hacker News,https://www.datacenterdynamics.com/en/news/digitalocean-seeks-800m-in-funding/,2026-03-30 20:02:51
You are falling behind because you haven't fed the insincerity machine,Hacker News,https://christianheilmann.com/2026/03/28/you-are-falling-behind-because-you-havent-fed-the-insincerity-machine-in-the-last-5-minutes/,2026-03-30 20:02:51
New Washington state law bans noncompete agreements,Hacker News,https://www.seattletimes.com/business/local-business/new-washington-law-bans-noncompete-agreements/,2026-03-30 20:02:51
"Take Better Notes, by Hand",Hacker News,https://brianschrader.com/archive/take-better-notes-by-hand/,2026-03-30 20:02:51
OCR For construction documents does not work,Hacker News,https://www.getanchorgrid.com/developer/docs/endpoints/drawings-doors,2026-03-30 20:02:51
Bitwarden Integrates with OneCLI Agent Vault,Hacker News,https://www.onecli.sh/blog/bitwarden-agent-access-sdk-onecli,2026-03-30 20:02:51
An NSFW Filter for Marginalia Search,Hacker News,https://www.marginalia.nu/log/a_134_nsfw/,2026-03-30 20:02:51
"FTC Action Against Match and OkCupid for Deceiving Users, Sharing Personal Data",Hacker News,https://www.ftc.gov/news-events/news/press-releases/2026/03/ftc-takes-action-against-match-okcupid-deceiving-users-sharing-personal-data-third-party,2026-03-30 20:02:51
Show HN: Coasts – Containerized Hosts for Agents,Hacker News,https://github.com/coast-guard/coasts,2026-03-30 20:02:51
CodingFont: A game to help you pick a coding font,Hacker News,https://www.codingfont.com/,2026-03-30 20:02:51
"""Over 1.5 million GitHub PRs have had ads injected into them by Copilot""",Hacker News,https://www.neowin.net/news/microsoft-copilot-is-now-injecting-ads-into-pull-requests-on-github-gitlab/,2026-03-30 20:02:51
72% of the dollar's purchasing power was destroyed in just four episodes,Hacker News,https://eco3min.fr/en/us-inflation-is-not-linear/,2026-03-30 20:02:51
"Hackers now exploit critical F5 BIG-IP flaw in attacks, patch now",Hacker News,https://www.bleepingcomputer.com/news/security/hackers-now-exploit-critical-f5-big-ip-flaw-in-attacks-patch-now/,2026-03-30 20:02:52
Pharma is dosing drugs wrong – the quantum tunneling correction nobody is using,Hacker News,https://sectio-aurea-q.github.io/pharma-dosing-error.html,2026-03-30 20:02:52
The ladder is missing rungs – Engineering Progression When AI Ate the Middle,Hacker News,https://negroniventurestudios.com/2026/03/19/the-ladder-is-missing-rungs/,2026-03-30 20:02:52
Show HN: Phantom – Open-source AI agent on its own VM that rewrites its config,Hacker News,https://github.com/ghostwright/phantom,2026-03-30 20:02:52
How to Turn Anything into a Router,Hacker News,https://nbailey.ca/post/router/,2026-03-30 20:02:52
Parrots pack twice as many neurons as primate brains of the same mass,Hacker News,https://www.dhanishsemar.com/writing/bird-brains,2026-03-30 20:02:52
Don't let AI write for you,Hacker News,https://alexhwoods.com/dont-let-ai-write-for-you/,2026-03-30 20:02:52
How the AI Bubble Bursts,Hacker News,https://martinvol.pe/blog/2026/03/30/how-the-ai-bubble-bursts/,2026-03-30 20:02:52
Ask HN: Where have you found the coding limits of current models?,Hacker News,https://news.ycombinator.com/item?id=47573224,2026-03-30 20:02:52
Spain closes airspace to aircraft involved in Iran war,Hacker News,https://english.elpais.com/international/2026-03-30/spain-closes-airspace-to-aircraft-involved-in-iran-war-but-us-bases-are-being-used-in-other-ways.html,2026-03-30 20:02:52
Ghostmoon.app – The Swiss Army Knife for your macOS menu bar,Hacker News,https://www.mgrunwald.com/ghostmoon/,2026-03-30 20:02:52
Mathematical methods and human thought in the age of AI,Hacker News,https://arxiv.org/abs/2603.26524,2026-03-30 20:02:52
"MCP is great, you're just using it wrong",Hacker News,https://techstackups.com/comparisons/mcp-is-solving-the-wrong-problem/,2026-03-30 20:02:52
How Reverse Game Theory Could Solve the Housing Shortage,Hacker News,https://www.noemamag.com/the-architecture-of-cooperation/,2026-03-30 20:02:52
Stripe stole $85k and closed our account,Hacker News,https://news.ycombinator.com/item?id=47572025,2026-03-30 20:02:52
Stripe Is Down,Hacker News,https://dashboard.stripe.com/login,2026-03-30 20:02:52
How to Survive in the Tech industry in 2026,Hacker News,https://blog.phuaxueyong.com/post/2026-03-23-how-to-survive-tech-in-2026/,2026-03-30 20:02:52
Hamilton-Jacobi-Bellman Equation: Reinforcement Learning and Diffusion Models,Hacker News,https://dani2442.github.io/posts/continuous-rl/,2026-03-30 20:02:52
Show HN: The Alphabetical Clock,Hacker News,https://boat.horse/clock/,2026-03-30 20:02:52
I use excalidraw to manage my diagrams for my blog,Hacker News,https://blog.lysk.tech/excalidraw-frame-export/,2026-03-30 20:02:52
I am definitely missing the pre-AI writing era,Hacker News,https://www.lesswrong.com/posts/BJ4pnropWdnzzgeJc/i-am-definitely-missing-the-pre-ai-writing-era,2026-03-30 20:02:52
AI and bots have officially taken over the internet,Hacker News,https://www.cnbc.com/2026/03/26/ai-bots-humans-internet.html,2026-03-30 20:02:52
"15 years, one server, 8GB RAM and 500k users – how Webminal refuses to die",Hacker News,https://community.webminal.org/t/15-years-one-server-8gb-ram-and-500k-users-how-webminal-refuses-to-die/8803,2026-03-30 20:02:52
The Curious Case of Retro Demo Scene Graphics,Hacker News,https://www.datagubbe.se/aipixels/,2026-03-30 20:02:52
HD Audio Driver for Windows 98SE / Me,Hacker News,https://github.com/andrew-hoffman/wdmhda,2026-03-30 20:02:52
VHDL's Crown Jewel,Hacker News,https://www.sigasi.com/opinion/jan/vhdls-crown-jewel/,2026-03-30 20:02:52
Copilot Edited an Ad into My PR,Hacker News,https://notes.zachmanson.com/copilot-edited-an-ad-into-my-pr/,2026-03-30 20:02:52
The Sudden Fall of OpenAI's Most Hyped Product Since ChatGPT,Hacker News,https://www.wsj.com/tech/ai/the-sudden-fall-of-openais-most-hyped-product-since-chatgpt-64c730c9,2026-03-30 20:02:52
Pretext,Hacker News,https://simonwillison.net/2026/Mar/29/pretext/,2026-03-30 20:02:52
New Apple Silicon M4 and M5 HiDPI Limitation on 4K External Displays,Hacker News,https://smcleod.net/2026/03/new-apple-silicon-m4-m5-hidpi-limitation-on-4k-external-displays/,2026-03-30 20:02:52
Philly courts will ban all smart eyeglasses starting next week,Hacker News,https://www.inquirer.com/news/philadelphia/smart-glasses-ai-meta-courts-20260326.html,2026-03-30 20:02:52
Something unexpected: Sunbathers live longer,Hacker News,https://www.health.harvard.edu/blog/heres-something-unexpected-sunbathers-live-longer-201606069738,2026-03-30 20:02:52
DoesItAgeVerify: The age verification status of Open Source Operating Systems,Hacker News,https://github.com/BryanLunduke/DoesItAgeVerify,2026-03-30 20:02:52
AI Tokens Are Mana,Hacker News,https://www.proofofconcept.pub/p/ai-tokens-are-mana,2026-03-30 20:02:52
There is No Spoon. A software engineers primer for demystified ML,Hacker News,https://github.com/dreddnafious/thereisnospoon,2026-03-30 20:02:52
'Project Hail Mary' Crosses $300M in Sales to Become Amazon/MGM's Highest-Gross,Hacker News,https://variety.com/2026/film/news/project-hail-mary-global-box-office-amazon-mgm-highest-grossing-film-1236702246/,2026-03-30 20:02:52
Coding Agents Could Make Free Software Matter Again,Hacker News,https://www.gjlondon.com/blog/ai-agents-could-make-free-software-matter-again/,2026-03-30 20:02:52
Claude Code runs Git reset –hard origin/main against project repo every 10 mins,Hacker News,https://github.com/anthropics/claude-code/issues/40710,2026-03-30 20:02:52
Build123d: A Python CAD programming library,Hacker News,https://github.com/gumyr/build123d,2026-03-30 20:02:52
What category theory teaches us about dataframes,Hacker News,https://mchav.github.io/what-category-theory-teaches-us-about-dataframes/,2026-03-30 20:02:52
Show HN: Crazierl – An Erlang Operating System,Hacker News,https://crazierl.org/demo/,2026-03-30 20:02:52
The road signs that teach travellers about France,Hacker News,https://www.bbc.com/travel/article/20260327-the-road-signs-that-teach-travellers-about-france,2026-03-30 20:02:52
ChatGPT Won't Let You Type Until Cloudflare Reads Your React State,Hacker News,https://www.buchodi.com/chatgpt-wont-let-you-type-until-cloudflare-reads-your-react-state-i-decrypted-the-program-that-does-it/,2026-03-30 20:02:52
Sky Wins Irish Court Order to Unmask 300 Pirate IPTV Users via Revolut Bank,Hacker News,https://torrentfreak.com/sky-wins-irish-court-order-to-unmask-300-pirate-iptv-users-via-revolut-bank/,2026-03-30 20:02:52
The first Apple Home Key-ready smart lock with UWB is cheaper during Amazon’s Big Spring Sale,The Verge,https://www.theverge.com/gadgets/903555/aqara-u400-apple-home-key-uwb-smart-lock-amazon-big-spring-sale-2026-deal,2026-03-30 20:02:52
Beats’ gym-friendly Powerbeats Fit are $30 off for Amazon’s Big Spring Sale,The Verge,https://www.theverge.com/gadgets/903373/beats-powerbeats-fit-pro-2-earbuds-amazon-big-spring-sale-2026-deal,2026-03-30 20:02:52
"A new RCS update could connect iPhone and Android video calls, someday",The Verge,https://www.theverge.com/tech/903509/apple-iphone-google-android-video-calls-rcs-universal-profile-4-0,2026-03-30 20:02:52
Dyson’s thin PencilVac Fluffycones is tougher to resist at $150 off,The Verge,https://www.theverge.com/gadgets/903416/dyson-pencilvac-fluffycones-amazon-big-spring-sale-deal-sale,2026-03-30 20:02:52
A new manufacturing process uses lasers to seal paper packaging instead of glue,The Verge,https://www.theverge.com/tech/903280/papure-project-fraunhofer-institute-laser-paper-packaging-recycling,2026-03-30 20:02:52
The latest Pixel 11 leak shows slimmer bezels and an all-black camera bar,The Verge,https://www.theverge.com/tech/903381/google-pixel-11-leak-bezels-camera-bar,2026-03-30 20:02:52
Okta’s CEO is betting big on AI agent identity,The Verge,https://www.theverge.com/podcast/902264/oktas-ceo-is-betting-big-on-ai-agent-identity,2026-03-30 20:02:52
Xbox’s next big games showcase happens on June 7th,The Verge,https://www.theverge.com/games/903282/xbox-games-showcase-2026-sgf-date,2026-03-30 20:02:52
"For $200 more, you can get a MacBook Air",The Verge,https://www.theverge.com/tech/901698/macbook-air-history,2026-03-30 20:02:52
The mad dash to build the future of multimedia,The Verge,https://www.theverge.com/tech/902721/quicktime-history-apple,2026-03-30 20:02:52
Apple @ 50,The Verge,https://www.theverge.com/tech/899623/apple-50-anniversary,2026-03-30 20:02:52
The origin story of Apple’s long-running relationship with FoxConn,The Verge,https://www.theverge.com/tech/898077/apple-in-china-patrick-mcgee-foxconn,2026-03-30 20:02:52
Vivo launches X300 Ultra flagship ‘designed for professional photography’,The Verge,https://www.theverge.com/tech/903250/vivo-x300-ultra-flagship-china-launch-specs,2026-03-30 20:02:52
Apple II Forever!,The Verge,https://www.theverge.com/tech/900677/apple-ii-personal-computer,2026-03-30 20:02:52
KitchenAid redesigned its iconic mixer so you can set an exact speed,The Verge,https://www.theverge.com/tech/901470/kitchenaid-artisan-plus-tilting-stand-mixer-speed-control-light,2026-03-30 20:02:52
"These retractable studded tires might save our roads, ears, and lungs",The Verge,https://www.theverge.com/transportation/902561/nokian-hakkapeliitta-tire-retract-stud-winter,2026-03-30 20:02:52
Steve Jobs and the greatest run of products in tech history,The Verge,https://www.theverge.com/tech/900655/steve-jobs-imac-ibook-ipod,2026-03-30 20:02:52
All the latest in AI ‘music’,The Verge,https://www.theverge.com/ai-artificial-intelligence/903196/ai-music-suno-udio-art-lawsuit,2026-03-30 20:02:52
Bluesky’s new app is an AI for customizing your feed,The Verge,https://www.theverge.com/ai-artificial-intelligence/903190/bluesky-attie-ai-custom-feeds,2026-03-30 20:02:52
Meta is testing an Instagram Plus subscription service with exclusive features,Engadget,https://www.engadget.com/social-media/meta-is-testing-an-instagram-plus-subscription-service-with-exclusive-features-181215180.html?src=rss,2026-03-30 20:02:52
OkCupid settles FTC case on alleged misuse of its users' personal data,Engadget,https://www.engadget.com/cybersecurity/okcupid-settles-ftc-case-on-alleged-misuse-of-its-users-personal-data-175159228.html?src=rss,2026-03-30 20:02:52
"50 years of Apple pushing tech forward, for better or worse",Engadget,https://www.engadget.com/big-tech/50-years-of-apple-pushing-tech-forward-for-better-or-worse-170025862.html?src=rss,2026-03-30 20:02:52
Uber to acquire Berlin-based chauffeur hailing app to ramp up its luxury travel efforts,Engadget,https://www.engadget.com/transportation/uber-to-acquire-berlin-based-chauffeur-hailing-app-to-ramp-up-its-luxury-travel-efforts-163855603.html?src=rss,2026-03-30 20:02:52
Microsoft's research assistant can now use multiple AI models simultaneously,Engadget,https://www.engadget.com/ai/microsofts-research-assistant-can-now-use-multiple-ai-models-simultaneously-154558628.html?src=rss,2026-03-30 20:02:52
This year's Xbox Games Showcase is set for June 7,Engadget,https://www.engadget.com/gaming/xbox/this-years-xbox-games-showcase-is-set-for-june-7-134942027.html?src=rss,2026-03-30 20:02:52
Project Hail Mary is already Amazon MGM's highest-grossing film ever,Engadget,https://www.engadget.com/entertainment/tv-movies/project-hail-mary-is-already-amazon-mgms-highest-grossing-film-ever-112955144.html?src=rss,2026-03-30 20:02:52
"I've tried more Nintendo Switch 2 accessories than I can count, but these six are simply the best",TechRadar,https://www.techradar.com/gaming/gaming-accessories/ive-tried-more-nintendo-switch-2-accessories-than-i-can-count-but-these-six-are-simply-the-best,2026-03-30 20:02:53
These are the best USB flash drive deals we found for World Backup Day,TechRadar,https://www.techradar.com/pro/these-are-the-best-usb-flash-drive-deals-we-found-for-world-backup-day,2026-03-30 20:02:53
Your smartphone could get its signal from the sky — thanks to an amazing drone armada that complements traditional cell towers,TechRadar,https://www.techradar.com/pro/your-smartphone-could-get-its-signal-from-the-sky-thanks-to-an-amazing-drone-armada-that-complements-traditional-cell-towers,2026-03-30 20:02:53
Amazon’s Spring Sale is basically Black Friday for tech — I found the 55 best deals worth shopping,TechRadar,https://www.techradar.com/seasonal-sales/amazons-spring-sale-is-basically-black-friday-for-tech-i-found-the-55-best-deals-worth-shopping,2026-03-30 20:02:53
IKEA's candy-colored Easter tableware collection is ultra-sweet for spring,TechRadar,https://www.techradar.com/home/ikeas-candy-colored-easter-tableware-collection-is-ultra-sweet-for-spring,2026-03-30 20:02:53
Marshals episode 5 is the closest we've seen seen to Yellowstone yet — but it's for the most heatbreaking and disturbing reason,TechRadar,https://www.techradar.com/streaming/paramount-plus/marshals-episode-5-yellowstone,2026-03-30 20:02:53
"Around 500,000 WordPress websites could be at risk from crucial plugin security flaw — here's what we know",TechRadar,https://www.techradar.com/pro/security/around-500-000-wordpress-websites-could-be-at-risk-from-crucial-plugin-security-flaw-heres-what-we-know,2026-03-30 20:02:53
The extremely handy and super-cheap air duster I use to clean out my gaming PC is back on sale again,TechRadar,https://www.techradar.com/gaming/pc-gaming/the-extremely-handy-and-super-cheap-air-duster-i-use-to-clean-out-my-gaming-pc-is-back-on-sale-again,2026-03-30 20:02:53
SSD fakes are getting more sophisticated — here's how to avoid falling victim to the scammers,TechRadar,https://www.techradar.com/computing/storage-backup/ssd-fakes-are-getting-more-sophisticated-heres-how-to-avoid-falling-victim-to-the-scammers,2026-03-30 20:02:53
Chris Hemsworth's new movie Crime 101 finally has a Prime Video release date — and 'you'll be able to watch it sooner than you think',TechRadar,https://www.techradar.com/streaming/amazon-prime-video/chris-hemsworths-new-movie-crime-101-finally-has-a-prime-video-release-date-and-youll-be-able-to-watch-it-sooner-than-you-think,2026-03-30 20:02:53
"Quordle hints and answers for Tuesday, March 31 (game #1527)",TechRadar,https://www.techradar.com/computing/websites-apps/quordle-today-answers-clues-31-march-2026,2026-03-30 20:02:53
"NYT Strands hints and answers for Tuesday, March 31 (game #758)",TechRadar,https://www.techradar.com/computing/websites-apps/nyt-strands-today-answers-hints-31-march-2026,2026-03-30 20:02:53
"NYT Connections hints and answers for Tuesday, March 31 (game #1024)",TechRadar,https://www.techradar.com/gaming/nyt-connections-today-answers-hints-31-march-2026,2026-03-30 20:02:53
There's no point in upgrading to the Apple Watch Series 11 — save $300 on the Series 10 in Amazon's Spring Sale and get a near-identical wearable for a lot less,TechRadar,https://www.techradar.com/seasonal-sales/theres-no-point-in-upgrading-to-the-apple-watch-series-11-save-usd300-on-the-series-10-in-amazons-spring-sale-and-get-a-near-identical-wearable-for-a-lot-less,2026-03-30 20:02:53
We reviewed all the best budget TVs — this 'fantastic TV for the price' is the one you should buy today for big-screen thrills,TechRadar,https://www.techradar.com/televisions/we-reviewed-all-the-best-budget-tvs-this-fantastic-tv-for-the-price-is-the-one-you-should-buy-today-for-big-screen-thrills,2026-03-30 20:02:53
I found the best portable SSD deals for World Backup Day — store lots and save big,TechRadar,https://www.techradar.com/pro/i-found-the-best-portable-ssd-deals-for-world-backup-day-store-lots-and-save-big,2026-03-30 20:02:53
Another worrying macOS malware scheme has been discovered — here's how to stay safe,TechRadar,https://www.techradar.com/pro/security/another-worrying-macos-malware-scheme-has-been-discovered-heres-how-to-stay-safe,2026-03-30 20:02:53
What is the release date for Invincible season 4 episode 5 on Prime Video?,TechRadar,https://www.techradar.com/streaming/amazon-prime-video/what-is-the-release-date-for-invincible-season-4-episode-5-on-prime-video,2026-03-30 20:02:53
Every phone ping takes 7 seconds of your attention — here’s how to get it back,TechRadar,https://www.techradar.com/phones/every-phone-ping-takes-7-seconds-of-your-attention-heres-how-to-get-it-back,2026-03-30 20:02:53
The PS5 Pro shot up Amazon's best seller list after recent price hike announcement,TechRadar,https://www.techradar.com/gaming/playstation/the-ps5-pro-shot-up-amazons-best-seller-list-after-recent-price-hike-announcement,2026-03-30 20:02:53
"Amazon just launched the biggest Yeti sale I've seen — up to 30% off dozens of coolers, water bottles and travel mugs",TechRadar,https://www.techradar.com/health-fitness/amazon-just-launched-the-biggest-yeti-sale-ive-seen-up-to-30-percent-off-dozens-of-coolers-water-bottles-and-travel-mugs,2026-03-30 20:02:53
Keep your data safe and save big with these top NAS deals for World Backup Day 2026,TechRadar,https://www.techradar.com/pro/keep-your-data-safe-and-save-big-with-these-top-nas-deals-for-world-backup-day-2026,2026-03-30 20:02:53
Netflix is adding 3 unmissable thriller movies in April 2026 — and fans of creature features will be pleased,TechRadar,https://www.techradar.com/streaming/netflix/netflix-is-adding-3-unmissable-thriller-movies-in-april-2026-and-fans-of-creature-features-will-be-pleased,2026-03-30 20:02:53
'This Internxt deal is as close as you'll get to free lifetime cloud storage': Our top cloud storage for security just cut the price by 90% when you use this link,TechRadar,https://www.techradar.com/pro/this-internxt-deal-is-as-close-as-youll-get-to-free-lifetime-cloud-storage-our-top-cloud-storage-for-security-just-cut-the-price-by-90-percent-when-you-use-this-link,2026-03-30 20:02:53
"I tested H2O Audio's affordable, no-frills, bone-conduction running headphones — and there's something to be said for simplicity",TechRadar,https://www.techradar.com/health-fitness/fitness-headphones/h2o-audio-tri-run-review,2026-03-30 20:02:53
"Amazon is slashing its smart home gadgets for Spring Prime Day — 16 deals on Fire TV, Blink, Echo, Kindles, and more",TechRadar,https://www.techradar.com/seasonal-sales/amazon-is-slashing-its-smart-home-gadgets-for-spring-prime-day-16-deals-on-fire-tv-blink-echo-kindles-and-more,2026-03-30 20:02:53
"I'm a gaming keyboard expert, and this analog model is one of my all-time favorites",TechRadar,https://www.techradar.com/computing/keyboards/im-a-gaming-keyboard-expert-and-this-analog-model-is-one-of-my-all-time-favorites,2026-03-30 20:02:53
Major compromise of the telnyx PyPI library could put millions of users at risk,TechRadar,https://www.techradar.com/pro/security/major-compromise-of-the-telnyx-pypi-library-could-put-millions-of-users-at-risk,2026-03-30 20:02:53
"Mullvad Browser's testers now get access to updates every four weeks, also on Linux ARM devices",TechRadar,https://www.techradar.com/vpn/vpn-privacy-security/mullvad-browsers-testers-now-get-access-to-updates-every-four-weeks-also-on-linux-arm-devices,2026-03-30 20:02:53
EV charging just got a massive boost for millions in the UK — as rule changes make it easier to avoid 'driveway discrimination’ at home,TechRadar,https://www.techradar.com/vehicle-tech/hybrid-electric-vehicles/ev-charging-just-got-a-massive-boost-for-millions-in-the-uk-as-rule-changes-make-it-easier-to-avoid-driveway-discrimination-at-home,2026-03-30 20:02:53
Apple removes custom VPN clients from Russian App Store amid Telegram crackdown,TechRadar,https://www.techradar.com/vpn/vpn-privacy-security/apple-removes-custom-vpn-clients-from-russian-app-store-amid-telegram-crackdown,2026-03-30 20:02:53
Crimson Desert's player count is soaring after new patches that make it even more of a game of the year contender,TechRadar,https://www.techradar.com/gaming/crimson-deserts-player-count-is-soaring-after-new-patches-that-make-it-even-more-of-a-game-of-the-year-contender,2026-03-30 20:02:53
GitHub developers targeted by fake VS Code alerts spreading malware,TechRadar,https://www.techradar.com/pro/security/github-developers-targeted-by-fake-vs-code-alerts-spreading-malware,2026-03-30 20:02:53
Beyond the spike: building resilient and trusted infrastructure in an era of sustained attacks,TechRadar,https://www.techradar.com/pro/beyond-the-spike-building-resilient-and-trusted-infrastructure-in-an-era-of-sustained-attacks,2026-03-30 20:02:53
Gamer reportedly buys Nvidia RTX 5060 Ti GPU for $80 from Walmart — so you might want to check the clearance aisle,TechRadar,https://www.techradar.com/computing/gpu/gamer-reportedly-buys-nvidia-rtx-5060-ti-gpu-for-usd80-from-walmart-so-you-might-want-to-check-the-clearance-aisle,2026-03-30 20:02:53
"Before you roll out more AI, answer this: Who's accountable?",TechRadar,https://www.techradar.com/pro/before-you-roll-out-more-ai-answer-this-whos-accountable,2026-03-30 20:02:53
'A superb resin 3D printer that brings professional-grade features to a consumer-friendly model': Elegoo Saturn 4 Ultra gets a huge price cut for Spring,TechRadar,https://www.techradar.com/pro/a-superb-resin-3d-printer-that-brings-professional-grade-features-to-a-consumer-friendly-model-elegoo-saturn-4-ultra-gets-a-huge-price-cut-for-spring,2026-03-30 20:02:53
How businesses can defend themselves against the rise of ‘phishing as a service’,TechRadar,https://www.techradar.com/pro/how-businesses-can-defend-themselves-against-the-rise-of-phishing-as-a-service,2026-03-30 20:02:53
VPN interest surges in Indonesia as under-16 social media ban takes effect,TechRadar,https://www.techradar.com/vpn/vpn-privacy-security/vpn-interest-surges-in-indonesia-as-under-16-social-media-ban-takes-effect,2026-03-30 20:02:53
Fast isn’t finished: Why production-ready still takes discipline,TechRadar,https://www.techradar.com/pro/fast-isnt-finished-why-production-ready-still-takes-discipline,2026-03-30 20:02:53
Forget Amazon — here are 3 gaming laptop deals from Walmart's rival sale that have the rest beat,TechRadar,https://www.techradar.com/computing/gaming-laptops/forget-amazon-here-are-3-gaming-laptop-deals-from-walmarts-rival-sale-that-have-the-rest-beat,2026-03-30 20:02:53
