headline,source,link,datetime
"Amateur may have cracked Linear A, a 120-year-old puzzle",Hacker News,https://aiclambake.com/clamtakes/linear-a/,2026-06-19 17:02:55
Doom composer Bobby Prince has died,Engadget,https://www.engadget.com/2198098/doom-composer-bobby-prince-has-died/,2026-06-19 17:02:56
Aliens: Fireteam Elite 2 director says the team 'worked very close' with 20th Century Studios 'to make sure that we were hitting the lore correctly',TechRadar,https://www.techradar.com/gaming/aliens-fireteam-elite-2-director-says-the-team-worked-very-close-with-20th-century-studios-to-make-sure-that-we-were-hitting-the-lore-correctly,2026-06-19 17:02:56
China's huge OLED screen factory is finally rolling at full speed — and I'm excited about what this means for cheaper OLED monitors and laptops,TechRadar,https://www.techradar.com/computing/monitors/chinas-huge-oled-screen-factory-is-finally-rolling-at-full-speed-and-im-excited-about-what-this-means-for-cheaper-oled-monitors-and-laptops,2026-06-19 17:02:56
"This life-size Koenigsegg just became the fastest drive-able Lego car ever — $5m hypercar recreated from 327,000 Technic elements and sent down Goodwood Hill at 69mph",TechRadar,https://www.techradar.com/vehicle-tech/hybrid-electric-vehicles/this-life-size-koenigsegg-just-became-the-fastest-drive-able-lego-car-ever-usd5m-hypercar-recreated-from-327-000-technic-elements-and-sent-down-goodwood-hill-at-69mph,2026-06-19 17:02:56
Australia's social media ban shows UK child safety measures are bound to fail — and it's not because of VPNs,TechRadar,https://www.techradar.com/vpn/vpn-privacy-security/australias-social-media-ban-shows-uk-child-safety-measures-are-bound-to-fail-and-its-not-because-of-vpns,2026-06-19 17:02:56
'It would be a lie to say there's no pressure taking on this great IP from this massive corporation' — Pico Park president says working with a huge company like Sega for its Sonic crossover was 'a little risky',TechRadar,https://www.techradar.com/gaming/it-would-be-a-lie-to-say-theres-no-pressure-taking-on-this-great-ip-from-this-massive-corporation-pico-park-president-says-working-with-a-huge-company-like-sega-for-its-sonic-crossover-was-a-little-risky,2026-06-19 17:02:56
"We spoke to three Xbox Game Studio teams about exclusivity, and got two very different answers",TechRadar,https://www.techradar.com/gaming/we-spoke-to-three-xbox-game-studio-teams-about-exclusivity-and-got-two-very-different-answers,2026-06-19 17:02:56
"How to watch USA vs Australia: Free Streams, TV Channels & Kick-Off time as Christian Pulisic & Co. continue FIFA World Cup 2026 journey",TechRadar,https://www.techradar.com/how-to-watch/football/usa-vs-australia-world-cup-2026-free,2026-06-19 17:02:56
