headline,source,link,datetime
"Need a new laptop? You might want to buy now, as Asus just warned that prices could soon jump by up to 30%",TechRadar,https://www.techradar.com/computing/laptops/need-a-new-laptop-you-might-want-to-buy-now-as-asus-just-warned-that-prices-could-soon-jump-by-up-to-30-percent,2026-03-25 14:02:37
‘Small enough to be tempting’: I need this award-winning turntable company’s new mini automatic vinyl-cleaning machine more than I’ll admit,TechRadar,https://www.techradar.com/audio/turntables/small-enough-to-be-tempting-i-need-this-award-winning-turntable-companys-new-mini-automatic-vinyl-cleaning-machine-more-than-ill-admit,2026-03-25 14:02:37
"Is Amazon's Big Spring Sale better than Prime Day? I've hand-picked the 55 best deals on TVs, appliances, cheap tech gadgets, and more",TechRadar,https://www.techradar.com/live/news/amazon-big-spring-sale-our-experts-hand-picked-the-55-best-deals-on-tvs-appliances-cheap-tech-gadgets-and-more,2026-03-25 14:02:37
"AI agents are flashy, but machine learning still pays the bills",TechRadar,https://www.techradar.com/pro/ai-agents-are-flashy-but-machine-learning-still-pays-the-bills,2026-03-25 14:02:37
I asked ChatGPT to grade my interview answers — it was more useful than real interviews,TechRadar,https://www.techradar.com/ai-platforms-assistants/chatgpt/i-asked-chatgpt-to-grade-my-interview-answers-it-was-more-useful-than-real-interviews,2026-03-25 14:02:37
"Don't wait for EOFY – there's still time to nab exceptional savings on the AirPods Pro 3, AirTags and more Apple gear if you're quick",TechRadar,https://www.techradar.com/audio/headphones/dont-wait-for-eofy-theres-still-time-to-nab-exceptional-savings-on-the-airpods-pro-3-airtags-and-more-apple-gear-if-youre-quick,2026-03-25 14:02:37
"No dropouts, no stress: United’s Starlink Wi-Fi just works — and the rollout to every plane can’t come soon enough",TechRadar,https://www.techradar.com/computing/internet/no-dropouts-no-stress-uniteds-starlink-wi-fi-just-works-and-the-rollout-to-every-plane-cant-come-soon-enough,2026-03-25 14:02:37
I watched all 8 episodes of Daredevil: Born Again season 2 on Disney+ — and the Marvel TV show would be even better than it is if it could fully exorcise its demons,TechRadar,https://www.techradar.com/streaming/disney-plus/daredevil-born-again-season-2-review,2026-03-25 14:02:37
"Need a case for your new 15-inch MacBook Air M5? Here are the best options to keep your kit safe, protected, and organized",TechRadar,https://www.techradar.com/computing/macbooks/need-a-case-for-your-new-15-inch-macbook-air-m5-here-are-the-best-options-to-keep-your-kit-safe-protected-and-organized,2026-03-25 14:02:37
LG's world-first LCD laptop display has a battery-saving superpower — and an OLED version is coming next,TechRadar,https://www.techradar.com/computing/laptops/lgs-world-first-lcd-laptop-display-has-a-battery-saving-superpower-and-an-oled-version-is-coming-next,2026-03-25 14:02:37
"OpenAI unexpectedly kills Sora, and I wonder if this is the start of a mini AI bubble collapse",TechRadar,https://www.techradar.com/ai-platforms-assistants/openai-unexpectedly-kills-sora-and-i-wonder-if-this-is-the-start-of-a-mini-ai-bubble-collapse,2026-03-25 14:02:37
'We are continuing to monitor the situation closely': Crunchyroll investigating breach which reportedly stole data on 6.8 million users,TechRadar,https://www.techradar.com/pro/security/we-are-continuing-to-monitor-the-situation-closely-crunchyroll-investigating-breach-which-reportedly-stole-data-on-6-8-million-users,2026-03-25 14:02:37
'Smartphones were never designed to be vaults': How hackers can steal PINs and private data from over a billion Android devices — even while they’re switched off,TechRadar,https://www.techradar.com/pro/security/smartphones-were-never-designed-to-be-vaults-how-hackers-can-steal-pins-and-private-data-from-over-a-billion-android-devices-even-while-theyre-switched-off,2026-03-25 14:02:37
‘I think we’ve achieved AGI’ — er Jensen… I don't think we have,TechRadar,https://www.techradar.com/ai-platforms-assistants/i-think-weve-achieved-agi-er-jensen-i-dont-think-we-have,2026-03-25 14:02:37
'We are going to push the limits of physics in compute': Elon Musk wants Texas 'Terafab' plant to produce one terawatt of computing power each year and build a global robot population using Tesla and SpaceX tech,TechRadar,https://www.techradar.com/pro/we-are-going-to-push-the-limits-of-physics-in-compute-elon-musk-wants-texas-terafab-plant-to-produce-one-terawatt-of-computing-power-each-year-and-build-a-global-robot-population-using-tesla-and-spacex-tech,2026-03-25 14:02:37
"Good luck, Americans, your Wi-Fi choices are about to get worse — we’ve tested hundreds of routers and every single one of our favorites is made outside of the US",TechRadar,https://www.techradar.com/computing/wi-fi-broadband/good-luck-americans-your-wi-fi-choices-are-about-to-get-worse-weve-tested-hundreds-of-routers-and-every-single-one-of-our-favorites-are-made-outside-of-the-us,2026-03-25 14:02:37
This tax-themed malvertising attack can blind security software before it arrives — and then unleashes ransomware,TechRadar,https://www.techradar.com/pro/security/this-tax-themed-malvertising-attack-can-blind-security-software-before-it-arrives-and-then-unleashes-ransomware,2026-03-25 14:02:37
"Samsung reveals its cheaper mini-LED TVs for 2026 — and it’s dropping QLED on some of them, I kid you not",TechRadar,https://www.techradar.com/televisions/samsung-reveals-its-cheaper-mini-led-tvs-for-2026-and-its-dropping-qled-on-some-of-them-i-kid-you-not,2026-03-25 14:02:37
Acer Swift Edge 14 AI laptop review: Another lightweight wonder from the Acer stable,TechRadar,https://www.techradar.com/pro/acer-swift-edge-14-ai-laptop-review-another-lightweight-wonder-from-the-acer-stable,2026-03-25 14:02:37
"Epic Games is laying off more than 1,000 employees just weeks after raising Fortnite V-Buck prices 'to help pay the bills'",TechRadar,https://www.techradar.com/gaming/gaming-industry/epic-games-is-laying-off-more-than-1-000-employees-just-weeks-after-raising-fortnite-v-buck-prices-to-help-pay-the-bills,2026-03-25 14:02:37
"Surfshark launches HeyPolo, a privacy-first location sharing app to kill ""always-on"" tracking",TechRadar,https://www.techradar.com/vpn/vpn-services/surfshark-launches-heypolo-a-privacy-first-location-sharing-app-to-kill-always-on-tracking,2026-03-25 14:02:37
"Capcom isn't completely abandoning generative AI, but has promised fans it won't use AI assets in games",TechRadar,https://www.techradar.com/gaming/capcom-isnt-completely-abandoning-generative-ai-but-has-promised-fans-it-wont-use-ai-assets-in-games,2026-03-25 14:02:37
'Traces of unauthorized access': Mazda confirms data breach exposing employee and partner data — here's what we know,TechRadar,https://www.techradar.com/pro/security/traces-of-unauthorized-access-mazda-confirms-data-breach-that-exposed-employee-and-partner-data,2026-03-25 14:02:37
"Fine, I'll buy another copy of Clair Obscur Expedition 33 to snag this special Mirror Edition",TechRadar,https://www.techradar.com/gaming/fine-ill-buy-another-copy-of-clair-obscur-expedition-33-to-snag-this-special-mirror-edition,2026-03-25 14:02:37
"Stop telling AI it's an expert programmer, you're making it worse at its job — new research shows the best results need specific prompts",TechRadar,https://www.techradar.com/pro/stop-telling-ai-its-an-expert-programmer-youre-making-it-worse-at-its-job-new-research-shows-the-best-results-need-specific-prompts,2026-03-25 14:02:37
"'Welcome back, Frank': Marvel confirms the official title for The Punisher TV Special on Disney+ — and it'll be released a week after the Daredevil: Born Again season 2 finale",TechRadar,https://www.techradar.com/streaming/disney-plus/welcome-back-frank-marvel-confirms-the-official-title-for-the-punisher-tv-special-on-disney-and-itll-be-released-a-week-after-the-daredevil-born-again-season-2-finale,2026-03-25 14:02:37
Best website builders,TechRadar,https://www.techradar.com/best/best-website-builders,2026-03-25 14:02:37
"I’m a big fan of FlexiSpot’s single monitor arm for freeing up desk space, and it’s just $30 in Amazon’s Spring Sale",TechRadar,https://www.techradar.com/pro/im-a-big-fan-of-flexispots-single-monitor-arm-for-freeing-up-desk-space-and-its-just-usd30-in-amazons-spring-sale,2026-03-25 14:02:37
Xbox indie program lead says Project Helix will be 'easier' for developers and that Microsoft is 'working hard so developers can make one Xbox build in the future' that will run on everything,TechRadar,https://www.techradar.com/gaming/xbox-indie-program-lead-says-project-helix-will-be-easier-for-developers-and-that-microsoft-is-working-hard-so-developers-can-make-one-xbox-build-in-the-future-that-will-run-on-everything,2026-03-25 14:02:37
I trapped a clone of my boss on a desert island in Tomodachi Life: Living the Dream — and it only got weirder from there,TechRadar,https://www.techradar.com/gaming/tomodachi-life-living-the-dream-preview,2026-03-25 14:02:37
Two streaming services are better than one — this is your last chance to score this Disney+ and Hulu bundle and pay $15 for three months,TechRadar,https://www.techradar.com/streaming/disney-plus/two-streaming-services-are-better-than-one-this-is-your-last-chance-to-score-this-disney-and-hulu-bundle-and-pay-usd15-for-three-months,2026-03-25 14:02:37
Louisiana researchers have made a nail polish that turns your fingernail into a phone stylus to solve ‘zombie finger’ problems,TechRadar,https://www.techradar.com/phones/louisiana-researchers-have-made-a-nail-polish-that-turns-your-fingernail-into-a-phone-stylus-to-solve-zombie-finger-problems,2026-03-25 14:02:37
Boost internet speeds from $87 with 6 super-fast TP-Link Wi-Fi 7 router deals in Amazon's early Spring Sale,TechRadar,https://www.techradar.com/pro/boost-internet-speeds-from-usd87-with-6-super-fast-tp-link-wi-fi-7-router-deals-in-amazons-early-spring-sale,2026-03-25 14:02:37
How to watch Power: The Downfall of Huw Edwards online from anywhere — it's *FREE*,TechRadar,https://www.techradar.com/how-to-watch/power-the-downfall-of-huw-edwards-free,2026-03-25 14:02:37
"Nvidia RTX 5090 buyer is literally cleaned out as box contains no GPU, just laundry detergent — a reminder to be careful out there",TechRadar,https://www.techradar.com/computing/gpu/nvidia-rtx-5090-buyer-is-literally-cleaned-out-as-box-contains-no-gpu-just-laundry-detergent-a-reminder-to-be-careful-out-there,2026-03-25 14:02:37
Exclusive: Get 4 months extra + up to $50 Amazon gift card with NordVPN,TechRadar,https://www.techradar.com/vpn/vpn-services/exclusive-get-4-months-extra-up-to-usd50-amazon-gift-card-with-nordvpn,2026-03-25 14:02:37
How AI is reshaping compliance: Why governance still matters,TechRadar,https://www.techradar.com/pro/how-ai-is-reshaping-compliance-why-governance-still-matters,2026-03-25 14:02:37
Oracle is revamping how businesses procure AI agents — leave the invoices to AI while you handle the negotiations,TechRadar,https://www.techradar.com/pro/oracle-is-revamping-how-businesses-procure-ai-agents-leave-the-invoices-to-ai-while-you-handle-the-negotiations,2026-03-25 14:02:37
How AI will collide with data readiness,TechRadar,https://www.techradar.com/pro/how-ai-will-collide-with-data-readiness,2026-03-25 14:02:37
Regional data sovereignty in the age of AI: Balancing innovation and regulation,TechRadar,https://www.techradar.com/pro/regional-data-sovereignty-in-the-age-of-ai-balancing-innovation-and-regulation,2026-03-25 14:02:37
"NYT Connections hints and answers for Wednesday, March 25 (game #1018)",TechRadar,https://www.techradar.com/gaming/nyt-connections-today-answers-hints-25-march-2026,2026-03-25 14:02:37
Spotify takes its first major step in tackling AI slop — now artists can review and approve what music appears on their profile,TechRadar,https://www.techradar.com/audio/spotify/spotify-takes-its-first-major-step-in-tackling-ai-slop-now-artists-can-review-and-approve-what-music-appears-on-their-profile,2026-03-25 14:02:37
Exclusive: This iconic Call of Duty zombies perk has been reborn as a collectible controller add-on,TechRadar,https://www.techradar.com/gaming/exclusive-this-iconic-call-of-duty-zombies-perk-has-been-reborn-as-a-collectible-controller-add-on,2026-03-25 14:02:37
"NYT Strands hints and answers for Wednesday, March 25 (game #752)",TechRadar,https://www.techradar.com/computing/websites-apps/nyt-strands-today-answers-hints-25-march-2026,2026-03-25 14:02:37
"Quordle hints and answers for Wednesday, March 25 (game #1521)",TechRadar,https://www.techradar.com/computing/websites-apps/quordle-today-answers-clues-25-march-2026,2026-03-25 14:02:37
"‘I am not a fan of AI’: Apple’s co-founder slams artificial intelligence, saying it lacks human emotional depth",TechRadar,https://www.techradar.com/ai-platforms-assistants/i-am-not-a-fan-of-ai-apples-co-founder-slams-artificial-intelligence-saying-it-lacks-human-emotional-depth,2026-03-25 14:02:37
"More than 10,000 have bought Amazon's Fire TV Stick 4K Plus this month — and it's so cheap right now, I'm buying it too",TechRadar,https://www.techradar.com/televisions/streaming-devices/more-than-10-000-have-bought-amazons-fire-tv-stick-4k-plus-this-month-and-its-so-cheap-right-now-im-buying-it-too,2026-03-25 14:02:37
Early Amazon Spring Sale standing desk deals: 11 top-rated FlexiSpot desks to get before tomorrow's chaos,TechRadar,https://www.techradar.com/pro/early-amazon-spring-sale-standing-desk-deals-11-top-rated-flexispot-desks-to-get-before-tomorrows-chaos,2026-03-25 14:02:37
