headline,source,link,datetime
"Mercedes-AMG's 1,153 hp electric GT 4-Door takes on Porsche's Taycan",Engadget,https://www.engadget.com/2177477/mercedes-amg-1153-hp-electric-gt-4-door-takes-on-porsche-taycan/,2026-05-20 10:02:40
"This controller is one of the best I’ve ever reviewed, and works across PC, Switch, and phones — and it has a unique feature I haven’t seen bettered",TechRadar,https://www.techradar.com/seasonal-sales/this-controller-is-one-of-the-best-ive-ever-reviewed-and-works-across-pc-switch-and-phones-and-it-has-a-unique-feature-i-havent-seen-bettered,2026-05-20 10:02:40
The verification economy is redefining productivity,TechRadar,https://www.techradar.com/pro/the-verification-economy-is-redefining-productivity,2026-05-20 10:02:40
Microsoft is fixing one of the most baffling things about Windows 11 — 'spam' in search results,TechRadar,https://www.techradar.com/computing/windows/microsoft-is-fixing-one-of-the-most-baffling-things-about-windows-11-spam-in-search-results,2026-05-20 10:02:40
Elon Musk's legal war with OpenAI ends in utter defeat,TechRadar,https://www.techradar.com/ai-platforms-assistants/elon-musks-legal-war-with-openai-ends-in-utter-defeat,2026-05-20 10:02:40
Pools is a Backrooms-style walking simulator with no jump scares and no threats — but I was still terrified playing it,TechRadar,https://www.techradar.com/gaming/pools-is-a-backrooms-style-walking-simulator-with-no-jump-scares-and-no-threats-but-i-was-still-terrified-playing-it,2026-05-20 10:02:40
"Yes, Google used an iPhone (not a Pixel) to demo Gemini Spark at Google I/O — but that actually makes perfect sense",TechRadar,https://www.techradar.com/phones/yes-google-used-an-iphone-not-a-pixel-to-demo-gemini-spark-at-google-i-o-but-that-actually-makes-perfect-sense,2026-05-20 10:02:40
