headline,source,link,datetime
"How to watch Barcelona-Catalunya Grand Prix 2026 F1: Live Stream, Preview, Schedule",TechRadar,https://www.techradar.com/how-to-watch/formula-one/catalunya-grand-prix-2026-f1-free,2026-06-12 10:02:44
"‘Siri’s not up for that’ — Apple explains why the new Siri AI won't become your romantic partner, in a subtle dig at ChatGPT",TechRadar,https://www.techradar.com/phones/iphone/siris-not-up-for-that-apple-explains-why-the-new-siri-ai-wont-become-your-romantic-partner-in-a-subtle-dig-at-chatgpt,2026-06-12 10:02:44
I love how much you can tweak the new Razer Huntsman — it's just a shame that you can't make full use of its precise analog switches,TechRadar,https://www.techradar.com/computing/keyboards/razer-huntsman-v3-tenkeyless-8khz-review,2026-06-12 10:02:44
How AI is changing the fight against invoice fraud,TechRadar,https://www.techradar.com/pro/how-ai-is-changing-the-fight-against-invoice-fraud,2026-06-12 10:02:44
Not prepared for cloud outages? You should be,TechRadar,https://www.techradar.com/pro/not-prepared-for-cloud-outages-you-should-be,2026-06-12 10:02:44
