headline,source,link,datetime
The Token Compression Illusion: Why I'm Skeptical of RTK,Hacker News,https://mroczek.dev/articles/the-token-compression-illusion-why-im-skeptical-of-rtk/,2026-06-18 18:03:25
Migrating from GNU Stow to Chezmoi,Hacker News,https://rednafi.com/misc/chezmoi/,2026-06-18 18:03:25
A year of Walmart Plus is half off ahead of Prime Day,The Verge,https://www.theverge.com/gadgets/952283/walmart-plus-half-off-deal-sale,2026-06-18 18:03:25
Firefox’s new home page widgets are helping me focus,The Verge,https://www.theverge.com/tech/952354/firefox-home-page-widgets,2026-06-18 18:03:25
Apple TV will broadcast the Formula 1 Austrian Grand Prix for free,Engadget,https://www.engadget.com/2197498/apple-tv-will-broadcast-the-formula-1-austrian-grand-prix-for-free/,2026-06-18 18:03:25
Can’t buy the DJI Pocket 4P? This 'remarkably similar' dual-lens camera will rescue US creators soon,TechRadar,https://www.techradar.com/cameras/video-cameras/cant-buy-the-dji-pocket-4p-this-remarkably-similar-dual-lens-camera-will-rescue-us-creators-soon,2026-06-18 18:03:25
ExpressVPN gives its desktop apps a visual makeover and a bigger push into AI,TechRadar,https://www.techradar.com/vpn/vpn-services/expressvpn-gives-its-desktop-apps-a-visual-makeover-and-a-bigger-push-into-ai,2026-06-18 18:03:25
'These actors are no longer relying solely on traditional cybercrime': Experts uncover another massive North Korean fake IT worker scam network,TechRadar,https://www.techradar.com/pro/security/these-actors-are-no-longer-relying-solely-on-traditional-cybercrime-experts-uncover-another-massive-north-korean-fake-it-worker-scam-network,2026-06-18 18:03:25
