headline,source,link,datetime
"The Social Edge of Intellgience: Individual Gain, Collective Loss",Hacker News,https://www.theideasletter.org/essay/the-social-edge-of-intelligence/,2026-04-28 11:02:46
An Update on GitHub Availability,Hacker News,https://github.blog/news-insights/company-news/an-update-on-github-availability/,2026-04-28 11:02:46
Magic: The Gathering Arena developers intend to form a union with the CWA,Engadget,https://www.engadget.com/gaming/magic-the-gathering-arena-developers-intend-to-form-a-union-with-the-cwa-104438341.html?src=rss,2026-04-28 11:02:47
The blueprint architecture for securing the AI data center,TechRadar,https://www.techradar.com/pro/the-blueprint-architecture-for-securing-the-ai-data-center,2026-04-28 11:02:47
Samsung's Galaxy phones could be getting a big camera redesign to facilitate MagSafe-style charging — here are 4 ways they could look different,TechRadar,https://www.techradar.com/phones/samsung-galaxy-phones/samsungs-galaxy-phones-could-be-getting-a-big-camera-redesign-to-facilitate-magsafe-style-charging-here-are-4-ways-they-could-look-different,2026-04-28 11:02:47
I compared ChatGPT Images 2.0 and Google’s Nano Banana 2 using real-world prompts — from portraits to product shots — and the AI image generator that came out on top genuinely surprised me,TechRadar,https://www.techradar.com/ai-platforms-assistants/i-compared-chatgpt-images-2-0-and-googles-nano-banana-2-using-real-world-prompts-from-portraits-to-product-shots-and-the-ai-image-generator-that-came-out-on-top-genuinely-surprised-me,2026-04-28 11:02:47
"The 4 best vacuum cleaners for seasonal allergies, recommended by a home tech expert — beat hayfever with powerful suction, HEPA filters, and sealed dust bags",TechRadar,https://www.techradar.com/home/vacuums/the-4-best-vacuum-cleaners-for-seasonal-allergies-recommended-by-a-home-tech-expert-beat-hayfever-with-powerful-suction-hepa-filters-and-sealed-dust-bags,2026-04-28 11:02:47
Quantum can wait: Why CISOs should focus on today’s preventable cyber risks,TechRadar,https://www.techradar.com/pro/quantum-can-wait-why-cisos-should-focus-on-todays-preventable-cyber-risks,2026-04-28 11:02:47
How to watch A Taste for Murder online for FREE – stream sun-soaked crime drama from anywhere,TechRadar,https://www.techradar.com/how-to-watch/tv-shows/a-taste-for-murder-free,2026-04-28 11:02:47
New iOS 26.4 emojis ranked by popularity — from Distorted Face to Hairy Creature,TechRadar,https://www.techradar.com/phones/ios/new-ios-26-4-emojis-ranked-by-popularity-from-distorted-face-to-hairy-creature,2026-04-28 11:02:47
