headline,source,link,datetime
YouTube now lets you offload your playlist curation to AI,Engadget,https://www.engadget.com/2182731/youtube-ai-generated-playlists/,2026-05-28 11:02:42
I asked ChatGPT to make my daily walks less boring and more mindful — and it changed how I see my neighborhood,TechRadar,https://www.techradar.com/ai-platforms-assistants/chatgpt/i-asked-chatgpt-to-make-my-daily-walks-less-boring-and-more-mindful-and-it-changed-how-i-see-my-neighborhood,2026-05-28 11:02:43
Immersive tech’s next phase of visual experiences,TechRadar,https://www.techradar.com/pro/immersive-techs-next-phase-of-visual-experiences,2026-05-28 11:02:43
The new reality of critical infrastructure security in the age of hybrid threats,TechRadar,https://www.techradar.com/pro/the-new-reality-of-critical-infrastructure-security-in-the-age-of-hybrid-threats,2026-05-28 11:02:43
What is the release date of Star City episodes 1 and 2 on Apple TV?,TechRadar,https://www.techradar.com/streaming/apple-tv-plus/star-city-episodes-1-2-release-date-time,2026-05-28 11:02:43
What the UK’s robot anxiety reveals about how automation will scale,TechRadar,https://www.techradar.com/pro/what-the-uks-robot-anxiety-reveals-about-how-automation-will-scale,2026-05-28 11:02:43
"UK businesses spend £11.7 billion on 'AI slop' corrections every year, with 1 out of every 4 hours wasted",TechRadar,https://www.techradar.com/pro/uk-businesses-spend-gbp11-7-billion-on-ai-slop-corrections-every-year-with-1-out-of-every-4-hours-wasted,2026-05-28 11:02:43
