headline,source,link,datetime
Cartoon Network Flash Games,Hacker News,https://www.webdesignmuseum.org/flash-game-exhibitions/cartoon-network-flash-games,2026-05-08 17:02:48
The Steam Controller’s reservation queue is open,The Verge,https://www.theverge.com/gadgets/924672/steam-controller-reservation-queue-buy,2026-05-08 17:02:48
PlayStation sees AI as a ‘powerful tool’ to help make games,The Verge,https://www.theverge.com/games/926914/sony-playstation-ai-powerful-tool-games,2026-05-08 17:02:48
Teenage Engineering’s KO Sidekick is a mixer with fun performance effects,The Verge,https://www.theverge.com/tech/926898/teenage-engineerings-ko-sidekick-is-a-mixer-with-fun-performance-effects,2026-05-08 17:02:48
Legendary Nintendo designer Takashi Tezuka is seemingly retiring from the company,Engadget,https://www.engadget.com/2167956/legendary-nintendo-designer-takashi-tezuka-is-seemingly-retiring-from-the-company/,2026-05-08 17:02:48
The studio that (technically) made Disco Elysium just dropped a trailer for its new game,Engadget,https://www.engadget.com/2167928/the-studio-that-technically-made-disco-elysium-just-dropped-a-trailer-for-its-new-game/,2026-05-08 17:02:48
Huawei has unveiled two new kids’ wearables to add to its lineup of smartwatches — the Watch Kids X1 Series — and they could prove to be serious competition for the Garmin Bounce 2 and Fitbit Ace LTE,TechRadar,https://www.techradar.com/health-fitness/smartwatches/huawei-has-unveiled-two-new-kids-wearables-to-add-to-its-lineup-of-smartwatches-the-watch-kids-x1-series-and-they-could-prove-to-be-serious-competition-for-the-garmin-bounce-2-and-fitbit-ace-lte,2026-05-08 17:02:49
"Bluehost's new service combines ChatGPT, Gemini, Claude, and Grok subscriptions for just $20 a month",TechRadar,https://www.techradar.com/pro/bluehosts-new-service-combines-chatgpt-gemini-claude-and-grok-subscriptions-for-just-usd20-a-month,2026-05-08 17:02:49
"Need a last-minute Mother's Day gift that she'll actually like? Amazon's Kindle Paperwhite arrives before Sunday, and it's on sale",TechRadar,https://www.techradar.com/seasonal-sales/need-a-last-minute-mothers-day-gift-that-shell-actually-like-amazons-kindle-paperwhite-arrives-before-sunday-and-its-on-sale,2026-05-08 17:02:49
"Vocci Ring may be the first AI wearable I do not hate — it's a ring that records, transcribes, organizes, and mostly stays out of the way",TechRadar,https://www.techradar.com/ai-platforms-assistants/vocci-ring-may-be-the-first-ai-wearable-i-do-not-hate-its-a-ring-that-records-transcribes-organizes-and-mostly-stays-out-of-the-way,2026-05-08 17:02:49
Apple TV's tense new thriller is a must-watch for Paradise fans as James Marsden steps into the role of a CIA agent,TechRadar,https://www.techradar.com/streaming/apple-tv-plus/apple-tvs-tense-new-thriller-is-a-must-watch-for-paradise-fans-as-james-marsden-steps-into-the-role-of-a-cia-agent,2026-05-08 17:02:49
Mozilla says Anthropic's Mythos Preview and other AI models helped it identify and ship 423 Firefox security bug fixes in just one month,TechRadar,https://www.techradar.com/pro/security/mozilla-says-anthropics-mythos-preview-and-other-ai-models-helped-it-identify-and-ship-423-firefox-security-bug-fixes-in-just-one-month,2026-05-08 17:02:49
I tested the DJI Osmo Mobile 8P — and DJI has fixed the one thing holding its smartphone gimbal back,TechRadar,https://www.techradar.com/phones/phone-accessories/dji-osmo-mobile-8p-review,2026-05-08 17:02:49
"'Threat actors are clearly adapting to the widespread interest in popular AI tools': AI fans beware, hackers create a fake Claude site to spread backdoor malware",TechRadar,https://www.techradar.com/pro/security/threat-actors-are-clearly-adapting-to-the-widespread-interest-in-popular-ai-tools-ai-fans-beware-hackers-create-a-fake-claude-site-to-spread-backdoor-malware,2026-05-08 17:02:49
