headline,source,link,datetime
Amazon ordered to bargain with Teamsters in case that could set back union progress,Engadget,https://www.engadget.com/2199578/amazon-ordered-to-bargain-with-teamsters/,2026-06-23 10:03:04
OpenAI's new Daybreak⁠ initiative will help open-source projects fend off bugs,Engadget,https://www.engadget.com/2199569/openai-new-daybreak-initiative-open-source-projects-bugs/,2026-06-23 10:03:04
I cover AI for a living — these are the 5 things I’d check before buying an AI PC during Amazon Prime Day,TechRadar,https://www.techradar.com/computing/i-cover-ai-for-a-living-these-are-the-5-things-id-check-before-buying-an-ai-pc-during-amazon-prime-day,2026-06-23 10:03:04
I'm making my fellow commuters jealous with the Shark ChillPill personal fan this week — and you can get your own for 20% off over Prime Day,TechRadar,https://www.techradar.com/seasonal-sales/im-making-my-fellow-commuters-jealous-with-the-shark-chillpill-personal-fan-this-week-and-you-can-get-your-own-for-20-percent-off-over-prime-day,2026-06-23 10:03:04
"‘Ask people if they want to be cared for by a robot, and most say no': People are warming up to robots at work - but they don't want them in hospitals or schools",TechRadar,https://www.techradar.com/pro/ask-people-if-they-want-to-be-cared-for-by-a-robot-and-most-say-no-people-are-warming-up-to-robots-at-work-but-they-dont-want-them-in-hospitals-or-schools,2026-06-23 10:03:04
