headline,source,link,datetime
A Post-Quantum Future for Let's Encrypt,Hacker News,https://letsencrypt.org/2026/06/03/pq-certs,2026-06-03 16:03:10
PlayStation is getting back to what it’s good at,The Verge,https://www.theverge.com/games/942520/playstation-wolverine-god-of-war-laufey-state-of-play-june-2026,2026-06-03 16:03:10
"‘We are welcoming others to join this category, which we created’: Samsung has already told us how it feels about the rumored iPhone Ultra — and the Galaxy Z Fold-maker clearly doesn’t fear Apple’s long-awaited foldable debut",TechRadar,https://www.techradar.com/phones/samsung-galaxy-phones/we-are-welcoming-others-to-join-this-category-which-we-created-samsung-has-already-told-us-how-it-feels-about-the-rumored-iphone-ultra-and-the-galaxy-z-fold-maker-clearly-doesnt-fear-apples-long-awaited-foldable-debut,2026-06-03 16:03:10
How to watch Netherlands vs Algeria: Free Streams & TV Channels for World Cup 2026 warm-up match,TechRadar,https://www.techradar.com/how-to-watch/football/netherlands-vs-algeria-free-streams,2026-06-03 16:03:10
Japan is considering stronger age restrictions for social media use — but public response to the move hasn't been as positive as hoped,TechRadar,https://www.techradar.com/vpn/vpn-privacy-security/japan-is-considering-stronger-age-restrictions-for-social-media-use-but-public-response-to-the-move-hasnt-been-as-positive-as-hoped,2026-06-03 16:03:10
AI is the top investment area for 3 out of 4 insurance CEOs,TechRadar,https://www.techradar.com/pro/ai-is-the-top-investment-area-for-3-out-of-4-insurance-ceos,2026-06-03 16:03:10
'They're building real momentum and player trust' — This former Xbox exec is a big fan of recent rebrand,TechRadar,https://www.techradar.com/gaming/gaming-industry/theyre-building-real-momentum-and-player-trust-this-former-xbox-exec-is-a-big-fan-of-recent-rebrand,2026-06-03 16:03:10
