headline,source,link,datetime
Meta won’t have to face the next planned social media addiction trial,The Verge,https://www.theverge.com/policy/969644/meta-social-media-addiction-trial-dropped,2026-07-22 23:03:14
Check out this nifty 3D Playdate game demo,Engadget,https://www.engadget.com/2221371/check-out-this-nifty-3d-playdate-game-demo/,2026-07-22 23:03:14
Steam adds handy gifting and wishlist updates,Engadget,https://www.engadget.com/2221369/steam-adds-handy-gifting-and-wishlist-updates/,2026-07-22 23:03:14
"NYT Strands hints and answers for Thursday, July 23 (game #872)",TechRadar,https://www.techradar.com/computing/websites-apps/nyt-strands-today-answers-hints-23-july-2026,2026-07-22 23:03:14
"NYT Connections hints and answers for Thursday, July 23 (game #1138)",TechRadar,https://www.techradar.com/gaming/nyt-connections-today-answers-hints-23-july-2026,2026-07-22 23:03:14
"Quordle hints and answers for Thursday, July 23 (game #1641)",TechRadar,https://www.techradar.com/computing/websites-apps/quordle-today-answers-clues-23-july-2026,2026-07-22 23:03:14
Split in half from space: satellite images confirm Ukraine's 800km drone strike destroyed an irreplaceable Russian Tu-95 bomber,TechRadar,https://www.techradar.com/pro/split-in-half-from-space-satellite-images-confirm-ukraines-800km-drone-strike-destroyed-an-irreplaceable-russian-tu-95-bomber,2026-07-22 23:03:14
