headline,source,link,datetime
California rocked by another earthquake that will unleash the Big One,Hacker News,https://www.dailymail.com/sciencetech/article-15973745/california-earthquake-unlocks-san-andreas-garlock.html,2026-07-13 23:03:27
‘Asia's cleanest village’ bans tourists on Sundays,Hacker News,https://www.bbc.com/travel/article/20260625-why-asias-cleanest-village-bans-tourists-on-sundays,2026-07-13 23:03:27
"Show HN: I built a one-prompt hackathon platform, free entry, sponsored prizes",Hacker News,https://1shotchallenge.ai,2026-07-13 23:03:27
Claude is just Mr. Meeseeks,Hacker News,https://github.com/thephw/claude-meseeks,2026-07-13 23:03:27
Please let this hot pink Pixel 11 leak be real,Engadget,https://www.engadget.com/2214292/please-let-this-hot-pink-pixel-11-leak-be-real/,2026-07-13 23:03:27
Like photosynthesis in plants: This CPU uses solar power to 'run computations' without the need for batteries,TechRadar,https://www.techradar.com/pro/like-photosynthesis-in-plants-this-cpu-uses-solar-power-to-run-computations-without-the-need-for-batteries,2026-07-13 23:03:28
