headline,source,link,datetime
The SpaceX IPO is a trillion-dollar gamble on the future of space,The Verge,https://www.theverge.com/science/915244/spacex-ipo-trillion-dollar-commercial-iss-nasa-launch,2026-04-21 13:02:47
Half Man review: Richard Gadd's HBO Max debut is the most uncomfortable TV series I've ever seen — but it's still not a patch on Baby Reindeer,TechRadar,https://www.techradar.com/streaming/hbo-max/half-man-richard-gadd-review,2026-04-21 13:02:48
What is the release date for Stranger Things: Tales From 85 on Netflix?,TechRadar,https://www.techradar.com/streaming/netflix/what-is-the-release-date-for-stranger-things-tales-from-85-on-netflix,2026-04-21 13:02:48
Explaining AMD gear modes and why they’re important for intensive workloads,TechRadar,https://www.techradar.com/pro/explaining-amd-gear-modes-and-why-theyre-important-for-intensive-workloads,2026-04-21 13:02:48
'88% Confident 90% Misled': Government & critical infrastructure leaders fundamentally misunderstand the security of the apps they use,TechRadar,https://www.techradar.com/pro/security/88-percent-confident-90-percent-misled-government-and-critical-infrastructure-leaders-fundamentally-misunderstand-the-security-of-the-apps-they-use,2026-04-21 13:02:48
How to watch Interior Design Masters with Alan Carr online from anywhere — it's *FREE*,TechRadar,https://www.techradar.com/how-to-watch/interior-design-masters-with-alan-carr-free,2026-04-21 13:02:48
"‘We must urgently bridge the gap’: Google’s Sergey Brin says Gemini is behind Claude in one important AI field, according to leaked memo",TechRadar,https://www.techradar.com/ai-platforms-assistants/we-must-urgently-bridge-the-gap-googles-sergey-brin-says-gemini-is-behind-claude-in-one-important-ai-field-according-to-leaked-memo,2026-04-21 13:02:48
"The latest Fitbit Air leak gives us colors, a launch date, and a possible price — and I've got my money ready",TechRadar,https://www.techradar.com/health-fitness/fitness-trackers/the-latest-fitbit-air-leak-gives-us-colors-a-launch-date-and-a-possible-price-and-ive-got-my-money-ready,2026-04-21 13:02:48
A limited edition Forza Horizon 6 Xbox wireless controller and headset have been officially announced and will launch alongside the upcoming game — here's how to preorder yours,TechRadar,https://www.techradar.com/gaming/a-limited-edition-forza-horizon-6-xbox-wireless-controller-and-headset-have-been-officially-announced-and-will-launch-alongside-the-upcoming-game-heres-how-to-preorder-yours,2026-04-21 13:02:48
NymVPN's Windows users have just gained this long-awaited feature,TechRadar,https://www.techradar.com/vpn/vpn-services/nymvpns-windows-users-have-just-gained-this-long-awaited-feature,2026-04-21 13:02:48
