headline,source,link,datetime
Sony's Xperia 1 VIII has bigger camera sensors and a new look,Engadget,https://www.engadget.com/2171753/sony-xperia-1-viii-bigger-camera-sensor-redesign/,2026-05-13 11:02:39
AI agent skills are becoming the next enterprise supply chain risk - here’s how to govern them,TechRadar,https://www.techradar.com/pro/ai-agent-skills-are-becoming-the-next-enterprise-supply-chain-risk-heres-how-to-govern-them,2026-05-13 11:02:39
Scuf just launched an officially licensed PS5 controller with loads of extra buttons and a wealth of high-end features,TechRadar,https://www.techradar.com/gaming/playstation/scuf-just-launched-an-officially-licensed-ps5-controller-with-loads-of-extra-buttons-and-a-wealth-of-high-end-features,2026-05-13 11:02:39
Fallout season 3 just added a major Westworld star to the cast — here's everything we know about the exciting new addition to the hit Prime Video series,TechRadar,https://www.techradar.com/streaming/amazon-prime-video/fallout-season-3-just-added-a-major-westworld-star-to-the-cast-heres-everything-we-know-about-the-exciting-new-addition-to-the-hit-prime-video-series,2026-05-13 11:02:39
"Why the future of quantum computing is about ownership, not just cloud access",TechRadar,https://www.techradar.com/pro/why-the-future-of-quantum-computing-is-about-ownership-not-just-cloud-access,2026-05-13 11:02:39
Škoda warns customers their data may have been breached following online shop hit,TechRadar,https://www.techradar.com/pro/security/skoda-warns-customers-their-data-may-have-been-breached-following-online-shop-hit,2026-05-13 11:02:39
