headline,source,link,datetime
"Cuba says it has run out of fuel, blames U.S. embargo",Hacker News,https://www.upi.com/Top_News/World-News/2026/05/14/Cuba-says-oil-reserves-totally-drained/9311778746907/,2026-05-14 17:02:44
Subnautica 2 is already having a huge launch on Steam,The Verge,https://www.theverge.com/games/930562/subnautica-2-early-access-launch-steam-pc-epic-games-store-xbox,2026-05-14 17:02:44
New Google accounts may only get 5GB free storage — unless you link a phone number,Engadget,https://www.engadget.com/2173013/new-google-accounts-may-only-get-5gb-free-storage-unless-you-link-a-phone-number/,2026-05-14 17:02:44
AMD will bring its next-generation FSR 4.1 upscaling tech to older GPUs,Engadget,https://www.engadget.com/2173003/amd-will-bring-its-next-generation-fsr-41-upscaling-tech-to-older-gpus/,2026-05-14 17:02:44
This worrying Microsoft BitLocker backdoor can grant full access to a locked drive — and all you need is a USB stick,TechRadar,https://www.techradar.com/pro/security/this-worrying-microsoft-bitlocker-backdoor-can-grant-full-access-to-a-locked-drive-and-all-you-need-is-a-usb-stick,2026-05-14 17:02:44
"There's a new alternative to the Philips Hue Play HDMI Sync Box 8K for immersive smart lighting synced to your TV — it's way cheaper, it still supports 4K 120Hz passthrough, it works with WiZ bulbs, and it comes from… Philips",TechRadar,https://www.techradar.com/home/smart-lights/theres-a-new-alternative-to-the-philips-hue-play-hdmi-sync-box-8k-for-immersive-smart-lighting-synced-to-your-tv-its-way-cheaper-it-still-supports-4k-120hz-passthrough-it-works-with-wiz-bulbs-and-it-comes-from-philips,2026-05-14 17:02:44
"Assassin's Creed Hexe leak seemingly reveals the witchy tale's main character, and hints at the return of the series' most beloved assassin",TechRadar,https://www.techradar.com/gaming/assassins-creed-hexe-leak-seemingly-reveals-the-witchy-tales-main-character-and-hints-at-the-return-of-the-series-most-beloved-assassin,2026-05-14 17:02:44
"Best Buy kicks off its Memorial Day sale early with massive savings of up to 45% on appliances — save on Samsung, LG, Whirlpool, Bosch, and more",TechRadar,https://www.techradar.com/seasonal-sales/best-buy-kicks-off-its-memorial-day-sale-early-with-massive-savings-of-up-to-45-percent-on-appliances-save-on-samsung-lg-whirlpool-bosch-and-more,2026-05-14 17:02:44
