headline,source,link,datetime
Egg Intake and the Incidence of Alzheimer's Disease in Adventist Health Study-2,Hacker News,https://www.sciencedirect.com/science/article/pii/S0022316626001902,2026-05-06 18:03:58
From Supabase to Clerk to Better Auth,Hacker News,https://blog.val.town/better-auth,2026-05-06 18:03:58
Mira Murati tells the court that she couldn’t trust Sam Altman’s words,The Verge,https://www.theverge.com/ai-artificial-intelligence/925338/openai-musk-v-altman-mira-murati,2026-05-06 18:03:58
Here’s what Microsoft is offering long-serving employees to voluntarily retire,The Verge,https://www.theverge.com/report/925218/microsoft-voluntary-retirement-program-package-details,2026-05-06 18:03:58
Google just bought a stake in the maker of Eve Online to train its AI models,Engadget,https://www.engadget.com/2166270/google-just-bought-a-stake-in-the-maker-of-eve-online-to-train-its-ai-models/,2026-05-06 18:03:59
The Garmin Fenix 7 Pro got a huge 4.5-star recommendation from us  — and it can be snapped up for just £400 at Go Outdoors and Decathlon right now,TechRadar,https://www.techradar.com/health-fitness/fitness-trackers/the-garmin-fenix-7-pro-got-a-huge-4-5-star-recommendation-from-us-and-it-can-be-snapped-up-for-just-gbp400-at-go-outdoors-and-decathlon-right-now,2026-05-06 18:03:59
"Researcher reveals official White House app is one command away from tracking your precise location every 4.5 minutes – app can also inject code to dodge cookie consent, GDPR banners, and paywalls",TechRadar,https://www.techradar.com/pro/security/researcher-reveals-official-white-house-app-is-one-command-away-from-tracking-your-precise-location-every-4-5-minutes-app-can-also-inject-code-to-dodge-cookie-consent-gdpr-banners-and-paywalls,2026-05-06 18:03:59
"23 top tech offers I'd buy from the latest Currys Epic Deals sale — get up to 40% off Apple, Ninja, Garmin, Dyson, and more",TechRadar,https://www.techradar.com/seasonal-sales/23-top-tech-offers-id-buy-from-the-latest-currys-epic-deals-sale-get-up-to-40-percent-off-apple-ninja-garmin-dyson-and-more,2026-05-06 18:03:59
