headline,source,link,datetime
AI's Affordability Crisis,Hacker News,https://blog.dshr.org/2026/06/ais-affordability-crisis.html,2026-06-23 16:04:04
Show HN: Treedocs: Documentation that automatically checks for staleness,Hacker News,https://dandylyons.github.io/treedocs/,2026-06-23 16:04:04
Something’s off with Midjourney’s pivot to body scanners,The Verge,https://www.theverge.com/report/954826/midjourney-medical-ai-ultrasound-body-scanner-lacks-evidence,2026-06-23 16:04:04
Meta’s smart glasses now have a dedicated charging stand,The Verge,https://www.theverge.com/tech/954900/meta-glasses-charging-stand-price-launch,2026-06-23 16:04:04
How much would the Steam Machine cost to build?,The Verge,https://www.theverge.com/games/953989/valve-steam-machine-pc-build-alternative,2026-06-23 16:04:04
What is the release date and launch time for The Bear season 5?,TechRadar,https://www.techradar.com/streaming/what-is-the-release-date-and-launch-time-for-the-bear-season-5,2026-06-23 16:04:04
"Resonance: A Plague Tale Legacy has taken inspiration from the likes of Tomb Raider and Uncharted in the best ways — and even after a short time with the game, I'm pumped for more",TechRadar,https://www.techradar.com/gaming/resonance-a-plague-tale-legacy-has-clearly-taken-inspiration-from-the-likes-of-tomb-raider-and-uncharted-and-even-after-a-short-time-with-the-game-im-pumped-for-more,2026-06-23 16:04:04
I've owned a Sony Alpha a6000 for years and am seriously considering this dual battery and charger Prime Day Deal — but I do have some concerns,TechRadar,https://www.techradar.com/cameras/camera-accessories/ive-owned-a-sony-alpha-a6000-for-years-and-am-seriously-considering-this-dual-battery-and-charger-prime-day-deal-but-i-do-have-some-concerns,2026-06-23 16:04:04
"Fans are selling fast — I'm an appliance expert, and I've found the best air quality and kitchen appliance deals still available to keep you cool in the UK's heatwave",TechRadar,https://www.techradar.com/seasonal-sales/fans-are-selling-fast-im-an-appliance-expert-and-ive-found-the-best-air-quality-and-kitchen-appliance-deals-still-available-to-keep-you-cool-in-the-uks-heatwave,2026-06-23 16:04:04
"The 3 top smart locks for easy installation and peace of mind, tested and trusted by home tech experts",TechRadar,https://www.techradar.com/seasonal-sales/the-3-top-smart-locks-for-easy-installation-and-peace-of-mind-tested-and-trusted-by-home-tech-experts,2026-06-23 16:04:04
The Samsung Galaxy Watch9 is likely to launch soon — which means now is the perfect time to score a discounted Samsung Galaxy Watch8,TechRadar,https://www.techradar.com/health-fitness/smartwatches/the-samsung-galaxy-watch9-is-likely-to-launch-soon-which-means-now-is-the-perfect-time-to-score-a-discounted-samsung-galaxy-watch8,2026-06-23 16:04:04
I asked ChatGPT and Claude to do my grocery shopping — one felt like the future,TechRadar,https://www.techradar.com/ai-platforms-assistants/i-asked-chatgpt-and-claude-to-do-my-grocery-shopping-one-felt-like-the-future,2026-06-23 16:04:04
"As TechRadar's TV tester, the LG C5 OLED TV is at 'the very top of my recommended list' — and there's no better time to buy it",TechRadar,https://www.techradar.com/televisions/as-techradars-tv-tester-the-lg-c5-oled-tv-is-at-the-very-top-of-my-recommended-list-and-theres-no-better-time-to-buy-it,2026-06-23 16:04:04
"Save $530 on this Dell Ryzen 7 laptop? Forget Amazon on Prime Day, check out these 5 laptops with huge price cuts",TechRadar,https://www.techradar.com/pro/save-usd530-on-this-dell-ryzen-7-laptop-forget-amazon-on-prime-day-check-out-these-5-laptops-with-huge-price-cuts,2026-06-23 16:04:04
The golf watch I covet the most is discounted just in time for prime golf season — and I'm seriously tempted,TechRadar,https://www.techradar.com/health-fitness/smartwatches/the-golf-watch-i-covet-the-most-is-discounted-just-in-time-for-prime-golf-season-and-im-seriously-tempted,2026-06-23 16:04:04
"I asked ChatGPT, Gemini and Claude what discount tech to buy on Amazon Prime Day — here’s which AI gave the best advice",TechRadar,https://www.techradar.com/ai-platforms-assistants/i-asked-chatgpt-gemini-and-claude-what-discount-tech-to-buy-on-amazon-prime-day-heres-which-ai-gave-the-best-advice,2026-06-23 16:04:04
Klara and the Sun's trailer teases another AI companion story — but here's why the dystopian sci-fi movie has caught my attention,TechRadar,https://www.techradar.com/streaming/entertainment/klara-and-the-suns-trailer-teases-another-ai-companion-story-but-heres-why-the-dystopian-sci-fi-movie-has-caught-my-attention,2026-06-23 16:04:04
"Shark’s PowerDetect UV Reveal has a lot of potential, but right now it’s the equivalent of a power washer in the hands of a caveman",TechRadar,https://www.techradar.com/home/robot-vacuums/sharks-powerdetect-uv-reveal-has-a-lot-of-potential-but-right-now-its-the-equivalent-of-a-power-washer-in-the-hands-of-a-caveman,2026-06-23 16:04:04
"Can't decide on an Amazon Echo deal this Prime Day? I've tried all of them, and my quiz can help you decide",TechRadar,https://www.techradar.com/seasonal-sales/cant-decide-on-an-amazon-echo-deal-this-prime-day-ive-tried-all-of-them-and-my-quiz-can-help-you-decide,2026-06-23 16:04:04
One of our favorite single-serve coffee machines is less than $100 this Prime Day — and it's also a perfect time for you to stock up on coffee pods for less,TechRadar,https://www.techradar.com/home/coffee-machines/one-of-our-favorite-single-serve-coffee-machines-is-less-than-usd100-this-prime-day-and-its-also-a-perfect-time-for-you-to-stock-up-on-coffee-pods-for-less,2026-06-23 16:04:04
This wild DJI Pocket clone with a built-in fan is the crossover I desperately need today — but these are the top vlogging cameras I actually recommend as a camera expert,TechRadar,https://www.techradar.com/cameras/video-cameras/this-wild-dji-pocket-clone-with-a-built-in-fan-is-the-crossover-i-desperately-need-today-but-these-are-the-top-vlogging-cameras-i-actually-recommend-as-a-camera-expert,2026-06-23 16:04:04
"The Coalition says Active Reload is an 'iconic feature' that has been updated for Gears of War: E-Day, and some weapons also have 'additional reload mechanics'",TechRadar,https://www.techradar.com/gaming/the-coalition-says-active-reload-is-an-iconic-feature-that-has-been-updated-for-gears-of-war-e-day-and-some-weapons-also-have-additional-reload-mechanics,2026-06-23 16:04:04
