headline,source,link,datetime
Anthropic makes last-ditch effort to salvage deal with Pentagon after blowup,The Verge,https://www.theverge.com/ai-artificial-intelligence/889782/anthropic-pentagon-discussions-ai-deal,2026-03-05 12:34:14
Nothing’s Headphone A are something worth considering,The Verge,https://www.theverge.com/tech/889615/nothing-headphone-a-review,2026-03-05 12:34:14
Nothing is finally covering up with the metal Phone 4A Pro,The Verge,https://www.theverge.com/tech/889769/nothing-phone-4a-pro-design-opaque-transparent,2026-03-05 12:34:14
Bill Gates’ nuclear company is the first to get approval to build next-gen reactor,The Verge,https://www.theverge.com/science/889768/bill-gates-terrapower-nuclear-wyoming-reactor,2026-03-05 12:34:14
"Apple Music can now flag AI content, but only if distributors elect to label it",Engadget,https://www.engadget.com/entertainment/music/apple-music-can-now-flag-ai-content-but-only-if-distributors-elect-to-label-it-121521873.html?src=rss,2026-03-05 12:34:14
Nothing Phone 4a hands-on: A more technically accomplished entry-level smartphone,Engadget,https://www.engadget.com/mobile/smartphones/nothing-phone-4a-hands-on-price-launch-date-111533547.html?src=rss,2026-03-05 12:34:14
Nothing's new over-ear headphones can pump out the jams for five days on a single charge,Engadget,https://www.engadget.com/audio/headphones/nothings-new-over-ear-headphones-can-pump-out-the-jams-for-five-days-on-a-single-charge-111515728.html?src=rss,2026-03-05 12:34:14
Nothing's Phone 4a Pro picks up flagship features and an even brighter display for $499,Engadget,https://www.engadget.com/mobile/smartphones/nothings-phone-4a-pro-picks-up-flagship-features-and-an-even-brighter-display-for-499-111500926.html?src=rss,2026-03-05 12:34:14
Google reportedly muzzles Epic Games CEO Tim Sweeney until 2032,Engadget,https://www.engadget.com/gaming/google-reportedly-muzzles-epic-games-ceo-tim-sweeney-until-2032-105501644.html?src=rss,2026-03-05 12:34:14
"Nothing sees your colorful MacBook Neo, and raises you two new funky Android phones — meet the Phone (4a) and (4a) Pro",TechRadar,https://www.techradar.com/phones/nothing-sees-your-colorful-macbook-neo-and-raises-you-two-new-funky-android-phones-meet-the-phone-4a-and-4a-pro,2026-03-05 12:34:14
You can get the MacBook Neo for just $499 / £499 with this easy-to-miss education discount at Apple,TechRadar,https://www.techradar.com/computing/macbooks/you-can-get-the-macbook-neo-for-just-usd499-gbp499-with-this-easy-to-miss-education-discount-at-apple,2026-03-05 12:34:14
"Ubisoft provides updates on the Assassin's Creed series, says its 'taking the time to deliver on its ambitious vision' of Hexe and Codename Invictus is 'a new approach to multiplayer in the franchise, but it isn't quite what the rumors have suggested'",TechRadar,https://www.techradar.com/gaming/ubisoft-provides-updates-on-the-assassins-creed-series-says-its-taking-the-time-to-deliver-on-its-ambitious-vision-of-hexe-and-codename-invictus-is-a-new-approach-to-multiplayer-in-the-franchise-but-it-isnt-quite-what-the-rumors-have-suggested,2026-03-05 12:34:14
'Email is at an inflection point': new study finds only 13% of emails sent worldwide were actually written by humans,TechRadar,https://www.techradar.com/pro/email-is-at-an-inflection-point-new-study-finds-only-13-percent-of-emails-sent-worldwide-were-actually-written-by-humans,2026-03-05 12:34:14
Security researchers found 'critical' flaw in IPVanish Mac VPN app — here's all you need to know,TechRadar,https://www.techradar.com/vpn/vpn-privacy-security/security-researchers-found-critical-flaw-in-ipvanish-mac-vpn-app-heres-all-you-need-to-know,2026-03-05 12:34:14
Microsoft Teams wants to make it easier to forget all your embarrassing meeting mistakes,TechRadar,https://www.techradar.com/pro/microsoft-teams-just-made-it-easier-to-forget-all-your-embarrassing-meeting-mistakes,2026-03-05 12:34:14
I didn't think it could be done — the Nothing Headphone (a) fix all the problems of the original while being way cheaper,TechRadar,https://www.techradar.com/audio/wireless-headphones/nothing-headphone-a-review,2026-03-05 12:34:14
"I reviewed Nothing's new budget phone, and it's a sleek, steady performer that impressed me so much that I might not go back to my Samsung",TechRadar,https://www.techradar.com/phones/nothing-phone-4a-review,2026-03-05 12:34:14
"The Nothing Headphone (a) are here, and they rock — here are 5 things you need to know about them",TechRadar,https://www.techradar.com/audio/wireless-headphones/the-nothing-headphone-a-are-here-and-they-rock-here-are-5-things-you-need-to-know-about-them,2026-03-05 12:34:14
"WWE 2K26 review: The game keeps getting better, the monetization keeps getting worse",TechRadar,https://www.techradar.com/gaming/wwe-2k26-review,2026-03-05 12:34:14
"Major data leak forum LeakBase seized by FBI, Europol, and shut down",TechRadar,https://www.techradar.com/pro/security/major-data-leak-forum-leakbase-seized-by-fbi-europol-and-shut-down,2026-03-05 12:34:14
The rumors were true! Assassin's Creed Black Flag Resynced has officially been announced by Ubisoft — 'Some whispers have a little more wind in their sails. Keep your spyglass on the horizon',TechRadar,https://www.techradar.com/gaming/the-rumors-were-true-assassins-creed-black-flag-resynced-has-officially-been-announced-by-ubisoft-some-whispers-have-a-little-more-wind-in-their-sails-keep-your-spyglass-on-the-horizon,2026-03-05 12:34:14
"Microsoft, Europol take down global phishing as a service network which was able to bypass 2FA with ease",TechRadar,https://www.techradar.com/pro/security/microsoft-europol-take-down-global-phishing-as-a-service-network-which-was-able-to-bypass-2fa-with-ease,2026-03-05 12:34:14
"How to watch India vs England: Free Streams, TV Channels & Preview for T20 World Cup semi-final 2026",TechRadar,https://www.techradar.com/how-to-watch/cricket/india-vs-england-t20-world-cup-semi-final-2026-free,2026-03-05 12:34:14
