headline,source,link,datetime
Bankruptcies Increase 11.9 Percent,Hacker News,https://www.uscourts.gov/data-news/judiciary-news/2026/04/23/bankruptcies-increase-119-percent,2026-04-28 19:02:43
Waymo in Portland,Hacker News,https://waymo.com/blog/shorts/waymo-in-portland/,2026-04-28 19:02:43
Elon Musk takes the stand in high-profile trial against OpenAI,The Verge,https://www.theverge.com/ai-artificial-intelligence/917052/elon-musk-takes-stand-trial-openai-sam-altman,2026-04-28 19:02:43
You can get dragged into a police investigation by proximity alone — for now,The Verge,https://www.theverge.com/report/919664/chatrie-v-united-states-supreme-court-arguments-fourth-amendment-geofence-warrants,2026-04-28 19:02:43
Google Home makes it easier to understand why devices aren’t working,The Verge,https://www.theverge.com/tech/919787/google-home-instant-account-relinking-update,2026-04-28 19:02:43
The Nex Playground gaming console is $60 off this week,The Verge,https://www.theverge.com/gadgets/919736/nex-playground-amazon-gaming-week-deal-sale,2026-04-28 19:02:43
The resurrected Commodore 64 is getting a facelift like the original,The Verge,https://www.theverge.com/tech/919625/commodore-64c-ultimate-fpga-computer-retro-c64c,2026-04-28 19:02:43
"'Battery-free, quiet, and inherently private' — These 3D-printed metal tags could change home and office tracking, turning penny-sized discs into smart devices using ultrasonic tech for maintenance-free monitoring without charging",TechRadar,https://www.techradar.com/pro/battery-free-quiet-and-inherently-private-these-3d-printed-metal-tags-could-change-home-and-office-tracking-turning-penny-sized-discs-into-smart-devices-using-ultrasonic-tech-for-maintenance-free-monitoring-without-charging,2026-04-28 19:02:44
