headline,source,link,datetime
Oura adds birth control support to its period tracker,The Verge,https://www.theverge.com/tech/921955/oura-hormonal-birth-control-tracking-update,2026-05-01 13:02:44
Our LG C6 OLED TV tests are underway — here’s your chance to ask our experts anything,TechRadar,https://www.techradar.com/televisions/our-lg-c6-oled-tv-tests-are-underway-heres-your-chance-to-ask-our-experts-anything,2026-05-01 13:02:45
"007 First Light art director says the limited edition Dualsense controller was inspired by a 'light' theme, not the inside of a gun barrel — 'What we were trying to do with that was reference more how the UI of the game feels'",TechRadar,https://www.techradar.com/gaming/007-first-light-art-director-says-the-limited-edition-dualsense-controller-was-inspired-by-a-light-theme-not-the-inside-of-a-gun-barrel-what-we-were-trying-to-do-with-that-was-reference-more-how-the-ui-of-the-game-feels,2026-05-01 13:02:45
"'Verified By Spotify' is the music streamer's new way to help you avoid AI artists, but it doesn't go as far as I'd like — especially with Deezer, Qobuz and Apple Music making major anti-AI steps",TechRadar,https://www.techradar.com/audio/spotify/verified-by-spotify-is-the-music-streamers-new-way-to-help-you-avoid-ai-artists,2026-05-01 13:02:45
Don't be alarmed — this major Android Auto annoyance could be finally get fixed soon by Google after almost a decade,TechRadar,https://www.techradar.com/vehicle-tech/car-infotainment/dont-be-alarmed-this-major-android-auto-annoyance-could-be-finally-get-fixed-soon-by-google-after-almost-a-decade,2026-05-01 13:02:45
'A galaxy of new Star Wars games' and more are coming to Fortnite to celebrate Star Wars Day,TechRadar,https://www.techradar.com/gaming/a-galaxy-of-new-star-wars-games-and-more-are-coming-to-fortnite-to-celebrate-star-wars-day,2026-05-01 13:02:45
"'An hour of scan time is all it took': ""Copy Fail"" flaw impacts all Linux kernels released since 2017, so patch now or face the consequences",TechRadar,https://www.techradar.com/pro/security/an-hour-of-scan-time-is-all-it-took-copy-fail-flaw-impacts-all-linux-kernels-released-since-2017-so-patch-now-or-face-the-consequences,2026-05-01 13:02:45
'A technical whack-a-mole:' Utah to become the first US state to target VPN users with controversial age verification law — and digital rights experts are furious,TechRadar,https://www.techradar.com/vpn/vpn-privacy-security/a-technical-whack-a-mole-utah-to-become-the-first-us-state-to-target-vpn-users-with-controversial-age-verification-law-and-digital-rights-experts-are-furious,2026-05-01 13:02:45
