headline,source,link,datetime
Apparently Google hates us now,Hacker News,https://twitter.com/pokemoncentral/status/2057123807404638250,2026-05-20 17:03:14
OpenAI Is Preparing to File for an IPO Soon,Hacker News,https://www.wsj.com/tech/ai/openai-is-preparing-to-file-for-an-ipo-very-soon-0ec95af5,2026-05-20 17:03:14
You can now remix other people’s YouTube Shorts with AI,The Verge,https://www.theverge.com/tech/934704/google-gemini-omni-youtub-shorts-remix-ai,2026-05-20 17:03:14
Xbox hires game industry analyst Matthew Ball to lead strategy,The Verge,https://www.theverge.com/report/934687/xbox-matthew-ball-strategy-officer-hire,2026-05-20 17:03:14
Quantic Dream is shutting down its MOBA Spellcasters Chronicles,Engadget,https://www.engadget.com/2177842/quantic-dream-is-shutting-down-its-moba-spellcasters-chronicles/,2026-05-20 17:03:14
The Sony Inzone Buds are 'a fantastic-sounding pair of gaming earbuds' — and this perfect pairing to the PS5 are now over $60 off at Amazon,TechRadar,https://www.techradar.com/gaming/gaming-accessories/the-sony-inzone-buds-are-a-fantastic-sounding-pair-of-gaming-earbuds-and-this-perfect-pairing-to-the-ps5-are-now-over-usd60-off-at-amazon,2026-05-20 17:03:14
Ditch the $60k MBA: 8 audiobooks to master business for $62.93,TechRadar,https://www.techradar.com/collection/pro/ditch-the-usd60k-mba-8-audiobooks-to-master-business-for-usd62-93,2026-05-20 17:03:14
'An important milestone' — IPVanish gets bigger and expands its network to 150 locations worldwide,TechRadar,https://www.techradar.com/vpn/vpn-services/an-important-milestone-ipvanish-gets-bigger-and-expands-its-network-to-150-locations-worldwide,2026-05-20 17:03:14
Microsoft takes down 'Fox Tempest' cybercrime service which used legitimate platforms to hide dangerous malware,TechRadar,https://www.techradar.com/pro/security/microsoft-takes-down-fox-tempest-cybercrime-service-which-used-legitimate-platforms-to-hide-dangerous-malware,2026-05-20 17:03:14
Firefox's free VPN now lets you pick your favorite server location,TechRadar,https://www.techradar.com/vpn/vpn-services/firefoxs-free-vpn-now-lets-you-pick-your-favorite-server-location,2026-05-20 17:03:14
