headline,source,link,datetime
Grok uploaded my user directory to xAI's servers,Hacker News,https://twitter.com/a_green_being/status/2076598897779020159,2026-07-13 14:04:08
Grok CLI uploaded the whole home directory to GCS,Hacker News,https://twitter.com/i/status/2076598897779020159,2026-07-13 14:04:08
"Not 300 miles, not 250 miles: These EVs have the worst range in 2026",Engadget,https://www.engadget.com/2210476/ev-worst-range-in-2026/,2026-07-13 14:04:08
HuggingChat AI review,TechRadar,https://www.techradar.com/pro/huggingchat-review,2026-07-13 14:04:08
Are VPNs under threat in Australia? FOI documents reveal plans to block age verification workarounds,TechRadar,https://www.techradar.com/vpn/vpn-privacy-security/are-vpns-under-threat-in-australia-foi-documents-reveal-plans-to-block-age-verification-workarounds,2026-07-13 14:04:08
"Zoom will let you add an AI receptionist at work, as 'businesses shouldn’t have to replace their phone system to benefit from AI'",TechRadar,https://www.techradar.com/pro/zoom-will-let-you-add-an-ai-receptionist-at-work-as-businesses-shouldnt-have-to-replace-their-phone-system-to-benefit-from-ai,2026-07-13 14:04:08
