headline,source,link,datetime
Robinhood now lets your AI agents trade stocks,Hacker News,https://techcrunch.com/2026/05/27/robinhood-now-lets-your-ai-agents-trade-stocks/,2026-05-29 18:02:44
Tech companies desperately want to film you doing chores,The Verge,https://www.theverge.com/ai-artificial-intelligence/940007/ai-companies-will-pay-for-robot-training-data,2026-05-29 18:02:44
ThermoWorks' Gravitas scale has a detachable display and a 20-minute memory,Engadget,https://www.engadget.com/2183798/thermoworks-gravitas-scale-has-a-detachable-display-and-a-20-minute-memory/,2026-05-29 18:02:44
"The Razer Viper V4 Pro took me back to basics, and you know what? Maybe that's all a gaming mouse should be",TechRadar,https://www.techradar.com/computing/mice/razer-viper-v4-pro-review,2026-05-29 18:02:44
Wix CEO cites 'fast evolution of AI capabilities' in announcement of 20% workforce cut,TechRadar,https://www.techradar.com/pro/wix-ceo-cites-fast-evolution-of-ai-capabilities-in-announcement-of-20-percent-workforce-cut,2026-05-29 18:02:44
