headline,source,link,datetime
I sent an email without opening Gmail thanks to ChatGPT's new feature — then I found the catch,TechRadar,https://www.techradar.com/ai-platforms-assistants/chatgpt/i-sent-an-email-without-opening-gmail-thanks-to-chatgpts-new-feature-then-i-found-the-catch,2026-06-09 12:02:51
"Windscribe now accepts cash for VPN subscriptions — but admits the process is 'the slowest, riskiest way to pay'",TechRadar,https://www.techradar.com/vpn/vpn-privacy-security/windscribe-now-accepts-cash-for-vpn-subscriptions-but-admits-the-process-is-the-slowest-riskiest-way-to-pay,2026-06-09 12:02:51
Apple Music is getting a mini iOS 27 glow-up — but it still lacks the features many subscribers actually want,TechRadar,https://www.techradar.com/audio/apple-music/apple-music-is-getting-a-mini-ios-27-glow-up-but-it-still-lacks-the-features-many-subscribers-actually-want,2026-06-09 12:02:51
Ergonofis Equation review: A premium feeling ergonomic office chair that's not afraid to be beautiful,TechRadar,https://www.techradar.com/pro/ergonofis-equation-ergonomic-office-chair-review,2026-06-09 12:02:51
The Garmin Cirqa seemingly lacks a key feature that could have helped it beat the Fitbit Air and Whoop 5.0,TechRadar,https://www.techradar.com/health-fitness/fitness-trackers/the-garmin-cirqa-seemingly-lacks-a-key-feature-that-could-have-helped-it-beat-the-fitbit-air-and-whoop-5-0,2026-06-09 12:02:51
A 'massive escalation in electronic warfare': researchers show how Russian satellites can jam GPS across Europe — and a mysterious series of ‘interference events’ show it could already be happening,TechRadar,https://www.techradar.com/computing/a-massive-escalation-in-electronic-warfare-researchers-show-how-russian-satellites-can-jam-gps-across-europe-and-a-mysterious-series-of-interference-events-show-it-could-already-be-happening,2026-06-09 12:02:51
Simple Height Adjustable Desk review: A mid-range standing desk with more depth than the 'simple' name might suggest,TechRadar,https://www.techradar.com/pro/simple-height-adjustable-desk-review,2026-06-09 12:02:51
"Nvidia next? Broadcom's value dropped by more than $440 billion as it posts disappointing forward outlook, prompting fears of AI bubble burst",TechRadar,https://www.techradar.com/pro/nvidia-next-broadcoms-value-dropped-by-more-than-usd440-billion-as-it-posts-disappointing-forward-outlook-prompting-fears-of-ai-bubble-burst,2026-06-09 12:02:51
"Forget Siri AI and EQ for AirPods, Apple's key WWDC announcement is CarPlay video streaming — and I worry it'll make for more dangerous roads",TechRadar,https://www.techradar.com/audio/forget-siri-ai-and-eq-for-airpods-apples-key-wwdc-announcement-is-carplay-video-streaming-and-i-worry-itll-make-for-more-dangerous-roads,2026-06-09 12:02:51
NordVPN lands on Meta Horizon — and VR privacy just got a whole lot easier,TechRadar,https://www.techradar.com/vpn/vpn-services/nordvpn-lands-on-meta-horizon-and-vr-privacy-just-got-a-whole-lot-easier,2026-06-09 12:02:51
