headline,source,link,datetime
UK security agency officially declares passkeys superior to passwords – passkeys should be the 'first choice' for authentication,TechRadar,https://www.techradar.com/pro/security/uk-security-agency-officially-declares-passkeys-superior-to-passwords-passkeys-should-be-the-first-choice-for-authentication,2026-04-23 11:02:55
AI Agents at your service,TechRadar,https://www.techradar.com/pro/ai-agents-at-your-service,2026-04-23 11:02:55
Inference pushes AI out of the data center,TechRadar,https://www.techradar.com/pro/inference-pushes-ai-out-of-the-data-center,2026-04-23 11:02:55
iOS 26.4.2 fixes an iPhone security flaw exploited by the FBI,TechRadar,https://www.techradar.com/phones/ios/ios-26-4-2-fixes-an-iphone-security-flaw-exploited-by-the-fbi,2026-04-23 11:02:55
These E Ink fridge magnets display Polaroid-like photos that you can change from your phone,TechRadar,https://www.techradar.com/phones/these-e-ink-fridge-magnets-display-polaroid-like-photos-that-you-can-change-from-your-phone,2026-04-23 11:02:55
Microsoft says it's 'directly influenced' by feedback from Windows 11 users when it comes to fixing the OS,TechRadar,https://www.techradar.com/computing/windows/microsoft-says-its-directly-influenced-by-feedback-from-windows-11-users-when-it-comes-to-fixing-the-os,2026-04-23 11:02:55
AI is overcrowding the smartphone; simplicity will fuel adoption,TechRadar,https://www.techradar.com/pro/ai-is-overcrowding-the-smartphone-simplicity-will-fuel-adoption,2026-04-23 11:02:55
Mozilla says Anthropic’s Mythos is ‘every bit as capable’ as ‘the world’s best security researchers’ after Firefox experiment — and says the ‘zero-days are numbered’,TechRadar,https://www.techradar.com/pro/mozilla-says-anthropics-mythos-is-every-bit-as-capable-as-the-worlds-best-security-researchers-after-firefox-experiment-and-says-the-zero-days-are-numbered,2026-04-23 11:02:55
