headline,source,link,datetime
Credit Cards Are Vulnerable to Brute Force Kind Attacks,Hacker News,https://metin.nextc.org/posts/Credit_Cards_Are_Vulnerable_To_Brute_Force_Kind_Attacks.html,2026-05-01 21:02:48
Ti-84 Evo,Hacker News,https://education.ti.com/en/products/calculators/graphing-calculators/ti-84-evo,2026-05-01 21:02:48
AI performances and screenplays won't be eligible for Oscars,Engadget,https://www.engadget.com/2162342/ai-performances-and-screenplays-wont-be-eligible-for-oscars/,2026-05-01 21:02:49
Apple appears to have discontinued its cheapest Mac mini,Engadget,https://www.engadget.com/2162334/apple-appears-to-have-discontinued-its-cheapest-mac-mini/,2026-05-01 21:02:49
"I don't know if Vision Pro is alive or dead, but it is still the most sophisticated, powerful, and coolest hardware Apple ever built — and we can surely thank it for the glasses that will follow",TechRadar,https://www.techradar.com/computing/virtual-reality-augmented-reality/i-dont-know-if-vision-pro-is-alive-or-dead-but-it-is-still-the-most-sophisticated-powerful-and-coolest-hardware-apple-ever-built-and-we-can-surely-thank-it-for-the-glasses-that-will-follow,2026-05-01 21:02:49
"'Tens of millions of Graviton cores': AWS scores huge coup as Meta 'buys' hundreds of thousands of CPUs and infrastructure, confirming Jeff Bezos' hyperscaler as the essential backbone of the agentic AI Era in a major blow to AMD and Intel ambitions",TechRadar,https://www.techradar.com/pro/tens-of-millions-of-graviton-cores-aws-scores-huge-coup-as-meta-buys-hundreds-of-thousands-of-cpus-and-infrastructure-confirming-jeff-bezos-hyperscaler-as-the-essential-backbone-of-the-agentic-ai-era-in-a-major-blow-to-amd-and-intel-ambitions,2026-05-01 21:02:49
