headline,source,link,datetime
PlayStation now requires a ‘one-time online check’ to confirm you own a game,The Verge,https://www.theverge.com/games/921064/sony-playstation-drm-online-license-statement,2026-04-30 10:02:57
I noticed ChatGPT slowly drifting off topic in long chats — this tiny prompt forces it to reset itself every few messages and keeps the conversation surprisingly on track,TechRadar,https://www.techradar.com/ai-platforms-assistants/chatgpt/i-noticed-chatgpt-slowly-drifting-off-topic-in-long-chats-this-tiny-prompt-forces-it-to-reset-itself-every-few-messages-and-keeps-the-conversation-surprisingly-on-track,2026-04-30 10:02:57
A small and crucial new plot detail for Spider-Man: Brand New Day has sparked confusion over its Marvel timeline position — but there's a very easy explanation that clears things up,TechRadar,https://www.techradar.com/streaming/entertainment/a-small-and-crucial-new-plot-detail-for-spider-man-brand-new-day-has-sparked-confusion-over-its-marvel-timeline-position-but-theres-a-very-easy-explanation-that-clears-things-up,2026-04-30 10:02:57
Is your IT ticket being lost in the 'ghost shift'? New report finds nearly half of complaints now land after hours,TechRadar,https://www.techradar.com/pro/is-your-it-ticket-being-lost-in-the-ghost-shift-new-report-finds-nearly-half-of-complaints-now-land-after-hours,2026-04-30 10:02:57
World Cup 2026: how mobile networks can avoid cybersecurity chaos at kick-off,TechRadar,https://www.techradar.com/pro/world-cup-2026-how-mobile-networks-can-avoid-cybersecurity-chaos-at-kick-off,2026-04-30 10:02:57
