headline,source,link,datetime
"Google must let publishers opt out of AI Search features, rules UK",The Verge,https://www.theverge.com/tech/942302/google-search-ai-overviews-uk-cma-publisher-opt-out,2026-06-03 09:03:10
Google shares Fitbit Air blueprints so you can 3D print your own accessories,Engadget,https://www.engadget.com/2186347/google-fitbit-air-blueprint-measurements-accessories/,2026-06-03 09:03:10
How compliance can unlock AI innovation at scale,TechRadar,https://www.techradar.com/pro/how-compliance-can-unlock-ai-innovation-at-scale,2026-06-03 09:03:10
Quarterly tax reporting is here – is HMRC ready?,TechRadar,https://www.techradar.com/pro/quarterly-tax-reporting-is-here-is-hmrc-ready,2026-06-03 09:03:10
Delivering AI systems enterprise users can’t live without,TechRadar,https://www.techradar.com/pro/delivering-ai-systems-enterprise-users-cant-live-without,2026-06-03 09:03:10
