headline,source,link,datetime
Atomic Display Switching: Solving,Hacker News,https://github.com/piot5/displayflow_cli,2026-03-24 19:02:49
Wine 11 rewrites how Linux runs Windows games at kernel with massive speed gains,Hacker News,https://www.xda-developers.com/wine-11-rewrites-linux-runs-windows-games-speed-gains/,2026-03-24 19:02:49
ARM AGI CPU: Specs and SKUs,Hacker News,https://sbcwiki.com/docs/soc-manufacturers/arm/arm-silicon/,2026-03-24 19:02:49
FCC has banned the import of all new foreign-made routers here's what you can do,Hacker News,https://blog.adafruit.com/2026/03/24/fcc-just-banned-the-import-of-all-new-foreign-made-routers-heres-what-you-can-do-about-it/,2026-03-24 19:02:49
Lago (YC S21) Is Hiring,Hacker News,https://getlago.notion.site/Lago-Product-Engineer-AI-Agents-for-Growth-327ef63110d280cdb030ccf429d3e4d7?source=copy_link,2026-03-24 19:02:49
Country that put backdoors in Cisco routers to spy on world bans foreign routers,Hacker News,https://www.theregister.com/2026/03/24/fcc_foreign_routers/,2026-03-24 19:02:49
The AI Industry Is Lying to You,Hacker News,https://www.wheresyoured.at/the-ai-industry-is-lying-to-you/,2026-03-24 19:02:49
Arm AGI CPU,Hacker News,https://newsroom.arm.com/blog/introducing-arm-agi-cpu,2026-03-24 19:02:49
"Show HN: Email.md – Markdown to responsive, email-safe HTML",Hacker News,https://www.emailmd.dev/,2026-03-24 19:02:49
Run a 1T parameter model on a 32gb Mac by streaming tensors from NVMe,Hacker News,https://github.com/t8/hypura,2026-03-24 19:02:49
No Terms. No Conditions,Hacker News,https://notermsnoconditions.com,2026-03-24 19:02:49
WolfGuard: WireGuard with FIPS 140-3 cryptography,Hacker News,https://github.com/wolfssl/wolfguard,2026-03-24 19:02:49
Apple Business,Hacker News,https://www.apple.com/newsroom/2026/03/introducing-apple-business-a-new-all-in-one-platform-for-businesses-of-all-sizes/,2026-03-24 19:02:49
"Hypothesis, Antithesis, Synthesis",Hacker News,https://antithesis.com/blog/2026/hegel/,2026-03-24 19:02:49
Major insider trading on oil detected ahead of Iran talks,Hacker News,https://www.wsj.com/livecoverage/stock-market-today-dow-sp-500-nasdaq-03-24-2026/card/mystery-jump-in-oil-trading-ahead-of-trump-post-draws-scrutiny-56sgwdXtlOlonqIKDsL6,2026-03-24 19:02:49
LaGuardia pilots raised safety alarms months before deadly runway crash,Hacker News,https://www.theguardian.com/us-news/2026/mar/24/laguardia-airplane-pilots-safety-concerns-crash,2026-03-24 19:02:49
"Show HN: Gemini can now natively embed video, so I built sub-second video search",Hacker News,https://github.com/ssrajadh/sentrysearch,2026-03-24 19:02:49
So where are all the AI apps?,Hacker News,https://www.answer.ai/posts/2026-03-12-so-where-are-all-the-ai-apps.html,2026-03-24 19:02:49
Your bridge to wealth is being pulled up,Hacker News,https://danielhomola.com/m%20&%20e/ai/your-bridge-to-wealth-is-being-pulled-up/,2026-03-24 19:02:49
"io_uring, libaio performance across Linux kernels and an unexpected IOMMU trap",Hacker News,https://blog.ydb.tech/how-io-uring-overtook-libaio-performance-across-linux-kernels-and-an-unexpected-iommu-trap-ea6126d9ef14,2026-03-24 19:02:49
Missile Defense Is NP-Complete,Hacker News,https://smu160.github.io/posts/missile-defense-is-np-complete/,2026-03-24 19:02:49
NanoClaw Adopts OneCLI Agent Vault,Hacker News,https://nanoclaw.dev/blog/nanoclaw-agent-vault/,2026-03-24 19:02:49
LiteLLM Python package compromised by supply-chain attack,Hacker News,https://github.com/BerriAI/litellm/issues/24512,2026-03-24 19:02:49
Secure Domain Name System (DNS) Deployment 2026 Guide [pdf],Hacker News,https://nvlpubs.nist.gov/nistpubs/SpecialPublications/NIST.SP.800-81r3.pdf,2026-03-24 19:02:49
Tell HN: Litellm 1.82.7 and 1.82.8 on PyPI are compromised,Hacker News,https://news.ycombinator.com/item?id=47501426,2026-03-24 19:02:49
"God, I hate .env files",Hacker News,https://news.ycombinator.com/item?id=47501386,2026-03-24 19:02:49
Nanobrew: The fastest macOS package manager compatible with brew,Hacker News,https://nanobrew.trilok.ai/,2026-03-24 19:02:49
Israel's Defense Innovation Industrial Base,Hacker News,https://www.israeltechinsider.com/p/inside-israels-defense-innovation,2026-03-24 19:02:49
ICE: $45 an Hour to Stand There. TSA: $0 an Hour to Keep You Safe,Hacker News,https://botonomous.ai/featured/government_shutdown/article-v2.html,2026-03-24 19:02:49
Debunking Zswap and Zram Myths,Hacker News,https://chrisdown.name/2026/03/24/zswap-vs-zram-when-to-use-what.html,2026-03-24 19:02:49
LLM Neuroanatomy II: Modern LLM Hacking and Hints of a Universal Language?,Hacker News,https://dnhkng.github.io/posts/rys-ii/,2026-03-24 19:02:49
curl > /dev/sda: How I made a Linux distro that runs wget | dd,Hacker News,https://astrid.tech/2026/03/24/0/curl-to-dev-sda/,2026-03-24 19:02:49
"Microsoft's ""Fix"" for Windows 11: Flowers After the Beating",Hacker News,https://www.sambent.com/microsofts-plan-to-fix-windows-11-is-gaslighting/,2026-03-24 19:02:49
"March, 19-21: God is a comedian",Hacker News,https://no01.substack.com/p/march-19-21-god-is-a-comedian,2026-03-24 19:02:49
"MagicAudio – Free Noise, Echo and Background Music Remover",Hacker News,https://magicaudio.pro/,2026-03-24 19:02:49
Opera: Rewind The Web to 1996 (Opera at 30),Hacker News,https://www.web-rewind.com,2026-03-24 19:02:49
Show HN: ProofShot – Give AI coding agents eyes to verify the UI they build,Hacker News,https://github.com/AmElmo/proofshot,2026-03-24 19:02:49
Show HN: ProofShot – Give AI coding agents eyes to verify the UI they build,Hacker News,https://proofshot.argil.io/,2026-03-24 19:02:49
systemd has not implemented age verification,Hacker News,https://blog.bofh.it/debian/id_473,2026-03-24 19:02:49
"Ripgrep is faster than {grep, ag, Git grep, ucg, pt, sift}",Hacker News,https://burntsushi.net/ripgrep/,2026-03-24 19:02:49
Pool spare GPU capacity to run LLMs at larger scale,Hacker News,https://github.com/michaelneale/mesh-llm,2026-03-24 19:02:49
Log File Viewer for the Terminal,Hacker News,https://lnav.org/,2026-03-24 19:02:49
"Microsoft blocks trick to unlock native NVMe driver, but workarounds still exist",Hacker News,https://www.tomshardware.com/software/windows/microsoft-blocks-the-registry-hack-trick-that-unlocked-native-nvme-performance-on-windows-11,2026-03-24 19:02:49
Box of Secrets: Discreetly modding an apartment intercom with Matter,Hacker News,https://www.jackhogan.me/blog/box-of-secrets/,2026-03-24 19:02:49
Cuba's Fragile Power Grid Finds a Powerful New Partner,Hacker News,https://oilprice.com/Energy/Energy-General/Cubas-Fragile-Power-Grid-Finds-a-Powerful-New-Partner.html,2026-03-24 19:02:49
US bans new foreign-made consumer Internet routers,Hacker News,https://www.bbc.com/news/articles/c74787w149zo,2026-03-24 19:02:49
Ubisoft's Death by a Thousand Cuts,Hacker News,https://www.thegamebusiness.com/p/ubisofts-death-by-a-thousand-cuts,2026-03-24 19:02:49
Sunsetting the Techempower Framework Benchmarks,Hacker News,https://github.com/TechEmpower/FrameworkBenchmarks/issues/10932,2026-03-24 19:02:49
Epoch confirms GPT5.4 Pro solved a Frontier Math Open Problem for the first time,Hacker News,https://epoch.ai/frontiermath/open-problems/ramsey-hypergraphs,2026-03-24 19:02:49
I Created My First AI-Assisted Pull Request and I Feel Like a Fraud,Hacker News,https://nelson.cloud/i-created-my-first-ai-assisted-pull-request-and-i-feel-like-a-fraud/,2026-03-24 19:02:49
"No, Windows Start does not use React",Hacker News,https://pathar.tl/blog/no-windows-start-does-not-use-react/,2026-03-24 19:02:49
"AI boom risks widening wealth divide, says BlackRock's Larry Fink",Hacker News,https://www.theguardian.com/technology/2026/mar/23/ai-boom-risks-widening-wealth-divide-blackrock-larry-fink,2026-03-24 19:02:49
Pentagon Adopts New Limits for Journalists After Court Loss,Hacker News,https://www.nytimes.com/2026/03/23/business/media/pentagon-closes-journalists-work-area.html,2026-03-24 19:02:49
Study: Workers who fall for 'corporate bullshit' may be worse at their jobs,Hacker News,https://www.theguardian.com/business/2026/mar/23/corporate-speak-study,2026-03-24 19:02:49
Windows 3.1 tiled background .bmp archive,Hacker News,https://github.com/andreasjansson/win-3.1-backgrounds,2026-03-24 19:02:49
IRIX 3dfx Voodoo driver and glide2x IRIX port,Hacker News,https://sdz-mods.com/index.php/2026/03/23/irix-3dfx-voodoo-driver-glide2x-irix-port/,2026-03-24 19:02:49
Nvidia CEO Jensen Huang says 'I think we've achieved AGI',Hacker News,https://www.theverge.com/ai-artificial-intelligence/899086/jensen-huang-nvidia-agi,2026-03-24 19:02:49
"FCC adds ""routers produced in foreign countries"" to covered list [pdf]",Hacker News,https://docs.fcc.gov/public/attachments/DA-26-278A1.pdf,2026-03-24 19:02:49
Talking Liquid Glass with Apple,Hacker News,https://captainswiftui.substack.com/p/talking-liquid-glass-with-apple,2026-03-24 19:02:49
Hacker Mints $80M USD Worth of USR Stablecoins,Hacker News,https://bfmtimes.com/hacker-mints-80-million-worth-of-fake-stablecoins-and-swaps-them-for-eth/,2026-03-24 19:02:49
The Resolv hack: How one compromised key printed $23M,Hacker News,https://www.chainalysis.com/blog/lessons-from-the-resolv-hack/,2026-03-24 19:02:49
FCC Adds Routers Produced in Foreign Countries to Covered List,Hacker News,https://www.fcc.gov/document/fcc-adds-routers-produced-foreign-countries-covered-list,2026-03-24 19:02:49
"Chat GPT 5.2 cannot explain the German word ""geschniegelt""",Hacker News,https://old.reddit.com/r/ChatGPT/comments/1r4goxh/chat_gpt_52_cannot_explain_the_word_geschniegelt/,2026-03-24 19:02:49
Printable Claude Code Cheat Sheet (auto-updated daily),Hacker News,https://cc.storyfox.cz,2026-03-24 19:02:49
FCC Updates Covered List to Include Foreign-Made Consumer Routers,Hacker News,https://www.fcc.gov/document/fcc-updates-covered-list-include-foreign-made-consumer-routers,2026-03-24 19:02:49
The Minimalist Entrepreneur – Claude Code Skills,Hacker News,https://github.com/slavingia/skills,2026-03-24 19:02:49
"Flipper Zero, Everyone's Favorite Legally Dubious Hacker Tool, Gets AI Upgrade",Hacker News,https://gizmodo.com/flipper-zero-everyones-favorite-legally-dubious-hacker-tool-gets-an-ai-upgrade-2000736967,2026-03-24 19:02:49
How I'm Productive with Claude Code,Hacker News,https://neilkakkar.com/productive-with-claude-code.html,2026-03-24 19:02:49
The Treasury just declared the U.S. insolvent,Hacker News,https://fortune.com/2026/03/23/us-government-insolvent-fiscal-crisis-fix/,2026-03-24 19:02:49
A retro terminal music player inspired by Winamp,Hacker News,https://github.com/bjarneo/cliamp,2026-03-24 19:02:49
Next-generation electricity is almost here,Hacker News,https://www.gatesnotes.com/work/accelerate-energy-innovation/reader/the-next-generation-of-electricity-is-almost-here,2026-03-24 19:02:49
"Bets on US-Iran ceasefire show signs of insider knowledge, say experts",Hacker News,https://www.theguardian.com/us-news/2026/mar/23/bets-us-iran-ceasefire-show-signs-of-insider-knowledge-say-experts-polymarket,2026-03-24 19:02:49
American Aviation Is Near Collapse,Hacker News,https://www.theatlantic.com/newsletters/2026/03/aviation-failures-tsa-dhs-shutdown/686505/,2026-03-24 19:02:49
"The Lego Game Boy makes for a great gift, and it’s $10 off today",The Verge,https://www.theverge.com/gadgets/899688/lego-game-boy-set-nintendo-handheld-kohls-deal-sale,2026-03-24 19:02:49
The Apple Watch SE 3 is even easier to recommend at $50 off,The Verge,https://www.theverge.com/gadgets/899671/apple-watch-se-third-generation-deal-sale,2026-03-24 19:02:49
ChatGPT and Gemini are fighting to be the AI bot that sells you stuff,The Verge,https://www.theverge.com/ai-artificial-intelligence/899677/openai-google-gemini-ai-shopping-features,2026-03-24 19:02:49
"Welp, I bought an iPhone again",The Verge,https://www.theverge.com/tech/899602/best-phone-android-ios-app-store,2026-03-24 19:02:49
A BlackBerry you might actually want just landed on Kickstarter,The Verge,https://www.theverge.com/tech/899632/unihertz-titan-2-elite-pro-android-blackberry-smartphone-pricing-kickstarter-preorder,2026-03-24 19:02:49
Google’s Android Automotive is moving from the dashboard to the ‘brain’ of the car,The Verge,https://www.theverge.com/tech/899034/google-android-automotive-os-software-defined-vehicle,2026-03-24 19:02:49
Life is Strange: Reunion is a full-circle moment for its stars,The Verge,https://www.theverge.com/entertainment/897984/life-is-strange-reunion-cast-interview,2026-03-24 19:02:49
Apple Maps will introduce ads this summer,The Verge,https://www.theverge.com/tech/899597/apple-maps-ads-launch-summer-2026,2026-03-24 19:02:49
Pokémon Champions is coming to the Nintendo Switch on April 8th,The Verge,https://www.theverge.com/games/899535/pokemon-champions-is-coming-to-the-nintendo-switch-on-april-8th,2026-03-24 19:02:49
Meta’s reckoning over kids safety is in the hands of two juries,The Verge,https://www.theverge.com/policy/899494/meta-new-mexico-los-angeles-kids-safety-jury-trial,2026-03-24 19:02:49
"Fortnite maker Epic is laying off over 1,000 workers",The Verge,https://www.theverge.com/games/899529/epic-games-layoffs-fortnite,2026-03-24 19:02:49
"John Deere, Garmin, and Philips may have undermined military right to repair",The Verge,https://www.theverge.com/policy/899471/military-right-to-repair-john-deere-philips-garmin,2026-03-24 19:02:49
For All Mankind will end with season 6,The Verge,https://www.theverge.com/streaming/899327/for-all-mankind-season-6-renewal-apple-tv,2026-03-24 19:02:49
The MPC Sample is my new favorite portable beat maker,The Verge,https://www.theverge.com/entertainment/899233/akai-mpc-sample-review,2026-03-24 19:02:49
Anthropic’s Claude Code and Cowork can control your computer,The Verge,https://www.theverge.com/ai-artificial-intelligence/899430/anthropic-claude-code-cowork-ai-control-computer,2026-03-24 19:02:49
Ayaneo says selling its Windows gaming handheld ‘is no longer sustainable’,The Verge,https://www.theverge.com/games/899357/ayaneo-windows-gaming-handheld-sustainable-ram,2026-03-24 19:02:49
Zoox is bringing its robotaxis to Austin and Miami,The Verge,https://www.theverge.com/transportation/899323/zoox-robotaxi-las-vegas-san-francisco-austin-miami,2026-03-24 19:02:49
The Hisense U7SG is a great midrange TV you shouldn’t buy yet,The Verge,https://www.theverge.com/tech/899160/hisense-u7sg-tv-review,2026-03-24 19:02:49
Nuki adds Apple Home Key to its smart lock,The Verge,https://www.theverge.com/tech/899330/nuki-keypad-2-nfc-aliro-apple-homekey-launch,2026-03-24 19:02:49
Nintendo cuts Switch 2 production amid weakening console sales,The Verge,https://www.theverge.com/games/899291/nintendo-switch-2-production-cut-weak-us-sales,2026-03-24 19:02:49
The US government just banned consumer routers made outside the US,The Verge,https://www.theverge.com/news/899172/fcc-foreign-router-ban,2026-03-24 19:02:49
"The kid-friendly Fitbit Ace is $100, which matches its best price",The Verge,https://www.theverge.com/gadgets/899134/fitbit-ace-amazon-big-spring-sale-2026-deal,2026-03-24 19:02:49
Kalshi says it will block politicians and athletes from trading in markets they’re tied to,The Verge,https://www.theverge.com/tech/899097/kalshi-politicians-athletes-insider-trading-blocked,2026-03-24 19:02:49
"Google’s new Pixel 10 ads made me go ‘wait, WHAT are they trying to sell?’",The Verge,https://www.theverge.com/tech/898992/google-pixel-10-ads-moving-on-stalker-lying-beach-view-100-zoom,2026-03-24 19:02:49
Nvidia CEO Jensen Huang says ‘I think we’ve achieved AGI’,The Verge,https://www.theverge.com/ai-artificial-intelligence/899086/jensen-huang-nvidia-agi,2026-03-24 19:02:49
Two of my favorite color e-book readers are the cheapest they’ve been in months,The Verge,https://www.theverge.com/gadgets/899019/kindle-colorsoft-kobo-libra-colour-ebook-reader-amazon-big-spring-sale-2026-deal,2026-03-24 19:02:49
Three new Gemini features come to Google TV,Engadget,https://www.engadget.com/entertainment/streaming/three-new-gemini-features-come-to-google-tv-175724155.html?src=rss,2026-03-24 19:02:49
Apple confirms ads are coming to Apple Maps,Engadget,https://www.engadget.com/apps/apple-confirms-ads-are-coming-to-apple-maps-175613751.html?src=rss,2026-03-24 19:02:49
For All Mankind is returning for a sixth and final season,Engadget,https://www.engadget.com/entertainment/tv-movies/for-all-mankind-is-returning-for-a-sixth-and-final-season-173859683.html?src=rss,2026-03-24 19:02:49
"iOS 26.4 is here, with Playlist Playground and new emoji",Engadget,https://www.engadget.com/mobile/ios-264-is-here-with-playlist-playground-and-new-emoji-171343120.html?src=rss,2026-03-24 19:02:49
Bandsintown integration for concerts is coming to Apple Music,Engadget,https://www.engadget.com/entertainment/music/bandsintown-integration-for-concerts-is-coming-to-apple-music-170034229.html?src=rss,2026-03-24 19:02:49
Pokémon Champions will hit Switch and Switch 2 on April 8,Engadget,https://www.engadget.com/gaming/nintendo/pokemon-champions-will-hit-switch-and-switch-2-on-april-8-165737121.html?src=rss,2026-03-24 19:02:49
The Punisher's one-off TV special hits Disney+ on May 12,Engadget,https://www.engadget.com/entertainment/tv-movies/the-punishers-one-off-tv-special-hits-disney-on-may-12-162208769.html?src=rss,2026-03-24 19:02:49
"There's a new Payday game, this time in VR",Engadget,https://www.engadget.com/gaming/theres-a-new-payday-game-this-time-in-vr-160051276.html?src=rss,2026-03-24 19:02:49
"Epic is laying off more than 1,000 workers, citing a downturn in Fortnite engagement",Engadget,https://www.engadget.com/gaming/epic-is-laying-off-more-than-1000-workers-citing-a-downturn-in-fortnite-engagement-154436905.html?src=rss,2026-03-24 19:02:49
Samsung's cheaper Mini LED TVs are now on sale,Engadget,https://www.engadget.com/home/home-theater/samsungs-cheaper-mini-led-tvs-are-now-on-sale-150034289.html?src=rss,2026-03-24 19:02:49
Akai just released a portable and relatively budget-friendly MPC sampler,Engadget,https://www.engadget.com/audio/akai-just-released-a-portable-and-relatively-budget-friendly-mpc-sampler-140047113.html?src=rss,2026-03-24 19:02:49
Ultrahuman opens US pre-orders for Ring Pro,Engadget,https://www.engadget.com/wearables/ultrahuman-opens-us-pre-orders-for-ring-pro-130043933.html?src=rss,2026-03-24 19:02:49
Spotify's SongDNA can tell you all about the track you're listening to,Engadget,https://www.engadget.com/apps/spotifys-songdna-can-tell-you-all-about-the-track-youre-listening-to-130000809.html?src=rss,2026-03-24 19:02:49
The Morning After: WWDC 2026 is happening June 8th,Engadget,https://www.engadget.com/general/the-morning-after-engadget-newsletter-121555441.html?src=rss,2026-03-24 19:02:49
Snapchat users sent 'nearly' 2 trillion snaps in 2025,Engadget,https://www.engadget.com/social-media/snapchat-users-sent-nearly-2-trillion-snaps-in-2025-121500274.html?src=rss,2026-03-24 19:02:49
"Denon expands its multi-room speaker lineup with the Home 200, Home 400 and Home 600",Engadget,https://www.engadget.com/audio/speakers/denon-expands-its-multi-room-speaker-lineup-with-the-home-200-home-400-and-home-600-080000916.html?src=rss,2026-03-24 19:02:49
The US bans all new foreign-made network routers,Engadget,https://www.engadget.com/big-tech/the-us-bans-all-new-foreign-made-network-routers-223622966.html?src=rss,2026-03-24 19:02:49
Claude Code and Cowork can now use your computer,Engadget,https://www.engadget.com/ai/claude-code-and-cowork-can-now-use-your-computer-210000126.html?src=rss,2026-03-24 19:02:49
EA is nuking Battlefield Hardline on consoles,Engadget,https://www.engadget.com/gaming/ea-is-nuking-battlefield-hardline-on-consoles-193321551.html?src=rss,2026-03-24 19:02:49
"Samsung reveals its cheaper mini-LED TVs for 2026 — and it’s dropping QLED on some of them, I kid you not",TechRadar,https://www.techradar.com/televisions/samsung-reveals-its-cheaper-mini-led-tvs-for-2026-and-its-dropping-qled-on-some-of-them-i-kid-you-not,2026-03-24 19:02:50
Acer Swift Edge 14 AI laptop review: Another lightweight wonder from the Acer stable,TechRadar,https://www.techradar.com/pro/acer-swift-edge-14-ai-laptop-review-another-lightweight-wonder-from-the-acer-stable,2026-03-24 19:02:50
"Epic Games is laying off more than 1,000 employees just weeks after raising Fortnite V-Buck prices 'to help pay the bills'",TechRadar,https://www.techradar.com/gaming/gaming-industry/epic-games-is-laying-off-more-than-1-000-employees-just-weeks-after-raising-fortnite-v-buck-prices-to-help-pay-the-bills,2026-03-24 19:02:50
"Surfshark launches HeyPolo, a privacy-first location sharing app to kill ""always-on"" tracking",TechRadar,https://www.techradar.com/vpn/vpn-services/surfshark-launches-heypolo-a-privacy-first-location-sharing-app-to-kill-always-on-tracking,2026-03-24 19:02:50
"Capcom isn't completely abandoning generative AI, but has promised fans it won't use AI assets in games",TechRadar,https://www.techradar.com/gaming/capcom-isnt-completely-abandoning-generative-ai-but-has-promised-fans-it-wont-use-ai-assets-in-games,2026-03-24 19:02:50
'Traces of unauthorized access': Mazda confirms data breach exposing employee and partner data — here's what we know,TechRadar,https://www.techradar.com/pro/security/traces-of-unauthorized-access-mazda-confirms-data-breach-that-exposed-employee-and-partner-data,2026-03-24 19:02:50
"Fine, I'll buy another copy of Clair Obscur Expedition 33 to snag this special Mirror Edition",TechRadar,https://www.techradar.com/gaming/fine-ill-buy-another-copy-of-clair-obscur-expedition-33-to-snag-this-special-mirror-edition,2026-03-24 19:02:50
"Stop telling AI it's an expert programmer, you're making it worse at its job — new research shows the best results need specific prompts",TechRadar,https://www.techradar.com/pro/stop-telling-ai-its-an-expert-programmer-youre-making-it-worse-at-its-job-new-research-shows-the-best-results-need-specific-prompts,2026-03-24 19:02:50
"'Welcome back, Frank': Marvel confirms the official title for The Punisher TV Special on Disney+ — and it'll be released a week after the Daredevil: Born Again season 2 finale",TechRadar,https://www.techradar.com/streaming/disney-plus/welcome-back-frank-marvel-confirms-the-official-title-for-the-punisher-tv-special-on-disney-and-itll-be-released-a-week-after-the-daredevil-born-again-season-2-finale,2026-03-24 19:02:50
Best website builders,TechRadar,https://www.techradar.com/best/best-website-builders,2026-03-24 19:02:50
"I’m a big fan of FlexiSpot’s single monitor arm for freeing up desk space, and it’s just $30 in Amazon’s Spring Sale",TechRadar,https://www.techradar.com/pro/im-a-big-fan-of-flexispots-single-monitor-arm-for-freeing-up-desk-space-and-its-just-usd30-in-amazons-spring-sale,2026-03-24 19:02:50
Xbox indie program lead says Project Helix will be 'easier' for developers and that Microsoft is 'working hard so developers can make one Xbox build in the future' that will run on everything,TechRadar,https://www.techradar.com/gaming/xbox-indie-program-lead-says-project-helix-will-be-easier-for-developers-and-that-microsoft-is-working-hard-so-developers-can-make-one-xbox-build-in-the-future-that-will-run-on-everything,2026-03-24 19:02:50
I trapped a clone of my boss on a desert island in Tomodachi Life: Living the Dream — and it only got weirder from there,TechRadar,https://www.techradar.com/gaming/tomodachi-life-living-the-dream-preview,2026-03-24 19:02:50
Two streaming services are better than one — this is your last chance to score this Disney+ and Hulu bundle and pay $15 for three months,TechRadar,https://www.techradar.com/streaming/disney-plus/two-streaming-services-are-better-than-one-this-is-your-last-chance-to-score-this-disney-and-hulu-bundle-and-pay-usd15-for-three-months,2026-03-24 19:02:50
Louisiana researchers have made a nail polish that turns your fingernail into a phone stylus to solve ‘zombie finger’ problems,TechRadar,https://www.techradar.com/phones/louisiana-researchers-have-made-a-nail-polish-that-turns-your-fingernail-into-a-phone-stylus-to-solve-zombie-finger-problems,2026-03-24 19:02:50
Boost internet speeds from $87 with 6 super-fast TP-Link Wi-Fi 7 router deals in Amazon's early Spring Sale,TechRadar,https://www.techradar.com/pro/boost-internet-speeds-from-usd87-with-6-super-fast-tp-link-wi-fi-7-router-deals-in-amazons-early-spring-sale,2026-03-24 19:02:50
How to watch Power: The Downfall of Huw Edwards online from anywhere — it's *FREE*,TechRadar,https://www.techradar.com/how-to-watch/power-the-downfall-of-huw-edwards-free,2026-03-24 19:02:50
"Nvidia RTX 5090 buyer is literally cleaned out as box contains no GPU, just laundry detergent — a reminder to be careful out there",TechRadar,https://www.techradar.com/computing/gpu/nvidia-rtx-5090-buyer-is-literally-cleaned-out-as-box-contains-no-gpu-just-laundry-detergent-a-reminder-to-be-careful-out-there,2026-03-24 19:02:50
Exclusive: Get 4 months extra + up to $50 Amazon gift card with NordVPN,TechRadar,https://www.techradar.com/vpn/vpn-services/exclusive-get-4-months-extra-up-to-usd50-amazon-gift-card-with-nordvpn,2026-03-24 19:02:50
How AI is reshaping compliance: Why governance still matters,TechRadar,https://www.techradar.com/pro/how-ai-is-reshaping-compliance-why-governance-still-matters,2026-03-24 19:02:50
Oracle is revamping how businesses procure AI agents — leave the invoices to AI while you handle the negotiations,TechRadar,https://www.techradar.com/pro/oracle-is-revamping-how-businesses-procure-ai-agents-leave-the-invoices-to-ai-while-you-handle-the-negotiations,2026-03-24 19:02:50
How AI will collide with data readiness,TechRadar,https://www.techradar.com/pro/how-ai-will-collide-with-data-readiness,2026-03-24 19:02:50
Regional data sovereignty in the age of AI: Balancing innovation and regulation,TechRadar,https://www.techradar.com/pro/regional-data-sovereignty-in-the-age-of-ai-balancing-innovation-and-regulation,2026-03-24 19:02:50
