headline,source,link,datetime
TanStack NPM Packages Compromised,Hacker News,https://github.com/TanStack/router/issues/7383,2026-05-11 22:02:51
I let AI build a tool to help me figure out what was waking me up at night,Hacker News,https://martin.sh/i-let-ai-build-a-tool-to-help-me-figure-out-what-was-waking-me-up-at-night/,2026-05-11 22:02:51
"'All modern operating systems do this, including macOS and Linux': Microsoft exec fires back at critics accusing it of 'cheating' with Windows 11 speed boost feature",TechRadar,https://www.techradar.com/computing/windows/all-modern-operating-systems-do-this-including-macos-and-linux-microsoft-exec-fires-back-at-critics-accusing-it-of-cheating-with-windows-11-speed-boost-feature,2026-05-11 22:02:52
New water-powered tech could power batteries that can last hundreds of years without degrading — and are so safe that the electrolytes can be used as 'tofu-brine' for home cooking,TechRadar,https://www.techradar.com/pro/water-powered-tech-could-power-batteries-that-can-last-hundreds-of-years-without-degrading-and-are-so-safe-that-the-electrolytes-can-be-used-as-tofu-brine-for-home-cooking,2026-05-11 22:02:52
TikTok is going ad-free in the UK — if you pay £3.99 a month for it,TechRadar,https://www.techradar.com/computing/tiktok/tiktok-is-going-ad-free-in-the-uk-if-you-pay-gbp3-99-a-month-for-it,2026-05-11 22:02:52
