headline,source,link,datetime
Gun Mistakes in Fiction Writing: Handgun Edition,Hacker News,https://www.swiftsilentdeadly.com/blog/gun-mistakes-in-fiction-writing-handgun-edition,2026-07-03 12:03:01
"Ed Zitron on CNBC: GenAI Doesn't Work, and Big Tech Is Out of Hypergrowth Ideas",Hacker News,https://www.youtube.com/watch?v=TtmPccUTDP8,2026-07-03 12:03:01
A behind-the-scenes look at Midjourney’s medical scanner leaves many questions unanswered,The Verge,https://www.theverge.com/ai-artificial-intelligence/961265/midjourney-medical-ultrasound-scanner-behind-the-scenes-video,2026-07-03 12:03:01
Sony already invested $34 million to repurpose its EU PlayStation disc factory,Engadget,https://www.engadget.com/2207546/sony-repurposing-austrian-playstation-disc-factory/,2026-07-03 12:03:01
New report claims companies which embrace AI also add more workers (eventually),TechRadar,https://www.techradar.com/pro/new-report-claims-companies-which-embrace-ai-also-add-more-workers-eventually,2026-07-03 12:03:01
Xerox C255a review:  I much prefer Xerox’s reboot of Lexmark’s laser printer,TechRadar,https://www.techradar.com/pro/xerox-c255a-laser-printer-review,2026-07-03 12:03:01
Apple's iPhone Ultra could raise foldable prices by almost 20% — no wonder Samsung isn't scared of its arrival,TechRadar,https://www.techradar.com/phones/iphone/apples-iphone-ultra-could-raise-foldable-prices-by-almost-20-percent-no-wonder-samsung-isnt-scared-of-its-arrival,2026-07-03 12:03:01
