headline,source,link,datetime
SFO Quiet Airport (2025),Hacker News,https://viewfromthewing.com/san-francisco-airport-removed-90-minutes-of-daily-noise-travelers-say-it-changed-everything/,2026-04-24 19:02:49
OpenAI releases GPT-5.5 and GPT-5.5 Pro in the API,Hacker News,https://developers.openai.com/api/docs/changelog,2026-04-24 19:02:49
Google plans to invest even more money into Anthropic,Engadget,https://www.engadget.com/ai/google-plans-to-invest-even-more-money-into-anthropic-185000776.html?src=rss,2026-04-24 19:02:49
Singapore police arrest alleged The Legend of Aang: The Last Airbender leaker,Engadget,https://www.engadget.com/entertainment/streaming/singapore-police-arrest-alleged-the-legend-of-aang-the-last-airbender-leaker-183954803.html?src=rss,2026-04-24 19:02:49
'We will be taking action to protect American innovation': White House accuses China of 'systematically' extracting American AI technologies,TechRadar,https://www.techradar.com/pro/security/we-will-be-taking-action-to-protect-american-innovation-white-house-accuses-china-of-systematically-extracting-american-ai-technologies,2026-04-24 19:02:49
