headline,source,link,datetime
New York City hospitals drop Palantir as controversial AI firm expands in UK,Hacker News,https://www.theguardian.com/technology/2026/mar/26/new-york-hospitals-palantir-ai,2026-03-26 21:03:01
We Haven't Seen the Worst of What Gambling and Prediction Markets Will Do,Hacker News,https://www.derekthompson.org/p/we-havent-seen-the-worst-of-what,2026-03-26 21:03:01
How much precision can you squeeze out of a table?,Hacker News,https://www.johndcook.com/blog/2026/03/26/table-precision/,2026-03-26 21:03:01
CERN to host Europe's flagship open access publishing platform,Hacker News,https://home.cern/news/news/cern/cern-host-europes-flagship-open-access-publishing-platform,2026-03-26 21:03:01
"Show HN: Layerleak – Like Trufflehog, but for Docker Hub",Hacker News,https://github.com/Brumbelow/layerleak,2026-03-26 21:03:01
Show HN: Turbolite – a SQLite VFS serving sub-250ms cold JOIN queries from S3,Hacker News,https://github.com/russellromney/turbolite,2026-03-26 21:03:01
"John Bradley, author of xv, has passed away",Hacker News,https://voxday.net/2026/03/25/rip-john-bradley/,2026-03-26 21:03:01
"John Bradley, author of xv, has passed away",Hacker News,https://gab.com/markofafreeman/posts/116290669616400528,2026-03-26 21:03:01
Taming LLMs: Using Executable Oracles to Prevent Bad Code,Hacker News,https://john.regehr.org/writing/zero_dof_programming.html,2026-03-26 21:03:01
Colibri – chat platform built on the AT Protocol for communities big and small,Hacker News,https://colibri.social/,2026-03-26 21:03:01
The Oxford Comma – Why and Why Not,Hacker News,https://www.deborahcourtbooks.com/post/the-oxford-comma-why-and-why-not,2026-03-26 21:03:01
Building a Blog with Elixir and Phoenix,Hacker News,https://jola.dev/posts/building-a-blog-with-elixir-and-phoenix,2026-03-26 21:03:01
OpenTelemetry Profiles Enters Public Alpha,Hacker News,https://opentelemetry.io/blog/2026/profiles-alpha/,2026-03-26 21:03:01
Stripe Projects: Provision and manage services from the CLI,Hacker News,https://projects.dev/,2026-03-26 21:03:01
Show HN: Claude skill that evaluates B2B vendors by talking to their AI agents,Hacker News,https://github.com/salespeak-ai/buyer-eval-skill,2026-03-26 21:03:01
My minute-by-minute response to the LiteLLM malware attack,Hacker News,https://futuresearch.ai/blog/litellm-attack-transcript/,2026-03-26 21:03:01
"French e, è, é, ê, ë – what's the difference?",Hacker News,https://jakubmarian.com/french-e-e-e-e-e-whats-the-difference/,2026-03-26 21:03:01
Intel Announces Arc Pro B70 and Arc Pro B65 GPUs,Hacker News,https://www.techpowerup.com/347703/intel-announces-arc-pro-b70-and-arc-pro-b65-gpus-maxes-out-xe2-battlemage-architecture,2026-03-26 21:03:01
Meta and YouTube Found Negligent in Social-Media Addiction Trial,Hacker News,https://www.wsj.com/tech/personal-tech/meta-and-youtube-found-negligent-in-social-media-addiction-trial-35b2830d,2026-03-26 21:03:01
Newly purchased Vizio TVs now require Walmart accounts to use smart features,Hacker News,https://arstechnica.com/gadgets/2026/03/newly-purchased-vizio-tvs-now-require-walmart-accounts-to-use-smart-features/,2026-03-26 21:03:01
Olympic Committee bars transgender athletes from women’s events,Hacker News,https://www.nytimes.com/2026/03/26/world/olympics/ioc-transgender-athletes-ban.html,2026-03-26 21:03:01
Show HN: Agent Skill Harbor – a GitHub-native skill platform for teams,Hacker News,https://news.ycombinator.com/item?id=47530391,2026-03-26 21:03:01
"Asbestos, talc, and The Lancet's 1977 publication",Hacker News,https://www.thelancet.com/journals/lancet/article/PIIS0140-6736%2826%2900558-1/fulltext,2026-03-26 21:03:01
"Moving from GitHub to Codeberg, for lazy people",Hacker News,https://unterwaditzer.net/2025/codeberg.html,2026-03-26 21:03:01
"Marriage over, €100k down; AI users whose lives were wrecked by delusion",Hacker News,https://www.theguardian.com/lifeandstyle/2026/mar/26/ai-chatbot-users-lives-wrecked-by-delusion,2026-03-26 21:03:01
European Parliament decided that Chat Control 1.0 must stop,Hacker News,https://bsky.app/profile/tuta.com/post/3mhxkfowv322c,2026-03-26 21:03:01
"End of ""Chat Control"": EU Parliament Stops Mass Surveillance in Voting Thriller",Hacker News,https://www.patrick-breyer.de/en/end-of-chat-control-eu-parliament-stops-mass-surveillance-in-voting-thriller-paving-the-way-for-genuine-child-protection/,2026-03-26 21:03:01
"Landmark L.A. jury verdict finds Instagram, YouTube were designed to addict kids",Hacker News,https://www.latimes.com/california/story/2026-03-25/social-media-lawsuit-trial-meta-google-verdict,2026-03-26 21:03:01
Show HN: Relay – The open-source Claude Cowork for OpenClaw,Hacker News,https://github.com/SeventeenLabs/relay,2026-03-26 21:03:01
LibreOffice and the Art of Overreacting,Hacker News,https://blog.documentfoundation.org/blog/2026/03/25/libreoffice-and-the-art-of-overreacting/,2026-03-26 21:03:01
Why Sora Failed: $15M/day inference cost vs. $2.1M lifetime revenue,Hacker News,https://www.revolutioninai.com/2026/03/%20chatgpt-gpt-54-mini-silent-switch-march-2026.html,2026-03-26 21:03:01
You probably don't want to buy a retro console,Hacker News,https://medium.com/@razorbeamz/you-probably-dont-want-to-buy-a-retro-console-a-guide-for-people-who-aren-t-freaks-90031659bd21,2026-03-26 21:03:01
Swift 6.3 Released,Hacker News,https://www.swift.org/blog/swift-6.3-released/,2026-03-26 21:03:01
Ashby (YC W19) Is Hiring Engineers Who Make Product Decisions,Hacker News,https://www.ashbyhq.com/careers?ashby_jid=c3c7125d-7883-4dff-a2bf-f5a55de4a364&utm_source=hn,2026-03-26 21:03:01
Data is everywhere. The government is buying it without a warrant,Hacker News,https://www.npr.org/2026/03/25/nx-s1-5752369/ice-surveillance-data-brokers-congress-anthropic,2026-03-26 21:03:01
Show HN: Orloj – agent infrastructure as code (YAML and GitOps),Hacker News,https://github.com/OrlojHQ/orloj,2026-03-26 21:03:01
Squirrel seen 'vaping' in London park,Hacker News,https://www.telegraph.co.uk/news/2026/03/23/squirrel-seen-vaping-in-london-park/,2026-03-26 21:03:01
Show HN: Robust LLM Extractor for Websites in TypeScript,Hacker News,https://github.com/lightfeed/extractor,2026-03-26 21:03:01
Obsolete Sounds,Hacker News,https://citiesandmemory.com/obsolete-sounds/,2026-03-26 21:03:01
The Last Contract: William T. Vollmann's Battle to Publish an Epic (2025),Hacker News,https://www.metropolitanreview.org/p/the-last-contract,2026-03-26 21:03:01
The Cassandra of 'The Machine',Hacker News,https://www.thenewatlantis.com/publications/the-cassandra-of-the-machine,2026-03-26 21:03:01
Show HN: Nit – I rebuilt Git in Zig to save AI agents 71% on tokens,Hacker News,https://justfielding.com/blog/nit-replacing-git-with-zig,2026-03-26 21:03:01
False claims in a widely-cited paper,Hacker News,https://statmodeling.stat.columbia.edu/2026/03/24/false-claims-in-a-published-no-corrections-no-consequences-welcome-to-the-business-school/,2026-03-26 21:03:01
False claims in a widely-cited paper. No corrections. No consequences,Hacker News,https://statmodeling.stat.columbia.edu/2026/03/24/false-claims-in-a-published-no-corrections-no-consequences-welcome-to-the-business-school/?unapproved=2412259&moderation-hash=80fae7fdc82aee50eb3cb14cd8c0b080#comment-2412259,2026-03-26 21:03:01
Shell Tricks That Make Life Easier (and Save Your Sanity),Hacker News,https://blog.hofstede.it/shell-tricks-that-actually-make-life-easier-and-save-your-sanity/,2026-03-26 21:03:01
Woman who never stopped updating her lost dog's chip reunites with him after 11y,Hacker News,https://www.cbc.ca/radio/asithappens/11-year-dog-reunion-9.7140780,2026-03-26 21:03:01
Show HN: A plain-text cognitive architecture for Claude Code,Hacker News,https://lab.puga.com.br/cog/,2026-03-26 21:03:01
"""Disregard That"" Attacks",Hacker News,https://calpaterson.com/disregard.html,2026-03-26 21:03:01
Show HN: Automate your workflow in plain English,Hacker News,https://www.operator23.com/,2026-03-26 21:03:01
Running Tesla Model 3's Computer on My Desk Using Parts from Crashed Cars,Hacker News,https://bugs.xdavidhu.me/tesla/2026/03/23/running-tesla-model-3s-computer-on-my-desk-using-parts-from-crashed-cars/,2026-03-26 21:03:01
Apple’s AI Playlist Playground is bad at music,The Verge,https://www.theverge.com/report/902005/apple-ai-playlist-playground-bad-at-music,2026-03-26 21:03:01
Netflix is raising prices again,The Verge,https://www.theverge.com/streaming/901833/netflix-subscription-pricing-increase-2026,2026-03-26 21:03:01
Google’s ‘live’ AI search assistant can handle conversations in dozens more languages,The Verge,https://www.theverge.com/tech/901816/google-search-live-ai-assistant-expansion,2026-03-26 21:03:01
"Fitbit’s budget-friendly Inspire 3 is $30 off, matching its best price",The Verge,https://www.theverge.com/tech/901765/fitbit-inspire-3-amazon-big-spring-sale-2026-deal,2026-03-26 21:03:01
"Xbox’s latest games showcase had Hades 2, The Expanse, and Bluey",The Verge,https://www.theverge.com/games/901384/xbox-partner-preview-games-news-trailers,2026-03-26 21:03:01
"My brief, weird time with the Samsung TriFold",The Verge,https://www.theverge.com/tech/901525/samsung-galaxy-z-trifold-hands-on-singapore-rom,2026-03-26 21:03:01
Govee’s color-changing smart lamps are on sale for up to 30 percent off,The Verge,https://www.theverge.com/gadgets/901580/govee-rgb-table-lamp-2-pro-speaker-amazon-big-spring-sale-2026-deal,2026-03-26 21:03:01
Meta gets ready to launch two new Ray-Ban AI glasses,The Verge,https://www.theverge.com/column/901314/meta-new-ray-ban-ai-glasses,2026-03-26 21:03:01
Everyone hates Ticketmaster. Why’d Trump go easy on them?,The Verge,https://www.theverge.com/podcast/900540/live-nation-ticketmaster-lawsuit-antitrust-trump-doj-settlement,2026-03-26 21:03:01
Wikipedia bans AI-generated articles,The Verge,https://www.theverge.com/tech/901461/wikipedia-ai-generated-article-ban,2026-03-26 21:03:01
Senators are pushing to find out how much electricity data centers actually use,The Verge,https://www.theverge.com/policy/901404/senators-warren-hawley-eia-letter-data-centers,2026-03-26 21:03:01
Why a two-seater robotaxi makes more sense than you think,The Verge,https://www.theverge.com/transportation/900559/robotaxi-two-seater-tesla-lucid-drag-cost,2026-03-26 21:03:01
Some of our favorite Apple tech is cheaper than ever during Amazon’s Big Spring Sale,The Verge,https://www.theverge.com/gadgets/900953/best-apple-deals-amazon-big-spring-sale-2026,2026-03-26 21:03:01
The versatile Play speaker is a great way into the Sonos world,The Verge,https://www.theverge.com/tech/901105/sonos-play-speaker-review,2026-03-26 21:03:01
Webtoon is adding AI localization tools to its comics platform,The Verge,https://www.theverge.com/ai-artificial-intelligence/899108/webtoon-canvas-ai-translation-localization-yongsoo-kim,2026-03-26 21:03:01
EU backs nude app ban and delays to landmark AI rules,The Verge,https://www.theverge.com/ai-artificial-intelligence/901315/eu-ai-act-delays-ban-nudify-apps,2026-03-26 21:03:01
"DJI’s Avata 360 is a more functional, flexible 360 drone",The Verge,https://www.theverge.com/tech/899735/dji-avata-360-release-date-price-specs-impressions-antigravity-a1-comparison,2026-03-26 21:03:01
OpenAI shelves erotic chatbot ‘indefinitely’,The Verge,https://www.theverge.com/ai-artificial-intelligence/901293/openai-adult-mode-erotic-chatbot-shelved-indefinitely,2026-03-26 21:03:01
Uber aims to launch Europe’s first robotaxi service with Pony AI and Verne,The Verge,https://www.theverge.com/transportation/900656/uber-pony-ai-verne-robotaxi-europe,2026-03-26 21:03:01
Intel and LG Display may have beaten Apple and Qualcomm with the best laptop battery life ever,The Verge,https://www.theverge.com/tech/901155/dell-xps-16-best-battery-lg-display-1hz-panther-lake-intel,2026-03-26 21:03:01
The Sonos Ace are a hefty 25 percent for Amazon’s Big Spring Sale,The Verge,https://www.theverge.com/tech/900836/sonos-ace-noise-canceling-headphones-amazon-big-spring-sale-2026-deal,2026-03-26 21:03:01
The portable Fanttik X9 Pro tire inflator is down to its best price in months,The Verge,https://www.theverge.com/gadgets/900863/fanttik-x9-pro-portable-tire-inflator-amazon-big-spring-sale-deal-sale,2026-03-26 21:03:01
Meta is laying off hundreds of employees as it pours money into AI,The Verge,https://www.theverge.com/tech/900946/meta-layoffs-hundreds-employees,2026-03-26 21:03:01
"Ugh, Netflix is raising prices again",Engadget,https://www.engadget.com/entertainment/streaming/ugh-netflix-is-raising-prices-again-202318277.html?src=rss,2026-03-26 21:03:01
Judge tosses out X's advertiser boycott lawsuit,Engadget,https://www.engadget.com/social-media/judge-tosses-out-xs-advertiser-boycott-lawsuit-184832071.html?src=rss,2026-03-26 21:03:01
Blumhouse's horror-centric cozy game Grave Seasons will be released on August 14,Engadget,https://www.engadget.com/gaming/blumhouses-horror-centric-cozy-game-grave-seasons-will-be-released-on-august-14-184042880.html?src=rss,2026-03-26 21:03:01
Dispatch is coming to Xbox this summer,Engadget,https://www.engadget.com/gaming/xbox/dispatch-is-coming-to-xbox-this-summer-183735998.html?src=rss,2026-03-26 21:03:01
"Stalker 2 is getting its first DLC, Cost of Hope, this summer",Engadget,https://www.engadget.com/gaming/stalker-2-is-getting-its-first-dlc-cost-of-hope-this-summer-183009759.html?src=rss,2026-03-26 21:03:01
Google begins rolling out Search Live globally,Engadget,https://www.engadget.com/ai/google-begins-rolling-out-search-live-globally-180938407.html?src=rss,2026-03-26 21:03:01
Hades 2 is coming to Xbox Series X/S and PS5 on April 14,Engadget,https://www.engadget.com/gaming/xbox/hades-2-is-coming-to-xbox-series-xs-and-ps5-on-april-14-175819696.html?src=rss,2026-03-26 21:03:01
The EU is investigating Snapchat over possible child protection breaches,Engadget,https://www.engadget.com/social-media/the-eu-is-investigating-snapchat-over-possible-child-protection-breaches-174722759.html?src=rss,2026-03-26 21:03:01
Serious Sam: Shatterverse will hit Xbox platforms this year,Engadget,https://www.engadget.com/gaming/xbox/serious-sam-shatterverse-will-hit-xbox-platforms-this-year-174620271.html?src=rss,2026-03-26 21:03:01
Sanders and Ocasio-Cortez introduce a bill to pause US data center construction,Engadget,https://www.engadget.com/ai/sanders-and-ocasio-cortez-introduce-a-bill-to-pause-us-data-center-construction-174451974.html?src=rss,2026-03-26 21:03:01
Wikipedia has banned AI-generated articles,Engadget,https://www.engadget.com/ai/wikipedia-has-banned-ai-generated-articles-173641377.html?src=rss,2026-03-26 21:03:01
EU says Pornhub and others failed to stop minors accessing adult content,Engadget,https://www.engadget.com/big-tech/eu-says-pornhub-and-others-failed-to-stop-minors-accessing-adult-content-155632108.html?src=rss,2026-03-26 21:03:01
AMD's Ryzen 9950X3D2 chip features an incredible 208MB of on-chip cache,Engadget,https://www.engadget.com/computing/amds-ryzen-9950x3d2-chip-features-an-incredible-208mb-of-on-chip-cache-154137156.html?src=rss,2026-03-26 21:03:01
How to use Apple's Playlist Playground to make AI-generated mixes,Engadget,https://www.engadget.com/entertainment/music/how-to-use-apples-playlist-playground-to-make-ai-generated-mixes-134500610.html?src=rss,2026-03-26 21:03:01
HBO Max finally launches in the UK and Ireland,Engadget,https://www.engadget.com/entertainment/streaming/hbo-max-finally-launches-in-the-uk-and-ireland-133406342.html?src=rss,2026-03-26 21:03:01
WhatsApp rolls out updates including multiple accounts for iOS,Engadget,https://www.engadget.com/social-media/whatsapp-rolls-out-updates-including-multiple-accounts-for-ios-130000252.html?src=rss,2026-03-26 21:03:01
March Madness 2026: How to watch the Sweet 16 and Elite Eight this weekend,Engadget,https://www.engadget.com/entertainment/streaming/march-madness-2026-how-to-watch-the-sweet-16-and-elite-eight-this-weekend-154903032.html?src=rss,2026-03-26 21:03:01
Sonos Play review: The company's best portable speaker so far,Engadget,https://www.engadget.com/audio/speakers/sonos-play-review-the-companys-best-portable-speaker-so-far-130000688.html?src=rss,2026-03-26 21:03:01
DJI Avata 360 drone review: 360 video hits new highs,Engadget,https://www.engadget.com/cameras/dji-avata-360-drone-review-360-video-hits-new-highs-120014666.html?src=rss,2026-03-26 21:03:01
OpenAI drops plans to release an adult chatbot,Engadget,https://www.engadget.com/ai/openai-drops-plans-to-release-an-adult-chatbot-113121190.html?src=rss,2026-03-26 21:03:01
Uber and Pony.ai are testing a robotaxi service for Europe,Engadget,https://www.engadget.com/transportation/uber-and-ponyai-are-testing-a-robotaxi-service-for-europe-104811944.html?src=rss,2026-03-26 21:03:01
Oversight Board tells Meta expanding Community Notes outside of US poses 'significant' risks,Engadget,https://www.engadget.com/social-media/oversight-board-tells-meta-expanding-community-notes-outside-of-us-poses-significant-risks-100000213.html?src=rss,2026-03-26 21:03:01
PSA: T-Mobile customers have a week to sign up for a free year of MLB.TV,Engadget,https://www.engadget.com/entertainment/streaming/psa-t-mobile-customers-have-a-week-to-sign-up-for-a-free-year-of-mlbtv-211306444.html?src=rss,2026-03-26 21:03:01
Our favorite web hosting company is providing access to AI's latest superstar for free: One click gets you OpenClaw on Hostinger's shared hosting,TechRadar,https://www.techradar.com/pro/our-favourite-web-hosting-company-is-giving-you-access-to-ais-latest-superstar-for-free-one-click-gets-you-openclaw-on-hostingers-shared-hosting,2026-03-26 21:03:02
The ‘PlayStation Car’ is dead — why Sony and Honda just pulled the plug on their Afeela EV before a single car was delivered,TechRadar,https://www.techradar.com/vehicle-tech/hybrid-electric-vehicles/the-playstation-car-is-dead-why-sony-and-honda-just-pulled-the-plug-on-their-afeela-ev-before-a-single-car-was-delivered,2026-03-26 21:03:02
How to watch iHeartRadio Music Awards 2026 for free online from anywhere,TechRadar,https://www.techradar.com/how-to-watch/tv-shows/iheartradio-music-awards-2026-free,2026-03-26 21:03:02
‘The fastest mobile platform for web browsing’: Google claims Android is up to 47% faster than iOS in this key metric,TechRadar,https://www.techradar.com/phones/the-fastest-mobile-platform-for-web-browsing-google-claims-android-is-up-to-47-percent-faster-than-ios-in-this-key-metric,2026-03-26 21:03:02
'86% report improved productivity': Nearly half of the world's biggest firms lack a critical AI risk framework — and it’s a dangerous gamble,TechRadar,https://www.techradar.com/pro/86-percent-report-improved-productivity-43-percent-of-the-worlds-biggest-firms-lack-a-critical-ai-risk-framework-and-its-a-dangerous-gamble,2026-03-26 21:03:02
"How to watch March Madness Sweet 16: Free Streams, TV Channels for 2026 Regional Semis",TechRadar,https://www.techradar.com/how-to-watch/basketball/march-madness-sweet-16-2026-regional-semis-free,2026-03-26 21:03:02
'I can't believe this is happening': iPhone users are threatening to defect to Android over new iOS age verification push — and I'd do the same,TechRadar,https://www.techradar.com/phones/ios/i-cant-believe-this-is-happening-iphone-users-are-threatening-to-defect-to-android-over-new-ios-age-verification-push-and-id-do-the-same,2026-03-26 21:03:02
Bluetti Elite 300 portable power station review: A serious step-up in power,TechRadar,https://www.techradar.com/pro/bluetti-elite-300-portable-power-station-review,2026-03-26 21:03:02
Take that hybrid working haters — survey reveals the true scale of how many of us are actually remote working today,TechRadar,https://www.techradar.com/pro/can-hybrid-working-really-last-the-true-scale-of-how-many-of-us-are-actually-remote-working-today,2026-03-26 21:03:02
Samsung Galaxy S26 Ultra vs Samsung Galaxy S25 Ultra: what's the difference?,TechRadar,https://www.techradar.com/phones/samsung-galaxy-phones/samsung-galaxy-s26-ultra-vs-samsung-galaxy-s25-ultra,2026-03-26 21:03:02
"How to watch Slovakia vs Kosovo: Free Streams, TV Channels for FIFA World Cup 2026 qualifier semi-final",TechRadar,https://www.techradar.com/how-to-watch/football/slovakia-vs-kosovo-fifa-world-cup-2026-qualifier-semi-final,2026-03-26 21:03:02
ChatGPT just made its shopping tools more visual — here are 5 prompts you can try right now for better results,TechRadar,https://www.techradar.com/ai-platforms-assistants/chatgpt/chatgpt-just-made-its-shopping-tools-more-visual-here-are-5-prompts-you-can-try-right-now-for-better-results,2026-03-26 21:03:02
Meta unveils new SMB platform looking to boost entrepreneurs 'in the prosperity created by superintelligence',TechRadar,https://www.techradar.com/pro/meta-unveils-new-smb-platform-looking-to-boost-entrepreneurs-in-the-prosperity-created-by-superintelligence,2026-03-26 21:03:02
I've found the security toolkit you can get for free with a $20 Amazon gift card from NordVPN,TechRadar,https://www.techradar.com/vpn/vpn-services/ive-found-the-security-toolkit-you-can-get-for-free-with-a-usd20-amazon-gift-card-from-nordvpn,2026-03-26 21:03:02
"Stalker 2: Heart of Chornobyl's first 'massive nonlinear' expansion, Cost of Hope, launches this summer",TechRadar,https://www.techradar.com/gaming/stalker-2-heart-of-chernobyls-first-massive-nonlinear-expansion-cost-of-hope-has-been-announced-and-its-launching-this-summer,2026-03-26 21:03:02
I gave myself $100 — can I get a full 'pro PC gamer' set-up from Amazon without breaking budget?,TechRadar,https://www.techradar.com/computing/computer-gaming-accessories/i-gave-myself-usd100-can-i-get-a-full-pro-pc-gamer-set-up-from-amazon-without-breaking-budget,2026-03-26 21:03:02
Denmark vs North Macedonia live stream: how to watch FIFA World Cup 2026 qualifier semi-final online from anywhere,TechRadar,https://www.techradar.com/how-to-watch/football/denmark-vs-north-macedonia-fifa-world-cup-2026-qualifier-semi-final,2026-03-26 21:03:02
"Housemarque says it 'hancrafted levels, art, design, and combat encounters' and 'kind of connect them in a procedural matter' to create Saros' ever-changing levels",TechRadar,https://www.techradar.com/gaming/housemarque-says-it-hancrafted-levels-art-design-and-combat-encounters-and-kind-of-connect-them-in-a-procedural-matter-to-create-saros-ever-changing-levels,2026-03-26 21:03:02
"IKEA just released a super cheap Philips Hue Play Light Bar lookalike, but there's one big drawback",TechRadar,https://www.techradar.com/home/smart-lights/ikea-just-released-a-super-cheap-philips-hue-play-light-bar-lookalike-but-theres-one-big-drawback,2026-03-26 21:03:02
This popular app builder has been hijacked to steal Microsoft account details - here's what we know,TechRadar,https://www.techradar.com/pro/security/this-popular-app-builder-has-been-hijacked-to-steal-microsoft-account-details-heres-what-we-know,2026-03-26 21:03:02
"I tried Microsoft OneDrive’s AI restyle feature, and now I know what I would look like as a crochet doll",TechRadar,https://www.techradar.com/ai-platforms-assistants/i-tried-microsoft-onedrives-ai-restyle-feature-and-now-i-know-what-i-would-look-like-as-a-crochet-doll,2026-03-26 21:03:02
I should hate this camera but I’ve bought it several times — Kodak’s $35 retro keychain camera is so cheap you can’t go wrong,TechRadar,https://www.techradar.com/cameras/compact-cameras/i-should-hate-this-camera-but-ive-bought-it-several-times-kodaks-usd35-retro-keychain-camera-is-so-cheap-you-cant-go-wrong,2026-03-26 21:03:02
How to watch Poland vs Albania: Free Streams & TV Channels for World Cup 2026 playoff qualifier,TechRadar,https://www.techradar.com/how-to-watch/poland-vs-albania-world-cup-2026-playoff-qualifier-free,2026-03-26 21:03:02
"How to watch Wales vs Bosnia & Herzegovina: Free Streams, TV Info as Craig Bellamy's side look to take a step closer to the World Cup",TechRadar,https://www.techradar.com/how-to-watch/football/wales-vs-bosnia-and-herzegovina-fifa-world-cup-2026-qualifier-semi-final,2026-03-26 21:03:02
Italy vs Northern Ireland Free Streams: How to Watch 2026 World Cup PlayOff Semifinal From Anywhere,TechRadar,https://www.techradar.com/how-to-watch/football/italy-vs-northern-ireland-free-streams-2026-world-cup-playoff,2026-03-26 21:03:02
"Czechia vs Ireland free streams: How to watch 2026 World Cup playoffs, TV schedule, preview",TechRadar,https://www.techradar.com/how-to-watch/football/czechia-vs-republic-of-ireland-free-streams,2026-03-26 21:03:02
Great news for creators and professionals: This special code will slash the price on Intel’s Core i7 desktop processor with turbo speeds reaching up to 5.6GHz,TechRadar,https://www.techradar.com/pro/great-news-for-creators-and-professionals-this-special-code-will-slash-the-price-on-intels-core-i7-desktop-processor-with-turbo-speeds-reaching-up-to-5-6ghz,2026-03-26 21:03:02
"Yes, you really can save $60 on an Asus motherboard and get a free 512GB Team Group SSD worth $113 — a deal so good I refreshed the page to make sure it was real",TechRadar,https://www.techradar.com/pro/yes-you-really-can-save-usd60-on-an-asus-motherboard-and-get-a-free-512gb-team-group-ssd-worth-usd113-a-deal-so-good-i-refreshed-the-page-to-make-sure-it-was-real,2026-03-26 21:03:02
Xbox Partner Preview live build-up: latest news ahead of the game showcase,TechRadar,https://www.techradar.com/news/live/xbox-partner-showcase-march-2026-live,2026-03-26 21:03:02
These are the biggest risks businesses see around using AI - including the most 'extreme' threats,TechRadar,https://www.techradar.com/pro/security/these-are-the-biggest-risks-businesses-see-around-using-ai-including-the-most-extreme-threats,2026-03-26 21:03:02
How to watch World Cup 2026 Qualifying play-offs: Free Streams & TV Channels,TechRadar,https://www.techradar.com/how-to-watch/football/world-cup-2026-qualifying-play-offs-free-streams-tv-channels,2026-03-26 21:03:02
