headline,source,link,datetime
Amazon has enough satellites to launch its Starlink competitor,The Verge,https://www.theverge.com/science/960563/amazon-leo-service-tipping-point,2026-07-02 10:03:11
OpenAI reportedly wants all AI companies to give the US government a stake in their businesses,Engadget,https://www.engadget.com/2206552/openai-ai-companies-give-us-government-stake-businesses-proposal/,2026-07-02 10:03:11
Google loses final appeal over $4.7 billion EU Android antitrust fine,Engadget,https://www.engadget.com/2206550/google-loses-final-appeal-over-eu-antitrust-fine/,2026-07-02 10:03:11
"Xbox might be following PlayStation's lead, as new reports claim Microsoft is testing a new disc-to-digital game feature called 'Positron', and the next-gen Project Helix console won't have a disc drive",TechRadar,https://www.techradar.com/gaming/xbox-might-be-following-playstations-lead-as-new-reports-claim-microsoft-is-testing-a-new-disc-to-digital-game-feature-called-positron-and-the-next-gen-project-helix-console-wont-have-a-disc-drive,2026-07-02 10:03:11
I'm a NAS expert — here's how to build your own personal cloud for just over $1000,TechRadar,https://www.techradar.com/pro/im-a-nas-expert-heres-how-to-build-your-own-personal-cloud-for-just-over-usd1000,2026-07-02 10:03:11
"Ninja's gone green — and blue, and oat-colored — with three new colors for one of its best coffee machines",TechRadar,https://www.techradar.com/home/coffee-machines/ninjas-gone-green-and-blue-and-oat-colored-with-three-new-colors-for-one-of-its-best-coffee-machines,2026-07-02 10:03:11
Garmin Forerunner 70 review: Substantial upgrades that come at a cost,TechRadar,https://www.techradar.com/health-fitness/garmin-forerunner-70-review,2026-07-02 10:03:11
