headline,source,link,datetime
Tom Scott is back on YouTube [video],Hacker News,https://www.youtube.com/watch?v=Yz3lSKgz4q8,2026-04-01 16:02:56
Apple Removes iPhone Vibe Coding App from App Store,Hacker News,https://gizmodo.com/apple-removes-iphone-vibe-coding-app-from-app-store-2000740084,2026-04-01 16:02:56
OpenAI Demand Sinks on Secondary Market as Anthropic Runs Hot,Hacker News,https://www.bloomberg.com/news/articles/2026-04-01/openai-demand-sinks-on-secondary-market-as-anthropic-runs-hot,2026-04-01 16:02:56
"Iran war sparks renewables boom as Europeans rush to buy solar, heat pumps, EVs",Hacker News,https://www.euronews.com/2026/03/31/iran-war-sparks-renewables-boom-as-europeans-rush-to-buy-solar-heat-pumps-and-evs,2026-04-01 16:02:56
Wedeo – a Rust Rewrite of FFmpeg,Hacker News,https://github.com/sharifhsn/wedeo,2026-04-01 16:02:56
OnlyOffice kills Nextcloud partnership for forking its project without approval,Hacker News,https://www.neowin.net/news/onlyoffice-suspends-nextcloud-partnership-over-unapproved-euro-office-fork/,2026-04-01 16:02:56
AI has suddenly become more useful to open-source developers,Hacker News,https://www.zdnet.com/article/maybe-open-source-needs-ai/,2026-04-01 16:02:56
Age verification now required for DNS resolution,Hacker News,https://easydns.com/blog/2026/04/01/age-verification-now-required-for-dns-resolution/,2026-04-01 16:02:56
"New Patches Allow Building Linux IPv6-Only, Option to Deprecate ""Legacy"" IPv4",Hacker News,https://www.phoronix.com/news/Linux-IPv6-IPv4-Legacy-Knobs,2026-04-01 16:02:56
Is BGP Safe Yet? No. Test Your ISP,Hacker News,https://isbgpsafeyet.com/,2026-04-01 16:02:56
CEO of largest public hospital says he's ready to replace radiologists with AI,Hacker News,https://radiologybusiness.com/topics/artificial-intelligence/ceo-americas-largest-public-hospital-system-says-hes-ready-replace-radiologists-ai,2026-04-01 16:02:56
Show HN: Sycamore – next gen Rust UI library powered by fine-grained reactivity,Hacker News,https://sycamore.dev,2026-04-01 16:02:56
Show HN: Baton – A desktop app for developing with AI agents,Hacker News,https://getbaton.dev/,2026-04-01 16:02:56
A Mysterious Numbers Station Is Broadcasting Through the Iran War,Hacker News,https://www.wired.com/story/a-mysterious-numbers-station-is-broadcasting-through-the-iran-war/,2026-04-01 16:02:56
The Document Foundation ejects its core developers,Hacker News,https://www.collaboraonline.com/blog/tdf-ejects-its-core-developers/,2026-04-01 16:02:56
What the Claude Code Leak Means for Regulated Industries,Hacker News,https://systima.ai/blog/claude-code-leak-compliance-implications,2026-04-01 16:02:56
I Quit. The Clankers Won,Hacker News,https://dbushell.com/2026/04/01/i-quit-the-clankers-won/,2026-04-01 16:02:56
Solar panels at Lidl? Plug-in versions set to appear in shops,Hacker News,https://www.thisismoney.co.uk/money/bills/article-15673955/Solar-panels-Lidl-Plug-versions-set-appear-shops-MONTHS.html,2026-04-01 16:02:56
CERN levels up with new superconducting karts,Hacker News,https://home.cern/news/news/engineering/cern-levels-new-superconducting-karts,2026-04-01 16:02:56
Remembering Magnetic Memories and the Apollo AGC,Hacker News,https://2earth.github.io/website/20260304.html,2026-04-01 16:02:56
Mad Bugs: Vim vs. Emacs vs. Claude,Hacker News,https://blog.calif.io/p/mad-bugs-vim-vs-emacs-vs-claude,2026-04-01 16:02:56
Claude Wrote a Full FreeBSD Remote Kernel RCE with Root Shell (CVE-2026-4747),Hacker News,https://github.com/califio/publications/blob/main/MADBugs/CVE-2026-4747/write-up.md,2026-04-01 16:02:56
Claude Code Unpacked : A visual guide,Hacker News,https://ccunpacked.dev/,2026-04-01 16:02:56
I built a 516-panel financial terminal in 3 weeks using AI,Hacker News,https://neuberg.ai/,2026-04-01 16:02:56
Analyzing Geekbench 6 under Intel's BOT,Hacker News,https://www.geekbench.com/blog/2026/03/analyzing-geekbench-6-under-intels-bot/,2026-04-01 16:02:56
My son pleasured himself on Gemini Live. Entire family's Google accounts banned,Hacker News,https://old.reddit.com/r/LegalAdviceUK/comments/1s92fql/my_son_pleasured_himself_in_front_of_gemini_live/,2026-04-01 16:02:56
Obsidian and Cursor had a baby. It's open source,Hacker News,https://cushionmd.com/,2026-04-01 16:02:56
We intercepted the White House app's traffic. 77% of requests go to 3rd parties,Hacker News,https://www.atomic.computer/blog/white-house-app-network-traffic-analysis/,2026-04-01 16:02:56
"U.S. exempts oil industry from protecting Gulf animals, for 'national security'",Hacker News,https://www.npr.org/2026/03/30/nx-s1-5745926/endangered-species-committee-hegseth-security,2026-04-01 16:02:56
Neanderthals survived on a knife's edge for 350k years,Hacker News,https://www.science.org/content/article/neanderthals-survived-knife-s-edge-350-000-years,2026-04-01 16:02:56
"Unhealthiest Foods on the Planet, According to Science",Hacker News,https://techfixated.com/100-unhealthiest-foods-on-the-planet-according-to-science/,2026-04-01 16:02:56
Ordinary Lab Gloves May Have Skewed Microplastic Data,Hacker News,https://nautil.us/ordinary-lab-gloves-may-have-skewed-microplastic-data-1279386,2026-04-01 16:02:56
A dot a day keeps the clutter away,Hacker News,https://scottlawsonbc.com/post/dot-system,2026-04-01 16:02:56
OpenAI raises $122B to accelerate the next phase of AI,Hacker News,https://openai.com/index/accelerating-the-next-phase-ai/,2026-04-01 16:02:56
"Show HN: 1-Bit Bonsai, the First Commercially Viable 1-Bit LLMs",Hacker News,https://prismml.com/,2026-04-01 16:02:56
Ministack (Replacement for LocalStack),Hacker News,https://ministack.org/,2026-04-01 16:02:56
JSSE: A JavaScript Engine Built by an Agent,Hacker News,https://p.ocmatos.com/blog/jsse-a-javascript-engine-built-by-an-agent.html,2026-04-01 16:02:56
OpenAI raises $122B,Hacker News,https://www.cnbc.com/2026/03/31/openai-funding-round-ipo.html,2026-04-01 16:02:56
Accelerating the Next Phase of AI,Hacker News,https://openai.com/index/accelerating-the-next-phase-ai,2026-04-01 16:02:56
Super Micro Computer Investors Look for Exits,Hacker News,https://catenaa.com/markets/equities/super-micro-computer-investors-look-for-exits/,2026-04-01 16:02:56
I Traced My Traffic Through a Home Tailscale Exit Node,Hacker News,https://tech.stonecharioteer.com/posts/2026/tailscale-exit-nodes/,2026-04-01 16:02:56
"Show HN: Cerno – CAPTCHA that targets LLM reasoning, not human biology",Hacker News,https://cerno.sh,2026-04-01 16:02:56
GitHub's Historic Uptime,Hacker News,https://damrnelson.github.io/github-historical-uptime/,2026-04-01 16:02:56
"Show HN: My open-world voxel game with a magic system, playable in the browser",Hacker News,https://kouh.me/wildmagic,2026-04-01 16:02:56
Iran says it will target US tech companies in Middle East,Hacker News,https://thehill.com/policy/technology/5809104-iran-irgc-apple-microsoft-google-hp-meta-tesla/,2026-04-01 16:02:56
"OkCupid gave 3M dating-app photos to facial recognition firm, FTC says",Hacker News,https://arstechnica.com/tech-policy/2026/03/okcupid-match-pay-no-fine-for-sharing-user-photos-with-facial-recognition-firm/,2026-04-01 16:02:56
I Decompiled the White House's New App,Hacker News,https://blog.thereallo.dev/blog/decompiling-the-white-house-app,2026-04-01 16:02:56
Ask HN: Academic study on AI's impact on software development – want to join?,Hacker News,https://news.ycombinator.com/item?id=47590261,2026-04-01 16:02:56
Objections to systemd age-attestation changes go overboard,Hacker News,https://lwn.net/SubscriberLink/1064706/ba8e449d224f5067/,2026-04-01 16:02:56
Show HN: How This Graybeard Built the Fastest and Freest Postgres BM25 Search,Hacker News,https://github.com/timescale/pg_textsearch,2026-04-01 16:02:56
Cohere Transcribe: Speech Recognition,Hacker News,https://cohere.com/blog/transcribe,2026-04-01 16:02:56
Show HN: PhAIL – Real-robot benchmark for AI models,Hacker News,https://phail.ai,2026-04-01 16:02:56
Forth VM and compiler written in C++ and Scryer Prolog,Hacker News,https://github.com/no382001/forth-vm,2026-04-01 16:02:56
Scotty: A beautiful SSH task runner,Hacker News,https://freek.dev/3064-scotty-a-beautiful-ssh-task-runner,2026-04-01 16:02:56
Show HN: Hyprmoncfg – Terminal-based monitor config manager for Hyprland,Hacker News,https://paolino.me/hyprmoncfg-monitor-configuration-for-hyprland/,2026-04-01 16:02:56
The Trump administration’s antitrust honeymoon is over,The Verge,https://www.theverge.com/policy/905222/antitrust-trump-tech-live-nation,2026-04-01 16:02:56
SpaceX announces IPO but it’s keeping the numbers secret (for now),The Verge,https://www.theverge.com/science/904991/spacex-announces-ipo-but-its-keeping-the-numbers-secret-for-now,2026-04-01 16:02:56
These Raspberry Pi price hikes are no joke,The Verge,https://www.theverge.com/gadgets/905189/raspberry-pi-price-increases-pi-4-3gb,2026-04-01 16:02:56
April Fools’ Day 2026: the best and cringiest pranks,The Verge,https://www.theverge.com/tldr/904346/april-fools-day-2026-pranks-jokes-best-worst,2026-04-01 16:02:56
The best Amazon Big Spring Sale deals you can still get,The Verge,https://www.theverge.com/gadgets/905059/best-amazon-big-spring-sale-2026-deals-you-can-still-get,2026-04-01 16:02:56
The Korg Handytraxx Play finally got me learning to scratch,The Verge,https://www.theverge.com/tech/898696/korg-handytraxx-play-dj-scratching-turntable-review,2026-04-01 16:02:56
A YouTuber channeled his distaste for the PS5’s design into slick console covers,The Verge,https://www.theverge.com/tech/904086/boxplates-ps5-pro-slim-console-covers-hands-on,2026-04-01 16:02:56
Nintendo is weathering the storm,The Verge,https://www.theverge.com/games/904653/nintendo-games-industry-success,2026-04-01 16:02:56
Today is the final day to save up to $150 on a PS5 before the price goes up,The Verge,https://www.theverge.com/gadgets/904614/playstation-5-ps5-pro-digital-edition-refurbished-deal-sale-price-increase,2026-04-01 16:02:56
AI can push your Stream Deck buttons for you,The Verge,https://www.theverge.com/tech/905021/elgato-stream-deck-mcp-ai-agent-update,2026-04-01 16:02:56
Baidu’s robotaxis froze in traffic creating chaos,The Verge,https://www.theverge.com/ai-artificial-intelligence/905012/baidu-apollo-robotaxi-freeze-china,2026-04-01 16:02:56
Amazon is offering up to 50 percent off chargers from Anker and others for its Big Spring Sale,The Verge,https://www.theverge.com/gadgets/904242/amazon-big-spring-sale-2026-baseus-anker-chargers-power-banks-batteries-deals,2026-04-01 16:02:56
Claude Code leak exposes a Tamagotchi-style ‘pet’ and an always-on agent,The Verge,https://www.theverge.com/ai-artificial-intelligence/904776/anthropic-claude-source-code-leak,2026-04-01 16:02:56
You can grab a four-pack of Govee’s color-changing smart bulbs for just $27,The Verge,https://www.theverge.com/gadgets/904698/govee-smart-a19-led-color-bulbs-amazon-big-spring-sale-2026-deal,2026-04-01 16:02:56
You can now use ChatGPT with Apple’s CarPlay,The Verge,https://www.theverge.com/ai-artificial-intelligence/904676/apple-carplay-openai-chatgpt,2026-04-01 16:02:56
Samsung’s new app claims to alleviate motion sickness using sound,The Verge,https://www.theverge.com/tech/904579/samsung-hearapy-mobile-app-galaxy-buds-motion-sickness-symptoms,2026-04-01 16:02:56
"Anker’s power bank with built-in cables is one of my favorite gadgets, and it’s cheaper than usual",The Verge,https://www.theverge.com/gadgets/904523/anker-laptop-power-bank-amazon-big-spring-sale-2026-deal-sale,2026-04-01 16:02:56
The Super Mario Galaxy Movie is beautiful but a little too busy,The Verge,https://www.theverge.com/entertainment/904033/the-super-mario-galaxy-movie-review,2026-04-01 16:02:56
Evercade’s new handheld has a larger screen and dual thumbsticks for 3D games,The Verge,https://www.theverge.com/tech/904543/evercade-nexus-handheld-console-retro-gaming-preorder-pricing-availability,2026-04-01 16:02:56
No Kings is taking back Americana,The Verge,https://www.theverge.com/policy/904405/no-kings-protests-portland-americana,2026-04-01 16:02:56
The Galaxy S26’s photo app can sloppify your memories,The Verge,https://www.theverge.com/tech/904176/samsung-galaxy-s26-ai-photo-assist-slop,2026-04-01 16:02:56
Hisense’s 75-inch U6 mini-LED TV is cheaper than its 65-inch model,The Verge,https://www.theverge.com/gadgets/904372/hisense-u6-mini-led-tv-4k-amazon-big-spring-sale-2026-deal,2026-04-01 16:02:56
The Sonos Play and mic-less Era 100 SL are now available,The Verge,https://www.theverge.com/gadgets/903746/sonos-play-era-100-sl-speakers-price-release-date-availability,2026-04-01 16:02:56
The latest Matter update improves camera streaming,The Verge,https://www.theverge.com/tech/904361/matter-spec-update1-5-1-camera-video-streaming-heic-doorbell-chimes,2026-04-01 16:02:56
"Lucid Motors recalls over 4,000 Gravity SUVs over seat belt defect",Engadget,https://www.engadget.com/transportation/evs/lucid-motors-recalls-over-4000-gravity-suvs-over-seat-belt-defect-155321460.html?src=rss,2026-04-01 16:02:56
SpaceX has reportedly filed for the biggest IPO in history,Engadget,https://www.engadget.com/big-tech/spacex-has-reportedly-filed-for-the-biggest-ipo-in-history-154547537.html?src=rss,2026-04-01 16:02:56
MindsEye will litigate its own launch 'sabotage' controversy in DLC form,Engadget,https://www.engadget.com/gaming/mindseye-will-litigate-its-own-launch-sabotage-controversy-in-dlc-form-152344593.html?src=rss,2026-04-01 16:02:56
Claude Code leak suggests Anthropic is working on a 'Proactive' mode for its coding tool,Engadget,https://www.engadget.com/ai/claude-code-leak-suggests-anthropic-is-working-on-a-proactive-mode-for-its-coding-tool-150107049.html?src=rss,2026-04-01 16:02:56
"The AI Doc's director was ""scared shitless"" by AI, so he made a movie about it",Engadget,https://www.engadget.com/entertainment/tv-movies/the-ai-docs-director-was-scared-shitless-by-ai-so-he-made-a-movie-about-it-145747961.html?src=rss,2026-04-01 16:02:56
The Getaway is Subaru's first three-row electric SUV,Engadget,https://www.engadget.com/transportation/evs/the-getaway-is-subarus-first-three-row-electric-suv-142500177.html?src=rss,2026-04-01 16:02:56
The new Storm Radar app is a treasure trove of data for weather nerds,Engadget,https://www.engadget.com/apps/the-new-storm-radar-app-is-a-treasure-trove-of-data-for-weather-nerds-133646812.html?src=rss,2026-04-01 16:02:56
Kia shows off the 2027 EV3 at the NY Auto Show,Engadget,https://www.engadget.com/transportation/evs/kia-shows-off-the-2027-ev3-at-the-ny-auto-show-132500658.html?src=rss,2026-04-01 16:02:56
"Roland Go:Mixer Studio review: Portable, professional and plenty of polish",Engadget,https://www.engadget.com/audio/roland-gomixer-studio-review-portable-professional-and-plenty-of-polish-130000723.html?src=rss,2026-04-01 16:02:56
Robosen Soundwave review: A childhood dream made real,Engadget,https://www.engadget.com/general/robosen-soundwave-review-a-childhood-dream-made-real-120000804.html?src=rss,2026-04-01 16:02:56
An immersive 'Black Mirror Experience' is launching in Montreal,Engadget,https://www.engadget.com/entertainment/streaming/an-immersive-black-mirror-experience-is-launching-in-montreal-115915992.html?src=rss,2026-04-01 16:02:56
What to expect from WWDC 2026,Engadget,https://www.engadget.com/big-tech/what-to-expect-from-wwdc-2026-110000086.html?src=rss,2026-04-01 16:02:56
Slack's upgraded AI can analyze how you work,Engadget,https://www.engadget.com/general/slacks-upgraded-ai-can-analyze-how-you-work-103007261.html?src=rss,2026-04-01 16:02:56
Watch the first crewed Artemis mission take flight,Engadget,https://www.engadget.com/science/space/watch-the-first-crewed-artemis-mission-take-flight-092800981.html?src=rss,2026-04-01 16:02:56
Dinosaur Polo Club has released a new co-op game and it's free,Engadget,https://www.engadget.com/gaming/dinosaur-polo-club-has-released-a-new-co-op-game-and-its-free-214638400.html?src=rss,2026-04-01 16:02:56
The Backrooms trailer combines creepypasta dread and A24 prestige horror,Engadget,https://www.engadget.com/entertainment/tv-movies/the-backrooms-trailer-combines-creepypasta-dread-and-a24-prestige-horror-213602238.html?src=rss,2026-04-01 16:02:56
Toyota's still trying to make hydrogen fuel cells happen,Engadget,https://www.engadget.com/transportation/toyotas-still-trying-to-make-hydrogen-fuel-cells-happen-202237728.html?src=rss,2026-04-01 16:02:56
"Tesla's robotaxis are reportedly remotely driven by humans, sometimes",Engadget,https://www.engadget.com/transportation/teslas-robotaxis-are-reportedly-remotely-driven-by-humans-sometimes-200639550.html?src=rss,2026-04-01 16:02:56
TikTok adds in-app Cameo integration for creators,Engadget,https://www.engadget.com/social-media/tiktok-adds-in-app-cameo-integration-for-creators-195411895.html?src=rss,2026-04-01 16:02:56
A Palworld horror-themed dating sim spinoff is on the way,Engadget,https://www.engadget.com/gaming/a-palworld-horror-themed-dating-sim-spinoff-is-on-the-way-185429664.html?src=rss,2026-04-01 16:02:56
Iran threatens imminent attacks on US tech companies in the Middle East,Engadget,https://www.engadget.com/big-tech/iran-threatens-imminent-attacks-on-us-tech-companies-in-the-middle-east-184841155.html?src=rss,2026-04-01 16:02:56
Google's 'Performance Advisor' Steph Curry teases probable new wearable,Engadget,https://www.engadget.com/wearables/googles-performance-advisor-steph-curry-teases-probable-new-wearable-183612209.html?src=rss,2026-04-01 16:02:56
The UK's antitrust regulator is looking into Microsoft's possible monopoly power,Engadget,https://www.engadget.com/big-tech/the-uks-antitrust-regulator-is-looking-into-microsofts-possible-monopoly-power-182221704.html?src=rss,2026-04-01 16:02:56
"Meta will ""substantially reduce"" describing Instagram teen accounts as PG-13",Engadget,https://www.engadget.com/social-media/meta-will-substantially-reduce-describing-instagram-teen-accounts-as-pg-13-175912683.html?src=rss,2026-04-01 16:02:56
"The Super Mario Bros. cartoon is back, but looks really weird thanks to AI",Engadget,https://www.engadget.com/entertainment/tv-movies/the-super-mario-bros-cartoon-is-back-but-looks-really-weird-thanks-to-ai-171536332.html?src=rss,2026-04-01 16:02:56
DoorDash partners with Rivian spinoff Also for autonomous delivery vehicles,Engadget,https://www.engadget.com/transportation/evs/doordash-partners-with-rivian-spinoff-also-for-autonomous-delivery-vehicles-163240124.html?src=rss,2026-04-01 16:02:56
Unmissable MacBook Pro M5 deals — celebrate 50 years of Apple by saving on the most stylish business-class laptops we've ever tested,TechRadar,https://www.techradar.com/pro/unmissable-macbook-pro-m5-deals-celebrate-50-years-of-apple-by-saving-on-the-most-stylish-business-class-laptops-weve-ever-tested,2026-04-01 16:02:57
This Ryzen 7 laptop deal for photo editors and business professionals gets a $1250 price cut — 32GB DDR5 and 1TB for under $850 is unbelievable,TechRadar,https://www.techradar.com/pro/this-ryzen-7-laptop-deal-for-photo-editors-and-business-professionals-gets-a-usd1250-price-cut-32gb-ddr5-and-1tb-for-under-usd850-is-unbelievable,2026-04-01 16:02:57
Easter tech deals have dropped at Amazon UK — 22 of the best offers I'd buy from under £10,TechRadar,https://www.techradar.com/tech/easter-tech-deals-have-dropped-at-amazon-uk-22-of-the-best-offers-id-buy-from-under-gbp10,2026-04-01 16:02:57
What beats a Paul McCartney concert to celebrate Apple turning 50? Discounts on Apple's pricey devices — shop the 10 best from $15.99,TechRadar,https://www.techradar.com/seasonal-sales/what-beats-a-paul-mccartney-concert-to-celebrate-apple-turning-50-discounts-on-apples-pricey-devices-shop-the-10-best-from-usd15-99,2026-04-01 16:02:57
Microsoft deploys yet another emergency patch for Windows 11 — but at least the fix for the broken March update arrived quickly,TechRadar,https://www.techradar.com/computing/windows/microsoft-deploys-yet-another-emergency-patch-for-windows-11-but-at-least-the-fix-for-the-broken-march-update-arrived-quickly,2026-04-01 16:02:57
"'Everything you want in headphones at this level': I tested JBL's new over-ears and if you're all about that bass, these cans go on and on (and on)",TechRadar,https://www.techradar.com/audio/wireless-headphones/jbl-live-780nc-review,2026-04-01 16:02:57
'What if the AI agent you just deployed was secretly working against you?': Vertex AI 'double agent' flaw exposes customer data and Google's internal code,TechRadar,https://www.techradar.com/pro/security/what-if-the-ai-agent-you-just-deployed-was-secretly-working-against-you-vertex-ai-double-agent-flaw-exposes-customer-data-and-googles-internal-code,2026-04-01 16:02:57
What are OpenClaw Skills? A detailed guide,TechRadar,https://www.techradar.com/pro/what-are-openclaw-skills-a-detailed-guide,2026-04-01 16:02:57
Looking for a job? It could be a scam — NordVPN uncovers phishing campaign impersonating top brands' recruiters,TechRadar,https://www.techradar.com/vpn/vpn-privacy-security/looking-for-a-job-it-could-be-a-scam-nordvpn-uncovers-phishing-campaign-impersonating-top-brands-recruiters,2026-04-01 16:02:57
RCS: The new reign of business messaging,TechRadar,https://www.techradar.com/pro/rcs-the-new-reign-of-business-messaging,2026-04-01 16:02:57
Why NIST’s AI agent standards initiative is a turning point for enterprise security,TechRadar,https://www.techradar.com/pro/why-nists-ai-agent-standards-initiative-is-a-turning-point-for-enterprise-security,2026-04-01 16:02:57
'Hundreds of thousands of stolen secrets could potentially be circulating as a result of these recent attacks': Google says North Korean hackers behind major attack on Axios,TechRadar,https://www.techradar.com/pro/security/hundreds-of-thousands-of-stolen-secrets-could-potentially-be-circulating-as-a-result-of-these-recent-attacks-google-says-north-korean-hackers-behind-major-attack-on-axios,2026-04-01 16:02:57
This upcoming retro handheld looks like the PSP successor I've been waiting for,TechRadar,https://www.techradar.com/gaming/this-upcoming-retro-handheld-looks-like-the-psp-successor-ive-been-waiting-for,2026-04-01 16:02:57
‘Vanity metrics’ are jeopardizing AI ROI,TechRadar,https://www.techradar.com/pro/vanity-metrics-are-jeopardizing-ai-roi,2026-04-01 16:02:57
iPhone 17e vs Google Pixel 10a: which cheap phone makes more sense for you?,TechRadar,https://www.techradar.com/phones/iphone/iphone-17e-vs-google-pixel-10a,2026-04-01 16:02:57
Apple adds the Apple TV HD to its ‘obsolete’ list despite it running tvOS 26 — and now users want a new 4K model more than ever,TechRadar,https://www.techradar.com/streaming/apple-tv-plus/apple-adds-the-apple-tv-hd-to-its-obsolete-list-despite-it-running-tvos-26-and-now-users-want-a-new-4k-model-more-than-ever,2026-04-01 16:02:57
Why is OpenClaw so popular in China?,TechRadar,https://www.techradar.com/pro/why-is-openclaw-so-popular-in-china,2026-04-01 16:02:57
Russian iPhone users lose Apple ID payments as Kremlin escalates VPN crackdown,TechRadar,https://www.techradar.com/vpn/vpn-privacy-security/russian-iphone-users-lose-apple-id-payments-as-kremlin-escalates-vpn-crackdown,2026-04-01 16:02:57
'We are growing revenue four times faster than the companies who defined the Internet and mobile eras': OpenAI says it's making $2 billion a month — mostly from enterprise users,TechRadar,https://www.techradar.com/pro/we-are-growing-revenue-four-times-faster-than-the-companies-who-defined-the-internet-and-mobile-eras-openai-says-its-making-usd2-billion-a-month-mostly-from-enterprise-users,2026-04-01 16:02:57
Save $720 on Aura Identity Theft Protection this Tax Season with 75% off family plans,TechRadar,https://www.techradar.com/pro/save-usd720-on-aura-identity-theft-protection-this-tax-season-with-75-percent-off-family-plans,2026-04-01 16:02:57
What is the release date for Monarch: Legacy of Monsters season 2 episode 6 on Apple TV?,TechRadar,https://www.techradar.com/streaming/apple-tv-plus/what-is-the-release-date-for-monarch-legacy-of-monsters-season-2-episode-6-on-apple-tv,2026-04-01 16:02:57
A big win for RAM buyers — Save $115 on 32GB of super-fast G.SKILL Flare X5 DDR5-6000 memory using this special code,TechRadar,https://www.techradar.com/pro/a-big-win-for-ram-buyers-save-usd115-on-32gb-of-super-fast-g-skill-flare-x5-ddr5-6000-memory-using-this-special-code,2026-04-01 16:02:57
Acer is pretty much giving away this Chromebook when you buy the premium Google software bundle,TechRadar,https://www.techradar.com/pro/acer-is-pretty-much-giving-away-this-chromebook-when-you-buy-the-premium-google-software-bundle,2026-04-01 16:02:57
"Fitbit leaps onto the Whoop-style screenless bandwagon, and Steph Curry teases it early",TechRadar,https://www.techradar.com/health-fitness/fitness-trackers/fitbit-leaps-onto-the-whoop-style-screenless-bandwagon-and-steph-curry-teases-it-early,2026-04-01 16:02:57
European Union wants to ban AI-created images and video in official messaging,TechRadar,https://www.techradar.com/pro/european-union-wants-to-ban-ai-created-images-and-video-in-official-messaging,2026-04-01 16:02:57
'DDR5 retail prices pullback amid market correction': TrendForce report sparks hope that we might be turning a corner in the RAM crisis,TechRadar,https://www.techradar.com/computing/memory/ddr5-retail-prices-pullback-amid-market-correction-trendforce-report-sparks-hope-that-we-might-be-turning-a-corner-in-the-ram-crisis,2026-04-01 16:02:57
I loved the exquisite design of this Samsung's MacBook air rival — and that’s not even the best thing about it,TechRadar,https://www.techradar.com/computing/laptops/samsung-galaxy-book6-pro-review,2026-04-01 16:02:57
"Anthropic confirms it leaked 512,000 lines of Claude Code source code — spilling some of its biggest secrets",TechRadar,https://www.techradar.com/pro/security/anthropic-confirms-it-leaked-512-000-lines-of-claude-code-source-code-spilling-some-of-its-biggest-secrets,2026-04-01 16:02:57
