headline,source,link,datetime
Shape Grammar,Hacker News,https://en.wikipedia.org/wiki/Shape_grammar,2026-04-13 20:02:48
The Looming College-Enrollment Death Spiral,Hacker News,https://www.theatlantic.com/ideas/2026/04/college-enrollment-demographic-cliff/686750/,2026-04-13 20:02:48
"Show HN: Ithihāsas – a character explorer for Hindu epics, built in a few hours",Hacker News,https://www.ithihasas.in,2026-04-13 20:02:48
AI influencers are ‘everywhere’ at Coachella,The Verge,https://www.theverge.com/ai-artificial-intelligence/911267/ai-influencers-coachella,2026-04-13 20:02:49
Xbox CEO called Game Pass 'too expensive for players' in a leaked memo,Engadget,https://www.engadget.com/gaming/xbox/xbox-ceo-called-game-pass-too-expensive-for-players-in-a-leaked-memo-194749597.html?src=rss,2026-04-13 20:02:49
I’m a smart glasses expert — and Apple’s rumored Meta Ray-Bans rivals could tempt me to switch thanks to one key strength,TechRadar,https://www.techradar.com/computing/virtual-reality-augmented-reality/im-a-smart-glasses-expert-and-apples-rumored-meta-ray-bans-rivals-could-tempt-me-to-switch-thanks-to-one-key-strength,2026-04-13 20:02:49
'Building gigawatt data centers in the US is becoming increasingly difficult': Why Orbital is taking AI infrastructure into space to solve power and cooling issues,TechRadar,https://www.techradar.com/pro/building-gigawatt-data-centers-in-the-us-is-becoming-increasingly-difficult-why-orbital-is-taking-ai-infrastructure-into-space-to-solve-power-and-cooling-issues,2026-04-13 20:02:49
The kings of ANC headphones from Bose hit their Black Friday price of $199,TechRadar,https://www.techradar.com/audio/wireless-headphones/the-kings-of-anc-headphones-from-bose-hit-their-black-friday-price-of-usd199,2026-04-13 20:02:49
