headline,source,link,datetime
Lossless model compression experiment: GLM-5.2 in 25% less memory,Hacker News,https://brianbell-x.github.io/weight-compression/,2026-07-20 15:03:36
Perfection Is Not Over-Engineering,Hacker News,https://var0.xyz/posts/perfection-is-not-over-engineering.html,2026-07-20 15:03:36
Firefox 153.0 Beta,Hacker News,https://www.firefox.com/en-US/firefox/153.0beta/releasenotes/,2026-07-20 15:03:36
The AirPods Max 2 are down to their second-best price,The Verge,https://www.theverge.com/gadgets/967822/airpods-max-2-logitech-superstrike-kodak-charmera-deal-sale,2026-07-20 15:03:36
"I wore the Samsung Galaxy XR headset for a whole work week, and it’s so close to greatness — but the head strap lets it down",TechRadar,https://www.techradar.com/computing/virtual-reality-augmented-reality/i-wore-the-samsung-galaxy-xr-headset-for-a-whole-work-week-and-its-so-close-to-greatness-but-the-head-strap-lets-it-down,2026-07-20 15:03:37
"I've found the 45 top tech deals in the Best Buy Black Friday in July sale — get up to 50% off Apple, LG, Nintendo, Garmin, and more",TechRadar,https://www.techradar.com/seasonal-sales/ive-found-the-45-top-tech-deals-in-the-best-buy-black-friday-in-july-sale-get-up-to-50-percent-off-apple-lg-nintendo-garmin-and-more,2026-07-20 15:03:37
Agentic commerce: why AI agents are transforming the ecommerce landscape,TechRadar,https://www.techradar.com/pro/agentic-commerce-why-ai-agents-are-transforming-the-ecommerce-landscape,2026-07-20 15:03:37
Colombian energy giant Ecopetrol says thousands of user accounts hit in cyberattack,TechRadar,https://www.techradar.com/pro/security/colombian-energy-giant-ecopetrol-says-thousands-of-user-accounts-hit-in-cyberattack,2026-07-20 15:03:37
"Best Buy Black Friday in July: Save $550 on the HP Victus, one of our our favorite budget laptops for creators with Ryzen 5 and RTX 3050 performance",TechRadar,https://www.techradar.com/pro/best-buy-black-friday-in-july-save-usd550-on-the-hp-victus-one-of-our-our-favorite-budget-laptops-for-creators-with-ryzen-5-and-rtx-3050-performance,2026-07-20 15:03:37
