headline,source,link,datetime
Show HN: Rmux – A programmable terminal multiplexer with a Playwright-style SDK,Hacker News,https://github.com/helvesec/rmux,2026-05-21 10:02:45
Meta lays off thousands of employees to offset AI investments,The Verge,https://www.theverge.com/tech/935163/meta-layoffs-ai-investment-offset-memo,2026-05-21 10:02:45
RAM crisis could soon get worse as disruption in Strait of Hormuz shipping hits supply chain hard,TechRadar,https://www.techradar.com/computing/computing-components/ram-crisis-could-soon-get-worse-as-disruption-in-strait-of-hormuz-shipping-hits-supply-chain-hard,2026-05-21 10:02:45
AI-driven cyber discovery signals a new era of systemic risk for banks,TechRadar,https://www.techradar.com/pro/ai-driven-cyber-discovery-signals-a-new-era-of-systemic-risk-for-banks,2026-05-21 10:02:45
"While the Steam Deck still struggles with stock issues, the Asus ROG Xbox Ally gets a tempting $100 discount at Amazon",TechRadar,https://www.techradar.com/gaming/while-the-steam-deck-still-struggles-with-stock-issues-the-asus-rog-xbox-ally-gets-a-tempting-usd100-discount-at-amazon,2026-05-21 10:02:45
'The season 1 finale is really just the beginning': The Testaments season 2 has officially been renewed — but Hulu and Disney+ show creators have 'been thinking in forever terms' for months,TechRadar,https://www.techradar.com/streaming/hulu/the-testaments-season-2-comment,2026-05-21 10:02:45
"'The challenge is not a lack of technology, but a lack of alignment with the realities of work': Study claims workers are using unapproved AI tools at work, despite knowing the risks",TechRadar,https://www.techradar.com/pro/the-challenge-is-not-a-lack-of-technology-but-a-lack-of-alignment-with-the-realities-of-work-study-claims-workers-are-using-unapproved-ai-tools-at-work-despite-knowing-the-risks,2026-05-21 10:02:45
