headline,source,link,datetime
"Jury says Meta knowingly harmed children for profit, awarding landmark verdict",Hacker News,https://www.latimes.com/business/story/2026-03-25/jury-says-meta-knowingly-harmed-children-for-profit-awarding-landmark-verdict,2026-03-25 17:02:50
Slovenian officials catch Israeli firm Black Cube trying to manipulate vote,Hacker News,https://www.wsj.com/world/europe/spies-lies-and-fake-investors-in-disguise-how-plotters-tried-to-flip-a-european-election-1f42b39a,2026-03-25 17:02:50
A Eulogy for Vim,Hacker News,https://drewdevault.com/2026/03/25/2026-03-25-Forking-vim.html,2026-03-25 17:02:50
Quantization from the Ground Up,Hacker News,https://ngrok.com/blog/quantization,2026-03-25 17:02:50
Musketeer d'Artagnan's remains believed found under Dutch church,Hacker News,https://www.bbc.co.uk/news/articles/cm2rew2dgzzo,2026-03-25 17:02:50
'Tiny Shortcuts' Are Poisoning Science,Hacker News,https://nautil.us/how-tiny-shortcuts-are-poisoning-science-1279176,2026-03-25 17:02:50
Sony V. Cox Decision Reversed,Hacker News,https://supreme.justia.com/cases/federal/us/607/24-171/,2026-03-25 17:02:50
Hubble Snaps a New Dazzling Photo of the Crab Nebula,Hacker News,https://nautil.us/hubble-snaps-a-new-dazzling-photo-of-the-crab-nebula-1279203,2026-03-25 17:02:50
Supreme Court Sides with Cox in Copyright Fight over Pirated Music,Hacker News,https://www.nytimes.com/2026/03/25/us/politics/supreme-court-cox-music-copyright.html,2026-03-25 17:02:50
Antimatter has been transported for the first time,Hacker News,https://www.nature.com/articles/d41586-026-00950-w,2026-03-25 17:02:50
How to Keep ICE Agents Out of Your Devices at Airports,Hacker News,https://theintercept.com/2026/03/25/ice-airports-phone-security-privacy-safety/,2026-03-25 17:02:50
OpenAI's latest repo has Claude as the third top contributor,Hacker News,https://twitter.com/CodeByNZ/status/2036723050197012771,2026-03-25 17:02:50
Ubuntu wants to strip some of GRUB features in 26.10 for security purposes,Hacker News,https://discourse.ubuntu.com/t/streamlining-secure-boot-for-26-10/79069,2026-03-25 17:02:50
Apple Just Lost Me,Hacker News,https://andregarzia.com/2026/03/apple-just-lost-me.html,2026-03-25 17:02:50
Thoughts on Slowing the Fuck Down,Hacker News,https://mariozechner.at/posts/2026-03-25-thoughts-on-slowing-the-fuck-down/,2026-03-25 17:02:50
Palestinians warn of expanding West Bank settler violence,Hacker News,https://www.bbc.com/news/articles/c747x00m83vo,2026-03-25 17:02:50
Local LLM by Ente,Hacker News,https://ente.com/blog/ensu/,2026-03-25 17:02:50
Open source isn't a tip jar – it's time to charge for access,Hacker News,https://www.theregister.com/2026/03/25/open_source_bill_opinion/,2026-03-25 17:02:50
Building a coding agent in Swift from scratch,Hacker News,https://github.com/ivan-magda/swift-claude-code,2026-03-25 17:02:50
I tried to prove I'm not AI. My aunt wasn't convinced,Hacker News,https://www.bbc.com/future/article/20260324-i-tried-to-prove-im-not-an-ai-deepfake,2026-03-25 17:02:50
Meta told to pay $375M for misleading users over child safety,Hacker News,https://www.bbc.com/news/articles/cql75dn07n2o,2026-03-25 17:02:50
I Forked Httpx,Hacker News,https://tildeweb.nl/~michiel/httpxyz.html,2026-03-25 17:02:50
Implementing automatic eSIM installation on Android,Hacker News,https://medium.com/proandroiddev/integration-of-automatic-esim-installation-on-android-6c5f6d7124cb,2026-03-25 17:02:50
TurboQuant: Redefining AI efficiency with extreme compression,Hacker News,https://research.google/blog/turboquant-redefining-ai-efficiency-with-extreme-compression/,2026-03-25 17:02:50
Social media bans and digital curfews to be trialled on UK teenagers,Hacker News,https://www.bbc.com/news/articles/cn89g3ngkyzo,2026-03-25 17:02:50
Miscellanea: The War in Iran,Hacker News,https://acoup.blog/2026/03/25/miscellanea-the-war-in-iran/,2026-03-25 17:02:50
Meta ordered to pay $375M in New Mexico trial over child exploitation,Hacker News,https://www.reuters.com/sustainability/boards-policy-regulation/jury-orders-meta-pay-375-mln-new-mexico-lawsuit-over-child-sexual-exploitation-2026-03-24/,2026-03-25 17:02:50
US Army raises enlistment age to 42 and removes marijuana waiver requirement,Hacker News,https://armypubs.army.mil/epubs/DR_pubs/DR_a/ARN42922-AR_601-210-000-WEB-1.pdf,2026-03-25 17:02:50
Show HN: DuckDB community extension for prefiltered HNSW using ACORN-1,Hacker News,https://github.com/cigrainger/duckdb-hnsw-acorn,2026-03-25 17:02:50
VitruvianOS – Desktop Linux Inspired by the BeOS,Hacker News,https://v-os.dev,2026-03-25 17:02:50
"Oil at $150 will trigger global recession, says boss of financial BlackRock",Hacker News,https://www.bbc.com/news/articles/c9wqrdkx8ppo,2026-03-25 17:02:50
"In Edison’s Revenge, Data Centers Are Transitioning From AC to DC",Hacker News,https://spectrum.ieee.org/data-center-dc,2026-03-25 17:02:50
Zero-Cost POSIX Compliance: Encoding the Socket State Machine in Lean's Types,Hacker News,https://ngrislain.github.io/blog/2026-3-25-zerocost-posix-compliance-encoding-the-socket-state-machine-in-lean-4s-type-system/,2026-03-25 17:02:50
Flighty Airports,Hacker News,https://flighty.com/airports,2026-03-25 17:02:50
A Compiler Writing Journey,Hacker News,https://github.com/DoctorWkt/acwj,2026-03-25 17:02:50
Thoughts on LLMs – Psychological Complications,Hacker News,https://parsingphase.dev/tech/LLMs/psychologicalFactors.html,2026-03-25 17:02:50
Jury finds Meta liable in case over child sexual exploitation on its platforms,Hacker News,https://www.cnn.com/2026/03/24/tech/meta-new-mexico-trial-jury-deliberation,2026-03-25 17:02:50
"I wanted to build vertical SaaS for pest control, so I took a technician job",Hacker News,https://www.onhand.pro/p/i-wanted-to-build-vertical-saas-for-pest-control-i-took-a-technician-job-instead,2026-03-25 17:02:50
Disney Exits OpenAI Deal After AI Giant Shutters Sora,Hacker News,https://www.hollywoodreporter.com/business/digital/openai-shutting-down-sora-ai-video-app-1236546187/,2026-03-25 17:02:50
Is anybody else bored of talking about AI?,Hacker News,https://blog.jakesaunders.dev/is-anybody-else-bored-of-talking-about-ai/,2026-03-25 17:02:50
GitHub is once again down,Hacker News,https://www.githubstatus.com/incidents/kp06czybl7dw,2026-03-25 17:02:50
We’re saying goodbye to Sora,Hacker News,https://twitter.com/soraofficialapp/status/2036532795984715896,2026-03-25 17:02:50
Welcome to FastMCP,Hacker News,https://gofastmcp.com/getting-started/welcome,2026-03-25 17:02:50
Show HN: Antimatter – Match the opposites (Mahjong solitaire mechanic),Hacker News,https://www.linguabase.org/antimatter/,2026-03-25 17:02:50
Show HN: AI Roundtable – Let 200 models debate your question,Hacker News,https://opper.ai/ai-roundtable/,2026-03-25 17:02:50
Young Graduates Face the Grimmest Job Market in Years,Hacker News,https://www.nytimes.com/2026/03/24/business/economy/college-graduates-job-market-hiring.html,2026-03-25 17:02:50
Atomic Display Switching: Solving,Hacker News,https://github.com/piot5/displayflow_cli,2026-03-25 17:02:50
Wine 11 rewrites how Linux runs Windows games at kernel with massive speed gains,Hacker News,https://www.xda-developers.com/wine-11-rewrites-linux-runs-windows-games-speed-gains/,2026-03-25 17:02:50
Show HN: I took back Video.js after 16 years and we rewrote it to be 88% smaller,Hacker News,https://videojs.org/blog/videojs-v10-beta-hello-world-again,2026-03-25 17:02:50
ARM AGI CPU: Specs and SKUs,Hacker News,https://sbcwiki.com/docs/soc-manufacturers/arm/arm-silicon/,2026-03-25 17:02:50
FCC has banned the import of all new foreign-made routers here's what you can do,Hacker News,https://blog.adafruit.com/2026/03/24/fcc-just-banned-the-import-of-all-new-foreign-made-routers-heres-what-you-can-do-about-it/,2026-03-25 17:02:50
Lago (YC S21) Is Hiring,Hacker News,https://getlago.notion.site/Lago-Product-Engineer-AI-Agents-for-Growth-327ef63110d280cdb030ccf429d3e4d7?source=copy_link,2026-03-25 17:02:50
Country that put backdoors in Cisco routers to spy on world bans foreign routers,Hacker News,https://www.theregister.com/2026/03/24/fcc_foreign_routers/,2026-03-25 17:02:50
The AI Industry Is Lying to You,Hacker News,https://www.wheresyoured.at/the-ai-industry-is-lying-to-you/,2026-03-25 17:02:50
Arm AGI CPU,Hacker News,https://newsroom.arm.com/blog/introducing-arm-agi-cpu,2026-03-25 17:02:50
Seiko resurrected a 44-year-old digital watch NASA astronauts wore to space,The Verge,https://www.theverge.com/tech/900428/seiko-rotocall-digital-watch-retro-nasa-astronauts,2026-03-25 17:02:50
Reddit accounts with ‘fishy’ bot-like behavior will soon need to prove they’re human,The Verge,https://www.theverge.com/tech/900363/reddit-human-verification-bots-crackdown,2026-03-25 17:02:50
Google Lyria 3 Pro makes longer AI songs,The Verge,https://www.theverge.com/ai-artificial-intelligence/900425/google-lyria-3-pro-ai-music,2026-03-25 17:02:50
Live-service games are such a mess even Fortnite is struggling,The Verge,https://www.theverge.com/games/900389/live-service-games-mess-fortnite-layoffs,2026-03-25 17:02:50
Senate Democrats are trying to ‘codify’ Anthropic’s red lines on autonomous weapons and mass surveillance,The Verge,https://www.theverge.com/policy/900341/senator-schiff-anthropic-autonomous-weapons-mass-surveillance,2026-03-25 17:02:50
You can install these wireless security cameras over half a mile away,The Verge,https://www.theverge.com/tech/898980/xthings-ulticam-security-camera-wi-fi-halow-wireless,2026-03-25 17:02:50
Mark Zuckerberg and Jensen Huang are part of Trump’s new ‘tech panel’,The Verge,https://www.theverge.com/policy/900340/trump-tech-panel-mark-zuckerberg-jensen-huang,2026-03-25 17:02:50
Ring finally brings 4K video to its battery-powered doorbell camera,The Verge,https://www.theverge.com/tech/900270/ring-4k-battery-powered-video-doorbell-ai-price-release-date-specs,2026-03-25 17:02:50
Keychron’s mechanical keyboards are up to 60 percent off,The Verge,https://www.theverge.com/gadgets/899433/keychron-mechanical-keyboards-amazon-big-spring-sale-2026-deal,2026-03-25 17:02:50
Apple’s iOS 26.4 update adds age verification in the UK,The Verge,https://www.theverge.com/tech/900284/apple-ios-26-4-uk-age-verification,2026-03-25 17:02:50
The best deals we’ve found from Amazon’s Big Spring Sale (so far),The Verge,https://www.theverge.com/gadgets/899580/best-amazon-big-spring-sale-2026-deals,2026-03-25 17:02:50
Reolink’s first solar-powered floodlight camera offers wire-free home security,The Verge,https://www.theverge.com/tech/900204/reolink-solar-floodlight-camera-price-release-date-specs,2026-03-25 17:02:50
"Dell made its new Pro laptops thinner and tweaked their naming scheme, again",The Verge,https://www.theverge.com/tech/900090/dell-made-its-new-pro-laptops-thinner-and-tweaked-their-naming-scheme-again,2026-03-25 17:02:50
Sony and Honda ain’t feelin’ the Afeela anymore,The Verge,https://www.theverge.com/tech/900219/sony-honda-afeela-discontinue-cancel-refund,2026-03-25 17:02:50
"Samsung’s Galaxy A57 gets thinner, faster, and more expensive",The Verge,https://www.theverge.com/gadgets/899399/samsung-galaxy-a57-a37-launch-price-specs,2026-03-25 17:02:50
Anthropic’s Claude Code gets ‘safer’ auto mode,The Verge,https://www.theverge.com/ai-artificial-intelligence/900201/anthropic-claude-code-auto-mode,2026-03-25 17:02:50
It’s always a good time to revisit Super Mario Bros. Wonder,The Verge,https://www.theverge.com/games/899839/super-mario-bros-wonder-nintendo-switch-2-review,2026-03-25 17:02:50
The BB-777 is the ultimate in boombox nostalgia,The Verge,https://www.theverge.com/tech/897876/the-bb-777-is-the-ultimate-in-boombox-nostalgia,2026-03-25 17:02:50
Instagram and Facebook are about to be filled with affiliate content,The Verge,https://www.theverge.com/news/899717/meta-instagram-facebook-affiliate-shopping-links-reels,2026-03-25 17:02:50
"Meta misled users about its products’ safety, jury decides",The Verge,https://www.theverge.com/policy/899910/meta-new-mexico-jury-verdict,2026-03-25 17:02:50
NASA wants to put a $20 billion base on the Moon,The Verge,https://www.theverge.com/science/899891/nasa-moon-base-mars-nuclear-power-jared-isaacman,2026-03-25 17:02:50
What is ICE actually doing at the airport?,The Verge,https://www.theverge.com/policy/899855/ice-airports-tsa-shutdown-dhs-jfk,2026-03-25 17:02:50
OpenAI just gave up on its Sora AI video generator,The Verge,https://www.theverge.com/ai-artificial-intelligence/899850/openai-sora-ai-chatgpt,2026-03-25 17:02:50
Arm’s first CPU ever will plug into Meta’s AI datacenters later this year,The Verge,https://www.theverge.com/ai-artificial-intelligence/899823/arm-agi-cpu-meta,2026-03-25 17:02:50
Apple is testing a standalone app for its overhauled Siri,The Verge,https://www.theverge.com/tech/899801/apple-wwdc-2026-new-siri-apple-intelligence-standalone-app,2026-03-25 17:02:50
The man who coined Metaverse now says Meta’s glasses are creepy,The Verge,https://www.theverge.com/tech/899797/metaverse-neal-stephenson-headsets-goggles-glasses-creepy-no-business-case,2026-03-25 17:02:50
"Apple launches iOS 26.4 with AI playlists, purchase sharing, and more",The Verge,https://www.theverge.com/tech/899799/apple-ios-26-4-ai-playlist-purchase-sharing-update,2026-03-25 17:02:50
"The Lego Game Boy makes for a great gift, and it’s $10 off today",The Verge,https://www.theverge.com/gadgets/899688/lego-game-boy-set-nintendo-handheld-kohls-deal-sale,2026-03-25 17:02:50
The Apple Watch SE 3 is even easier to recommend at $50 off,The Verge,https://www.theverge.com/gadgets/899671/apple-watch-se-third-generation-deal-sale,2026-03-25 17:02:50
ChatGPT and Gemini are fighting to be the AI bot that sells you stuff,The Verge,https://www.theverge.com/ai-artificial-intelligence/899677/openai-google-gemini-ai-shopping-features,2026-03-25 17:02:50
The Afeela 1 came too late and now is gone too soon,Engadget,https://www.engadget.com/transportation/evs/the-afeela-1-came-too-late-and-now-is-gone-too-soon-164845008.html?src=rss,2026-03-25 17:02:51
Supreme Court rules ISPs aren't liable for subscribers' music piracy,Engadget,https://www.engadget.com/entertainment/streaming/supreme-court-rules-isps-arent-liable-for-subscribers-music-piracy-163412791.html?src=rss,2026-03-25 17:02:51
Spotify is testing a tool to help real artists deal with AI slop on their profiles,Engadget,https://www.engadget.com/ai/spotify-is-testing-a-tool-to-help-real-artists-deal-with-ai-slop-on-their-profiles-161013653.html?src=rss,2026-03-25 17:02:51
Reddit will prompt some accounts to 'verify humanness' in latest bot crackdown,Engadget,https://www.engadget.com/social-media/reddit-will-prompt-some-accounts-to-verify-humanness-in-latest-bot-crackdown-161000181.html?src=rss,2026-03-25 17:02:51
Sony's upcoming Bravia 3 II is a mid-range LED TV available in sizes up to 100 inches,Engadget,https://www.engadget.com/home/home-theater/sonys-upcoming-bravia-3-ii-is-a-mid-range-led-tv-available-in-sizes-up-to-100-inches-160002697.html?src=rss,2026-03-25 17:02:51
Sony adds the Bravia Theater Bar 5 and Bar 7 to its soundbar lineup,Engadget,https://www.engadget.com/audio/speakers/sony-adds-the-bravia-theater-bar-5-and-bar-7-to-its-soundbar-lineup-160000680.html?src=rss,2026-03-25 17:02:51
"Mark Zuckerberg, Jensen Huang and Sergey Brin join Trump's tech advisory panel",Engadget,https://www.engadget.com/big-tech/mark-zuckerberg-jensen-huang-and-sergey-brin-join-trumps-tech-advisory-panel-144722797.html?src=rss,2026-03-25 17:02:51
Stephen Colbert is writing a new Lord of the Rings movie,Engadget,https://www.engadget.com/entertainment/tv-movies/stephen-colbert-is-writing-a-new-lord-of-the-rings-movie-143004743.html?src=rss,2026-03-25 17:02:51
Anthropic releases safer Claude Code 'auto mode' to avoid mass file deletions and other AI snafus,Engadget,https://www.engadget.com/ai/anthropic-releases-safer-claude-code-auto-mode-to-avoid-mass-file-deletions-and-other-ai-snafus-142500615.html?src=rss,2026-03-25 17:02:51
Ring adds 4K to its battery-powered video doorbells,Engadget,https://www.engadget.com/home/ring-adds-4k-to-its-battery-powered-video-doorbells-130021181.html?src=rss,2026-03-25 17:02:51
Sennheiser's owners want to sell its consumer headphone business,Engadget,https://www.engadget.com/audio/sennheisers-owners-want-to-sell-its-consumer-headphone-business-121830441.html?src=rss,2026-03-25 17:02:51
Samsung Galaxy A37 and A57 hands-on: The cheaper phone might be a winner,Engadget,https://www.engadget.com/mobile/smartphones/samsung-galaxy-a37-and-a57-hands-on-the-cheaper-phone-might-be-a-winner-120000965.html?src=rss,2026-03-25 17:02:51
Apple introduces age verification for iCloud accounts in the UK,Engadget,https://www.engadget.com/big-tech/apple-introduces-age-verification-for-icloud-accounts-in-the-uk-115340237.html?src=rss,2026-03-25 17:02:51
Sony and Honda kill its Afeela EVs,Engadget,https://www.engadget.com/transportation/evs/sony-and-honda-kill-its-afeela-evs-100426852.html?src=rss,2026-03-25 17:02:51
X is changing its revenue-sharing policy to deter users pretending to be Americans,Engadget,https://www.engadget.com/social-media/x-is-changing-its-revenue-sharing-policy-to-deter-users-pretending-to-be-americans-090701729.html?src=rss,2026-03-25 17:02:51
Meta is letting creators fill their Reels with shopping links,Engadget,https://www.engadget.com/social-media/meta-is-letting-creators-fill-their-reels-with-shopping-links-232406681.html?src=rss,2026-03-25 17:02:51
"Jury rules against Meta, orders $375 million fine in major child safety trial",Engadget,https://www.engadget.com/social-media/jury-rules-against-meta-orders-375-million-fine-in-major-child-safety-trial-224215209.html?src=rss,2026-03-25 17:02:51
"Sony is reportedly shutting down Dark Outlaw Games, run by former Call of Duty director",Engadget,https://www.engadget.com/gaming/playstation/sony-is-reportedly-shutting-down-dark-outlaw-games-run-by-former-call-of-duty-director-215634410.html?src=rss,2026-03-25 17:02:51
Baltimore sues xAI over Grok deepfakes,Engadget,https://www.engadget.com/ai/baltimore-sues-xai-over-grok-deepfakes-214135922.html?src=rss,2026-03-25 17:02:51
OpenAI is shutting down its Sora video generation app,Engadget,https://www.engadget.com/ai/openai-is-shutting-down-its-sora-video-generation-app-211023358.html?src=rss,2026-03-25 17:02:51
Apple could give Siri a standalone app and an 'Ask Siri' button in iOS 27,Engadget,https://www.engadget.com/ai/apple-could-give-siri-a-standalone-app-and-an-ask-siri-button-in-ios-27-202802492.html?src=rss,2026-03-25 17:02:51
Zoox is bringing its robotaxi to new cities and expanding coverage in Las Vegas and San Francisco,Engadget,https://www.engadget.com/transportation/zoox-is-bringing-its-robotaxi-to-new-cities-and-expanding-coverage-in-las-vegas-and-san-francisco-195410391.html?src=rss,2026-03-25 17:02:51
AccuWeather is now available inside ChatGPT,Engadget,https://www.engadget.com/ai/accuweather-is-now-available-inside-chatgpt-192637363.html?src=rss,2026-03-25 17:02:51
Splitgate's 1047 Games is starting work on a Titanfall-style movement shooter,Engadget,https://www.engadget.com/gaming/splitgates-1047-games-is-starting-work-on-a-titanfall-style-movement-shooter-192551191.html?src=rss,2026-03-25 17:02:51
Three new Gemini features come to Google TV,Engadget,https://www.engadget.com/entertainment/streaming/three-new-gemini-features-come-to-google-tv-175724155.html?src=rss,2026-03-25 17:02:51
Apple confirms ads are coming to Apple Maps,Engadget,https://www.engadget.com/apps/apple-confirms-ads-are-coming-to-apple-maps-175613751.html?src=rss,2026-03-25 17:02:51
For All Mankind is returning for a sixth and final season,Engadget,https://www.engadget.com/entertainment/tv-movies/for-all-mankind-is-returning-for-a-sixth-and-final-season-173859683.html?src=rss,2026-03-25 17:02:51
"iOS 26.4 is here, with Playlist Playground and new emoji",Engadget,https://www.engadget.com/mobile/ios-264-is-here-with-playlist-playground-and-new-emoji-171343120.html?src=rss,2026-03-25 17:02:51
Should Nintendo be worried? The maker of the best Switch accessory just announced the 'ultimate' Switch 2 controller,TechRadar,https://www.techradar.com/gaming/nintendo-switch/should-nintendo-be-worried-the-maker-of-the-best-switch-accessory-just-announced-the-ultimate-switch-2-controller,2026-03-25 17:02:51
My favorite gadget in the world just got a price cut — the reMarkable 2 bundle is a masterclass in focus for business professionals and writers,TechRadar,https://www.techradar.com/seasonal-sales/my-favorite-gadget-in-the-world-just-got-a-price-cut-the-remarkable-2-bundle-is-a-masterclass-in-focus-for-business-professionals-and-writers,2026-03-25 17:02:51
Who needs a DJI? This ultimate DIY drone hits 67mph and costs just $155,TechRadar,https://www.techradar.com/cameras/drones/who-needs-a-dji-this-ultimate-diy-drone-hits-67mph-and-costs-just-usd155,2026-03-25 17:02:51
Don’t buy your next Nintendo Switch 2 game until you use this easy trick to save $15,TechRadar,https://www.techradar.com/seasonal-sales/dont-buy-your-next-nintendo-switch-2-game-until-you-use-this-easy-trick-to-save-usd15,2026-03-25 17:02:51
I checked every deal and this is the best budget standing desk across the whole Amazon Big Spring Sale,TechRadar,https://www.techradar.com/seasonal-sales/i-checked-every-deal-and-this-is-the-best-budget-standing-desk-across-the-whole-amazon-big-spring-sale,2026-03-25 17:02:51
Why strong authentication beyond the browser will define the future of connected devices,TechRadar,https://www.techradar.com/pro/why-strong-authentication-beyond-the-browser-will-define-the-future-of-connected-devices,2026-03-25 17:02:51
Invincible season 4 episode 4 does something that the Prime Video show has never done before — but fans are saying 'this is not it' for a wholly different reason,TechRadar,https://www.techradar.com/streaming/amazon-prime-video/invincible-season-4-episode-4-does-something-that-the-prime-video-show-has-never-done-before-but-fans-are-saying-this-is-not-it-for-a-wholly-different-reason,2026-03-25 17:02:51
The rise of the cyber hacker - does clout matter more than cash?,TechRadar,https://www.techradar.com/pro/the-rise-of-the-cyber-hacker-does-clout-matter-more-than-cash,2026-03-25 17:02:51
iOS 26.4 is here with some handy upgrades for your iPhone — here are the 5 best new features,TechRadar,https://www.techradar.com/phones/ios-26-4-is-here-with-some-handy-upgrades-for-your-iphone-here-are-the-5-best-new-features,2026-03-25 17:02:51
How to get early access to Alexa+ in the UK — here's what you need to know,TechRadar,https://www.techradar.com/home/smart-home/how-do-i-get-alexa-in-the-uk,2026-03-25 17:02:51
AI robot snaps together like Lego and moves unlike anything I've ever seen before — I can't stop watching,TechRadar,https://www.techradar.com/ai-platforms-assistants/ai-robot-snaps-together-like-lego-and-moves-unlike-anything-ive-ever-seen-before-i-cant-stop-watching,2026-03-25 17:02:51
"The 'best shipping label printer' we ever tested is only $76 in the Amazon Big Spring Sale — the Munbyn RW403B is quick, quiet, and actually fun to use",TechRadar,https://www.techradar.com/seasonal-sales/the-best-shipping-label-printer-we-ever-tested-is-only-usd76-in-the-amazon-big-spring-sale-the-munbyn-rw403b-is-quick-quiet-and-actually-fun-to-use,2026-03-25 17:02:51
Millions possibly affected by data breach at dermatology giant QualDerm,TechRadar,https://www.techradar.com/pro/security/millions-possibly-affected-by-data-breach-at-dermatology-giant-qualderm,2026-03-25 17:02:51
"50 home office finds under $50: I searched the whole Amazon Big Spring Sale for the best office upgrades, desk accessories, and organizers",TechRadar,https://www.techradar.com/pro/50-home-office-finds-under-usd50-i-searched-the-whole-amazon-big-spring-sale-for-the-best-office-upgrades-desk-accessories-and-organizers,2026-03-25 17:02:51
I'm a running tech expert — beginner runners should spend $500 on these 3 things to be set for up to 500 miles of training,TechRadar,https://www.techradar.com/health-fitness/im-a-running-tech-expert-beginner-runners-should-spend-usd500-on-these-3-things-to-be-set-for-up-to-500-miles-of-training,2026-03-25 17:02:51
Closing retail’s AI ROI gap with end-to-end process networks,TechRadar,https://www.techradar.com/pro/closing-retails-ai-roi-gap-with-end-to-end-process-networks,2026-03-25 17:02:51
US workers think they're pretty good at spotting phishing emails - but the reality is quite different,TechRadar,https://www.techradar.com/pro/security/us-workers-think-theyre-pretty-good-at-spotting-phishing-emails-but-the-reality-is-quite-different,2026-03-25 17:02:51
How to watch Temptation Island Spain 9 online for free (from anywhere),TechRadar,https://www.techradar.com/how-to-watch/tv-shows/how-to-watch-temptation-island-spain-9-online-for-free-from-anywhere,2026-03-25 17:02:51
"What's the best Apple gadget ever? Have your say in our epic, controversy-ending poll",TechRadar,https://www.techradar.com/tech/whats-the-best-apple-gadget-ever-have-your-say-in-our-epic-controversy-ending-poll,2026-03-25 17:02:51
"Quordle hints and answers for Thursday, March 26 (game #1522)",TechRadar,https://www.techradar.com/computing/websites-apps/quordle-today-answers-clues-26-march-2026,2026-03-25 17:02:51
"NYT Strands hints and answers for Thursday, March 26 (game #753)",TechRadar,https://www.techradar.com/computing/websites-apps/nyt-strands-today-answers-hints-26-march-2026,2026-03-25 17:02:51
"NYT Connections hints and answers for Thursday, March 26 (game #1019)",TechRadar,https://www.techradar.com/gaming/nyt-connections-today-answers-hints-26-march-2026,2026-03-25 17:02:51
Forget wearable AI – the future of AI is contextual,TechRadar,https://www.techradar.com/pro/forget-wearable-ai-the-future-of-ai-is-contextual,2026-03-25 17:02:51
