headline,source,link,datetime
We sped up bun by 100x,Hacker News,https://vers.sh/blog/git-zig-bun-100x,2026-04-02 20:02:44
The ABS Challenge System is exposing the worst umpire in baseball,The Verge,https://www.theverge.com/entertainment/906151/mlb-abs-challenge-system-cb-bucknor-worst-umpire-baseball,2026-04-02 20:02:44
Pinterest said he violated laid-off colleagues’ privacy. Now he’s going public,The Verge,https://www.theverge.com/policy/906122/pinterest-employee-fired-obstructionist-speaks-out,2026-04-02 20:02:44
Trump fires attorney general Pam Bondi.,The Verge,https://www.theverge.com/policy/905961/pam-bondi-fired,2026-04-02 20:02:44
OpenAI brings ChatGPT's Voice mode to CarPlay,Engadget,https://www.engadget.com/ai/openai-brings-chatgpts-voice-mode-to-carplay-191422297.html?src=rss,2026-04-02 20:02:45
If only your EV did this: Dell’s new supercapacitor keyboard and mouse combo delivers 'full day use' with a 5-second charge — here’s how,TechRadar,https://www.techradar.com/pro/if-only-your-ev-did-this-dells-new-supercapacitor-keyboard-mouse-combo-delivers-full-day-use-with-5-second-charge-heres-how,2026-04-02 20:02:45
