headline,source,link,datetime
Netflix releases a VHS-quality version of Stranger Things' first season,Engadget,https://www.engadget.com/2216396/netflix-stranger-things-vhs-quality/,2026-07-16 10:03:31
McIntosh’s new AV processor can handle 9.4.4 channels of Dolby Atmos and 7x 4K 120Hz HDMI ports for ‘today’s most advanced home cinema systems’ – but you’ll need to add your own amps for all those speakers…,TechRadar,https://www.techradar.com/televisions/home-theater/mcintoshs-new-av-processor-can-handle-9-4-4-channels-of-dolby-atmos-and-7x-4k-120hz-hdmi-ports,2026-07-16 10:03:31
"The Duskbloods network test has finally revealed a few new details about FromSoftware's upcoming Switch 2 game, including multiplayer matches with 'up to eight players'",TechRadar,https://www.techradar.com/gaming/the-duskbloods-network-test-has-finally-revealed-a-few-new-details-about-fromsoftwares-upcoming-switch-2-game-including-multiplayer-matches-with-up-to-eight-players,2026-07-16 10:03:31
Many businesses are deploying AI faster than they’re preparing employees — leading to an 'AI underclass' at some firms,TechRadar,https://www.techradar.com/pro/many-businesses-are-deploying-ai-faster-than-theyre-preparing-employees-leading-to-an-ai-underclass-at-some-firms,2026-07-16 10:03:31
Most enterprise AI governance is already out of date,TechRadar,https://www.techradar.com/pro/most-enterprise-ai-governance-is-already-out-of-date,2026-07-16 10:03:31
'Who came up with this idea?' ExpressVPN continues to drop its 30-day money-back guarantee in favour of raffles — and users aren't happy about it,TechRadar,https://www.techradar.com/vpn/who-came-up-with-this-idea-expressvpn-continues-to-drop-its-30-day-money-back-guarantee-in-favour-of-raffles-and-users-arent-happy-about-it,2026-07-16 10:03:31
