headline,source,link,datetime
It’s time to let my iPhone Mini go,The Verge,https://www.theverge.com/tech/924488/apple-iphone-13-mini-battery-liquid-glass,2026-05-06 13:02:47
"A robot hand wiping some egg off its fingers with a towel is the most bizarrely human thing you'll see a robot do all week, and it's just the beginning",TechRadar,https://www.techradar.com/ai-platforms-assistants/a-robot-hand-wiping-some-egg-off-its-fingers-with-a-towel-is-the-most-bizarrely-human-thing-youll-see-a-robot-do-all-week-and-its-just-the-beginning,2026-05-06 13:02:47
Why messy data will make your company’s AI bill much higher than expected,TechRadar,https://www.techradar.com/pro/why-messy-data-will-make-your-companys-ai-bill-much-higher-than-expected,2026-05-06 13:02:47
"Google Home is rolling out its spring update, and your Nest camera app is about to get some handy improvements — and there are more automation capabilities on the way",TechRadar,https://www.techradar.com/home/home-security/google-home-is-rolling-out-its-spring-update-and-your-nest-camera-app-is-about-to-get-some-handy-improvements-and-there-are-more-automation-capabilities-on-the-way-too,2026-05-06 13:02:47
ChatGPT painted a picture of what my life might look like in three years — here’s how you can make the AI your visual oracle,TechRadar,https://www.techradar.com/ai-platforms-assistants/chatgpt/chatgpt-painted-a-picture-of-what-my-life-might-look-like-in-three-years-heres-how-you-can-make-the-ai-your-visual-oracle,2026-05-06 13:02:47
OpenAI finally fixed the most annoying thing about ChatGPT — and I'm already noticing the difference,TechRadar,https://www.techradar.com/ai-platforms-assistants/chatgpt/openai-finally-fixed-the-most-annoying-thing-about-chatgpt-and-im-already-noticing-the-difference,2026-05-06 13:02:47
Kasperky warns popular Daemon Tools app backdoored by hackers to target specific victims,TechRadar,https://www.techradar.com/pro/security/kasperky-warns-popular-daemon-tools-app-backdoored-by-hackers-to-target-specific-victims,2026-05-06 13:02:47
