headline,source,link,datetime
Using Changesets in a polyglot monorepo,Hacker News,https://luke.hsiao.dev/blog/changesets-polyglot-monorepo/,2026-04-21 07:02:49
"Louis Zocchi, inventor of the d100, has died",Hacker News,https://icv2.com/articles/news/view/62176/r-i-p-louis-zocchi-the-godfather-dice,2026-04-21 07:02:49
A mad undertaking: An undefinitive guide to the Aadam Jacobs collection,Hacker News,https://aadamjacobscollection.org/,2026-04-21 07:02:49
Instagram says a bug turned your photos black and white,Engadget,https://www.engadget.com/apps/instagram-says-a-bug-turned-your-photos-black-and-white-061802389.html?src=rss,2026-04-21 07:02:49
"BackgroundChecks.com review: It's fast and easy for small business use, but I'm not a fan of the hidden fees",TechRadar,https://www.techradar.com/pro/backgroundchecks-com-review,2026-04-21 07:02:49
10 fascinating facts about laser printers you probably didn't know,TechRadar,https://www.techradar.com/computing/printers-scanners/10-fascinating-facts-about-laser-printers-you-probably-didnt-know,2026-04-21 07:02:49
