headline,source,link,datetime
"NYT Connections hints and answers for Wednesday, March 25 (game #1018)",TechRadar,https://www.techradar.com/gaming/nyt-connections-today-answers-hints-25-march-2026,2026-03-24 19:02:50
Spotify takes its first major step in tackling AI slop — now artists can review and approve what music appears on their profile,TechRadar,https://www.techradar.com/audio/spotify/spotify-takes-its-first-major-step-in-tackling-ai-slop-now-artists-can-review-and-approve-what-music-appears-on-their-profile,2026-03-24 19:02:50
Exclusive: This iconic Call of Duty zombies perk has been reborn as a collectible controller add-on,TechRadar,https://www.techradar.com/gaming/exclusive-this-iconic-call-of-duty-zombies-perk-has-been-reborn-as-a-collectible-controller-add-on,2026-03-24 19:02:50
"NYT Strands hints and answers for Wednesday, March 25 (game #752)",TechRadar,https://www.techradar.com/computing/websites-apps/nyt-strands-today-answers-hints-25-march-2026,2026-03-24 19:02:50
"Quordle hints and answers for Wednesday, March 25 (game #1521)",TechRadar,https://www.techradar.com/computing/websites-apps/quordle-today-answers-clues-25-march-2026,2026-03-24 19:02:50
"‘I am not a fan of AI’: Apple’s co-founder slams artificial intelligence, saying it lacks human emotional depth",TechRadar,https://www.techradar.com/ai-platforms-assistants/i-am-not-a-fan-of-ai-apples-co-founder-slams-artificial-intelligence-saying-it-lacks-human-emotional-depth,2026-03-24 19:02:50
"More than 10,000 have bought Amazon's Fire TV Stick 4K Plus this month — and it's so cheap right now, I'm buying it too",TechRadar,https://www.techradar.com/televisions/streaming-devices/more-than-10-000-have-bought-amazons-fire-tv-stick-4k-plus-this-month-and-its-so-cheap-right-now-im-buying-it-too,2026-03-24 19:02:50
Early Amazon Spring Sale standing desk deals: 11 top-rated FlexiSpot desks to get before tomorrow's chaos,TechRadar,https://www.techradar.com/pro/early-amazon-spring-sale-standing-desk-deals-11-top-rated-flexispot-desks-to-get-before-tomorrows-chaos,2026-03-24 19:02:50
Panasonic’s ‘most advanced travel zoom camera’ gets a surprise successor 8 years later — here are two major differences,TechRadar,https://www.techradar.com/cameras/compact-cameras/panasonics-most-advanced-travel-zoom-camera-gets-a-surprise-successor-8-years-later-here-are-two-major-differences,2026-03-24 19:02:50
"'Put Claude to work': Claude can now use your computer autonomously, you just have to tell it what to do",TechRadar,https://www.techradar.com/pro/put-claude-to-work-claude-can-now-use-your-computer-autonomously-you-just-have-to-tell-it-what-to-do,2026-03-24 19:02:50
Amnezia VPN drops new AmneziaWG 2.0 protocol as censorship tactics grow smarter,TechRadar,https://www.techradar.com/vpn/vpn-services/amnezia-vpn-drops-new-amneziawg-2-0-protocol-as-censorship-tactics-grow-smarter,2026-03-24 19:02:50
Nintendo has reportedly cut Switch 2 production significantly due to weak holiday sales and now aims to produce 4 million units instead of 6 million this quarter,TechRadar,https://www.techradar.com/gaming/nintendo-has-reportedly-cut-switch-2-production-significantly-due-to-weak-holiday-sales-and-now-aims-to-produce-4-million-units-instead-of-6-million-this-quarter,2026-03-24 19:02:50
'That branch of AI is lethal. We've got to do something about that' — Neil deGrasse Tyson wants to ban AI superintelligence,TechRadar,https://www.techradar.com/ai-platforms-assistants/that-branch-of-ai-is-lethal-weve-got-to-do-something-about-that-neil-degrasse-tyson-wants-to-ban-ai-superintelligence,2026-03-24 19:02:50
PS5 console architect Mark Cerny confirms FSR Frame Generation is coming to PlayStation 'at some point' but not in 2026 — 'All I can say is that we have no more releases planned for this year',TechRadar,https://www.techradar.com/gaming/ps5-console-architect-mark-cerny-confirms-fsr-frame-generation-is-coming-to-playstation-at-some-point-but-not-in-2026-all-i-can-say-is-that-we-have-no-more-releases-planned-for-this-year,2026-03-24 19:02:50
Annoyed that your smart TV wants to steer you to certain services? The EU is being asked by streamers to clamp down and make TVs work more neutrally,TechRadar,https://www.techradar.com/televisions/annoyed-that-your-smart-tv-wants-to-steer-you-to-certain-services-the-eu-is-being-asked-by-streamers-to-clamp-down-and-make-tvs-work-more-neutrally,2026-03-24 19:02:50
"Beat the Amazon Spring Sale rush: 5 unmissable FlexiSpot office chair deals based on our tests, from $210",TechRadar,https://www.techradar.com/pro/beat-the-amazon-spring-sale-rush-5-unmissable-flexispot-office-chair-deals-based-on-our-tests-from-usd210,2026-03-24 19:02:50
'It's honestly my life's goal': Bridgerton season 5 will officially focus on Francesca Michaela romance — and stars are 'ready' to become LGBT icons,TechRadar,https://www.techradar.com/streaming/netflix/bridgerton-season-5-francesca-michaela-romance,2026-03-24 19:02:50
Dutton Ranch gets a surprisingly early release date — and I’m convinced Paramount+ is planning a Marshals: A Yellowstone Story crossover,TechRadar,https://www.techradar.com/streaming/paramount-plus/dutton-ranch-release-date-taylor-sheridan-yellowstone-crossover,2026-03-24 19:02:50
The perfect iPhone 17e deal? Visible Wireless is rebating the entire cost of the device right now,TechRadar,https://www.techradar.com/phones/iphone/the-perfect-iphone-17e-deal-visible-wireless-is-rebating-the-entire-cost-of-the-device-right-now,2026-03-24 19:02:50
"'I could see where they're coming from, I don't love AI slop myself' — Nvidia CEO tries to defend DLSS 5 again, shortly after telling gamers 'they're completely wrong'",TechRadar,https://www.techradar.com/computing/gpu/i-could-see-where-theyre-coming-from-i-dont-love-ai-slop-myself-nvidia-ceo-tries-to-defend-dlss-5-again-shortly-after-telling-gamers-theyre-completely-wrong,2026-03-24 19:02:50
This Premium WordPress plugin and theme have been compromised – here's how to check your website hasn't been infected,TechRadar,https://www.techradar.com/pro/security/this-premium-wordpress-plugin-and-theme-have-been-compromised-heres-how-to-check-your-website-hasnt-been-infected,2026-03-24 19:02:50
What is the release date for Scrubs season 10 episode 6 on Hulu and Disney+?,TechRadar,https://www.techradar.com/streaming/what-is-the-release-date-for-scrubs-season-10-episode-6-on-hulu-and-disney,2026-03-24 19:02:50
What OpenAI’s 4% checkout fee means for the future of commerce,TechRadar,https://www.techradar.com/pro/what-openais-4-percent-checkout-fee-means-for-the-future-of-commerce,2026-03-24 19:02:50
Secretlab has discounted its World of Warcraft collab gear to celebrate the Midnight launch,TechRadar,https://www.techradar.com/gaming/gaming-accessories/secretlab-has-discounted-its-world-of-warcraft-collab-gear-to-celebrate-the-midnight-launch,2026-03-24 19:02:50
"‘AI is not here to replace expertise, it's here to elevate’: Oracle CEO says the best still to come when it comes to agentic innovation",TechRadar,https://www.techradar.com/pro/ai-is-not-here-to-replace-expertise-its-here-to-elevate-oracle-ceo-says-the-best-still-to-come-when-it-comes-to-agentic-innovation,2026-03-24 19:02:50
"When AI drives the M&A deal, reality arrives fast",TechRadar,https://www.techradar.com/pro/when-ai-drives-the-m-and-a-deal-reality-arrives-fast,2026-03-24 19:02:50
PS5 Pro architect Mark Cerny says Sony's updated PSSR tech is 'something like 100 microseconds faster than the original',TechRadar,https://www.techradar.com/gaming/ps5-pro-architect-mark-cerny-says-sonys-updated-pssr-tech-is-something-like-100-microseconds-faster-than-the-original,2026-03-24 19:02:50
‘Warcraft… with pure thought control’ — 100 days with Neuralink ‘feels like science fiction’ to early brain chip pioneer,TechRadar,https://www.techradar.com/ai-platforms-assistants/warcraft-with-pure-thought-control-100-days-with-neuralink-feels-like-science-fiction-to-early-brain-chip-pioneer,2026-03-24 19:02:50
The US just banned new routers that aren't made in America — here's what it means for your Wi-Fi network,TechRadar,https://www.techradar.com/computing/wi-fi-broadband/the-us-just-banned-new-routers-that-arent-made-in-america-heres-what-it-means-for-your-wi-fi-network,2026-03-24 19:02:50
What is the macOS Dock? Here’s how to master Apple’s taskbar rival on your brand-new MacBook Neo,TechRadar,https://www.techradar.com/computing/mac-os/what-is-the-macos-dock-heres-how-to-master-apples-taskbar-rival-on-your-brand-new-macbook-neo,2026-03-24 19:02:50
Microsoft exec promises big changes for Windows 11 will come 'this month and every month this year' — but temper your expectations,TechRadar,https://www.techradar.com/computing/windows/microsoft-exec-promises-big-changes-for-windows-11-will-come-this-month-and-every-month-this-year-but-temper-your-expectations,2026-03-24 19:02:50
Marvel's best bromance will return in Wonder Man season 2 — and the highly-rated Disney+ show's next entry needs to prove if a big MCU fan theory is right or not,TechRadar,https://www.techradar.com/streaming/disney-plus/marvels-best-bromance-will-return-in-wonder-man-season-2-and-the-highly-rated-disney-shows-next-entry-needs-to-prove-if-a-big-mcu-fan-theory-is-right-or-not,2026-03-24 19:02:50
'Very significant privacy concerns': UK hands over financial regulation data to Palantir to help tackle financial crime,TechRadar,https://www.techradar.com/pro/very-significant-privacy-concerns-uk-hands-over-financial-regulation-data-to-palantir-to-help-tackle-financial-crime,2026-03-24 19:02:50
From hype to value: The AI trends set to shape 2026,TechRadar,https://www.techradar.com/pro/from-hype-to-value-the-ai-trends-set-to-shape-2026,2026-03-24 19:02:50
From the Backlog,TechRadar,https://www.techradar.com/tag/from-the-backlog,2026-03-24 19:02:50
'My phone is about to die and I don’t want to buy anything' — I tested Google Maps’ Ask Maps AI and it actually helped,TechRadar,https://www.techradar.com/ai-platforms-assistants/gemini/my-phone-is-about-to-die-and-i-dont-want-to-buy-anything-i-tested-google-maps-ask-maps-ai-and-it-actually-helped,2026-03-24 19:02:50
"We have two exclusive Riftbound Unleashed card previews, and they include the return of a fan-favorite Legend of Runeterra nihilist",TechRadar,https://www.techradar.com/gaming/gaming-accessories/we-have-two-exclusive-riftbound-unleashed-card-previews-and-they-include-the-return-of-a-fan-favorite-legend-of-runeterra-nihilist,2026-03-24 19:02:50
‘Dolby Atmos with headroom to spare’ — my afternoon with Denon’s 'Sonos-busting' trio of wireless speakers (and why WiiM should also be worried),TechRadar,https://www.techradar.com/audio/hi-fi/dolby-atmos-with-headroom-to-spare-my-afternoon-with-denons-sonos-busting-trio-of-wireless-speakers-and-why-wiim-should-also-be-worried,2026-03-24 19:02:50
What is the release date for The Pitt season 2 episode 12 on HBO Max?,TechRadar,https://www.techradar.com/streaming/hbo-max/the-pitt-season-2-episode-12-release-date-time,2026-03-24 19:02:50
"‘The feature was not a good feature’ — Grammarly CEO admits Experts Review didn’t work, but you may not like what replaces it",TechRadar,https://www.techradar.com/ai-platforms-assistants/the-feature-was-not-a-good-feature-grammarly-ceo-admits-experts-review-didnt-work-but-you-may-not-like-what-replaces-it,2026-03-24 19:02:50
I want to love Marathon but can already see why players are falling off its miserable grind,TechRadar,https://www.techradar.com/gaming/marathon-review,2026-03-24 19:02:50
I switched back to earbuds after using headphones for three years — here’s what I have and haven’t missed,TechRadar,https://www.techradar.com/audio/earbuds-airpods/i-switched-back-to-earbuds-after-using-headphones-for-three-years-heres-what-i-have-and-havent-missed,2026-03-24 19:02:50
"Samsung has smart glasses landing later this year — here are 4 details leaks have already revealed, including displays and XR apps",TechRadar,https://www.techradar.com/computing/virtual-reality-augmented-reality/samsung-has-smart-glasses-landing-later-this-year-here-are-4-details-leaks-have-already-revealed-including-displays-and-xr-apps,2026-03-24 19:02:50
'We're supposed to start prepping on it soon': The Mummy 4 gets its first tease from Ready or Not 2 directors — it's going to be chaotic,TechRadar,https://www.techradar.com/streaming/entertainment/the-mummy-4-filming-update,2026-03-24 19:02:50
Apple sets WWDC for June 8 — and this may be its last best chance to fix Siri and deliver the AI we were promised,TechRadar,https://www.techradar.com/phones/iphone/apple-sets-wwdc-for-june-8-and-this-may-be-its-last-best-chance-to-fix-siri-and-deliver-the-ai-we-were-promised,2026-03-24 19:02:50
The amazing Kindle Colorsoft just dropped to its record-low Black Friday price on Amazon,TechRadar,https://www.techradar.com/tablets/ereaders/the-amazing-kindle-colorsoft-just-dropped-to-its-record-low-black-friday-price-on-amazon,2026-03-24 19:02:50
"""This framework can succeed only if it is applied uniformly across the United States"": White House rolls out national legislative AI framework that looks to trump state level rules",TechRadar,https://www.techradar.com/pro/this-framework-can-succeed-only-if-it-is-applied-uniformly-across-the-united-states-white-house-rolls-out-national-legislative-ai-framework-that-looks-to-trump-state-level-rules,2026-03-24 19:02:50
