headline,source,link,datetime
Show HN: Script to bulk delete Claude chats from the web UI,Hacker News,https://github.com/MatteoLeonesi/bulk-delete-claude-chat,2026-06-12 16:02:54
Govee’s rechargeable smart table lamp is down to $60,The Verge,https://www.theverge.com/gadgets/948806/govee-table-lamp-classic-jbl-charge-6-deal-sale,2026-06-12 16:02:54
'The people have spoken': fans rejoice as Resident Evil Veronica hits a million wishlists on PS5 and PC just under a week after its announcement,TechRadar,https://www.techradar.com/gaming/the-people-have-spoken-fans-rejoice-as-resident-evil-veronica-hits-a-million-wishlists-on-ps5-and-pc-just-under-a-week-after-its-announcement,2026-06-12 16:02:55
"Justin Bieber just teased new Bluetooth speakers under his SKYLRK brand and actually, they look like something I wish B&O would do",TechRadar,https://www.techradar.com/audio/wireless-bluetooth-speakers/justin-bieber-just-teased-new-bluetooth-speakers-under-his-skylrk-brand-and-actually-they-look-like-something-i-wish-b-and-o-would-do,2026-06-12 16:02:55
Explosive Lioness season 3 trailer proves why it's the most underrated Taylor Sheridan show on Paramount+ — as August 2026 release date is confirmed,TechRadar,https://www.techradar.com/streaming/paramount-plus/lioness-season-3-trailer,2026-06-12 16:02:55
"Spyro: A Realm Beyond studio CEO says there was no 'pushback' to becoming independent from Activision Blizzard, but the process and planning the game at the same time was 'complex' — 'I think that was the biggest challenge'",TechRadar,https://www.techradar.com/gaming/spyro-a-realm-beyond-studio-ceo-says-there-was-no-pushback-to-becoming-independent-from-activision-blizzard-but-the-process-and-planning-the-game-at-the-same-time-was-complex-i-think-that-was-the-biggest-challenge,2026-06-12 16:02:55
NordVPN’s next-gen antivirus aces independent testing with a 96% phishing block rate,TechRadar,https://www.techradar.com/vpn/vpn-services/nordvpns-next-gen-antivirus-aces-independent-testing-with-a-96-percent-phishing-block-rate,2026-06-12 16:02:55
