headline,source,link,datetime
MAGA Is Winning Its War Against U.S. Science,Hacker News,https://paulkrugman.substack.com/p/maga-is-winning-its-war-against-us,2026-04-19 20:02:34
I wrote a CHIP-8 emulator in my own programming language,Hacker News,https://github.com/navid-m/chip8emu,2026-04-19 20:02:34
Cloud development platform Vercel was hacked,The Verge,https://www.theverge.com/tech/914723/vercel-hacked,2026-04-19 20:02:34
Beijing's robot half-marathon is back for its second year with far less embarassing results,Engadget,https://www.engadget.com/ai/beijings-robot-half-marathon-is-back-for-its-second-year-with-far-less-embarassing-results-191308396.html?src=rss,2026-04-19 20:02:35
'It’s a bit surprising': Why the majority of businesses are still sending marketing emails without tracking ROI,TechRadar,https://www.techradar.com/pro/its-a-bit-surprising-why-the-majority-of-businesses-are-still-sending-marketing-emails-without-tracking-roi,2026-04-19 20:02:35
