headline,source,link,datetime
Dead.letter (CVE-2026-45185) Humans vs. LLM for Unauthenticated RCE Race on Exim,Hacker News,https://xbow.com/blog/dead-letter-cve-2026-45185-xbow-found-rce-exim,2026-05-12 18:02:49
Googlebook: Designed for Gemini Intelligence – Coming Fall 2026 – Googlebook,Hacker News,https://googlebook.google/,2026-05-12 18:02:49
Canada's Bill C-22 Is a Repackaged Version of Last Year's Surveillance Nightmare,Hacker News,https://www.eff.org/deeplinks/2026/05/canadas-bill-c-22-repackaged-version-last-years-surveillance-nightmare,2026-05-12 18:02:49
Show HN: Agentic interface for mainframes and COBOL,Hacker News,https://www.hypercubic.ai/hopper,2026-05-12 18:02:49
Sam Altman says Elon Musk’s mind games were damaging OpenAI,The Verge,https://www.theverge.com/ai-artificial-intelligence/928861/openai-sam-altman-elon-musk-damage,2026-05-12 18:02:49
Spotify is down for some users,Engadget,https://www.engadget.com/2171078/spotify-is-down-for-some-users/,2026-05-12 18:02:49
Panasonic's L10 camera honors 25 years of Lumix,Engadget,https://www.engadget.com/2171075/panasonics-l10-camera-honors-25-years-of-lumix/,2026-05-12 18:02:49
Everything announced at The Android Show: I/O 2026 edition,Engadget,https://www.engadget.com/2171038/everything-announced-at-android-show-google-io-2026/,2026-05-12 18:02:49
What is the release date for Hacks season 5 episode 8 on HBO Max?,TechRadar,https://www.techradar.com/streaming/hbo-max/hacks-season-5-episode-8-release-date-time,2026-05-12 18:02:49
"PlayStation gamers could get a share of $8 million in a class action settlement — here’s how to know if you’re eligible, and why you shouldn’t expect a big payout",TechRadar,https://www.techradar.com/gaming/ps5/playstation-gamers-could-get-a-share-of-usd8-million-in-a-class-action-settlement-heres-how-to-know-if-youre-eligible-and-why-you-shouldnt-expect-a-big-payout,2026-05-12 18:02:49
"'We’re aware of some issues right now' — live updates as Spotify confirms outage, with thousands of users reporting that they can't access the music streaming service",TechRadar,https://www.techradar.com/news/live/spotify-outage-may-2026,2026-05-12 18:02:49
"'We’re aware of some issues right now' — live updates as Spotify confirms outage, with thousands of users reporting that they can't access the music streaming service",TechRadar,https://www.techradar.com/live/news/spotify-outage-may-2026,2026-05-12 18:02:49
Mac users beware — scammers are hijacking Claude chats and Google ads to push malware,TechRadar,https://www.techradar.com/pro/security/mac-users-beware-scammers-are-hijacking-claude-chats-and-google-ads-to-push-malware,2026-05-12 18:02:49
"Android Auto gets a massive AI-powered upgrade with YouTube, Dolby Atmos, and immersive 3D Maps",TechRadar,https://www.techradar.com/vehicle-tech/hybrid-electric-vehicles/android-auto-gets-a-massive-ai-powered-upgrade-with-youtube-dolby-atmos-and-immersive-3d-maps,2026-05-12 18:02:49
