headline,source,link,datetime
‘Raising the bar for mobile photography’ — Vivo launches the X300 Ultra and its eye-popping 400mm telephoto attachment,TechRadar,https://www.techradar.com/phones/raising-the-bar-for-mobile-photography-vivo-launches-the-x300-ultra-and-its-eye-popping-400mm-telephoto-attachment,2026-03-31 14:03:01
I connected my Dropbox to ChatGPT — and it changed how I find everything,TechRadar,https://www.techradar.com/ai-platforms-assistants/chatgpt/i-connected-my-dropbox-to-chatgpt-and-it-changed-how-i-find-everything,2026-03-31 14:03:01
"The Elder Scrolls Online is coming to Xbox Game Pass in June, and it's free right now with PlayStation Plus",TechRadar,https://www.techradar.com/gaming/the-elder-scrolls-online-is-coming-to-xbox-game-pass-in-june-and-its-free-right-now-with-playstation-plus,2026-03-31 14:03:01
"DR Congo vs Jamaica free streams: How to watch 2026 World Cup intercontinental playoff, TV schedule, preview",TechRadar,https://www.techradar.com/how-to-watch/football/dr-congo-vs-jamaica-free-streams-2026-world-cup-intercontinental-playoff,2026-03-31 14:03:01
What is the release date for The Pitt season 2 episode 13 on HBO Max?,TechRadar,https://www.techradar.com/streaming/hbo-max/the-pitt-season-2-episode-13-release-date-time,2026-03-31 14:03:01
"The best cheap headphones in Australia — get top-quality audio at affordable prices, all tested by our reviewers",TechRadar,https://www.techradar.com/audio/headphones/the-best-cheap-headphones-in-australia-get-top-quality-audio-at-affordable-prices-all-tested-by-our-reviewers,2026-03-31 14:03:01
Paramount Plus is easily one of the premier streaming services right now — and you've only got one more day to take advantage of this excellent deal,TechRadar,https://www.techradar.com/streaming/paramount-plus/paramount-plus-is-easily-one-of-the-premier-streaming-services-right-now-and-youve-only-got-one-more-day-to-take-advantage-of-this-excellent-deal,2026-03-31 14:03:01
'The best of its kind': DapuStor’s 245.76TB PCIe Gen5 SSD is a speed monster you’ll likely never own,TechRadar,https://www.techradar.com/pro/the-best-of-its-kind-dapustors-245-76tb-pcie-gen5-ssd-is-a-speed-monster-youll-likely-never-own,2026-03-31 14:03:01
Sora is gone — but these 3 AI video tools are already replacing it,TechRadar,https://www.techradar.com/ai-platforms-assistants/sora-is-gone-but-these-3-ai-video-tools-are-already-replacing-it,2026-03-31 14:03:01
"Bad news, photographers: Sony has halted production of SD and CFexpress memory cards",TechRadar,https://www.techradar.com/computing/storage-backup/bad-news-photographers-sony-has-halted-production-of-sd-and-cfexpress-memory-cards,2026-03-31 14:03:01
It's not just a RAM crisis — Panasonic says data center batteries are also selling out months in advance,TechRadar,https://www.techradar.com/pro/its-not-just-a-ram-crisis-panasonic-says-data-center-batteries-are-also-selling-out-months-in-advance,2026-03-31 14:03:01
"I've tried more Nintendo Switch 2 accessories than I can count, but these six are simply the best",TechRadar,https://www.techradar.com/gaming/gaming-accessories/ive-tried-more-nintendo-switch-2-accessories-than-i-can-count-but-these-six-are-simply-the-best,2026-03-31 14:03:01
These are the best USB flash drive deals we found for World Backup Day,TechRadar,https://www.techradar.com/pro/these-are-the-best-usb-flash-drive-deals-we-found-for-world-backup-day,2026-03-31 14:03:01
Your smartphone could get its signal from the sky — thanks to an amazing drone armada that complements traditional cell towers,TechRadar,https://www.techradar.com/pro/your-smartphone-could-get-its-signal-from-the-sky-thanks-to-an-amazing-drone-armada-that-complements-traditional-cell-towers,2026-03-31 14:03:01
Amazon’s Spring Sale is basically Black Friday for tech — I found the 55 best deals worth shopping,TechRadar,https://www.techradar.com/seasonal-sales/amazons-spring-sale-is-basically-black-friday-for-tech-i-found-the-55-best-deals-worth-shopping,2026-03-31 14:03:01
IKEA's candy-colored Easter tableware collection is ultra-sweet for spring,TechRadar,https://www.techradar.com/home/ikeas-candy-colored-easter-tableware-collection-is-ultra-sweet-for-spring,2026-03-31 14:03:01
Marshals episode 5 is the closest we've seen seen to Yellowstone yet — but it's for the most heatbreaking and disturbing reason,TechRadar,https://www.techradar.com/streaming/paramount-plus/marshals-episode-5-yellowstone,2026-03-31 14:03:01
"Around 500,000 WordPress websites could be at risk from crucial plugin security flaw — here's what we know",TechRadar,https://www.techradar.com/pro/security/around-500-000-wordpress-websites-could-be-at-risk-from-crucial-plugin-security-flaw-heres-what-we-know,2026-03-31 14:03:01
The extremely handy and super-cheap air duster I use to clean out my gaming PC is back on sale again,TechRadar,https://www.techradar.com/gaming/pc-gaming/the-extremely-handy-and-super-cheap-air-duster-i-use-to-clean-out-my-gaming-pc-is-back-on-sale-again,2026-03-31 14:03:01
SSD fakes are getting more sophisticated — here's how to avoid falling victim to the scammers,TechRadar,https://www.techradar.com/computing/storage-backup/ssd-fakes-are-getting-more-sophisticated-heres-how-to-avoid-falling-victim-to-the-scammers,2026-03-31 14:03:01
Chris Hemsworth's new movie Crime 101 finally has a Prime Video release date — and 'you'll be able to watch it sooner than you think',TechRadar,https://www.techradar.com/streaming/amazon-prime-video/chris-hemsworths-new-movie-crime-101-finally-has-a-prime-video-release-date-and-youll-be-able-to-watch-it-sooner-than-you-think,2026-03-31 14:03:01
"Quordle hints and answers for Tuesday, March 31 (game #1527)",TechRadar,https://www.techradar.com/computing/websites-apps/quordle-today-answers-clues-31-march-2026,2026-03-31 14:03:01
"NYT Strands hints and answers for Tuesday, March 31 (game #758)",TechRadar,https://www.techradar.com/computing/websites-apps/nyt-strands-today-answers-hints-31-march-2026,2026-03-31 14:03:01
"NYT Connections hints and answers for Tuesday, March 31 (game #1024)",TechRadar,https://www.techradar.com/gaming/nyt-connections-today-answers-hints-31-march-2026,2026-03-31 14:03:01
There's no point in upgrading to the Apple Watch Series 11 — save $300 on the Series 10 in Amazon's Spring Sale and get a near-identical wearable for a lot less,TechRadar,https://www.techradar.com/seasonal-sales/theres-no-point-in-upgrading-to-the-apple-watch-series-11-save-usd300-on-the-series-10-in-amazons-spring-sale-and-get-a-near-identical-wearable-for-a-lot-less,2026-03-31 14:03:01
We reviewed all the best budget TVs — this 'fantastic TV for the price' is the one you should buy today for big-screen thrills,TechRadar,https://www.techradar.com/televisions/we-reviewed-all-the-best-budget-tvs-this-fantastic-tv-for-the-price-is-the-one-you-should-buy-today-for-big-screen-thrills,2026-03-31 14:03:01
I found the best portable SSD deals for World Backup Day — store lots and save big,TechRadar,https://www.techradar.com/pro/i-found-the-best-portable-ssd-deals-for-world-backup-day-store-lots-and-save-big,2026-03-31 14:03:01
Another worrying macOS malware scheme has been discovered — here's how to stay safe,TechRadar,https://www.techradar.com/pro/security/another-worrying-macos-malware-scheme-has-been-discovered-heres-how-to-stay-safe,2026-03-31 14:03:01
What is the release date for Invincible season 4 episode 5 on Prime Video?,TechRadar,https://www.techradar.com/streaming/amazon-prime-video/what-is-the-release-date-for-invincible-season-4-episode-5-on-prime-video,2026-03-31 14:03:01
Every phone ping takes 7 seconds of your attention — here’s how to get it back,TechRadar,https://www.techradar.com/phones/every-phone-ping-takes-7-seconds-of-your-attention-heres-how-to-get-it-back,2026-03-31 14:03:01
The PS5 Pro shot up Amazon's best seller list after recent price hike announcement,TechRadar,https://www.techradar.com/gaming/playstation/the-ps5-pro-shot-up-amazons-best-seller-list-after-recent-price-hike-announcement,2026-03-31 14:03:01
"Amazon just launched the biggest Yeti sale I've seen — up to 30% off dozens of coolers, water bottles and travel mugs",TechRadar,https://www.techradar.com/health-fitness/amazon-just-launched-the-biggest-yeti-sale-ive-seen-up-to-30-percent-off-dozens-of-coolers-water-bottles-and-travel-mugs,2026-03-31 14:03:01
Keep your data safe and save big with these top NAS deals for World Backup Day 2026,TechRadar,https://www.techradar.com/pro/keep-your-data-safe-and-save-big-with-these-top-nas-deals-for-world-backup-day-2026,2026-03-31 14:03:01
Netflix is adding 3 unmissable thriller movies in April 2026 — and fans of creature features will be pleased,TechRadar,https://www.techradar.com/streaming/netflix/netflix-is-adding-3-unmissable-thriller-movies-in-april-2026-and-fans-of-creature-features-will-be-pleased,2026-03-31 14:03:01
'This Internxt deal is as close as you'll get to free lifetime cloud storage': Our top cloud storage for security just cut the price by 90% when you use this link,TechRadar,https://www.techradar.com/pro/this-internxt-deal-is-as-close-as-youll-get-to-free-lifetime-cloud-storage-our-top-cloud-storage-for-security-just-cut-the-price-by-90-percent-when-you-use-this-link,2026-03-31 14:03:01
"I tested H2O Audio's affordable, no-frills, bone-conduction running headphones — and there's something to be said for simplicity",TechRadar,https://www.techradar.com/health-fitness/fitness-headphones/h2o-audio-tri-run-review,2026-03-31 14:03:01
"Amazon is slashing its smart home gadgets for Spring Prime Day — 16 deals on Fire TV, Blink, Echo, Kindles, and more",TechRadar,https://www.techradar.com/seasonal-sales/amazon-is-slashing-its-smart-home-gadgets-for-spring-prime-day-16-deals-on-fire-tv-blink-echo-kindles-and-more,2026-03-31 14:03:01
"I'm a gaming keyboard expert, and this analog model is one of my all-time favorites",TechRadar,https://www.techradar.com/computing/keyboards/im-a-gaming-keyboard-expert-and-this-analog-model-is-one-of-my-all-time-favorites,2026-03-31 14:03:01
Major compromise of the telnyx PyPI library could put millions of users at risk,TechRadar,https://www.techradar.com/pro/security/major-compromise-of-the-telnyx-pypi-library-could-put-millions-of-users-at-risk,2026-03-31 14:03:01
"Mullvad Browser's testers now get access to updates every four weeks, also on Linux ARM devices",TechRadar,https://www.techradar.com/vpn/vpn-privacy-security/mullvad-browsers-testers-now-get-access-to-updates-every-four-weeks-also-on-linux-arm-devices,2026-03-31 14:03:01
EV charging just got a massive boost for millions in the UK — as rule changes make it easier to avoid 'driveway discrimination’ at home,TechRadar,https://www.techradar.com/vehicle-tech/hybrid-electric-vehicles/ev-charging-just-got-a-massive-boost-for-millions-in-the-uk-as-rule-changes-make-it-easier-to-avoid-driveway-discrimination-at-home,2026-03-31 14:03:01
Apple removes custom VPN clients from Russian App Store amid Telegram crackdown,TechRadar,https://www.techradar.com/vpn/vpn-privacy-security/apple-removes-custom-vpn-clients-from-russian-app-store-amid-telegram-crackdown,2026-03-31 14:03:01
Crimson Desert's player count is soaring after new patches that make it even more of a game of the year contender,TechRadar,https://www.techradar.com/gaming/crimson-deserts-player-count-is-soaring-after-new-patches-that-make-it-even-more-of-a-game-of-the-year-contender,2026-03-31 14:03:01
GitHub developers targeted by fake VS Code alerts spreading malware,TechRadar,https://www.techradar.com/pro/security/github-developers-targeted-by-fake-vs-code-alerts-spreading-malware,2026-03-31 14:03:01
Beyond the spike: building resilient and trusted infrastructure in an era of sustained attacks,TechRadar,https://www.techradar.com/pro/beyond-the-spike-building-resilient-and-trusted-infrastructure-in-an-era-of-sustained-attacks,2026-03-31 14:03:01
Gamer reportedly buys Nvidia RTX 5060 Ti GPU for $80 from Walmart — so you might want to check the clearance aisle,TechRadar,https://www.techradar.com/computing/gpu/gamer-reportedly-buys-nvidia-rtx-5060-ti-gpu-for-usd80-from-walmart-so-you-might-want-to-check-the-clearance-aisle,2026-03-31 14:03:01
"Before you roll out more AI, answer this: Who's accountable?",TechRadar,https://www.techradar.com/pro/before-you-roll-out-more-ai-answer-this-whos-accountable,2026-03-31 14:03:01
'A superb resin 3D printer that brings professional-grade features to a consumer-friendly model': Elegoo Saturn 4 Ultra gets a huge price cut for Spring,TechRadar,https://www.techradar.com/pro/a-superb-resin-3d-printer-that-brings-professional-grade-features-to-a-consumer-friendly-model-elegoo-saturn-4-ultra-gets-a-huge-price-cut-for-spring,2026-03-31 14:03:01
How businesses can defend themselves against the rise of ‘phishing as a service’,TechRadar,https://www.techradar.com/pro/how-businesses-can-defend-themselves-against-the-rise-of-phishing-as-a-service,2026-03-31 14:03:01
