headline,source,link,datetime
Microsoft faces fresh Windows Recall security concerns,The Verge,https://www.theverge.com/report/912101/microsoft-windows-recall-new-security-concerns-response,2026-04-15 12:03:13
Snap is laying off 16 percent of its staff as it leans into AI,The Verge,https://www.theverge.com/tech/912314/snap-layoffs-1000-staffers-ai-profitability,2026-04-15 12:03:13
Our sister site Tom's Guide just got a massive upgrade — check it out now,TechRadar,https://www.techradar.com/tech/our-sister-site-toms-guide-just-got-a-massive-upgrade-check-it-out-now,2026-04-15 12:03:14
Valve's Steam price history feature could be extended to all regions — but it needs one big change before the Steam Machine's launch,TechRadar,https://www.techradar.com/gaming/consoles-pc/valves-steam-price-history-feature-could-be-extended-to-all-regions-but-it-needs-one-big-change-before-the-steam-machines-launch,2026-04-15 12:03:14
"Invincible season 4 episode 7 ending explained: Is [spoiler] dead, how is Thragg so strong, and more big questions answered",TechRadar,https://www.techradar.com/streaming/amazon-prime-video/invincible-season-4-episode-7-ending-explained,2026-04-15 12:03:14
I’ve been using the Acer Predator Orion 7000 to play the latest titles and it’s one of the best gaming PCs you can buy right now,TechRadar,https://www.techradar.com/computing/gaming-pcs/acer-predator-orion-7000,2026-04-15 12:03:14
Google Chrome users beware — experts warn over 100 Web Store extensions found stealing user data from thousands of accounts,TechRadar,https://www.techradar.com/pro/security/google-chrome-users-beware-experts-warn-over-100-web-store-extensions-found-stealing-user-data-from-thousands-of-accounts,2026-04-15 12:03:14
Europe wants tech sovereignty but is this realistic?,TechRadar,https://www.techradar.com/pro/europe-wants-tech-sovereignty-but-is-this-realistic,2026-04-15 12:03:14
