headline,source,link,datetime
Lets Encrypt Stopping Issuance for Potential Incident,Hacker News,https://letsencrypt.status.io/pages/incident/55957a99e800baa4470002da/69fe2d6698ca07050eb4b1b3,2026-05-08 20:02:50
My first in-prod corrupted hard drive problem,Hacker News,https://blog.pavementlink.ch/2026/05/07/my-first-corrupted-hard-drive-problem/,2026-05-08 20:02:50
Here is Yarbo’s promise to fix the robot mower that ran me over,The Verge,https://www.theverge.com/tech/926989/yarbo-robot-lawn-mower-hack-company-update-security-promise,2026-05-08 20:02:50
Prime Video is adding a TikTok-like feed,Engadget,https://www.engadget.com/2168176/prime-video-is-adding-a-tiktok-like-feed/,2026-05-08 20:02:50
"Amazon is slashing prices of best-selling women's running shoes from Nike, Saucony, Brooks, Asics and more — here are 28 deals you should make a sprint for",TechRadar,https://www.techradar.com/health-fitness/amazon-is-slashing-prices-of-best-selling-womens-running-shoes-from-nike-saucony-brooks-asics-and-more-here-are-28-deals-you-should-make-a-sprint-for,2026-05-08 20:02:50
The Netherlands' ambitious homegrown AI model enters the real world,TechRadar,https://www.techradar.com/ai-platforms-assistants/the-netherlands-ambitious-homegrown-ai-model-enters-the-real-world,2026-05-08 20:02:50
"'From the inventors of origami': Japan joins Australia in building cardboard drones designed for one-way missions and swarming targets — and at just $2,000, they’re scarily cheap",TechRadar,https://www.techradar.com/pro/from-the-inventors-of-origami-japan-joins-australia-in-building-cardboard-drones-designed-for-one-way-missions-and-swarming-targets-and-at-just-usd2-000-theyre-scarily-cheap,2026-05-08 20:02:50
