headline,source,link,datetime
Meta building cloud business to sell excess AI capacity,Hacker News,https://www.reuters.com/business/meta-sell-excess-ai-computing-capacity-via-cloud-business-bloomberg-news-reports-2026-07-01/,2026-07-02 11:03:06
OpenAI floats giving Trump administration 5 percent cut of AI boom,The Verge,https://www.theverge.com/ai-artificial-intelligence/960588/openai-government-5-percent-stake-trump,2026-07-02 11:03:06
Opera's new security feature stops copy paste attacks from malicious websites,Engadget,https://www.engadget.com/2206574/opera-new-security-feature-stops-copy-paste-clickfix-attacks/,2026-07-02 11:03:07
"7 new horror movies on Netflix, Prime Video, Shudder, and more in July 2026",TechRadar,https://www.techradar.com/streaming/7-new-horror-movies-on-netflix-prime-video-shudder-and-more-in-july-2026,2026-07-02 11:03:07
Keep running low on storage and don't know why? Mysterious Windows 11 file that ate tons of drive space is fixed in latest update,TechRadar,https://www.techradar.com/computing/windows/keep-running-low-on-storage-and-dont-know-why-mysterious-windows-11-file-that-ate-tons-of-drive-space-is-fixed-in-latest-update,2026-07-02 11:03:07
"‘Something has gone completely wrong’: Palantir CEO Alex Karp slams OpenAI, says AI industry is ""effing insane""",TechRadar,https://www.techradar.com/pro/something-has-gone-completely-wrong-palantir-ceo-alex-karp-slams-openai-says-ai-industry-is-effing-insane,2026-07-02 11:03:07
Don't pay silly prices for DDR5 memory — Newegg's 4th of July sale is packed with unmissable RAM deals right now,TechRadar,https://www.techradar.com/pro/dont-pay-silly-prices-for-ddr5-memory-neweggs-4th-of-july-sale-is-packed-with-unmissable-ram-deals-right-now,2026-07-02 11:03:07
Exclusive: Blood Message developer says latest trailer's glowing reception gives them 'confidence' — 'We are very excited to see that they love this story',TechRadar,https://www.techradar.com/gaming/exclusive-blood-message-developer-says-latest-trailers-glowing-reception-gives-them-confidence-we-are-very-excited-to-see-that-they-love-this-story,2026-07-02 11:03:07
What is the fastest laptop under $1000 right now? The MSI Katana 15 with a Core i7-14650HX and RTX 5050,TechRadar,https://www.techradar.com/pro/fastest-laptop-under-1000,2026-07-02 11:03:07
